,rep_no,cnf_prd,aff_dt,gwrk_typs,claim_val,title,rep_yr,wrk_yr,conf_ldate,conf_adate,aff_ndate,aff_adate,page_ct,prpty_nm,nts_maps,bcgs_maps,lat83_deg,lat83_min,lat83_sec,lon83_deg,lon83_min,lon83_sec,zone83,north83,east83,lat83,long83,com_cds,camp_cd,geo_sum,reg_geo,info_cls,mdiv_cds,mdiv_nmx,mdiv_nms,claim_nmx,minf_nox,camp_nm,claim_nms,gwrk_nmx,gwrk_nms,rel_ars,oper_nms,own_nms,auth_nms,com_nms,kwl_nms,MERG_SPENT,DOLL_INX,doll_86,CPIdex1992,doll_92,CPIdex2002,doll_02,URL
100,33232,1.0,2011/12/13,PROS:,3046,Prospecting Survey Report Hook Bay Cu Property,2012,2011.0,,2012-12-13,,2011/12/13,25,Hook Bay,092F02W:,092F006:,49,4,49,124,52,36,10,5438074,362950,49.080278,-124.876667,CU:AG:AU:,,,NAN,3.0,ALBI:,Alberni,Alberni,840842,092F  195,,840842,Prospecting,Prospecting,12044,"Ferguson, Delbert W.","Ferguson, Delbert W.","Ferguson, Delbert W.","Copper, Silver, Gold","Triassic, Vancouver Group, Karmutsen Formation, Basaltic volcanics, Jurassic, Island Plutonic Suite, Granodiorites",3100.0,1.7690000000000001,1752.402487,1.389,2231.821454,1.178,2631.578947,http://aris.empr.gov.bc.ca/search.asp?mode=repsum&rep_no=33232
176,32090,1.0,2011/2/3,PROS:,3708,"Geochemical, Prospecting Report on the Bitterroot Property",2011,2011.0,,2012-02-03,,2011/2/3,36,Bitterroot,092F07E:,092F027:,49,16,33,124,42,19,10,5459519,375965,49.275833,-124.705278,,24.0,,NAN,3.0,ALBI:,Alberni,Alberni,"700664,<br>700827,<br>701146,<br>705562,<br>705563,<br>705712,<br>700683","092F  246, 092F  451, 092F  452",Sicker Belt,"700664, 700827, 701146, 705562, 705563, 705712, 700683",Prospecting,Prospecting,30529,"Saulnier, Paul","Saulnier, Paul","Saulnier, Paul",,"Devonian-Permian, Nitinat Formation, McLaughlin Ridge Formation, Mount Mark Formation, Karmutsen Formation, Limestones, Basalts",4386.09,1.75,2506.337143,1.374,3192.20524,1.165,3764.88412,http://aris.empr.gov.bc.ca/search.asp?mode=repsum&rep_no=32090
225,32897,1.0,2010/11/28,GEOC:,6487,Geological and Rock Geochemistry at the DAAS Bornite Vein Deposit,2012,2011.0,,2011-11-28,,2010/11/28,18,DASS,092F13E:,092F092:,49,56,47,125,41,50,10,5536158,306495,49.946389,-125.697222,CU:,,,NAN,3.0,ALBI:,Alberni,Alberni,571072,,,571072,Geochemical,Geochemical,30383,"Crombie, Walter","Crombie, Walter","Wasteneys, Hardolph",Copper,"Triassic, Karmutsen Formation, Basalts, Bornite",5578.23,1.7690000000000001,3153.3239120000003,1.389,4016.0043200000005,1.178,4735.339559,http://aris.empr.gov.bc.ca/search.asp?mode=repsum&rep_no=32897
336,32556,1.0,2011/9/12,GEOP:,6102,Assessment Report Spectral Data Fusion and Spectral Analyses on the WWW Property,2011,2011.0,,2012-09-12,,2011/9/12,24,WWW,092F02E:,092F007:,49,0,41,124,43,1,10,5430142,374450,49.011389,-124.716944,,,,NAN,3.0,ALBI:,Alberni,Alberni,516512,,,516512,Geophysical,Geophysical,"30045, 30948, 31357, 31821","McLelland, Julie","McLelland, Julie","McLelland, David",,"Jurassic, Karmutsen Formation, Island Plutonic Suite, Granodiorites, Diorites, Basalts",8216.66,1.75,4695.234286,1.374,5980.101892000001,1.165,7052.927039,http://aris.empr.gov.bc.ca/search.asp?mode=repsum&rep_no=32556
358,33624,1.0,2012/5/10,PROS:,7914,Prospecting Report on the Wiskey Jack Property,2012,2011.0,,2013-05-10,,2012/5/10,31,Wiskey Jack,092F03W:,092F014:,49,6,59,125,18,5,10,5442945,332070,49.116389,-125.30138899999999,,25.0,,NAN,4.0,ALBI:,Alberni,Alberni,"Wiskey Jack,<br>Sherelle,<br>Danny Boy",,Tofino - Kennedy River Area,"Wiskey Jack, Sherelle, Danny Boy",Prospecting,Prospecting,,"Herriott, Douglas; Brouwer, Douglas A.","Herriott, Douglas; Brouwer, Douglas A.","Herriott, Douglas; Brouwer, Douglas A.",,"Jurassic, Triassic, Island Plutonic Suite, Karmutsen Formation, Basalts, Granodiorites",8930.88,1.7690000000000001,5048.547202000001,1.389,6429.719222,1.178,7581.3921900000005,http://aris.empr.gov.bc.ca/search.asp?mode=repsum&rep_no=33624
546,32557,1.0,2011/7/25,GEOP:,17290,Spectral Data Fusion and Spectral Analyses on the WWW Property,2011,2011.0,,2012-07-25,,2011/7/25,27,WWW,092F02E:,092F007:,49,0,17,124,40,47,10,5429340,377150,49.004721999999994,-124.679722,,,,NAN,3.0,ALBI:,Alberni,Alberni,"516513,<br>516514",,,"516513, 516514",Geophysical,Geophysical,"30045, 30948, 31816, 32342","McLelland, Julie","McLelland, Julie","McLelland, David",,"Jurassic, Island Plutonic Suite, Karmutsen Formation, Basalts, Granodiorites",16433.34,1.75,9390.48,1.374,11960.218340000001,1.165,14105.87124,http://aris.empr.gov.bc.ca/search.asp?mode=repsum&rep_no=32557
636,33041,1.0,2011/9/25,GEOC:,25250,Geological and Geochemical Report on the Scrutor Gold Property,2011,2011.0,,2012-09-25,,2011/9/25,96,Scrutor Gold,092L03E:,092L015:,50,8,10,127,1,30,9,5555632,641138,50.136111,-127.025,AU:AG:CU:,29.0,,NAN,3.0,ALBI:,Alberni,Alberni,"Tahsish One,<br>Artlish Two,<br>Scrutor North",092L  100,Zeballos - Kyuquot Area,"Tahsish One, Artlish Two, Scrutor North",Geochemical,Geochemical,"14608, 15562, 17134, 19820, 25749, 29591, 30218, 31961","Shearer, Johan Tom FMC 124452","Shearer, Johan Tom FMC 124452","Shearer, Johan Tom FMC 124452","Gold, Silver, Copper","Jurassic, Bonanza Group, Island Plutonic Suite, Granodiorites, Andesites, Crystal tuffs, Rhyolites, Argillites",27258.5,1.75,15576.28571,1.374,19838.79185,1.165,23397.85408,http://aris.empr.gov.bc.ca/search.asp?mode=repsum&rep_no=33041
711,33577,1.0,2012/11/13,PROS:GEOC:,42243,Technical Assessment Report for a Prospecting and Geochemistry Program on the Old Joe Property,2012,2011.0,,2013-11-13,,2012/11/13,36,Old Joe,092F06E:,092F035:,49,20,48,125,1,56,10,5467981,352397,49.346667,-125.03222199999999,CU:AG:AU:,,,NAN,3.0,ALBI:,Alberni,Alberni,"POONTANG2,<br>JOHNNY BOY1,<br>OLD JOE,<br>BOOTS ON THE GROUND,<br>ASH 276,<br>940215,<br>MUD LAKE,<br>POONTANG3,<br>MUD LAKE PIT EXTENSION,<br>ASH 276,<br>941482,<br>964869,<br>964889,<br>964909,<br>964929,<br>975698,<br>975707,<br>977092","092F  293, 092F  340, 092F  415, 092F  430",,"POONTANG2, JOHNNY BOY1, OLD JOE, BOOTS ON THE GROUND, ASH 276, 940215, MUD LAKE, POONTANG3, MUD LAKE PIT EXTENSION, ASH 276, 941482, 964869, 964889, 964909, 964929, 975698, 975707, 977092","Prospecting,<br>Geochemical","Prospecting, Geochemical","16101, 16239, 19943, 21401","Bruner, Danny","Bruner, Danny","Houle, Jacques (FMC 137830)","Copper, Silver, Gold","Jurassic, Island Plutonic Suite, Granodiorites, Triassic, Vancouver Group, Karmutsen Formation, Mafic volcanics, Chalcopyrite, Pyrite, Bornite, Chlorite alteration, Porphyries",42294.74,1.7690000000000001,23908.84115,1.389,30449.77682,1.178,35903.853989999996,http://aris.empr.gov.bc.ca/search.asp?mode=repsum&rep_no=33577
984,33388,1.0,2012/8/9,GEOL:,1693,Petrology of One Rock Sample Number 8R299851 Collected from Tunjony Lake Island,2012,2011.0,,2013-08-09,,2012/8/9,31,Tunjony,104K07E:,104K047:,58,27,0,132,42,46,8,6481083,633480,58.45,-132.71277800000001,,,,SMI,3.0,ATLN:,Atlin,Atlin,TUNJONY 1,,,TUNJONY 1,Geological,Geological,,"Aspinall, Nicholas Clive","Aspinall, Nicholas Clive","Aspinall, Nicholas Clive",,"Triassic, Stuhini Group, Andesite flows, Basalt flows, Volcanic breccias",1740.0,1.7690000000000001,983.6065573999999,1.389,1252.699784,1.178,1477.079796,http://aris.empr.gov.bc.ca/search.asp?mode=repsum&rep_no=33388
990,32677,1.0,2011/10/5,PROS:,483,Prospecting Report on the Husselbee Property,2011,2011.0,,2012-10-05,,2011/10/5,39,Husselbee,104N12W:,104N071:,59,42,26,133,51,24,8,6619360,564333,59.707221999999994,-133.856667,RS:,,,SMI,3.0,ATLN:,Atlin,Atlin,672503,104N  001,,672503,Prospecting,Prospecting,"02786, 28771","Aspinall, Nicholas Clive","Aspinall, Nicholas Clive","Aspinall, Nicholas Clive",Rare Earths,"Permian-Jurassic, Cache Creek Complex, Nakina Formation, Three Sisters Plutonic Suite, Tonalites, Basalts",2020.0,1.75,1154.285714,1.374,1470.160116,1.165,1733.905579,http://aris.empr.gov.bc.ca/search.asp?mode=repsum&rep_no=32677
1027,33228,1.0,2011/11/12,GEOL:,2991,Petrology Study on the Imperial Property,2011,2011.0,,2012-11-12,,2011/11/12,36,Imperial,104N12E:,104N062:,59,36,37,133,36,13,8,6608838,578798,59.610278,-133.603611,AU:AG:,53.0,,SMI,3.0,ATLN:,Atlin,Atlin,Imperial,,Atlin Camp,Imperial,Geological,Geological,"17495, 26602, 27504, 28620, 29481, 30462, 31403","Aspinall, Nicholas Clive","Aspinall, Nicholas Clive","Aspinall, Nicholas Clive","Gold, Silver","Mississippian-Permian, Cache Creek Complex, Nakina Formation, Basaltic volcanics, Ultramafic rocks, Gabbros",3183.0,1.75,1818.857143,1.374,2316.593886,1.165,2732.188841,http://aris.empr.gov.bc.ca/search.asp?mode=repsum&rep_no=33228
1104,33623,1.0,2012/5/9,PROS:,5126,Assessment Report describing Prospecting on the Silt Claims,2012,2011.0,,2013-05-09,,2012/5/9,20,Silt,104M13E:,104M093:,59,54,22,135,32,17,8,6641077,469904,59.906110999999996,-135.538056,,,,SMI,3.0,ATLN:,Atlin,Atlin,Silt,,,Silt,Prospecting,Prospecting,,"Wilson, Bradley S.","Wilson, Bradley S.","Wilson, Bradley S.",,"Paleogene, Granites, Biotite granites",5127.7,1.7690000000000001,2898.643301,1.389,3691.648668,1.178,4352.886248,http://aris.empr.gov.bc.ca/search.asp?mode=repsum&rep_no=33623
1262,32511,1.0,2011/8/15,GEOC:,11726,Geochemistry Reconnaissance on West Boundaries Metla Property,2011,2011.0,,2012-08-15,,2011/8/15,55,Metla,104K07E:,104K037:,58,23,26,132,40,10,8,6474553,636237,58.390556000000004,-132.669444,,,,SMI,3.0,ATLN:,Atlin,Atlin,"Metla 1,<br>Metla West 1-5",104K  161,,"Metla 1, Metla West 1-5",Geochemical,Geochemical,"21757, 27145, 27771, 29058, 30661, 32184","Aspinall, Nicholas Clive; Dawson, James Martin","Aspinall, Nicholas Clive; Dawson, James Martin","Aspinall, Nicholas Clive",,"Triassic, Stuhini Group, Andesites, Breccias, Agglomerates, Phyllites",9122.6,1.75,5212.914286,1.374,6639.446870000001,1.165,7830.557940000001,http://aris.empr.gov.bc.ca/search.asp?mode=repsum&rep_no=32511
1314,33184,1.0,2011/11/1,PROS:,5737,VLF-EM Prospecting Report on the Pine Creek Placer Claims,2011,2011.0,,2012-11-01,,2011/11/1,30,Pine Creek,104N12E:,104N053:,59,35,1,133,34,6,8,6605912,580852,59.583611,-133.568333,AU:,,,SMI,4.0,ATLN:,Atlin,Atlin,746362,,,746362,Prospecting,Prospecting,,"Javorsky, David","Javorsky, David","Javorsky, David",Gold,"Mississippian-Permian, Cache Creek Complex, Ultramafics, Basalts",11116.45,1.75,6352.257143,1.374,8090.574964,1.165,9542.017167,http://aris.empr.gov.bc.ca/search.asp?mode=repsum&rep_no=33184
2564,32621,1.0,2011/12/9,PROS:,2632,2011 Geological Mapping on the Murray Property,2011,2011.0,,2012-12-09,,2011/12/9,24,Murray,093G03W:,093G023:,53,14,0,123,25,18,10,5898310,471855,53.233332999999995,-123.421667,,,,PRG,3.0,CBOO:,Cariboo,Cariboo,M 1-4,,,M 1-4,Prospecting,Prospecting,"25504, 25911","Poole, William E.","Poole, William E.","Poole, William E.",,"Carboniferous-Triassic, Cache Creek Complex, Trembleur Intrusives, Granodiorites, Greenstones, Argillites, Andesites, Ultramafics",3900.0,1.75,2228.571429,1.374,2838.427948,1.165,3347.639485,http://aris.empr.gov.bc.ca/search.asp?mode=repsum&rep_no=32621
2600,32683,1.0,2011/10/13,GEOP:,1362,Geophysical Technical Report on the Fontaine Property,2012,2011.0,,2012-10-13,,2011/10/13,31,Fontaine,093A13E:,093A092:,52,58,40,121,44,0,10,5870549,585048,52.977778,-121.733333,AU:,,,PRG,3.0,CBOO:,Cariboo,Cariboo,Fontaincreek,,,Fontaincreek,Geophysical,Geophysical,,"Walter, Jason Douglas","Walter, Jason Douglas","Garrow, Terry D.",Gold,"Proterozoic, Snowshoe Group, Phyllites, Quartzites, Argillites",4265.0,1.7690000000000001,2410.966648,1.389,3070.5543559999996,1.178,3620.5432939999996,http://aris.empr.gov.bc.ca/search.asp?mode=repsum&rep_no=32683
2626,32858,1.0,2011/7/22,PHYS:,4720,Archaelogical Impact Assessment Interim Report on the Fraser Sed Property,2011,2011.0,,2012-07-22,,2011/7/22,17,Fraser Sed,093B01W:,093B029:,52,14,7,122,16,16,10,5787457,549776,52.235278,-122.271111,,,,PRG,4.0,CBOO:,Cariboo,Cariboo,"625383,<br>625403,<br>643383",,,"625383, 625403, 643383",Physical,Physical,,"MARUNIAK, DONALD","MARUNIAK, DONALD",TY HEFFNER,,"Permian-Triassic, Cache Creek Complex, Marine sediments",4382.5,1.75,2504.285714,1.374,3189.592431,1.165,3761.802575,http://aris.empr.gov.bc.ca/search.asp?mode=repsum&rep_no=32858
2631,32395,1.0,2011/6/1,GEOC:,6049,Geochemical Report on the MH Property,2011,2011.0,,2012-06-01,,2011/6/1,27,MH,093A05E:,093A042:,52,26,53,121,38,3,10,5811751,592824,52.44805600000001,-121.63416699999999,,36.0,,PRG,4.0,CBOO:,Cariboo,Cariboo,"665425,<br>665423,<br>665424",,Cariboo - Quesnel Belt,"665425, 665423, 665424",Geochemical,Geochemical,"14420, 22853, 23941, 28882, 30423","Livgard, Egil","Livgard, Egil; MacPherson, Frances Jean","Livgard, Egil",,"Triassic, Nicola Group, Basalts, Sedimentary rocks",4421.44,1.75,2526.537143,1.374,3217.933042,1.165,3795.227468,http://aris.empr.gov.bc.ca/search.asp?mode=repsum&rep_no=32395
2942,32385,1.0,2011/5/21,GEOP:PHYS:,10449,Geophysical Survey for Placer Prospecting at Mary Creek,2011,2011.0,,2012-05-21,,2011/5/21,43,Mary Creek,093G01E:,093G010:,53,3,47,122,5,0,10,5879678,561427,53.063056,-122.08333300000001,AU:,38.0,,PRG,3.0,CBOO:,Cariboo,Cariboo,"Lee 3,<br>Mary Gold 2,<br>Mary Gold 1,<br>643263,<br>839298",093G  026,Cariboo - Barkerville Camp,"Lee 3, Mary Gold 2, Mary Gold 1, 643263, 839298","Geophysical,<br>Physical","Geophysical, Physical","12474, 16365","Zeiler, Melvin Lee","Zeiler, Melvin Lee","Moll, Philipp",Gold,"Surficial geology, Placer, Tertiary, Glaciofluvial deposits, Gravels, Sediments, Triassic, Sandstone",7712.44,1.75,4407.108571,1.374,5613.129549,1.165,6620.120172,http://aris.empr.gov.bc.ca/search.asp?mode=repsum&rep_no=32385
3171,33238,1.0,2011/12/21,PROS:,7190,Prospecting Report on the Tubby Property,2012,2011.0,,2012-12-21,,2011/12/21,45,Tubby,093B10E:,093B077:,52,43,48,122,39,0,10,5842293,523635,52.73,-122.65,AU:,,,PRG,3.0,CBOO:,Cariboo,Cariboo,"Tubby 1-5,<br>Tubby 8-9",093B  065,,"Tubby 1-5, Tubby 8-9",Prospecting,Prospecting,,"Shearer, Johan Tom FMC 124452","Shearer, Johan Tom FMC 124452","Shearer, Johan Tom FMC 124452",Gold,"Ootsa Lake Group, Triassic, Takla Group, Limestones, Volcanics",10289.5,1.7690000000000001,5816.563029999999,1.389,7407.847372,1.178,8734.719864,http://aris.empr.gov.bc.ca/search.asp?mode=repsum&rep_no=33238
3175,33449,1.0,2012/1/13,GEOC:,10513,Geological and Geochemical and Prospecting Report on the Blackwater Property,2012,2011.0,,2013-01-13,,2012/1/13,34,Blackwater,093G07W:,093G026:,53,17,49,122,57,29,10,5905305,502796,53.296943999999996,-122.958056,AU:AG:CU:PB:ZN:,,,PRG,3.0,CBOO:,Cariboo,Cariboo,845472,"093G  062, 093G  010",,845472,Geochemical,Geochemical,"31538, 20506, 16073, 30932","Raven, Alan R.","Raven, Alan R.","Raven, Alan R.","Gold, Silver, Copper, Lead, Zinc","Permian-Triassic, Cache Creek Complex, Cherts, Siliciclastics, Oligocene-Pliocene, Conglomerates, Coarse Clastic Sedimentary Rocks",10323.73,1.7690000000000001,5835.912945,1.389,7432.491001,1.178,8763.777589,http://aris.empr.gov.bc.ca/search.asp?mode=repsum&rep_no=33449
3227,32659,1.0,2011/11/21,PHYS:GEOC:,15105,Report of 2011 Geochemical Survey on the Keno Property,2011,2011.0,,2012-11-21,,2011/11/21,33,Keno,093A06E:,093A035:,52,18,30,121,2,35,10,5797136,633414,52.308333000000005,-121.043056,MO:CU:AU:,36.0,,PRG,3.0,CBOO:,Cariboo,Cariboo,522517,093A  079,Cariboo - Quesnel Belt,522517,"Physical,<br>Geochemical","Physical, Geochemical","12363, 20040, 30356, 26317, 28677","Wahl, Herbert Joseph (FMC# 128059); Brown - John, Jack","Wahl, Herbert Joseph (FMC# 128059); Brown - John, Jack","Wahl, Herbert Joseph (FMC# 128059)","Molybdenum/Molybdenite, Copper, Gold","Quesnel Trough, Triassic, Nicola Group, Argillites, Quartz monzonites, Granodiorites, Rhyolite dykes",10974.66,1.75,6271.234286,1.374,7987.379913,1.165,9420.309013,http://aris.empr.gov.bc.ca/search.asp?mode=repsum&rep_no=32659
3257,32752,1.0,2011/12/30,GEOC:PROS:,10959,Report on 2011 Geochemical and Prospecting Programs,2012,2011.0,,2012-12-30,,2011/12/30,26,Star,093B12E:,093B063:,52,39,2,123,30,33,10,5833521,465555,52.65055600000001,-123.50916699999999,AU:,,,PRG,3.0,CBOO:,Cariboo,Cariboo,"854085,<br>854087,<br>854088,<br>854090",,,"854085, 854087, 854088, 854090","Geochemical,<br>Prospecting","Geochemical, Prospecting",,"Dunn, David St. Clair","Dunn, David St. Clair","Dunn, David St. Clair",Gold,"Eocene-Oligocene, Endako Group, Basalts",11468.13,1.7690000000000001,6482.832109,1.389,8256.393089,1.178,9735.254669,http://aris.empr.gov.bc.ca/search.asp?mode=repsum&rep_no=32752
3350,32660,1.0,2011/11/23,PHYS:GEOC:,18137,Geochemical Report on the Horsefly Motherlode Gold Project,2011,2011.0,,2012-11-23,,2011/11/23,29,Motherlode,093A06W:,093A023:,52,17,30,121,26,35,10,5794621,606186,52.291667,-121.443056,CU:PB:ZN:AG:AU:,36.0,,PRG,3.0,CBOO:,Cariboo,Cariboo,"521461,<br>521538","093A  064, 093A  075",Cariboo - Quesnel Belt,"521461, 521538","Physical,<br>Geochemical","Physical, Geochemical","13490, 30448, 31568, 06965, 27258","Wahl, Herbert Joseph (FMC# 128059); Brown - John, Jack","Wahl, Herbert Joseph (FMC# 128059); Brown - John, Jack","Wahl, Herbert Joseph (FMC# 128059)","Copper, Lead, Zinc, Silver, Gold","Triassic, Quesnel Trough, Mafic volcanics, Syenites",12712.05,1.75,7264.028570999999,1.374,9251.855895,1.165,10911.6309,http://aris.empr.gov.bc.ca/search.asp?mode=repsum&rep_no=32660
3894,32479,1.0,2011/8/24,GEOC:,35763,Rimfire Project Report of July 2011 Soil Sampling,2011,2011.0,,2012-08-24,,2011/8/24,33,Rimfire Project,093A05E:,093A033:,52,20,27,121,30,42,10,5799990,601394,52.340833,-121.51166699999999,,36.0,,PRG,3.0,CBOO:,Cariboo,Cariboo,518839,"093A  208, 093A  209, 093A  242",Cariboo - Quesnel Belt,518839,Geochemical,Geochemical,"13203, 26276, 26553, 26865, 27121, 31234","Wahl, Herbert Joseph (FMC# 128059); Brown - John, Jack","Wahl, Herbert Joseph (FMC# 128059); Brown - John, Jack","Wahl, Herbert Joseph (FMC# 128059)",,"Triassic, Nicola Group, Basalts, Chilcotin Group",25136.29,1.75,14363.594290000001,1.374,18294.24309,1.165,21576.21459,http://aris.empr.gov.bc.ca/search.asp?mode=repsum&rep_no=32479
4594,32899,1.0,2012/1/31,GEOP:PHYS:GEOC:,70822,Geophysical and Geochemical Report on the Murray Property,2011,2011.0,,2013-01-31,,2012/1/31,126,Murray,093G03W:,093G023:,53,12,30,123,24,30,10,5895524,472729,53.208332999999996,-123.40833300000001,,,,PRG,3.0,CBOO:,Cariboo,Cariboo,M 1-19,,,M 1-19,"Geophysical,<br>Physical,<br>Geochemical","Geophysical, Physical, Geochemical","25504, 25911, 28536, 30932, 32138, 32621","Poole, William E.","Poole, William E.","Mark, David G.",,"Eocene-Oligocene, Permian-Triassic, Endako Group, Cache Creek Complex, Basalts, Granodiorites, Ultramafics",71290.0,1.75,40737.14286,1.374,51885.00728,1.165,61193.13305,http://aris.empr.gov.bc.ca/search.asp?mode=repsum&rep_no=32899
5361,33173,1.0,2012/4/28,PROS:,1856,2012 Prospecting and Geochemical Report on the Big Sky Property,2012,2011.0,,2013-04-28,,2012/4/28,24,Big Sky,092O07W:,092O036:,51,23,3,122,55,37,10,5692540,505093,51.384167,-122.92694399999999,CU:AU:AG:,35.0,,KAM,3.0,CLIN:,Clinton,Clinton,"653853,<br>603855",,Taseko - Blackdome Area,"653853, 603855",Prospecting,Prospecting,,"Johnson, Bruce","Johnson, Bruce","Lane, Robert A. (Bob) (FMC 115043); Johnson, Bruce","Copper, Gold, Silver","Jurassic-Cretaceous, Granodiorites, Mount Alex Plutonic Complex, Monzogranitic intrusives, Cretaceous, Spences Bridge Group, Volcanics",2821.45,1.7690000000000001,1594.940644,1.389,2031.281497,1.178,2395.1188460000003,http://aris.empr.gov.bc.ca/search.asp?mode=repsum&rep_no=33173
5374,33154,1.0,2012/4/14,PROS:,2035,2011-2012 Prospecting Report on the Jurassic Hardrock Property,2012,2011.0,,2013-04-14,,2012/4/14,10,Jurassic Hardrock,092I13W:,092I091:,50,58,15,121,53,52,10,5647160,577390,50.970833,-121.897778,,,,KAM,4.0,CLIN:,Clinton,Clinton,853574,,,853574,Prospecting,Prospecting,"18366, 33019, 33020, 33021","Amey, William Larry","Amey, William Larry","Amey, William Larry",,"Jurassic, Granodiorites, Basalts",3242.85,1.7690000000000001,1833.1543239999999,1.389,2334.665227,1.178,2752.843803,http://aris.empr.gov.bc.ca/search.asp?mode=repsum&rep_no=33154
5593,33241,1.0,2011/12/22,PROS:,9474,Prospecting Assessment Report on the Sherwood Volcanic Ash Deposit,2012,2011.0,,2012-12-22,,2011/12/22,43,Sherwood,092P02W:,092P006:,51,4,59,120,52,6,10,5661222,649304,51.083056,-120.868333,VL:,,,KAM,3.0,CLIN:,Clinton,Clinton,"846176,<br>846097,<br>842292,<br>846098,<br>842284,<br>842283,<br>842294",092P  163,,"846176, 846097, 842292, 846098, 842284, 842283, 842294",Prospecting,Prospecting,"22221, 30478, 26727, 27248","Shearer, Johan Tom FMC 124452","Shearer, Johan Tom FMC 124452","Shearer, Johan Tom FMC 124452",Volcanic Ash,"Miocene, Deadman River Formation, Rhyolites, Chilcotin Group, Chilcotin Group, Basalts",8731.8,1.7690000000000001,4936.009045000001,1.389,6286.393089,1.178,7412.393888,http://aris.empr.gov.bc.ca/search.asp?mode=repsum&rep_no=33241
5599,32744,1.0,2011/6/28,GEOC:,7228,Geochemical and Geological Report on the Precisely Property,2011,2011.0,,2012-06-28,,2011/6/28,62,Hi Ox,092P02W:,092P017:,51,8,43,120,48,2,10,5668281,653844,51.145278000000005,-120.800556,AU:AG:,,,KAM,3.0,CLIN:,Clinton,Clinton,Big D,092P  156,,Big D,Geochemical,Geochemical,"13253, 14101, 15143, 15987","Shearer, Johan Tom FMC 124452","Shearer, Johan Tom FMC 124452","Shearer, Johan Tom FMC 124452","Gold, Silver","Triassic, Nicola Group, Jurassic, Thuya Batholith, Quartz diorites, Miocene, Basalts, Argillites, Andesites, Quartz veins",8892.35,1.75,5081.342857,1.374,6471.870451,1.165,7632.918455,http://aris.empr.gov.bc.ca/search.asp?mode=repsum&rep_no=32744
5721,32590,1.0,2011/9/17,GEOC:,13723,Geochemical and Geological Report on the Rod-Stir Property,2011,2011.0,,2012-09-17,,2011/9/17,41,Rod-Stir,092O01E:,092O019:,51,7,0,122,15,5,10,5663065,552398,51.116667,-122.25138899999999,,35.0,,KAM,3.0,CLIN:,Clinton,Clinton,"518186,<br>518258,<br>550812","092O  054, 092O  055, 092O  060",Taseko - Blackdome Area,"518186, 518258, 550812",Geochemical,Geochemical,"28631, 28032, 25929, 23954, 23953, 29376","Durfeld Geological Managment; Durfeld, Rudolf M.","Stewart, John Melvin (Mel)","Durfeld, Rudolf M.",,"Cretaceous, Jackass Mountain Group, Sandstones, Siltstones, Conglomerates, Granodiorites, Quartz feldspar porphyry",12931.72,1.75,7389.554286,1.374,9411.732168999999,1.165,11100.18884,http://aris.empr.gov.bc.ca/search.asp?mode=repsum&rep_no=32590
6413,32398,1.0,2011/7/8,PHYS:GEOC:,28817,Geochemical and Geological Report on the Kingpin Property,2011,2011.0,,2012-07-08,,2011/7/8,55,Kingpin,092P15E:,092P097:,51,59,32,120,38,10,10,5762812,662299,51.992222,-120.63611100000001,,36.0,,KAM,3.0,CLIN:CBOO:,"Clinton,<br>Cariboo","Clinton, Cariboo","506288,<br>522113","092P  184, 092P  089, 092P  200",Cariboo - Quesnel Belt,"506288, 522113","Physical,<br>Geochemical","Physical, Geochemical","25800, 25935, 25979, 26019, 26204, 26447, 26448, 26821, 26968, 27753, 27966, 28027, 28795, 29139, 29435, 29875, 31138, 31184, 31233","Wahl, Herbert Joseph (FMC# 128059)","Wahl, Herbert Joseph (FMC# 128059)","Wahl, Herbert Joseph (FMC# 128059)",,"Triassic, Nicola Group, Basalts, Conglomerates, Wackes, Turbidites",22824.88,1.75,13042.78857,1.374,16611.99418,1.165,19592.17167,http://aris.empr.gov.bc.ca/search.asp?mode=repsum&rep_no=32398
6824,33243,1.0,2012/12/26,PROS:,7477,Prospecting Assessment Report on the BBX Barite Deposit,2012,2011.0,,2013-12-26,,2012/12/26,39,BBX,082G13W:,082G091:,49,59,17,115,52,49,11,5537903,580266,49.988056,-115.880278,BA:,,,CRA,3.0,FORT:,Fort Steele,Fort Steele,BBX,,,BBX,Prospecting,Prospecting,"06886, 07613, 07690, 08794, 09670, 21710","Shearer, Johan Tom FMC 124452","Shearer, Johan Tom FMC 124452","Shearer, Johan Tom FMC 124452",Barium/Barite,"Proterozoic, Purcell Supergroup, Sedimentary rocks, Argillites, Dutch Creek Formation, Barite",7127.04,1.7690000000000001,4028.852459,1.389,5131.058315,1.178,6050.118846,http://aris.empr.gov.bc.ca/search.asp?mode=repsum&rep_no=33243
6935,32911,1.0,2011/12/19,GEOP:,6511,Geophysical Assessment (Gravity Survey) of the Bootleg Mountain Property,2011,2011.0,,2012-12-19,,2011/12/19,29,Bootleg Mountain,082F09E:,082F070:,49,39,23,116,10,23,11,5500756,559686,49.656389000000004,-116.173056,,1.0,,CRA,4.0,FORT:,Fort Steele,Fort Steele,"841428,<br>841686,<br>841687",,Purcell Belt (Sullivan),"841428, 841686, 841687",Geophysical,Geophysical,,"Sanders, Edward (Ted)","Sanders, Edward (Ted)","Sanders, Edward (Ted)",,"Proterozoic, Aldridge Formation, Quartz wackes, Siltstones, Gabbros, Quartzites",9902.5,1.75,5658.571429,1.374,7207.059679999999,1.165,8500.0,http://aris.empr.gov.bc.ca/search.asp?mode=repsum&rep_no=32911
6942,33693,1.0,2012/6/18,GEOP:,6064,Gravity Survey on the JV 13 and 14 Claims,2012,2011.0,,2013-06-18,,2012/6/18,23,JV,082G12E:,082G052:,49,39,0,115,36,0,11,5500658,601059,49.65,-115.6,,1.0,,CRA,3.0,FORT:,Fort Steele,Fort Steele,JV 13-14,,Purcell Belt (Sullivan),JV 13-14,Geophysical,Geophysical,"00822, 12953, 15912, 23477, 26347, 26500, 26683, 31651, 32378, 32632, 33290","Kostiuk, Brian","Kostiuk, Brian","Ransom, P.W.",,"Helikian, Aldridge Formation, Argillites, Quartzites, Greywackes, Turbidites",10300.0,1.7690000000000001,5822.498587,1.389,7415.406767,1.178,8743.633276999999,http://aris.empr.gov.bc.ca/search.asp?mode=repsum&rep_no=33693
