,rep_no,cnf_prd,aff_dt,gwrk_typs,claim_val,title,rep_yr,wrk_yr,conf_ldate,conf_adate,aff_ndate,aff_adate,page_ct,prpty_nm,nts_maps,bcgs_maps,lat83_deg,lat83_min,lat83_sec,lon83_deg,lon83_min,lon83_sec,zone83,north83,east83,lat83,long83,com_cds,camp_cd,geo_sum,reg_geo,info_cls,mdiv_cds,mdiv_nmx,mdiv_nms,claim_nmx,minf_nox,camp_nm,claim_nms,gwrk_nmx,gwrk_nms,rel_ars,oper_nms,own_nms,auth_nms,com_nms,kwl_nms,MERG_SPENT,DOLL_INX,doll_86,CPIdex1992,doll_92,CPIdex2002,doll_02,URL
8248,33825,1.0,2012/12/20,GEOC:,8342,Fen Property AssessmentGeochemical Report on the Fen Property,2013,2012.0,,2013-12-20,,2012/12/20,28,Fen,082J06W:,082J043:,50,25,1,115,29,34,11,5586076,607079,50.416944,-115.492778,RS:,,,CRA,3.0,GOLD:,Golden,Golden,"Jack 7,<br>Sat 2,<br>G 16",,,"Jack 7, Sat 2, G 16",Geochemical,Geochemical,"29007, 29352, 29777, 30674, 31439, 31888",Fen Resources Ltd.,Fen Resources Ltd.,"Gifford, Robert Gordon",Rare Earths,"Cambrian, Cambrian-Ordovician, Chancellor Formation, Ottertail Formation, Limestones, Slates, Siltstones, Argillites, Diorites, Sills, Hornfels, Galena",12535.88,1.767,7094.442558,1.3880000000000001,9031.613833,1.177,10650.705179999999,http://aris.empr.gov.bc.ca/search.asp?mode=repsum&rep_no=33825
8409,34429,1.0,2013/9/18,GEOC:,52921,Baymag 2013 Geological Report,2013,2012.0,,2014-09-18,,2013/9/18,26,Baymag,082J13E:,082J072:,50,47,0,115,41,4,11,5626556,592740,50.783333,-115.684444,MT:,,,CRA,3.0,GOLD:,Golden,Golden,"Bay 38,<br>Bay 34,<br>Bay 36,<br>596229,<br>596517,<br>596518,<br>596529,<br>597887,<br>597888","082JNW001, 082JNW006, 082JNW010, 082JNW011, 082JNW012, 082JNW013",,"Bay 38, Bay 34, Bay 36, 596229, 596517, 596518, 596529, 597887, 597888",Geochemical,Geochemical,"02048, 06565, 17538, 18203, 19033, 20451, 21924, 21962, 22671, 23186, 24685, 25110, 25995, 26313, 26619, 27295, 27581, 29504, 30633, 31408, 32808, 33900",Baymag Inc.,Baymag Inc.,"Knuckey, Ian R.J.; Stern, Fabio",Magnesite,"Cambrian, Chancellor Formation, Limestones, Slates, Siltstones, Argillites",40984.5,1.767,23194.39728,1.3880000000000001,29527.73775,1.177,34821.15548,http://aris.empr.gov.bc.ca/search.asp?mode=repsum&rep_no=34429
8428,33900,1.0,2012/9/17,GEOL:GEOC:,62164,Baymag 2012 Geological and Geochemical Report,2012,2012.0,,2013-09-17,,2012/9/17,25,Baymag,082J13E:,082J072:,50,45,44,115,39,40,11,5624238,594427,50.762221999999994,-115.661111,MT:,,,CRA,3.0,GOLD:,Golden,Golden,"596228,<br>596230,<br>596231,<br>596506,<br>596507,<br>596509,<br>596519,<br>596521,<br>BAY 41,<br>597889","082JNW001, 082JNW006",,"596228, 596230, 596231, 596506, 596507, 596509, 596519, 596521, BAY 41, 597889","Geological,<br>Geochemical","Geological, Geochemical","02048, 17538, 19033, 21962, 22671, 24685, 25110, 25995, 26313, 26619, 27295, 27581, 29504, 30633, 31408, 32808",Baymag Inc.,Baymag Inc.,"Knuckey, Ian R.J.; Stern, Fabio",Magnesite,"Cambrian, Chancellor Formation, Limestones, Slates, Siltstones, Argillites, Magnesite",48558.16,1.7690000000000001,27449.49689,1.389,34959.07847,1.178,41220.8489,http://aris.empr.gov.bc.ca/search.asp?mode=repsum&rep_no=33900
8478,33565,1.0,2013/1/22,GEOL:GEOC:,130130,Geological and Geochemical Report 2012 Field activities at the Ice River Property,2013,2012.0,,2014-01-22,,2013/1/22,160,Ice River,082N01W:,082N019:,51,10,10,116,23,4,11,5668848,543036,51.169444,-116.38444399999999,RS:NB:PB:ZN:AG:AU:,,,CRA,3.0,GOLD:,Golden,Golden,"504463,<br>516018,<br>516355,<br>575641",082N  028,,"504463, 516018, 516355, 575641","Geological,<br>Geochemical","Geological, Geochemical","03389, 03433, 20207, 25751, 26663, 28187, 29013, 30321, 32421",Eagle Plains Resources Ltd.,Eagle Plains Resources Ltd.,"Brown, Jarrod","Rare Earths, Niobium/Columbium, Lead, Zinc, Silver, Gold","Devonian, Devonian, Ice River Complex, Ice River Complex, Syenites, Syenites, Monzonites, Monzonites, Cambrian, Cambrian, Ottertail Formation, Ottertail Formation, Dolomitic calcareous rocks, Dolomitic calcareous rocks, Carbonatites",98141.64,1.767,55541.39219,1.3880000000000001,70707.23343,1.177,83382.87171,http://aris.empr.gov.bc.ca/search.asp?mode=repsum&rep_no=33565
8503,33332,1.0,2012/6/27,DRIL:GEOL:GEOC:,209005,"2012 Diamond Drilling, Geological and Geochemical Report on the Black Diamond Property",2012,2012.0,,2013-06-27,,2012/6/27,106,Black Diamond,082K08W:,082K039:,50,21,11,116,23,9,11,5578067,543692,50.353056,-116.385833,AG:PB:AU:ZN:,,,CRA,3.0,GOLD:,Golden,Golden,BD,"082KSE001, 082KSE007, 082KSE027, 082KSE032, 082KSE033, 082KSE034, 082KSE035, 082KSE038, 082KSE045, 082KSE049, 082KSE055, 082KSE066, 082KSE071, 082KSE071, 082KSE080, 082KSE086, 082KSE088",,BD,"Drilling,<br>Geological,<br>Geochemical","Drilling, Geological, Geochemical","01897, 08639, 09829, 09846, 13657, 14594, 15101, 17008, 19891, 21207, 23241, 23346, 23533, 23823, 24326, 24997, 25523, 25896, 27729, 28788, 31524, 32105",Eagle Plains Resources Ltd.,Eagle Plains Resources Ltd.,"Ryley, James K.","Silver, Lead, Gold, Zinc","Helikian, Purcell Supergroup, Windermere Supergroup, Toby Formation, Quartzites, Quartz arenites, Dolomites, Conglomerates, Quartz veins, Proterozoic",150263.23,1.7690000000000001,84942.47032000001,1.389,108180.8711,1.178,127557.9202,http://aris.empr.gov.bc.ca/search.asp?mode=repsum&rep_no=33332
8557,33732,1.0,2013/4/2,DRIL:GEOL:GEOC:GEOP:,1187038,"Geological, Geophysical, Geochemical and Drilling on the Ptarmigan Property",2013,2012.0,,2014-04-02,,2013/4/2,759,Ptarmigan,082K09W:,082K058:,50,30,15,116,24,40,11,5594854,541761,50.504166999999995,-116.411111,AG:AU:CU:PB:ZN:,,,CRA,3.0,GOLD:,Golden,Golden,"705107,<br>705247,<br>834603,<br>834604,<br>837802,<br>837803,<br>551570,<br>583845,<br>583849,<br>583853,<br>583855,<br>583860,<br>598556,<br>598575,<br>598576,<br>1013644,<br>1013645","082KSE030, 082KSE036, 082KSE037, 082KSE050, 082KSE091",,"705107, 705247, 834603, 834604, 837802, 837803, 551570, 583845, 583849, 583853, 583855, 583860, 598556, 598575, 598576, 1013644, 1013645","Drilling,<br>Geological,<br>Geochemical,<br>Geophysical","Drilling, Geological, Geochemical, Geophysical","11739, 15334, 22369, 22370, 22969, 23007, 23182, 23461, 24586, 25146, 25658, 25695, 26325, 26617, 26931, 27215, 27439, 28214, 28707, 31005, 31512, 32719",Silver Mountain Mines Inc.,Silver Mountain Mines Inc.,"Walker, Richard T.","Silver, Gold, Copper, Lead, Zinc","Proterozoic, Purcell Supergroup, Windermere Supergroup, Mount Nelson Formation, Toby Formation, Horsethief Creek Group, Massive sulphides, Pyrite, Tetrahedrite, Turbidites, Quartzites, Argillites, Dolomites, Iron carbonates, Sphalerite, Galena",1187415.63,1.767,671995.2632,1.3880000000000001,855486.7651,1.177,1008849.303,http://aris.empr.gov.bc.ca/search.asp?mode=repsum&rep_no=33732
8711,34016,1.0,2013/1/8,PROS:GEOC:,2859,Prospecting and Rock Geochemical Report on the Don Claims,2013,2012.0,,2014-01-08,,2013/1/8,23,Don,082E01E:,082E010:,49,1,0,118,10,4,11,5429965,414615,49.016667,-118.167778,NI:CR:PT:PD:CU:,,,CRA,3.0,GRWD:,Greenwood,Greenwood,DON,082ESE276,,DON,"Prospecting,<br>Geochemical","Prospecting, Geochemical","16358, 24385, 24636","Gal, Leonard","Gal, Leonard","Gal, Leonard","Nickel, Chromium/Chromite, Platinum, Palladium, Copper","Carboniferous-Permian, Mount Roberts Formation, Ultramafics, Eocene, Penticton Group, Volcanics, Jurassic, Granites, Magnetite, Serpentinites",2860.33,1.767,1618.749293,1.3880000000000001,2060.756484,1.177,2430.186916,http://aris.empr.gov.bc.ca/search.asp?mode=repsum&rep_no=34016
8839,33957,1.0,2013/3/15,GEOC:,6026,Rock Geochemistry Report  on the Bubba Buddha Property,2013,2012.0,,2014-03-15,,2013/3/15,27,Bubba Buddha,082E07W:,082E036:,49,23,35,118,52,20,11,5472837,364145,49.393056,-118.872222,CU:AU:,,,CRA,3.0,GRWD:,Greenwood,Greenwood,BUBBA BUDDHA 1-3,"082ESE176, 082ESE100",,BUBBA BUDDHA 1-3,Geochemical,Geochemical,"01722, 06899, 07245, 09079, 12553, 13883, 23522, 25632, 26034, 26820, 26916, 27236, 29255, 32675, 32676",Kootenay Silver Inc.,"Kennedy, Thomas Peter James (FMC134308)","Kennedy, Thomas Peter James (FMC134308)","Copper, Gold","Cretaceous, Cretaceous, Okanagan Batholith, Okanagan Batholith, Carboniferous-Permian, Carboniferous-Permian, Anarchist Schist, Anarchist Schist, Eocene, Eocene, Penticton Group, Penticton Group, Volcanic rocks, Volcanic rocks, Mafic volcanics, Mafic volcanics, Tuffs, Tuffs, Wallace Formation",4500.0,1.767,2546.689304,1.3880000000000001,3242.074928,1.177,3823.279524,http://aris.empr.gov.bc.ca/search.asp?mode=repsum&rep_no=33957
8850,33945,1.0,2012/12/2,GEOC:,4611,Franklin Project Exploration and Geochemical Sampling Report,2013,2012.0,,2013-12-02,,2012/12/2,34,Franklin,082E09W:,082E059:,49,33,37,118,22,11,11,5490643,400945,49.560278000000004,-118.369722,AU:CU:,,,CRA,3.0,GRWD:,Greenwood,Greenwood,"SILVER QUEEN,<br>MORELL'S CAMP,<br>DANE","082ESE108, 082ESE177, 082ESE271",,"SILVER QUEEN, MORELL'S CAMP, DANE",Geochemical,Geochemical,"27750, 05535, 19504, 09583, 28790",Crucible Resources Ltd.,"Warkentin, Doug (FMC 145582)","Warkentin, Doug (FMC 145582)","Gold, Copper","Harper Ranch Group, Franklin Group, Eocene, Kettle River Formation, Marron Formation, Jurassic, Granodiorites, Volcaniclastics, Carboniferous-Permian, Diorites, Greenstones",4708.88,1.767,2664.900962,1.3880000000000001,3392.5648409999994,1.177,4000.747664,http://aris.empr.gov.bc.ca/search.asp?mode=repsum&rep_no=33945
8978,34437,1.0,2013/9/19,PROS:,3808,Cannon Ball Property Technical  Report,2013,2012.0,,2014-09-19,,2013/9/19,42,Cannonball,082E01E:,082E009:,49,5,5,118,12,6,11,5437569,412257,49.084722,-118.20166699999999,AU:AG:CU:PB:ZN:,,,CRA,3.0,GRWD:,Greenwood,Greenwood,CANNONBALL,082ESE093,,CANNONBALL,Prospecting,Prospecting,"02371, 03054","Firmston, Benjamin Alan","Firmston, Benjamin Alan","Hirtz, Alexander","Gold, Silver, Copper, Lead, Zinc","Carboniferous-Permian, Jurassic, Mount Roberts Formation, Mudstones, Siltstones, Shales, Granites, Hornfels, Granodiorites, Arsenopyrite",6676.82,1.767,3778.6191280000003,1.3880000000000001,4810.389049,1.177,5672.744265,http://aris.empr.gov.bc.ca/search.asp?mode=repsum&rep_no=34437
9065,34412,1.0,2013/9/5,DRIL:,9427,Technical Drilling Report on the Terrace Lake Property,2013,2012.0,,2014-09-05,,2013/9/5,15,Terrace Lake,082E07E:,082E037:,49,22,9,118,39,40,11,5469822,379405,49.369167,-118.661111,AU:AG:,,,CRA,3.0,GRWD:,Greenwood,Greenwood,Terrace Lake,,,Terrace Lake,Drilling,Drilling,33892,Cannon Minerals Ltd.,"Cannon, Steven W","Cannon, Steven W","Gold, Silver","Eocene, Cretaceous, Coryell Plutonic Suite, Okanagan Batholith, Syenites, Monzonites, Granite porphyry",8557.15,1.767,4842.756084000001,1.3880000000000001,6165.09366,1.177,7270.305862,http://aris.empr.gov.bc.ca/search.asp?mode=repsum&rep_no=34412
9133,34309,1.0,2013/6/17,GEOC:,8256,Geochemical Report on the Golden Goose Property,2013,2012.0,,2014-06-17,,2013/6/17,43,Golden Goose,082E01E:,082E009:,49,3,21,118,12,20,11,5434363,411922,49.055833,-118.205556,AU:AG:CU:PB:ZN:,,,CRA,3.0,GRWD:,Greenwood,Greenwood,1000802,082ESE097,,1000802,Geochemical,Geochemical,,"Firmston, Benjamin Alan","Firmston, Benjamin Alan","Firmston, Benjamin Alan; Hirtz, Alexander","Gold, Silver, Copper, Lead, Zinc","Eocene, Carboniferous-Permian, Mount Roberts Formation, Coryell Plutonic Suite, Syenites, Monzonites, Skarns",10542.61,1.767,5966.38936,1.3880000000000001,7595.540346,1.177,8957.187766,http://aris.empr.gov.bc.ca/search.asp?mode=repsum&rep_no=34309
9439,33688,1.0,2012/12/13,DRIL:,21748,Report on 2012 Diamond Drilling on the 97 Bev Mineral Claim,2013,2012.0,,2013-12-13,,2012/12/13,24,97 Bev,082E03E:,082E015:,49,8,9,119,11,3,11,5444853,340685,49.135833,-119.18416699999999,TC:CU:NI:AU:AG:,9.0,,CRA,3.0,GRWD:,Greenwood,Greenwood,97 BEV,082ESW221,Similkameen - Boundary Area,97 BEV,Drilling,Drilling,"13768, 16168, 25789, 26133, 29300, 30371","Whatley, Christopher Drew; 3 spurs Resources Ltd.","Whatley, Christopher Drew; 3 spurs Resources Ltd.","Cannon, Steven W","Talc, Copper, Nickel, Gold, Silver","Permian, Anarchist Group, Greenstones, Talc",24490.0,1.767,13859.649119999998,1.3880000000000001,17644.09222,1.177,20807.13679,http://aris.empr.gov.bc.ca/search.asp?mode=repsum&rep_no=33688
9515,33407,1.0,2012/7/10,GEOC:,31913,Geochemical Report on the Beaverdell Project,2012,2012.0,,2013-07-10,,2012/7/10,117,Mullins Hill,082E06E:,082E035:,49,23,27,119,3,51,11,5472953,350211,49.390833,-119.064167,,10.0,,CRA,3.0,GRWD:,Greenwood,Greenwood,"Mullins Hill,<br>748242","082ESW240, 082ESW071, 082ESW061",Beaverdell Area,"Mullins Hill, 748242",Geochemical,Geochemical,"04521, 05519, 05525, 05914, 07900, 08356, 08526, 09988, 10979, 24083, 24084, 25255, 30082, 30766, 31308",St. Elias Mines Ltd.,St. Elias Mines Ltd.,"Thom, James - DGW Consultants",,"Carboniferous-Permian, Jurassic, Anarchist Group, Greenstones, Granites, Schists",31575.5,1.7690000000000001,17849.34992,1.389,22732.5414,1.178,26804.32937,http://aris.empr.gov.bc.ca/search.asp?mode=repsum&rep_no=33407
9521,33602,1.0,2012/12/11,GEOP:GEOC:,39194,Geophysical Report on the Beaverdell Project,2012,2012.0,,2013-12-11,,2012/12/11,216,Beaverdell,082E11E:,082E055:,49,30,39,119,1,3,11,5486201,353955,49.510833,-119.0175,AG:PB:ZN:AU:CU:MO:,10.0,,CRA,3.0,GRWD:,Greenwood,Greenwood,"EAST EXT,<br>561837,<br>407369","082ENW046, 082ENW037, 082ENW047",Beaverdell Area,"EAST EXT, 561837, 407369","Geophysical,<br>Geochemical","Geophysical, Geochemical","01230, 04521, 05519, 05525, 05914, 07900, 08356, 09731, 11599, 15439, 16998, 20818, 24006, 30082, 30766, 30865, 31308",St. Elias Mines Ltd.,St. Elias Mines Ltd.,"Thom, James - DGW Consultants","Silver, Lead, Zinc, Gold, Copper, Molybdenum/Molybdenite","Carboniferous-Permian, Jurassic, Anarchist Schist, Greenstones, Greenschists, Granites",32095.92,1.7690000000000001,18143.53872,1.389,23107.213819999997,1.178,27246.11205,http://aris.empr.gov.bc.ca/search.asp?mode=repsum&rep_no=33602
9539,33551,1.0,2012/3/21,GEOC:,34768,Geochemical Orientation Survey and Economic Evaluation of the Grandby Gold Property,2012,2012.0,,2013-03-21,,2012/3/21,76,Grandby Gold,082E01W:,082E018:,49,11,45,118,27,49,11,5450257,393370,49.195833,-118.46361100000001,AU:AG:,,,CRA,3.0,GRWD:,Greenwood,Greenwood,753242,"082ESE179, 082ESE072, 082ESE110, 082ESE281",,753242,Geochemical,Geochemical,"06130, 08883, 11522, 11680, 13165, 13546, 16066, 17375, 22349, 22516, 23993, 25125, 25563, 25720, 25901, 26172, 26470, 27629, 28239","Maddin, C. Hugh (FMC 116570)","Maddin, C. Hugh (FMC 116570)","Levson, Vic; McMillan, Ronald H.","Gold, Silver","Devonian-Permian, Devonian-Permian, Knob Hill Group, Knob Hill Group, Cherts, Cherts, Argillites, Argillites, Cretaceous, Cretaceous, Anstey Pluton, Anstey Pluton, Granodiorites, Granodiorites, Eocene, Eocene, Coryell Plutonic Suite, Coryell Plutonic Suite, Syenites, Syenites, Monzonites, Monzonites, Jurassic, Jurassic, Granites, Granites, Skarns, Pyrite, Pyrrhotite, Magnetite, Chalcopyrite",35347.86,1.7690000000000001,19981.83154,1.389,25448.42333,1.178,30006.67233,http://aris.empr.gov.bc.ca/search.asp?mode=repsum&rep_no=33551
9545,33433,1.0,2012/11/13,GEOL:PHYS:GEOC:,24169,Geochemical and Geological Report on the Bud-Elk Property,2012,2012.0,,2013-11-13,,2012/11/13,123,Bud-Elk,082E02E:,082E007:,49,5,25,118,42,46,11,5438904,374952,49.090278000000005,-118.712778,CU:AU:,8.0,,CRA,3.0,GRWD:,Greenwood,Greenwood,"Bud 4,<br>Bud 6,<br>Bud 8,<br>Elk 1,<br>Elk","083ESE154, 082ESE172",Greenwood Camp,"Bud 4, Bud 6, Bud 8, Elk 1, Elk","Geological,<br>Physical,<br>Geochemical","Geological, Physical, Geochemical","00079, 00129, 00143, 00301, 00562, 00881, 01648, 01878, 02054, 03932, 04125, 04237, 05023, 05158, 18798, 18917, 19046, 20588, 20921, 22529, 22914, 24543, 24919, 25346, 30052",Saville Resources Inc.,"Kemp, John","Caron, Linda J.","Copper, Gold","Knob Hill Group, Cherts, Quartzites, Granodiorites, Devonian-Permian, Triassic, Brooklyn Formation, Greenstones, Coarse Clastic Sedimentary Rocks, Limestones, Eocene, Marron Formation, Nelson Plutonic Complex",36123.01,1.7690000000000001,20420.01696,1.389,26006.48668,1.178,30664.6944,http://aris.empr.gov.bc.ca/search.asp?mode=repsum&rep_no=33433
9972,33337,1.0,2012/9/6,PROS:,799,Prospecting Report on Pyro Claim,2012,2012.0,,2013-09-06,,2012/9/6,10,Pyro,092I14E:,092I075:,50,46,33,121,6,6,10,5626615,633841,50.775833,-121.10166699999999,PL:,,,KAM,4.0,KAML:,Kamloops,Kamloops,PYRO 1,092INW087,,PYRO 1,Prospecting,Prospecting,14914,"Marlow, Jeremy (FMC# 140671)","Marlow, Jeremy (FMC# 140671)","Marlow, Jeremy (FMC# 140671)",Pyrophyllite,"Triassic, Nicola Group, Andesites, Eocene, Kamloops Group, Volcanic rocks, Pyrophyllite",1000.0,1.7690000000000001,565.2911249,1.389,719.9424046,1.178,848.8964346000001,http://aris.empr.gov.bc.ca/search.asp?mode=repsum&rep_no=33337
10025,33348,1.0,2012/11/5,GEOP:,1847,Prospecting Report Kerrisdale 1 Property,2012,2012.0,,2013-11-05,,2012/11/5,30,Kerrisdale,092I10W:,092I056:,50,33,22,120,52,40,10,5602615,650325,50.556111,-120.877778,,18.0,,KAM,3.0,KAML:,Kamloops,Kamloops,Kerrisdale 1,092INE111,Highland Valley Camp,Kerrisdale 1,Geophysical,Geophysical,29416,Crestwell Resources Inc.,Crestwell Resources Inc.,"Hemingway, Alan Brent",,"Triassic, Nicola Group, Guichon Creek Batholith, Quartz diorites, Basalts",1507.08,1.7690000000000001,851.9389486,1.389,1085.0107990000001,1.178,1279.354839,http://aris.empr.gov.bc.ca/search.asp?mode=repsum&rep_no=33348
10037,34205,1.0,2013/5/7,PHYS:,1401,"Archaeological Impact Assessment Report, PFR",2013,2012.0,,2014-05-07,,2013/5/7,0,Rainbow Ridge Lava Rock,092I14W:,092I094:,50,59,7,121,21,21,10,5649474,615404,50.985278,-121.355833,PU:,,,KAM,3.0,KAML:,Kamloops,Kamloops,SCOTTY,092INW107,,SCOTTY,Physical,Physical,"30260, 16525","Jones, Mike Gerald","Jones, Mike Gerald","Jones, Mike Gerald",Pumice,"Miocene-Pliocene, Chilcotin Group, Eocene, Kamloops Group, Volcanic rocks, Sedimentary rocks, Lavas, Building stone, Pumice",1605.52,1.767,908.6134691999999,1.3880000000000001,1156.7146970000001,1.177,1364.0781650000001,http://aris.empr.gov.bc.ca/search.asp?mode=repsum&rep_no=34205
10191,33749,1.0,2013/2/27,PROS:,3716,Prospecting Survey on the Fraser River Project,2013,2012.0,,2014-02-27,,2013/2/27,31,Fraser River Project,092I05E:,092I022:,50,16,1,121,36,31,10,5569238,599162,50.266944,-121.60861100000001,AU:PT:,,,KAM,3.0,KAML:,Kamloops,Kamloops,"545980,<br>575009,<br>575011,<br>941069,<br>955697","092ISW078, 092ISW100, 092ISW092, 092ISW083",,"545980, 575009, 575011, 941069, 955697",Prospecting,Prospecting,,North Bay Resources Inc. (FMC 204090),North Bay Resources Inc. (FMC 204090),"Oancea, Dan V.","Gold, Platinum","Permian-Triassic, Mount Lytton Complex, Granodiorites, Cretaceous, Jackass Mountain Group, Sedimentary rocks, Alluvial deposits, Placer gold, Placers",2602.71,1.767,1472.95416,1.3880000000000001,1875.1512969999999,1.177,2211.308411,http://aris.empr.gov.bc.ca/search.asp?mode=repsum&rep_no=33749
10324,33788,1.0,2012/7/4,GEOC:,3614,Geochemical Report on the Dot Mordenite Project,2012,2012.0,,2013-07-04,,2012/7/4,40,Dot Mordenite,092I03E:,092I025:,50,15,40,121,7,30,10,5569345,633642,50.261111,-121.125,ZE:,,,KAM,3.0,KAML:,Kamloops,Kamloops,"DOT MORDENITE,<br>DOT SE",092ISW108,,"DOT MORDENITE, DOT SE",Geochemical,Geochemical,30607,"Shearer, Johan Tom FMC 124452","Shearer, Johan Tom FMC 124452","Shearer, Johan Tom FMC 124452",Zeolite,"Cretaceous, Spences Bridge Group, Spius Creek Formation, Andesitic volcanics, Zeolites, Mordenite",3362.0,1.7690000000000001,1900.5087620000002,1.389,2420.446364,1.178,2853.9898129999997,http://aris.empr.gov.bc.ca/search.asp?mode=repsum&rep_no=33788
10465,33832,1.0,2012/7/2,GEOL:,2526,Detailed Mapping of Thrust Structure in Bex Zone,2013,2012.0,,2013-07-02,,2012/7/2,11,Sam,082M05E:,082M022:,51,17,39,119,43,30,11,5686065,310015,51.294167,-119.725,CU:AG:,39.0,,KAM,3.0,KAML:,Kamloops,Kamloops,Sam,"082M  010, 082M  049, 082M  117",Adams Plateau - Clearwater Area,Sam,Geological,Geological,"02231, 06720, 12081, 21378, 21590, 27970, 28667, 29437, 30508, 32487","Murphy, Jay Deneen","Murphy, Jay Deneen","Murphy, Jay Deneen","Copper, Silver","Devonian, Eagle Bay Assemblage, Quartzites, Paragneisses, Quartz monzonites",4308.0,1.767,2438.03056,1.3880000000000001,3103.746398,1.177,3660.152931,http://aris.empr.gov.bc.ca/search.asp?mode=repsum&rep_no=33832
10471,34236,1.0,2013/5/4,GEOL:PROS:,6159,Geological Assessment Report on the Alyce Mineral Claim,2013,2012.0,,2014-05-04,,2013/5/4,26,Alyce,092I11W:,092I054:,50,33,38,121,18,21,10,5602316,620000,50.560556,-121.305833,GY:,,,KAM,3.0,KAML:,Kamloops,Kamloops,503900,092INW054,,503900,"Geological,<br>Prospecting","Geological, Prospecting","03680, 16963, 27206","Shearer, Johan Tom FMC 124452","Shearer, Johan Tom FMC 124452","Shearer, Johan Tom FMC 124452",Gypsum,"Triassic, Nicola Group, Western Volcanic Facies, Rhyolites, Andesites, Dacites, Gypsum",4400.0,1.767,2490.096208,1.3880000000000001,3170.028818,1.177,3738.3177570000003,http://aris.empr.gov.bc.ca/search.asp?mode=repsum&rep_no=34236
10484,33767,1.0,2013/2/12,GEOC:,3997,Geochemical Report 2008 on the GJP Claim,2013,2012.0,,2014-02-12,,2013/2/12,26,GJP,092P09W:,092P078:,51,42,8,120,27,6,10,5730996,676084,51.702222,-120.45166699999999,CU:AU:ZN:,,,KAM,3.0,KAML:,Kamloops,Kamloops,953453,,,953453,Geochemical,Geochemical,,"Kerr, John R.","Kerr, John R.","Kerr, John R.","Copper, Gold, Zinc","Triassic, Nicola Group, Intermediate volcanic rocks, Basic volcanics",4573.0,1.767,2588.002264,1.3880000000000001,3294.668588,1.177,3885.301614,http://aris.empr.gov.bc.ca/search.asp?mode=repsum&rep_no=33767
10538,33680,1.0,2012/11/10,GEOC:,4881,Mad Squirrel Property Technical Report,2013,2012.0,,2013-11-10,,2012/11/10,41,Mad Squirrel,082M04E:,082M022:,51,12,10,119,41,28,11,5675817,312005,51.202778,-119.691111,,39.0,,KAM,3.0,KAML:,Kamloops,Kamloops,"SPRING 1-2,<br>THRUST 5,<br>THRUST 2,<br>FAULT",,Adams Plateau - Clearwater Area,"SPRING 1-2, THRUST 5, THRUST 2, FAULT",Geochemical,Geochemical,"14193, 29674, 32583, 30419, 31710, 18321","Lowry, Cleveland","Lowry, Cleveland","Lowry, Cleveland",,"Proterozoic-Cambrian, Eagle Bay Assemblage, Graffunder Lakes Unit, Quartzites, Quartz arenites, Johnson Lake Unit, Greenschists, Greenstones",4903.57,1.767,2775.08206,1.3880000000000001,3532.8314119999995,1.177,4166.1597280000005,http://aris.empr.gov.bc.ca/search.asp?mode=repsum&rep_no=33680
10540,34123,1.0,2013/2/14,PROS:,4844,Prospecting Report on the Graph Property,2013,2012.0,,2014-02-14,,2013/2/14,30,Graph Lucky-J,082M05E:,082M032:,51,21,16,119,41,15,11,5692670,312883,51.354444,-119.6875,GT:,,,KAM,3.0,KAML:,Kamloops,Kamloops,GRAPH 1,,,GRAPH 1,Prospecting,Prospecting,,"Shearer, Johan Tom FMC 124452","Shearer, Johan Tom FMC 124452","Shearer, Johan Tom FMC 124452",Graphite,"Cretaceous, Quartz monzonites, Devonian, Eagle Bay Assemblage, Paragneisses",4907.5,1.767,2777.306169,1.3880000000000001,3535.662824,1.177,4169.498726,http://aris.empr.gov.bc.ca/search.asp?mode=repsum&rep_no=34123
10639,34005,1.0,2012/12/23,GEOL:,5241,Airphoto Report on the McGillivray Project,2013,2012.0,,2013-12-23,,2012/12/23,65,McGillivray,092I05E:,092I042:,50,29,9,121,40,8,10,5593487,594426,50.485833,-121.668889,AU:CU:AG:,,,KAM,3.0,KAML:,Kamloops,Kamloops,"MCGILL 1,<br>MCGILL 9,<br>MCGILL SW,<br>MCGILL 7",092ISW039,,"MCGILL 1, MCGILL 9, MCGILL SW, MCGILL 7",Geological,Geological,"03154, 04455, 11371, 28798, 31066, 32728",Atocha Resources Inc,"Shearer, Johan Tom FMC 124452","Shearer, Johan Tom FMC 124452","Gold, Copper, Silver","Feldspar dykes, Argillic alteration, Cretaceous, Intermediate volcanics, Felsic volcanics, Permian-Triassic, Mount Lytton Complex, Granodiorites, Quartz veins, Gossans",5661.0,1.767,3203.735144,1.3880000000000001,4078.5302590000006,1.177,4809.685641,http://aris.empr.gov.bc.ca/search.asp?mode=repsum&rep_no=34005
10657,33316,1.0,2012/5/18,PROS:,5737,Prospecting and Physical Report on the Parker Group of Mineral Claims,2012,2012.0,,2013-05-18,,2012/5/18,47,Parker,092I11W:,092I063:,50,38,37,121,24,33,10,5611390,612473,50.643611,-121.409167,AU:CU:NI:CR:,14.0,,KAM,3.0,KAML:,Kamloops,Kamloops,508389,092INW034,Swakum Mountain Area,508389,Prospecting,Prospecting,"13322, 13383, 27768, 30160","Parker, Trevor; Parker, Flora","Parker, Trevor; Parker, Flora","Parker, Trevor; Parker, Flora","Gold, Copper, Nickel, Chromium/Chromite","Pennsylvanian-Triassic, Cache Creek Complex, Serpentinite Ultramafic Rocks, Triassic, Nicola Group, Volcanics, Permian-Triassic, Marble Canyon Formation, Limestones, Granites, Granites, Diorites",5875.0,1.7690000000000001,3321.085359,1.389,4229.661627,1.178,4987.266553,http://aris.empr.gov.bc.ca/search.asp?mode=repsum&rep_no=33316
10664,33257,1.0,2012/9/16,PROS:,5887,2012 Prospecting Report on the Birch Mineral Claim Group,2012,2012.0,,2013-09-16,,2012/9/16,23,Birch,082M12W:,082M051:,51,30,52,119,56,49,11,5711152,295536,51.514444,-119.94694399999999,CU:AG:AU:,,,KAM,3.0,KAML:,Kamloops,Kamloops,"CW,<br>BIRCH,<br>BIRCH SOUTH,<br>FOGHORN,<br>LYDIA,<br>KEYSTONE","082M  008, 082M  029, 082M  030, 082M  040, 082M  041, 082M  048, 082M  108, 082M  134",,"CW, BIRCH, BIRCH SOUTH, FOGHORN, LYDIA, KEYSTONE",Prospecting,Prospecting,"01597, 01624, 01924, 03820, 04876, 07404, 07757, 07758, 07813, 08530, 09008, 09537, 09716, 11381, 11503, 14054, 15303, 17328, 17555, 18320, 26926","Jones, Gerald Albert","Jones, Mike; Jones, Gerald Albert","Jones, Mike","Copper, Silver, Gold","Devonian-Permian, Fennell Assemblage, Marine sediments, Devonian-Mississippian, Eagle Bay Assemblage, Andesitic volcanics, Calc-alkaline volcanics, Proterozoic-Cambrian, Paragneisses, Cretaceous, Quartz monzonites",5919.2,1.7690000000000001,3346.071227,1.389,4261.483081,1.178,5024.787776,http://aris.empr.gov.bc.ca/search.asp?mode=repsum&rep_no=33257
