,rep_no,cnf_prd,aff_dt,gwrk_typs,claim_val,title,rep_yr,wrk_yr,conf_ldate,conf_adate,aff_ndate,aff_adate,page_ct,prpty_nm,nts_maps,bcgs_maps,lat83_deg,lat83_min,lat83_sec,lon83_deg,lon83_min,lon83_sec,zone83,north83,east83,lat83,long83,com_cds,camp_cd,geo_sum,reg_geo,info_cls,mdiv_cds,mdiv_nmx,mdiv_nms,claim_nmx,minf_nox,camp_nm,claim_nms,gwrk_nmx,gwrk_nms,rel_ars,oper_nms,own_nms,auth_nms,com_nms,kwl_nms,MERG_SPENT,DOLL_INX,doll_86,CPIdex1992,doll_92,CPIdex2002,doll_02,URL
7248,36064,1.0,2016/3/5,GEOC:,27273,Rock Geochemistry and Soil Geochemistry Report,2016,2015.0,,2017-03-05,,2016/3/5,57,Silverfox,082G04E:,082G022:,49,14,1,115,40,8,11,5454278,596903,49.233610999999996,-115.668889,CU:PB:ZN:AG:,1.0,,CRA,3.0,FORT:,Fort Steele,Fort Steele,"KRL 12-10,<br>KRL 31-15,<br>KRL 33-15","082GSW021, 082GSW025, 082GSW030, 082GSW058, 082GSW066, 082GSW070, 082GSW072, 082GSW073",Purcell Belt (Sullivan),"KRL 12-10, KRL 31-15, KRL 33-15",Geochemical,Geochemical,"22942, 24401, 24478, 24772, 24840, 24932, 25138, 25378, 25559, 25647, 25671, 25672, 25799, 25822, 25823, 25858, 26018, 26202, 26502, 27805, 28069, 28450, 28623, 29290, 29810, 30232, 30660, 31658, 32181, 32629, 32638, 32645, 32807, 33261, 33379, 34086, 34146, 34178, 34440",Kootenay Gold Inc.,"Kennedy, Craig","Kennedy, Sean J. (FMC # 142365)","Copper, Lead, Zinc, Silver","Proterozoic, Purcell Supergroup, Creston Formation, Kitchener Formation, Aldridge Formation, Quartz wackes, Argillites, Siltstones, Quartzites, Gabbro sills, Pyrrhotite, Pyrite, Chalcopyrite, Polymetallic Veins, Galena, Sphalerite, Moyie Intrusions, Turbidites",27279.62,1.837,14850.092540000001,1.443,18904.79556,1.224,22287.271240000002,http://aris.empr.gov.bc.ca/search.asp?mode=repsum&rep_no=36064
7418,35964,1.0,2016/3/15,GEOC:,51341,Geological and Geochemical Report on the Sweet Spot Property,2016,2015.0,,2017-03-15,,2016/3/15,79,Sweet Spot,082G04W:,082G001:,49,0,38,115,57,55,11,5429158,575664,49.010556,-115.965278,ZN:PB:,,,CRA,3.0,FORT:,Fort Steele,Fort Steele,"Sweet Spot, Sweet Spot 04-11..",082GSW077,,"Sweet Spot, Sweet Spot 04-11..",Geochemical,Geochemical,"22609, 31661, 32246, 33481, 34340, 35667",Teck Resources Limited (FMC # 126548),"Kennedy, R.D.C.","Hollis, Lucy","Zinc, Lead","Proterozoic, Purcell Supergroup, Aldridge Formation, Moyie sills, Conglomerate turbidites, Quartzites, Wackes, Arenites, Siltstones, Argillites, Sedex, Sphalerite, Galena, Pyrite",42509.12,1.837,23140.5117,1.443,29458.849619999997,1.224,34729.6732,http://aris.empr.gov.bc.ca/search.asp?mode=repsum&rep_no=35964
7434,36022,1.0,2016/2/27,GEOL:,44990,Assessment Report for Geological Mapping,2016,2015.0,,2017-02-27,,2016/2/27,27,Silver Fox,082G04E:,082G012:,49,9,0,115,39,4,11,5445007,598363,49.15,-115.65111100000001,CU:AG:,,,CRA,3.0,FORT:,Fort Steele,Fort Steele,"KRL 04-10-14,<br>KRL 07-10-14,<br>KRL 10-10,<br>KRL 29-10-14,<br>KRL 115-12","082GSW058, 082GSW070, 082GSW072, 082GSW073, 082GSW087, 082GSW088, 082GSW089",,"KRL 04-10-14, KRL 07-10-14, KRL 10-10, KRL 29-10-14, KRL 115-12",Geological,Geological,"10907, 25559, 25647, 25671, 25672, 28069, 28623, 29609, 30660, 31658, 32181, 32629, 32638, 32645, 32807, 33379, 34086, 34965, 35034, 35377, 35769, 34146",Kootenay Silver Inc.,"Lavoie, Darlene (132094)","Anderson, Doug","Copper, Silver","Proterozoic, Purcell Supergroup, Creston Formation, Siltstones, Argillites, Quartzites, Quartz arenites, Kitchener Formation, Dolomitic carbonate rocks, Malachite, Azurite, Cerrusite, Hemimorphite, Chalcopyrite, Moyie sills, Galena, Pyrite, Gabbros",44990.96,1.837,24491.540559999998,1.443,31178.766460000003,1.224,36757.32026,http://aris.empr.gov.bc.ca/search.asp?mode=repsum&rep_no=36022
7443,35844,1.0,2015/9/25,GEOL:GEOC:,59285,Report on Geological Mapping and Rock Geochemistry on the Gold Mountain Property,2016,2015.0,,2016-09-25,,2015/9/25,65,Gold Mountain,082G12E:,082G063:,49,40,0,115,32,22,11,5502594,605394,49.666667,-115.53944399999999,AU:,1.0,,CRA,3.0,FORT:,Fort Steele,Fort Steele,"CELT,<br>LONE 4,<br>BOULDER 1,<br>941968","082GNW023, 082GNW036",Purcell Belt (Sullivan),"CELT, LONE 4, BOULDER 1, 941968","Geological,<br>Geochemical","Geological, Geochemical","20420, 27713, 34920, 18193, 23932, 24683","Kostiuk, Brian","Kostiuk, Brian; Fredlund, Albert T.","Pighin, David L.; Kennedy, Sean J. (FMC # 142365)",Gold,"Proterozoic, Purcell Supergroup, Creston Formation, Sedimentary rocks, Kitchener Formation, Dolomitic carbonate rocks, Aldridge Formation, Argillites, Wackes, Greywackes, Conglomerate turbidites, Cranbrook Formation, Quartzites, Quartz veins, Gold, Shear zones, Breccias, Nicol Creek Formation, Metabasalts, Amygdaloidal flows, Basalts, Eager Formation, Siltstones, Cambrian",45849.6,1.837,24958.95482,1.443,31773.80457,1.224,37458.82353,http://aris.empr.gov.bc.ca/search.asp?mode=repsum&rep_no=35844
7562,35769,1.0,2015/7/3,GEOL:PROS:GEOC:,65781,Prospecting and Rock Geochemistry Report,2015,2015.0,,2016-07-03,,2015/7/3,82,Silver Fox,082G04E:,082G003:,49,5,5,115,35,22,11,5437832,602995,49.084722,-115.589444,CU:,,,CRA,3.0,FORT:,Fort Steele,Fort Steele,"KRL 03-05-14,<br>KRL 04-10-14,<br>KRL 06-10-14,<br>KRL 13-10-14,<br>KRL 14-10-14,<br>515408,<br>KRL,<br>KRL 2,<br>KRL 03-05-14,<br>KRL 04-10-14,<br>KRL 04-10-14,<br>KRL 06-10-14,<br>KRL 07-10-14,<br>KRL 08-10-14,<br>KRL 09-10,<br>KRL 10-10,<br>KRL 15-10-14,<br>KRL 16-10,<br>KRL 18-10,<br>KRL 21-10-14,<br>KRL 26-10,<br>KRL 27-10,<br>KRL 28-10,<br>KRL 29-10-14,<br>KRL 111-11-14,<br>KRL 113-11-14,<br>KRL 30-15,<br>KRL 31-15,<br>KRL 32-15","082GSW025, 082GSW030, 082GSW058, 082GSW070, 082GSW072, 082GSW073, 082GSW085, 082GSW086, 082GSW087, 082GSW088, 082GSW089",,"KRL 03-05-14, KRL 04-10-14, KRL 06-10-14, KRL 13-10-14, KRL 14-10-14, 515408, KRL, KRL 2, KRL 03-05-14, KRL 04-10-14, KRL 04-10-14, KRL 06-10-14, KRL 07-10-14, KRL 08-10-14, KRL 09-10, KRL 10-10, KRL 15-10-14, KRL 16-10, KRL 18-10, KRL 21-10-14, KRL 26-10, KRL 27-10, KRL 28-10, KRL 29-10-14, KRL 111-11-14, KRL 113-11-14, KRL 30-15, KRL 31-15, KRL 32-15","Geological,<br>Prospecting,<br>Geochemical","Geological, Prospecting, Geochemical","22503, 24401, 25559, 25647, 25671, 25672, 25799, 26018, 27805, 28069, 28450, 28623, 29290, 29609, 29810, 30660, 31658, 32181, 32629, 32638, 32645, 32807, 33261, 33379, 34086, 34440, 34695, 34965, 35034",Kootenay Silver Inc.,"Kennedy, Craig","Kennedy, Sean J. (FMC # 142365)",Copper,"Proterozoic, Purcell Supergroup, Aldridge Formation, Creston Formation, Kitchener Formation, Mafic dikes, Wackes, Greywackes, Conglomerate turbidites, Quartzites, Argillites, Limestones, Chalcopyrite",65802.0,1.804,36475.60976,1.4169999999999998,46437.54411,1.202,54743.7604,http://aris.empr.gov.bc.ca/search.asp?mode=repsum&rep_no=35769
8042,35736,1.0,2015/7/2,PROS:GEOC:,2662,Technical Report Geochemical and Prospecting,2015,2015.0,,2016-07-02,,2015/7/2,33,Golden Leaf,082K16W:,082K089:,50,49,37,116,15,30,11,5630843,552236,50.826944,-116.25833300000001,LS:,,,CRA,3.0,GOLD:,Golden,Golden,ROCKY MOUNTAIN TUFA,082KNE059,,ROCKY MOUNTAIN TUFA,"Prospecting,<br>Geochemical","Prospecting, Geochemical",,"Delorme, Christopher (FMC 141575)","Delorme, Christopher (FMC 141575)","Delorme, Christopher (FMC 141575)",Limestone,"Ordovician-Silurian, Beaverfoot Formation, Dolomitic carbonate rocks, Ordovician, Cambrian-Ordovician, McKay Group, Mudstones, Siltstones, Shales, Tufa",2850.0,1.804,1579.822616,1.4169999999999998,2011.291461,1.202,2371.048253,http://aris.empr.gov.bc.ca/search.asp?mode=repsum&rep_no=35736
8045,35435,1.0,2015/3/29,GEOL:GEOC:,4143,Geological and Geochemical Report,2015,2015.0,,2016-03-29,,2015/3/29,35,Koot Silica,082J04W:,082J012:,50,8,43,115,45,20,11,5555525,588915,50.145278000000005,-115.755556,SI:,,,CRA,3.0,GOLD:,Golden,Golden,KOOT SILICA,082JSW025,,KOOT SILICA,"Geological,<br>Geochemical","Geological, Geochemical","08976, 10160",MGX Minerals Inc. (FMC# 283853),"Kikauka, Andris (FMC # 114051)","Kikauka, Andris (FMC # 114051)",Silica,"Proterozoic-Cambrian, Cranbrook Formation, Eager Formation, Limestones, Slates, Siltstones, Argillites, Cambrian, Sullivan Formation, Jubilee Formation, Lyell Formation, Marbles, Calcareous sedimentary rocks, Quartzites, Sandstones, Metamorphism, Conglomerates",2939.25,1.804,1629.296009,1.4169999999999998,2074.276641,1.202,2445.299501,http://aris.empr.gov.bc.ca/search.asp?mode=repsum&rep_no=35435
8505,35677,1.0,2015/10/7,DRIL:GEOC:,48005,"Geological, Geochemical and Core Drilling Report",2015,2015.0,,2016-10-07,,2015/10/7,166,Driftwood,082K15E:,082K098:,50,54,22,116,34,11,11,5639472,530253,50.906110999999996,-116.569722,MT:,,,CRA,3.0,GOLD:,Golden,Golden,"511333,<br>511335",082KNE068,,"511333, 511335","Drilling,<br>Geochemical","Drilling, Geochemical","26345, 19416, 08760, 30243, 35175, 31353",MGX Minerals Inc. (FMC# 283853),"Klewchuk, Peter; Rodgers, Glen M. (FMC#123054); Kikauka, Andris (FMC # 114051)","Kikauka, Andris (FMC # 114051)",Magnesite,"Proterozoic, Purcell Supergroup, Mount Nelson Formation, Quartzites, Quartz arenites, Dolomites, Magnesite, Horsethief Creek Group, Coarse Clastic Sedimentary Rocks",159881.05,1.804,88625.8592,1.4169999999999998,112830.6634,1.202,133012.5208,http://aris.empr.gov.bc.ca/search.asp?mode=repsum&rep_no=35677
8744,36027,1.0,2016/1/6,GEOC:,3734,Exploration and Sampling,2016,2015.0,,2017-01-06,,2016/1/6,36,Franklin,082E09W:,082E059:,49,34,55,118,23,29,11,5493081,399423,49.581944,-118.39138899999999,AU:AG:CU:PT:PD:,,,CRA,3.0,GRWD:,Greenwood,Greenwood,"AVERRILL NW,<br>BUFFALO,<br>UNION TAILS,<br>ALPHA TWIN,<br>1036688","082ENE001, 082ENE002, 082ENE004, 082ENE007, 082ENE008, 082ENE013, 082ENE020, 082ENE021, 082ENE033, 082ENE042, 082ENE050, 082ENE051, 082ENE052, 082ENE053, 082ENE054, 082ENE059, 082ENE062, 082ENE063, 082ENE066",,"AVERRILL NW, BUFFALO, UNION TAILS, ALPHA TWIN, 1036688",Geochemical,Geochemical,"01688, 06340, 08126, 09115, 09583, 09584, 09674, 13710, 15964, 21195, 21768, 26306, 26591, 27328, 27626, 27929, 28790, 33945, 34310, 34714, 35033, 35477, 35780","Warkentin, Doug (FMC 145582)","Warkentin, Doug (FMC 145582)","Warkentin, Doug (FMC 145582)","Gold, Silver, Copper, Platinum, Palladium","Jurassic, Carboniferous-Permian, Eocene, Penticton Group, Harper Ranch Group, Kettle River Formation, Marron Formation, Franklin Group, Limestones, Skarns, Volcaniclastic rocks, Granites, Averill Alkalic Complex, Coryell Plutonic Suite, Syenites, Pyrite, Sphalerite, Galena, Argentite, Chalcopyrite, Pyrargyrite, Tetrahedrite",3400.09,1.837,1850.8927600000002,1.443,2356.2647260000003,1.224,2777.851307,http://aris.empr.gov.bc.ca/search.asp?mode=repsum&rep_no=36027
8800,35780,1.0,2015/7/30,GEOC:,3978,Union Tails Area - Metallurgical testing Report,2015,2015.0,,2016-07-30,,2015/7/30,42,Franklin,082E09W:,082E059:,49,33,25,118,22,8,11,5490272,400999,49.556944,-118.368889,AU:AG:CU:,,,KAM,3.0,GRWD:,Greenwood,Greenwood,"UNION TAILS,<br>TWIN CREEK,<br>ALPHA TWIN,<br>UNION","082ENE001, 082ENE004, 082ENE008, 082ENE013, 082ENE020, 082ENE021, 082ENE033, 082ENE042, 082ENE050, 082ENE052, 082ENE053, 082ENE054, 082ENE059, 082ENE062, 082ENE063",,"UNION TAILS, TWIN CREEK, ALPHA TWIN, UNION",Geochemical,Geochemical,"01688, 06340, 08126, 09115, 09583, 09584, 09674, 13710, 21195, 21768, 26306, 26591, 27328, 27626, 27929, 28790, 33945, 34310, 34714, 35033, 35477","Warkentin, Doug (FMC 145582)","Warkentin, Doug (FMC 145582)","Warkentin, Doug (FMC 145582)","Gold, Silver, Copper","Jurassic, Eocene, Carboniferous-Permian, Penticton Group, Harper Ranch Group, Kettle River Formation, Marron Formation, Franklin Group, Volcaniclastic rocks, Limestones, Granites, Skarns, Polymetallic Veins, Pyrite, Chalcopyrite, Galena, Sphalerite",4057.61,1.804,2249.2294899999997,1.4169999999999998,2863.5215239999998,1.202,3375.715474,http://aris.empr.gov.bc.ca/search.asp?mode=repsum&rep_no=35780
8802,35477,1.0,2015/2/16,GEOC:,4222,Franklin Project Union Tails Area Metallurgical Testing Report,2015,2015.0,,2016-02-16,,2015/2/16,37,Franklin,082E09W:,082E059:,49,33,6,118,21,54,11,5489680,401269,49.551667,-118.365,AU:AG:,,,CRA,3.0,GRWD:,Greenwood,Greenwood,UNION TAILS,"082ENE003, 082ENE001, 083ENE004, 082ENE008, 082ENE013, 082ENE020, 082ENE021, 082ENE033, 082ENE052, 082ENE054, 082ENE059, 082ENE062",,UNION TAILS,Geochemical,Geochemical,"00637, 17273, 21768, 26306, 26440, 27328, 27604, 27929, 28790, 29306, 33945, 34310, 34714, 34846, 08126, 09115, 09515, 09583, 09584, 09674","Warkentin, Doug (FMC 145582)","Warkentin, Doug (FMC 145582)","Warkentin, Doug (FMC 145582)","Gold, Silver","Jurassic, Granitic batholith, Granites, Carboniferous-Permian, Harper Ranch Group, Volcaniclastic rocks, Eocene, Coryell Plutonic Suite, Syenites, Monzonites, Penticton Group, Volcanic rocks",4082.44,1.804,2262.993348,1.4169999999999998,2881.04446,1.202,3396.372712,http://aris.empr.gov.bc.ca/search.asp?mode=repsum&rep_no=35477
9048,35864,1.0,2015/9/18,PROS:GEOC:,6978,British Columbia Geological Assessment Report Geochemical Prospecting Report,2015,2015.0,,2016-09-18,,2015/9/18,50,Boomerang,082E07W:,082E026:,49,16,26,118,59,27,11,5459810,355190,49.273889000000004,-118.99083300000001,AU:AG:CU:PB:ZN:RS:,,,CRA,3.0,GRWD:,Greenwood,Greenwood,BOOMERANG PLATEAUX,"082ESW063, 082ESW234",,BOOMERANG PLATEAUX,"Prospecting,<br>Geochemical","Prospecting, Geochemical","05621, 06286, 08211, 08929, 15191, 16671, 21092, 21658, 22282, 34480, 34578, 34584, 34776, 34822, 35162","Snider, Rodney J.","Snider, Rodney J.","Snider, Rodney J.","Gold, Silver, Copper, Lead, Zinc, Rare Earths","Cretaceous, Jurassic, Okanagan Batholith, Valhalla Intrusions, Granites, Eocene, Penticton Group, Volcanic rocks",8245.0,1.804,4570.399113,1.4169999999999998,5818.63091,1.202,6859.400998,http://aris.empr.gov.bc.ca/search.asp?mode=repsum&rep_no=35864
9139,36515,1.0,2016/9/21,PROS:,9695,British Columbia Geological Assessment Report,2017,2015.0,,2017-09-21,,2016/9/21,21,Boomerang Plateaux,082E07W:,082E026:,49,17,22,118,59,14,11,5461533,355498,49.289444,-118.987222,AU:AG:PB:ZN:CU:,,,CRA,3.0,GRWD:,Greenwood,Greenwood,BOOMERANG PLATEAUX,,,BOOMERANG PLATEAUX,Prospecting,Prospecting,"08929, 34480, 34578, 34584, 35864","Snider, Rodney J.","Snider, Rodney J.","Snider, Rodney J.","Gold, Silver, Lead, Zinc, Copper","Cretaceous, Okanagan Batholith, Valhalla Intrusions, Jurassic, Granites, Alkali-feldspar granites, Eocene, Penticton Group, Volcanic rocks",11270.0,1.875,6010.666667,1.474,7645.8616010000005,1.25,9016.0,http://aris.empr.gov.bc.ca/search.asp?mode=repsum&rep_no=36515
9153,35860,1.0,2015/10/7,GEOP:GEOC:,12067,Geophysical Report,2015,2015.0,,2016-10-07,,2015/10/7,120,Carmi,082E11E:,082E055:,49,30,55,119,10,12,11,5487002,342930,49.515278,-119.17,MO:,10.0,,KAM,3.0,GRWD:,Greenwood,Greenwood,"1011070,<br>1011079,<br>1011090",082ENW036,Beaverdell Area,"1011070, 1011079, 1011090","Geophysical,<br>Geochemical","Geophysical, Geochemical","05860, 14559, 16102, 19298, 20275, 28874, 30806, 32304, 34139","Leslie, Dorian","Leslie, Dorian","Leslie, Dorian",Molybdenum/Molybdenite,"Tertiary, Valhalla Plutonic Complex, Granodiorites, Quartz diorites, Monzonites, Molybdenite, Pyrite, Magnetite, Chalcopyrite, Bornite, Breccias, Quartz monzonites",11208.18,1.804,6212.960089,1.4169999999999998,7909.795342,1.202,9324.608984999999,http://aris.empr.gov.bc.ca/search.asp?mode=repsum&rep_no=35860
9315,35550,1.0,2015/5/6,GEOP:,18187,Ground-Penetrating Radar Survey Report,2015,2015.0,,2016-05-06,,2015/5/6,38,Vergo,082E03E:,082E005:,49,5,58,119,9,22,11,5440764,342625,49.099444,-119.15611100000001,AU:,9.0,,CRA,4.0,GRWD:,Greenwood,Greenwood,VERGO GROUP,,Similkameen - Boundary Area,VERGO GROUP,Geophysical,Geophysical,"32349, 31077, 31076, 17176, 12368, 05795, 05408","Bedard, Phil","Bedard, Phil","Tessari, Warren",Gold,"Carboniferous-Permian, Anarchist Schist, Greenstones, Greenschists, Metamorphic rocks, Placer, Placer gold, Gold, Ground penetrating radar",18256.0,1.804,10119.73392,1.4169999999999998,12883.55681,1.202,15188.01997,http://aris.empr.gov.bc.ca/search.asp?mode=repsum&rep_no=35550
9520,35567,1.0,2015/8/11,GEOP:,32692,Ronin Placer Ground Penetrating Radar Survey Report,2015,2015.0,,2016-08-11,,2015/8/11,68,Ronin,082E03E:,082E015:,49,6,6,119,5,56,11,5440879,346800,49.101667,-119.09888899999999,AU:,9.0,,CRA,3.0,GRWD:,Greenwood,Greenwood,"EAST RONIN,<br>MIDDLE RONIN","082ESW119, 082ESW023",Similkameen - Boundary Area,"EAST RONIN, MIDDLE RONIN",Geophysical,Geophysical,"23979, 33239, 33694, 35615",Ronin Exploration Ltd.,"Tessari, Warren","Tessari, Warren",Gold,"Carboniferous-Permian, Anarchist Schist, Eocene, Penticton Group, Greenschists, Greenstones, Mudstones, Siltstones, Shales, Volcanic rocks",32716.0,1.804,18135.25499,1.4169999999999998,23088.21454,1.202,27217.97005,http://aris.empr.gov.bc.ca/search.asp?mode=repsum&rep_no=35567
9653,35911,1.0,2015/11/18,GEOL:GEOP:PROS:GEOC:PHYS:,52376,"Geological, Geochemical Geophysical Report on the Boomerang",2016,2015.0,,2016-11-18,,2015/11/18,67,Boomerang,082E06E:,082E025:,49,15,5,119,1,0,11,5457359,353244,49.251389,-119.016667,AU:AG:,10.0,,KAM,3.0,GRWD:,Greenwood,Greenwood,"TERESA,<br>ICONOCLAST,<br>BOOMERANG",082ESW063,Beaverdell Area,"TERESA, ICONOCLAST, BOOMERANG","Geological,<br>Geophysical,<br>Prospecting,<br>Geochemical,<br>Physical","Geological, Geophysical, Prospecting, Geochemical, Physical","05621, 06286, 08211, 15191, 16671, 21658",Carrara Exploration Ltd.,"Lynes, Craig A. (FMC 116233)","Kikauka, Andris (FMC # 114051); Lynes, Craig A. (FMC 116233)","Gold, Silver","Jurassic, Eocene, Granites, Alkali-feldspar granites, Penticton Group, Volcanic rocks, Pyrite, Chalcopyrite, Galena, Quartz diorites, Nelson Intrusions, Tetrahedrite, Sphalerite",55392.96,1.837,30154.03375,1.443,38387.35967,1.224,45255.68627,http://aris.empr.gov.bc.ca/search.asp?mode=repsum&rep_no=35911
10097,35356,1.0,2015/3/23,GEOC:,2842,Technical Exploration Report on Prospecting and Exploring,2015,2015.0,,2016-03-23,,2015/3/23,34,LD-Comstock,092I02W:,092I007:,50,3,14,120,47,46,10,5546949,657763,50.053889,-120.79611100000001,AU:AG:PB:ZN:CU:,12.0,,KAM,3.0,KAML:,Kamloops,Kamloops,COQ COMSTOCK,"092ISE022, 092ISE052, 092ISE053, 092ISE156, 092ISE159",Nicola Belt,COQ COMSTOCK,Geochemical,Geochemical,"01735, 02757, 02817, 02967, 03192, 03455, 03456, 03711, 03791, 05185, 05228, 06248, 07568, 09018, 10114, 12799, 12860, 13114, 16058, 16817, 17721, 18888, 26766, 27926, 28719, 30354, 30403, 32183, 34187, 34963, 35284","Ellerbeck, Kenneth (FMC 107608)","Ellerbeck, Kenneth (FMC 107608)","Ellerbeck, Kenneth (FMC 107608)","Gold, Silver, Lead, Zinc, Copper","Triassic, Nicola Group, Western Volcanic Facies, Volcanic rocks, Malachite, Pyrite, Chalcopyrite, Hematite",2089.5,1.804,1158.259424,1.4169999999999998,1474.594213,1.202,1738.352745,http://aris.empr.gov.bc.ca/search.asp?mode=repsum&rep_no=35356
10101,35986,1.0,2015/10/31,PROS:,1952,Prospecting Program 2015,2016,2015.0,,2016-10-31,,2015/10/31,21,LIttler's Cabin and Tit Bit,093A14W:,093A093:,52,55,39,121,26,27,10,5865343,604808,52.9275,-121.44083300000001,AU:AG:PT:PD:ZN:CU:,38.0,,KAM,3.0,KAML:,Kamloops,Kamloops,LITTLER'S CABIN,"093A  165, 093A  177",Cariboo - Barkerville Camp,LITTLER'S CABIN,Prospecting,Prospecting,"15623, 34384, 35323","Hegel, Ron","Hegel, Ron","Hegel, Ron","Gold, Silver, Platinum, Palladium, Zinc, Copper","Proterozoic, Snowshoe Group, Metamorphic rocks, Paleozoic, Greenstones, Greenschists, Placers, Alluvial deposits",2140.0,1.837,1164.942842,1.443,1483.021483,1.224,1748.3660129999998,http://aris.empr.gov.bc.ca/search.asp?mode=repsum&rep_no=35986
10110,35657,1.0,2015/10/7,PROS:,1409,Prospecting Report,2015,2015.0,,2016-10-07,,2015/10/7,14,1031619,092I03W:,092I023:,50,14,48,121,28,43,10,5567164,608472,50.246666999999995,-121.47861100000001,AU:,,,KAM,4.0,KAML:,Kamloops,Kamloops,1031619,092ISW074,,1031619,Prospecting,Prospecting,"33204, 31598, 31069, 30109, 29334","Gust, Nicholas","Gust, Nicholas","Gust, Nicholas",Gold,"Permian-Triassic, Mount Lytton Complex, Metamorphic rocks, Diorites, Intrusive rocks, Gold",2150.0,1.804,1191.796009,1.4169999999999998,1517.290049,1.202,1788.6855239999998,http://aris.empr.gov.bc.ca/search.asp?mode=repsum&rep_no=35657
10177,36039,1.0,2016/3/18,PROS:GEOC:,2452,Technical Exploration and Development Report,2016,2015.0,,2017-03-18,,2016/3/18,48,Barn,092I09E:,092I070:,50,37,37,120,7,27,10,5612288,703393,50.626944,-120.12416699999999,AU:AG:CU:,,,KAM,3.0,KAML:,Kamloops,Kamloops,"BARNUM,<br>PT",092INE128,,"BARNUM, PT","Prospecting,<br>Geochemical","Prospecting, Geochemical","08635, 08739, 09881, 04315, 03616, 17556","Ellerbeck, Kenneth (FMC 107608)","Ellerbeck, Kenneth (FMC 107608)","Ellerbeck, Kenneth (FMC 107608)","Gold, Silver, Copper","Triassic, Nicola Group, Mudstones, Siltstones, Shales, Argillites, Feldspar porphyry dykes, Pyrite, Pyrrhotite",2665.95,1.837,1451.252041,1.443,1847.505198,1.224,2178.063725,http://aris.empr.gov.bc.ca/search.asp?mode=repsum&rep_no=36039
10185,36096,1.0,2016/4/18,PROS:GEOC:,2623,Technical Exploration Report Prospecting and Exploring,2016,2015.0,,2017-04-18,,2016/4/18,46,Powder Claim Group,092P08E:,092P040:,51,18,37,120,11,57,10,5688055,695203,51.310278000000004,-120.19916699999999,AU:AG:,39.0,,KAM,3.0,KAML:,Kamloops,Kamloops,POW SOUTH,092P  012,Adams Plateau - Clearwater Area,POW SOUTH,"Prospecting,<br>Geochemical","Prospecting, Geochemical","23913, 32042, 32856, 34245","Ellerbeck, Kenneth (FMC 107608)","Ellerbeck, Kenneth (FMC 107608)","Ellerbeck, Kenneth (FMC 107608)","Gold, Silver","Triassic-Jurassic, Granodiorites, Thuya Batholith, Eocene, Kamloops Group, Volcanic rocks, Epithermal veins, Propylitic alteration, Argillic alteration, Chalcedonic quartz, Skull Hill Formation, Marcasite, Fluorite",2696.75,1.837,1468.018508,1.443,1868.849619,1.224,2203.227124,http://aris.empr.gov.bc.ca/search.asp?mode=repsum&rep_no=36096
10186,36062,1.0,2016/4/4,PROS:GEOC:,2576,Technical Exploration Report Prospecting and Exploring,2016,2015.0,,2017-04-04,,2016/4/4,47,Jenny Long,092I08W:,092I039:,50,18,57,120,22,0,10,5577064,687472,50.315833000000005,-120.36666699999999,AG:PB:ZN:CU:AU:WO:,13.0,,KAM,3.0,KAML:,Kamloops,Kamloops,"JENNY BABY LONG,<br>WREN",092ISE031,Stump Lake Area,"JENNY BABY LONG, WREN","Prospecting,<br>Geochemical","Prospecting, Geochemical","05565, 06348, 06856, 08310, 30722, 35771","Ellerbeck, Kenneth (FMC 107608)","Ellerbeck, Kenneth (FMC 107608)","Ellerbeck, Kenneth (FMC 107608)","Silver, Lead, Zinc, Copper, Gold, Tungsten","Triassic, Nicola Group, Intermediate volcanics, Volcaniclastic rocks, Sedimentary rocks, Greenstones, Polymetallic Veins, Pyrite, Galena, Sphalerite, Chalcopyrite, Scheelite, Eastern Volcanic Facies",2697.25,1.837,1468.290691,1.443,1869.1961190000002,1.224,2203.635621,http://aris.empr.gov.bc.ca/search.asp?mode=repsum&rep_no=36062
10187,35694,1.0,2015/10/22,PROS:,2649,Technical Exploration and Development Report on Prospecting and Exploring,2015,2015.0,,2016-10-22,,2015/10/22,37,Brassie,092I11E:,092I075:,50,44,52,121,0,42,10,5623663,640270,50.747778000000004,-121.01166699999999,AU:AG:CU:ZN:,,,KAM,3.0,KAML:,Kamloops,Kamloops,1014024 East,"092INW055, 092INW061, 092INW018",,1014024 East,Prospecting,Prospecting,"05730, 06107, 33229, 34217, 13329, 02773, 02772, 21625, 25285, 24809, 16641","Ellerbeck, Kenneth (FMC 107608)","Ellerbeck, Kenneth (FMC 107608)","Ellerbeck, Kenneth (FMC 107608)","Gold, Silver, Copper, Zinc","Triassic, Nicola Group, Central Volcanic Facies, Andesitic volcanics, Triassic-Jurassic, Granodiorites, Stocks, Rhyolites, Rhyolite breccias, Pyrite, Malachite",2650.0,1.804,1468.957871,1.4169999999999998,1870.1482,1.202,2204.658902,http://aris.empr.gov.bc.ca/search.asp?mode=repsum&rep_no=35694
10318,35599,1.0,2015/8/4,PROS:GEOC:,4818,Rock and Soil Geochemical Report,2015,2015.0,,2016-08-04,,2015/8/4,29,Mud Lake,083D03E:,083D015:,52,8,0,119,11,4,11,5778119,350492,52.133333,-119.184444,TA:NB:RS:,,,KAM,3.0,KAML:,Kamloops,Kamloops,MUD LAKE,083D  037,,MUD LAKE,"Prospecting,<br>Geochemical","Prospecting, Geochemical","07783, 20501","Gal, Leonard","Gal, Leonard","Gal, Leonard","Tantalum, Niobium/Columbium, Rare Earths","Proterozoic, Proterozoic, Mica Creek Succession, Metamorphic rocks, Dolomitic carbonatite, Carbonatite, Schist, Rauhaugite, Fenite, Pyrochlore, Columbite, Zircon",3412.25,1.804,1891.4911309999998,1.4169999999999998,2408.080452,1.202,2838.810316,http://aris.empr.gov.bc.ca/search.asp?mode=repsum&rep_no=35599
10328,35826,1.0,2015/11/25,GEOP:GEOC:,4172,Mist Property Geochemical Geophysical & Preparatory Survey Report,2016,2015.0,,2016-11-25,,2015/11/25,57,Mist,082M14W:,082M093:,51,56,28,119,33,42,11,5757589,323924,51.941111,-119.56166699999999,ZN:PB:AG:GA:,,,KAM,4.0,KAML:,Kamloops,Kamloops,"AHorne3C,<br>AHorne3B,<br>AHorne 3A",082M  225,,"AHorne3C, AHorne3B, AHorne 3A","Geophysical,<br>Geochemical","Geophysical, Geochemical","28600, 31254, 00911, 16030, 17539, 18359, 25641, 28445, 02564, 27059, 29448, 28969",Denis Delisle,Denis Delisle,Denis Delisle,"Zinc, Lead, Silver, Gallium","Proterozoic-Paleozoic, Shuswap Assemblage, Shuswap Metamorphic Complex, Metamorphic rocks, Gneisses, Granites, Pegmatite dykes, Pegmatites, Marbles, Marble, Sills, Metasediments, Calc-silicates, Amphibolite gneisses, Pelitic gneiss, Sphalerite, Lead, Silver, Pyrrhotite",3521.0,1.837,1916.7120300000001,1.443,2440.0554399999996,1.224,2876.633987,http://aris.empr.gov.bc.ca/search.asp?mode=repsum&rep_no=35826
