,rep_no,cnf_prd,aff_dt,gwrk_typs,claim_val,title,rep_yr,wrk_yr,conf_ldate,conf_adate,aff_ndate,aff_adate,page_ct,prpty_nm,nts_maps,bcgs_maps,lat83_deg,lat83_min,lat83_sec,lon83_deg,lon83_min,lon83_sec,zone83,north83,east83,lat83,long83,com_cds,camp_cd,geo_sum,reg_geo,info_cls,mdiv_cds,mdiv_nmx,mdiv_nms,claim_nmx,minf_nox,camp_nm,claim_nms,gwrk_nmx,gwrk_nms,rel_ars,oper_nms,own_nms,auth_nms,com_nms,kwl_nms,MERG_SPENT,DOLL_INX,doll_86,CPIdex1992,doll_92,CPIdex2002,doll_02,URL
27313,33882,1.0,2013/1/17,PHYS:GEOC:,88759,Geochemical Report on the Entrance Peak Project,2013,2012.0,,2014-01-17,,2013/1/17,341,Poly,104A04E:,104A013:,56,4,7,129,30,6,9,6213822,468769,56.068611,-129.501667,AU:AG:PB:ZN:,50.0,,SMI,3.0,OMIN:,Omineca,Omineca,"Poly 1-7,<br>Poly 20-31,<br>Lord Nelson 1-5,<br>Suprise Mtn,<br>Suprise Creek Mill Site","104A  025, 104A  177",Stewart Camp,"Poly 1-7, Poly 20-31, Lord Nelson 1-5, Suprise Mtn, Suprise Creek Mill Site","Physical,<br>Geochemical","Physical, Geochemical","16126, 33345, 33574, 33345, 33163, 23236, 26253, 26580, 27028, 27793, 28088, 29203, 29917, 30204, 30929, 32060",Frontline Gold Corporation,Goldfine Exploration Consultants Ltd.,,"Gold, Silver, Lead, Zinc","Triassic, Stuhini Group, Triassic-Jurassic, Hazelton Group, Unuk River Formation, Andesitic flows, Tuffs, Jurassic, Bowser Lake Group, Shales, Argillites, Siltstones, Greywackes, Diorites, Granodiorites, Quartz monzonites, Eocene, Texas Creek Plutonic Suite, Betty Creek Formation, Pyroclastics, Salmon River Formation, Digital data geochemistry",83417.68,1.767,47208.647430000005,1.3880000000000001,60099.19308,1.177,70873.13509,http://aris.empr.gov.bc.ca/search.asp?mode=repsum&rep_no=33882
27338,34263,1.0,2013/8/28,GEOC:,73457,Assessment Report Geochemical Surveys,2013,2012.0,,2014-08-28,,2013/8/28,150,OGK Copper Gold,094C04E:,094C003:,56,2,20,125,33,6,10,6213344,341038,56.038889000000005,-125.551667,CU:AU:,,,PRG,3.0,OMIN:,Omineca,Omineca,"HH!,<br>832423,<br>HH2","093N  176, 094C  050, 094C  097, 094C  170, 094C  174",,"HH!, 832423, HH2",Geochemical,Geochemical,"00217, 04618, 05251, 05252, 05602, 05957, 21449, 22265, 22381, 29468, 31144, 32352, 32989, 32993, 33515",Tajiri Resources Corp.,"Bragg, Donald Kenneth","McLaughlin, Jason B.Sc.; Gra, Paul D.","Copper, Gold","Jurassic, Hogem Plutonic Suite, Quartz monzonites, Cretaceous, Granites, Duckling Creek Syenite Complex, Syenites, Triassic, Takla Group, Volcanics, Ultramafic rocks, Chalcopyrite, Potassic alteration, Pyrite, Quartz-sulphide veins, Galena",85136.63,1.767,48181.454439999994,1.3880000000000001,61337.62968,1.177,72333.58539,http://aris.empr.gov.bc.ca/search.asp?mode=repsum&rep_no=34263
27481,34050,1.0,2013/3/12,GEOC:,126102,Geochemical Report on the Redton Project,2013,2012.0,,2014-03-12,,2013/3/12,215,Redton,093N11W:,093N054:,55,30,2,125,15,20,10,6152807,357530,55.500556,-125.255556,CU:AU:MO:,,,PRG,4.0,OMIN:,Omineca,Omineca,CS 052-080,"092N  107, 093N  077",,CS 052-080,Geochemical,Geochemical,"03998, 04577, 05266, 05619, 07432, 07898, 07926, 10492, 26147, 28180, 29261, 31933, 33334",Rimfire Minerals Corporation; Redton Resources Inc.,Rimfire Minerals Corporation; Redton Resources Inc.,"English, Jeremy","Copper, Gold, Molybdenum/Molybdenite","Triassic, Takla Group, Hogem Batholith, Quartz monzonites, Granites",98056.05,1.767,55492.95416,1.3880000000000001,70645.56916,1.177,83310.15293,http://aris.empr.gov.bc.ca/search.asp?mode=repsum&rep_no=34050
27553,33655,1.0,2013/7/8,GEOP:,103171,Geophysical Report on the Kuyakuz Property,2013,2012.0,,2014-07-08,,2013/7/8,35,Kuyakuz,093F02E:,093F018:,53,8,8,124,31,50,10,5888444,397609,53.13555600000001,-124.530556,,,,PRG,3.0,OMIN:,Omineca,Omineca,"Kuy 5,<br>Kuy 11",,,"Kuy 5, Kuy 11",Geophysical,Geophysical,"24142, 32133, 32905",Driven Capital Corp.; Driven Capital Corp.,Ansell Capital Corp.; Driven Capital Corp.,"Krause, Robert G.",,"Jurassic, Naglico Formation, Nechako Formation, Tuffs, Sandstones, Siltstones, Andesites, Basalts",104657.5,1.767,59228.91907,1.3880000000000001,75401.65706,1.177,88918.86151,http://aris.empr.gov.bc.ca/search.asp?mode=repsum&rep_no=33655
27565,33294,1.0,2012/6/30,GEOL:PROS:GEOC:,106331,Geochemistry and Prospecting Report on the Cathedral Property,2012,2012.0,,2013-06-30,,2012/6/30,49,Cathedral,094C04E:,094C012:,56,9,30,125,36,43,10,6226774,337787,56.158333,-125.611944,CU:AU:,,,PRG,3.0,OMIN:,Omineca,Omineca,"837059,<br>837069,<br>HILLSIDE,<br>TENAKI,<br>942663","094C  135, 094C  010, 094C  071, 094C  072, 094C  133, 094C  016, 094C  123",,"837059, 837069, HILLSIDE, TENAKI, 942663","Geological,<br>Prospecting,<br>Geochemical","Geological, Prospecting, Geochemical","04599, 14192, 17742, 17743, 21419, 21425, 21426, 26530, 29112, 32106, 33099","Naas, Christopher O.","Naas, Christopher O.","Naas, Christopher O.","Copper, Gold","Jurassic, Hogem Plutonic Suite, Quartz monzonites, Triassic, Takla Group, Calc-alkaline volcanics, Fine Clastic Sedimentary Rocks, Diorites, Jurassic-Triassic",106331.51,1.7690000000000001,60108.2589,1.389,76552.56298999999,1.178,90264.43973,http://aris.empr.gov.bc.ca/search.asp?mode=repsum&rep_no=33294
27578,33719,1.0,2012/10/26,GEOP:PHYS:,99532,Assessment Report Induced Polarization Survey DM Property,2012,2012.0,,2013-10-26,,2012/10/26,96,Pinchi,093N13E:,093N092:,55,54,19,125,44,7,10,6198918,329014,55.905278,-125.73527800000001,,,,PRG,3.0,OMIN:,Omineca,Omineca,"DM 1-3,<br>832455,<br>Dondon 9",093N  065,,"DM 1-3, 832455, Dondon 9","Geophysical,<br>Physical","Geophysical, Physical","12549, 13971, 29785, 30491, 31335, 31565, 32900",Sointula Resources Inc.,"Bragg, Donald Kenneth; Sointula Resources Inc.","Bragg, Donald Kenneth; Price, Barry J.",,"Jurassic-Triassic, Hogem Plutonic Suite, Cache Creek Complex, Limestones, Marbles, Quartz monzonites",108003.24,1.7690000000000001,61053.27304,1.389,77756.11231,1.178,91683.56537000001,http://aris.empr.gov.bc.ca/search.asp?mode=repsum&rep_no=33719
27591,33505,1.0,2012/11/15,GEOL:GEOC:,100393,Geologic and Geochemical Assessment Report on the Gnome Property,2012,2012.0,,2013-11-15,,2012/11/15,139,Gnome,094F02E:,094F028:,57,13,59,124,33,6,10,6344396,406334,57.233056000000005,-124.551667,PB:ZN:AG:,,,PRG,3.0,OMIN:,Omineca,Omineca,"GNOME,<br>MISTA GNOMER,<br>BOCHA,<br>ZORRO,<br>ZOROO,<br>GOT-IT!,<br>ZIT,<br>GNOME NW",094F  016,,"GNOME, MISTA GNOMER, BOCHA, ZORRO, ZOROO, GOT-IT!, ZIT, GNOME NW","Geological,<br>Geochemical","Geological, Geochemical","08334, 08478, 09722, 10002, 14610, 24461, 29831, 30485, 31871",Asia Base Metals Inc.,Asia Base Metals Inc.,"Harwood, Jeremy B.Sc; Childs, John F.","Lead, Zinc, Silver","Ordovician-Devonian, Earn Group, Road River Group, Mudstones, Siltstones, Shales, Limestones",109165.5,1.7690000000000001,61710.2883,1.389,78592.87257,1.178,92670.20374,http://aris.empr.gov.bc.ca/search.asp?mode=repsum&rep_no=33505
27593,33483,1.0,2012/10/12,GEOL:GEOC:,94323,"Geological Mapping, Geochemical Sampling Assessment Report on the 3T's Property",2012,2012.0,,2013-10-12,,2012/10/12,106,3T,093F03E:,093F005:,53,2,0,125,1,6,10,5877884,364661,53.033333,-125.01833300000001,AU:AG:,,,PRG,3.0,OMIN:,Omineca,Omineca,"BW-S 1,<br>516843,<br>510136,<br>510137,<br>516797,<br>516807","093F  055, 093F  068",,"BW-S 1, 516843, 510136, 510137, 516797, 516807","Geological,<br>Geochemical","Geological, Geochemical","24710, 23746, 23758, 23881, 24203, 24369, 24788, 25366, 25810, 27043, 27091, 27177, 27860, 27867, 27882, 32671",Independence Gold Corp.,Independence Gold Corp.,"Pawliuk, David J.; Layman, Maggie","Gold, Silver","Jurassic, Hazelton Group, Naglico Formation, Volcanic rocks, Bowser Lake Group, Ashman Formation, Coarse Clastic Sedimentary Rocks, Cretaceous, Capoose Batholith, Granodiorites, Feldspar porphyries",109369.0,1.7690000000000001,61825.325039999996,1.389,78739.38085,1.178,92842.95416000001,http://aris.empr.gov.bc.ca/search.asp?mode=repsum&rep_no=33483
27600,33965,1.0,2012/11/15,GEOP:,141085,IP Resistivity and Seismic Work on the Bell and Granisle Property,2012,2012.0,,2013-11-15,,2012/11/15,47,Bell and Granisle,093L16E:,093L100:,54,55,48,126,9,37,9,6090682,681947,54.93,-126.160278,CU:,44.0,,SMI,3.0,OMIN:,Omineca,Omineca,"BELL 4,<br>BABINE,<br>GRANI,<br>HAGAN 1,<br>HAGAN 3,<br>ASQ21,<br>LAKE6","093M  001, 093L  146",Babine Porphyry,"BELL 4, BABINE, GRANI, HAGAN 1, HAGAN 3, ASQ21, LAKE6",Geophysical,Geophysical,"00059, 00529, 00664, 00678, 00810, 00811, 00844, 01072, 01115, 02646, 15711, 16574, 16992, 21012",Xstrata Canada Corporation,Astorius Resources Ltd.,"Maxwell, Gordon; Ward, Ross",Copper,"Cretaceous, Skeena Group, Kitsuns Creek Formation, Sediments, Jurassic, Hazelton Group, Smithers Formation, Saddle Hill Formation, Eocene, Babine Plutonic Suite, Granodiorites, Volcaniclastics, Marine sediments, Felsic volcanics, Basaltic volcanics",110495.13,1.7690000000000001,62461.916339999996,1.389,79550.12959,1.178,93798.9219,http://aris.empr.gov.bc.ca/search.asp?mode=repsum&rep_no=33965
27604,33733,1.0,2012/9/28,GEOP:GEOL:GEOC:,99611,"Geological, Geochemical and Geophysical Report on the Zymoetz River Property",2013,2012.0,,2013-09-28,,2012/9/28,224,Zymoetz River,093L12W:,093L061:,54,41,14,127,57,6,9,6060491,567580,54.687222,-127.95166699999999,,,,SMI,3.0,OMIN:,Omineca,Omineca,"OX1,<br>OX3-12","093L  187, 093L  188",,"OX1, OX3-12","Geophysical,<br>Geological,<br>Geochemical","Geophysical, Geological, Geochemical",,Liaoning / Eden Venture Investments ltd,Liaoning / Eden Venture Investments ltd,"Wasteneys, Hardolph; Yang, Wanjin",,"Jurassic, Hazelton Group, Telkwa Formation, Eocene, Nanika Plutonic Suite, Calc-alkaline volcanics, Pyroclastic rocks, Granites, Gabbros, Diorites, Granodiorites, Veins, Bornite, Chalcopyrite, Epidotization, Chalcocite, Digital data airborne geophysics",110555.99,1.767,62567.057160000004,1.3880000000000001,79651.28963,1.177,93930.32285,http://aris.empr.gov.bc.ca/search.asp?mode=repsum&rep_no=33733
27627,33278,1.0,2012/7/3,GEOP:,145530,Aeromagnetic Geophysical Survey of the Hanson Property,2012,2012.0,,2013-07-03,,2012/7/3,131,Hanson,093K03E:,093K025:,54,14,24,125,0,51,10,6012097,368741,54.24,-125.01416699999999,,,,PRG,3.0,OMIN:,Omineca,Omineca,"HANSON LAKE,<br>HANSON LAKE 2,<br>ENDEX,<br>HANS 1-27,<br>HANS,<br>NORHANS 3-7","093K  078, 093K  081",,"HANSON LAKE, HANSON LAKE 2, ENDEX, HANS 1-27, HANS, NORHANS 3-7",Geophysical,Geophysical,"02931, 03645, 04282, 04281, 04283, 04284, 04703, 04758, 06664, 07190, 17506, 18398, 19155, 21187, 22499, 23042, 29154",Stone Ridge Exploration Corp.,"Chapman, John Arthur (FMC 104633); Carlson, Gerald G.","MacIntyre, Donald George",,"Cretaceous, Endako Quartz Monzonite, Quartz monzonites, Amphibolites",113894.42,1.7690000000000001,64383.5048,1.389,81997.42261000001,1.178,96684.56706,http://aris.empr.gov.bc.ca/search.asp?mode=repsum&rep_no=33278
27699,33288,1.0,2012/9/4,GEOP:,110211,Assessment Report Treasure Mountain Exporation Property,2012,2012.0,,2013-09-04,,2012/9/4,108,Treasure Mountain,103I09E:,103I060:,54,30,36,128,0,42,9,6040716,563989,54.51,-128.011667,CU:,,,SMI,3.0,OMIN:,Omineca,Omineca,"Treasure,<br>Treasure 1-5,<br>BF 5-6,<br>Wells 2-3,<br>King 1-5,<br>TWD,<br>TWD 1-4,<br>510714,<br>510716","103I  090, 103I  086, 103I  087, 103I  089, 103I  130, 103I  163",,"Treasure, Treasure 1-5, BF 5-6, Wells 2-3, King 1-5, TWD, TWD 1-4, 510714, 510716",Geophysical,Geophysical,"03959, 03960, 28304, 29726, 30780",Trade Winds Ventures Inc.,Trade Winds Ventures Inc.,"Burton, Alex D.K.",Copper,"Jurassic, Telkwa Formation, Andesites, Basalts, Dacites, Tuffs, Hazelton Group, Granodiorites",122248.56,1.7690000000000001,69106.026,1.389,88011.92225,1.178,103776.3667,http://aris.empr.gov.bc.ca/search.asp?mode=repsum&rep_no=33288
27704,33939,1.0,2012/10/3,GEOL:PHYS:GEOC:,122894,"Linecutting, Soil and Rock Sampling and Mapping Report on the Babine Property",2013,2012.0,,2013-10-03,,2012/10/3,66,Babine,093M01E:,093M010:,55,5,0,126,11,0,9,6107689,679779,55.083332999999996,-126.183333,CU:AU:AG:,44.0,,SMI,3.0,OMIN:,Omineca,Omineca,Babine 3-22,"093M  160, 093M  198",Babine Porphyry,Babine 3-22,"Geological,<br>Physical,<br>Geochemical","Geological, Physical, Geochemical","00976, 02524, 03261, 20415, 21106, 25401, 29629, 30720, 31469, 32339, 33139, 33643",Copper Point Mining Corp,Copper Point Mining Corp,"Raven, Wesley D.T.","Copper, Gold, Silver","Jurassic, Hazelton Group, Smithers Formation, Marine sediments, Cretaceous, Skeena Group, Saddle Hill Formation, Cretaceous-Eocene, Diorites",122968.49,1.767,69591.67516,1.3880000000000001,88594.01297000001,1.177,104476.2022,http://aris.empr.gov.bc.ca/search.asp?mode=repsum&rep_no=33939
27705,33699,1.0,2012/12/3,GEOL:PHYS:GEOC:,114941,Geological and Geochemical Report on the Silver Switchback Property,2013,2012.0,,2013-12-03,,2012/12/3,172,Silver Switchback,093L05W:,093L032:,54,23,55,127,47,47,9,6028540,578139,54.398610999999995,-127.79638899999999,,42.0,,SMI,3.0,OMIN:,Omineca,Omineca,"HOWSON 2,<br>HOWSON 3",,Telkwa Range,"HOWSON 2, HOWSON 3","Geological,<br>Physical,<br>Geochemical","Geological, Physical, Geochemical",,Multiple Metals Resources Ltd.,"Weicker, Robert; Multiple Metals Resources Ltd.","LeBarge, William P.",,"Jurassic, Eocene, Telkwa Formation, Nanika Plutonic Suite, Quartz monzonites, Calc-alkaline volcanics",123179.17,1.767,69710.90549,1.3880000000000001,88745.79971,1.177,104655.1997,http://aris.empr.gov.bc.ca/search.asp?mode=repsum&rep_no=33699
27717,33629,1.0,2012/10/31,GEOC:,136544,Geochemical Assessment Report on the Wasi Creek Property,2013,2012.0,,2013-10-31,,2012/10/31,243,Wasi Creek,094C03E:,094C015:,56,6,49,125,1,50,10,6220582,373740,56.113611,-125.030556,AG:PB:ZN:,,,PRG,3.0,OMIN:,Omineca,Omineca,"503533,<br>511313,<br>512685,<br>512686,<br>W 01-05","094C  024, 094C  080, 094C  103, 094C  130",,"503533, 511313, 512685, 512686, W 01-05",Geochemical,Geochemical,"04620, 05647, 05803, 06072, 06618, 07611, 21211, 21809, 22612, 23094, 23320, 23732, 25464, 26827, 27032, 27532, 27907, 28364, 29667",Selkirk Metals Corp. (FMC# 231261),Selkirk Metals Corp. (FMC# 231261),"Perry, Dustin","Silver, Lead, Zinc","Ordovician-Mississippian, Big Creek Group, Echo Lake Group, Atan Group, Nina Creek Group, Dacites, Mudstones, Siltstones, Shales, Dolomites",124711.5,1.767,70578.09847000001,1.3880000000000001,89849.78386,1.177,105957.0943,http://aris.empr.gov.bc.ca/search.asp?mode=repsum&rep_no=33629
27726,33995,1.0,2013/2/15,GEOP:,95132,Electromagnetic (ZTEM) and Airborne Magnetic Report on the Silver Hope Property,2013,2012.0,,2014-02-15,,2013/2/15,84,Silver Hope,093L01W:,093L019:,54,9,0,126,16,12,9,6003655,678285,54.15,-126.27,CU:MO:,41.0,,SMI,3.0,OMIN:,Omineca,Omineca,Findlay 1-10,"093L  256, 093L  263, 093L  313, 093L  001",New Nadina - Equity Area,Findlay 1-10,Geophysical,Geophysical,"02876, 10727, 13264, 13943, 14603, 14761, 15710, 16968, 17680, 21123, 23132, 24757, 25028, 25381, 26751, 27862, 29018, 30988, 32622, 33405",Finlay Minerals Ltd. (142793),Finlay Minerals Ltd. (142793),"Walcott, Peter E.","Copper, Molybdenum/Molybdenite","Cretaceous-Eocene, Goosly Lake Formation, Kasalka Plutonic Suite, Tuffs, Quartzites, Chert pebble conglomerates, Quartz monzonites",126232.03,1.767,71438.61347000001,1.3880000000000001,90945.26657,1.177,107248.9635,http://aris.empr.gov.bc.ca/search.asp?mode=repsum&rep_no=33995
27730,33690,1.0,2013/2/14,PHYS:GEOC:,181068,Geochemical and Physical Work Report on the MAC Property,2013,2012.0,,2014-02-14,,2013/2/14,232,MAC,093K13E:,093K083:,54,51,0,125,34,45,10,6081148,334418,54.85,-125.579167,CU:MO:NI:,,,PRG,3.0,OMIN:,Omineca,Omineca,"522451,<br>545543,<br>545544,<br>545545,<br>545757,<br>547860,<br>633844,<br>936727,<br>936729,<br>936730,<br>1005942",093K  097,,"522451, 545543, 545544, 545545, 545757, 547860, 633844, 936727, 936729, 936730, 1005942","Physical,<br>Geochemical","Physical, Geochemical","11861, 12881, 19451, 24033, 24319, 24638, 30592, 30594, 32927, 31999, 33182, 33314",STRATTON RESOURCES INC.,"Funk, Kelly; STRATTON RESOURCES INC.","Haslinger, R.; Giles, Graham D.","Copper, Molybdenum/Molybdenite, Nickel","Permian-Triassic, Cache Creek Complex, Rubyrock Igneous Complex, Greenstones, Gabbros, Diorites, Ultramafics",126955.0,1.767,71847.76457,1.3880000000000001,91466.13833,1.177,107863.2116,http://aris.empr.gov.bc.ca/search.asp?mode=repsum&rep_no=33690
27739,33515,1.0,2012/8/29,GEOP:,109269,Assessment Report Airborne Geophysical Survey on the OGK Property,2012,2012.0,,2013-08-29,,2012/8/29,93,OGK,094C04E:,094C003:,56,2,20,125,33,6,10,6213344,341038,56.038889000000005,-125.551667,CU:AU:,,,PRG,3.0,OMIN:,Omineca,Omineca,"OS 3,<br>DKSYN 17-18,<br>OS 1,<br>DKSYN 15,<br>832426,<br>832412,<br>832399,<br>795713,<br>HH!,<br>BP 1,<br>BP6,<br>832416,<br>BP10",,,"OS 3, DKSYN 17-18, OS 1, DKSYN 15, 832426, 832412, 832399, 795713, HH!, BP 1, BP6, 832416, BP10",Geophysical,Geophysical,,Tajiri Resources Corp.,"Bragg, Donald Kenneth","Price, Barry J.; McLaughlin, Jason B.Sc.","Copper, Gold","Jurassic, Hogem Plutonic Suite, Quartz monzonites, Cretaceous, Granites, Digital data airborne geophysics",128339.0,1.7690000000000001,72548.89768,1.389,92396.68826,1.178,108946.5195,http://aris.empr.gov.bc.ca/search.asp?mode=repsum&rep_no=33515
27771,33948,1.0,2013/4/15,GEOL:GEOC:,214372,2012 Assessment Report on the Deer Horn Property,2013,2012.0,,2014-04-15,,2013/4/15,71,Deer Horn,093E06W:,093E034:,53,22,26,127,17,22,9,5915227,613797,53.373889,-127.28944399999999,AU:AG:TE:WO:CU:,,,SMI,3.0,OMIN:,Omineca,Omineca,"Deerhorn 1-5,<br>Deer Horn 2006,<br>Deer Horn West,<br>Deer Horn Southwest,<br>Deer Horn Northwest,<br>Deer Horn North,<br>Deer Horn Northeast,<br>Deer Horn Moly,<br>DH B1-2","093E  019, 093E  020, 093E  021, 093E  126, 093E  127, 093E  128",,"Deerhorn 1-5, Deer Horn 2006, Deer Horn West, Deer Horn Southwest, Deer Horn Northwest, Deer Horn North, Deer Horn Northeast, Deer Horn Moly, DH B1-2","Geological,<br>Geochemical","Geological, Geochemical","00050, 19966, 26419, 28898, 29527, 31511, 33172",Deer Horn Metals Corp.,Guardsmen Resources Inc.,"Lane, Robert A. (Bob) (FMC 115043)","Gold, Silver, Tellurium, Tungsten, Copper","Gamsby Group, Quartz diorites, Mafic volcanics, Jurassic, Telkwa Formation, Hazelton Group, Cretaceous, Skeena Group, Eocene, Granodiorites, Telluride, Scheelite, Veins",135726.31,1.767,76811.72043,1.3880000000000001,97785.52593999999,1.177,115315.4715,http://aris.empr.gov.bc.ca/search.asp?mode=repsum&rep_no=33948
27810,33310,1.0,2012/7/25,GEOL:GEOC:,166430,Assessment Report on the Snowbird Property,2012,2012.0,,2013-07-25,,2012/7/25,198,Snowbird,093K07E:,093K048:,54,28,0,124,32,6,10,6036530,400514,54.466667,-124.535,AU:,,,PRG,3.0,OMIN:,Omineca,Omineca,"Omineca 17-19,<br>OG 5-7,<br>Snowbird 1-3,<br>Boarchea,<br>SW Gold 1-2,<br>Snowbird North,<br>West Gold,<br>South Gold,<br>Snowbird Southwest,<br>Snowbird Northwest,<br>Camp",093K  036,,"Omineca 17-19, OG 5-7, Snowbird 1-3, Boarchea, SW Gold 1-2, Snowbird North, West Gold, South Gold, Snowbird Southwest, Snowbird Northwest, Camp","Geological,<br>Geochemical","Geological, Geochemical","00520, 02764, 03520, 05136, 08613, 15261, 15732, 15853, 16766, 23523, 27154",Omineca Gold Ltd.,Omineca Gold Ltd.,"Rensby, Justin",Gold,"Triassic-Jurassic, Cache Creek Complex, Trembleur Intrusives, Endako Batholith, Mudstones, Siltstones, Shales, Ultramafics, Quartz diorites",142745.04,1.7690000000000001,80692.50424,1.389,102768.2073,1.178,121175.7555,http://aris.empr.gov.bc.ca/search.asp?mode=repsum&rep_no=33310
27860,33838,1.0,2013/2/7,GEOP:,146036,Geophysical Report on the Karma Property,2013,2012.0,,2014-02-07,,2013/2/7,56,Karma,093E15E:,093E098:,53,55,0,126,36,5,9,5976915,657528,53.916667000000004,-126.60138899999998,CU:AU:ZN:,,,SMI,3.0,OMIN:,Omineca,Omineca,"Argo 1-9,<br>Bono 38-59,<br>CNKS 60-77,<br>Dale 16-78,<br>Karma 1-15,<br>NIRN 1-7,<br>OOT 1-15",,,"Argo 1-9, Bono 38-59, CNKS 60-77, Dale 16-78, Karma 1-15, NIRN 1-7, OOT 1-15",Geophysical,Geophysical,"09788, 10253, 12074, 13042, 17804, 18137, 19098, 19107, 19238, 20382, 20630",Quartz Mountain Resources Ltd.,"Billingsley, Richard John; Quartz Mountain Resources Ltd.; HDRL Holdings Ltd.","Rebagliati, C. Mark; Takahashi, Drew; Shaw, Alexandra","Copper, Gold, Zinc","Cretaceous, Eocene, Kasalka Group, Endako Group, Ootsa Lake Formation, Rhyolites, Basalts, Andesites",152220.0,1.767,86146.01019,1.3880000000000001,109668.5879,1.177,129328.802,http://aris.empr.gov.bc.ca/search.asp?mode=repsum&rep_no=33838
27955,33954,1.0,2013/3/27,GEOP:,168346,Assessment Report on Induced Polarization Surveying,2013,2012.0,,2014-03-27,,2013/3/27,81,Aspen East and West,093F07E:,093F037:,53,20,7,124,42,55,10,5910940,385786,53.335278,-124.715278,,,,PRG,3.0,OMIN:,Omineca,Omineca,"Gold Pot 9-11,<br>Chutanli,<br>Gold 3-4,<br>Gold 22,<br>Gold 30-31",,,"Gold Pot 9-11, Chutanli, Gold 3-4, Gold 22, Gold 30-31",Geophysical,Geophysical,33684,Redhill Resources Corp.,"Bilquist, Ronald John (102389); Mountain Boy Minerals Ltd.; Redhill Resources Corp.","Walus, Alex",,"Jurassic, Hazelton Group, Dacitic volcanics, Andesitic volcanics, Sediments, Monzonites, Diorites, Jurassic-Cretaceous",175112.0,1.767,99101.30163999999,1.3880000000000001,126161.3833,1.177,148778.2498,http://aris.empr.gov.bc.ca/search.asp?mode=repsum&rep_no=33954
28009,33750,1.0,2013/4/14,GEOC:,184045,Geochemical Report Nechako Gold Property,2013,2012.0,,2014-04-14,,2013/4/14,252,Nechako Gold,093F07W:,093F036:,53,21,3,124,59,26,10,5913146,367506,53.350832999999994,-124.99055600000001,,,,SMI,3.0,OMIN:,Omineca,Omineca,KL 1-15,,,KL 1-15,Geochemical,Geochemical,32059,Deveron Resources Ltd.,"Strickland, Derrick","Strickland, Derrick",,"Naglico Formation, Ootsa Lake Formation, Ootsa Lake Group, Mafic volcanics, Jurassic",191190.22,1.767,108200.4641,1.3880000000000001,137745.1153,1.177,162438.5896,http://aris.empr.gov.bc.ca/search.asp?mode=repsum&rep_no=33750
28015,33745,1.0,2013/1/19,GEOP:PHYS:,276142,"Geophysical Report on the ""Tas"" Gold Copper Mineral Property",2013,2012.0,,2014-01-19,,2013/1/19,134,Tas,093K16W:,093K099:,54,54,15,124,19,8,10,6084924,415434,54.904167,-124.31888899999998,CU:AU:,,,PRG,3.0,OMIN:,Omineca,Omineca,"531596,<br>531598,<br>531603","093K  080, 093K  091, 093K  110",,"531596, 531598, 531603","Geophysical,<br>Physical","Geophysical, Physical","13979, 15687, 16657, 16763, 17234, 19102, 19977, 21637, 25839, 26185, 26187, 27152, 31226, 31681, 32950",INZANA METALS INC,INZANA METALS INC,"Westphal, Mathias W.","Copper, Gold","Triassic, Inzana Lake Formation, Argillites, Cherty tuffs, Triassic-Jurassic, Diorites, Monzonites, Breccias, Potassic alteration, Pyrite, Pyrrhotite, Chalcopyrite, Siltstones",193704.89,1.767,109623.5937,1.3880000000000001,139556.8372,1.177,164575.0977,http://aris.empr.gov.bc.ca/search.asp?mode=repsum&rep_no=33745
28054,34152,1.0,2013/5/18,GEOP:GEOC:,210189,Geochemical and Geophysical Work on the ZNT Claim Group,2013,2012.0,,2014-05-18,,2013/5/18,293,ZNT,093L11E:,093L065:,54,37,12,127,1,19,9,6054305,627718,54.62,-127.02194399999999,CU:ZN:,,,SMI,3.0,OMIN:,Omineca,Omineca,ZNT 01-14,"093L  224, 093L  226",,ZNT 01-14,"Geophysical,<br>Geochemical","Geophysical, Geochemical","04808, 05156, 05162",Quartz Mountain Resources Ltd.,Quartz Mountain Resources Ltd.,"Ditson, Gwendolen May; Galicki, Michael; Andrzejewski, Anna; Takahashi, Drew","Copper, Zinc","Jurassic, Cretaceous, Telkwa Formation, Red Rose Formation, Tuffs, Andesites, Volcanic breccias, Basalts, Sandstones, Siltstones, Chert pebble conglomerates",211025.07,1.767,119425.6197,1.3880000000000001,152035.353,1.177,179290.6287,http://aris.empr.gov.bc.ca/search.asp?mode=repsum&rep_no=34152
28073,33499,1.0,2012/9/7,GEOP:,212174,Geophysical Work Performed on the Silver Vista Property,2012,2012.0,,2013-09-07,,2012/9/7,52,Silver Vista,093M02W:,093M027:,55,12,57,126,45,59,9,6121085,642100,55.215832999999996,-126.76638899999999,AG:CU:,44.0,,SMI,3.0,OMIN:,Omineca,Omineca,"Bob 1-2,<br>SV 3-12,<br>Bulk 01-46,<br>Fall,<br>Hazel 01-62,<br>Hulk 01-08,<br>Copper Hill 2-4,<br>Hornet,<br>Copper Joe 1-2,<br>Little Joe",093M  195,Babine Porphyry,"Bob 1-2, SV 3-12, Bulk 01-46, Fall, Hazel 01-62, Hulk 01-08, Copper Hill 2-4, Hornet, Copper Joe 1-2, Little Joe",Geophysical,Geophysical,"21609, 22462, 25514, 31197",Amarc Resources Limited,Amarc Resources Limited,"Rebagliati, C. Mark; Jessen, Katrina  E.H.","Silver, Copper","Cretaceous, Skeena Group, Sedimentary rocks, Jurassic, Bowser Lake Group, Hazelton Group, Triassic, Nicola Group, Basaltic volcanics, Bulkley Intrusions, Eocene, Babine Intrusions",220076.0,1.7690000000000001,124407.0096,1.389,158442.0446,1.178,186821.7317,http://aris.empr.gov.bc.ca/search.asp?mode=repsum&rep_no=33499
28089,33678,1.0,2012/10/5,DRIL:GEOC:,177975,Drilling Report on the Ruby Property,2013,2012.0,,2013-10-05,,2012/10/5,135,Ruby,094C03E:,094C025:,56,13,29,125,6,0,10,6233075,369800,56.224722,-125.1,AG:AU:,,,PRG,3.0,OMIN:,Omineca,Omineca,"778682,<br>RUBY10,<br>JIMMAY CREEK","094C  026, 094C  062, 094C  083, 094C  057",,"778682, RUBY10, JIMMAY CREEK","Drilling,<br>Geochemical","Drilling, Geochemical","17458, 27014, 31836, 33280, 17825",Brocade Metals Corp.,"Luck, Westley Grant; CJL Enterprises Ltd.","Baldys, Christopher; Lane, Robert A. (Bob) (FMC 115043)","Silver, Gold","Ingenika Group, Swannell Formation, Quartzites, Mica schists, Veins, Stockworks, Pyrite, Ruby silver, Sericite alteration, Silicification, Quartz Feldspar Porphyries, Polymetallic Veins, Proterozoic",223942.6,1.767,126736.0498,1.3880000000000001,161341.9308,1.177,190265.5905,http://aris.empr.gov.bc.ca/search.asp?mode=repsum&rep_no=33678
