,rep_no,cnf_prd,aff_dt,gwrk_typs,claim_val,title,rep_yr,wrk_yr,conf_ldate,conf_adate,aff_ndate,aff_adate,page_ct,prpty_nm,nts_maps,bcgs_maps,lat83_deg,lat83_min,lat83_sec,lon83_deg,lon83_min,lon83_sec,zone83,north83,east83,lat83,long83,com_cds,camp_cd,geo_sum,reg_geo,info_cls,mdiv_cds,mdiv_nmx,mdiv_nms,claim_nmx,minf_nox,camp_nm,claim_nms,gwrk_nmx,gwrk_nms,rel_ars,oper_nms,own_nms,auth_nms,com_nms,kwl_nms,MERG_SPENT,DOLL_INX,doll_86,CPIdex1992,doll_92,CPIdex2002,doll_02,URL
24430,35734,1.0,2015/11/20,GEOL:GEOC:,16871,Geomorphological-Glaciological Report on Molybdenite Boulders,2015,2015.0,,2016-11-20,,2015/11/20,34,Kisgegas Molybdenum,093M14W:,093M073:,55,45,0,127,26,7,9,6179364,598213,55.75,-127.435278,MO:RE:,,,SMI,3.0,OMIN:,Omineca,Omineca,"514818,<br>KISGEGAS SOUTH",093M  082,,"514818, KISGEGAS SOUTH","Geological,<br>Geochemical","Geological, Geochemical","06723, 09382, 10290, 24279, 28065","Blusson, Ronald Ross; McMillan, Ronald H.","Blusson, Ronald Ross; McMillan, Ronald H.","McMillan, Ronald H.","Molybdenum/Molybdenite, Rhenium","Eocene, Babine Plutonic Suite, Granodiorites, Jurassic-Cretaceous, Bowser Lake Group, Sedimentary rocks, Stockworks, Molybdenite, Pyrite, Chalcopyrite, Quartz veinlets, Potassic alteration, Scheelite, Hornfels, Skarns",10908.35,1.804,6046.757206,1.4169999999999998,7698.200423,1.202,9075.166389,http://aris.empr.gov.bc.ca/search.asp?mode=repsum&rep_no=35734
24474,35752,1.0,2015/11/24,GEOC:,14474,Assessment Report 2015 Geochemical Sampling and Prospecting Report,2015,2015.0,,2016-11-24,,2015/11/24,35,Valleau Creek,093N07W:,093N046:,55,28,0,124,53,6,10,6148339,380831,55.466667,-124.885,AU:AG:,,,PRG,4.0,OMIN:,Omineca,Omineca,Vall Main North,092N  215,,Vall Main North,Geochemical,Geochemical,"15634, 19450, 20178, 21700, 22757, 33449, 33413","Kreft, John Bernard (FMC #114661)","Kreft, John Bernard (FMC #114661)","Kreft, John Bernard (FMC #114661)","Gold, Silver","Triassic, Takla Group, Inzana Lake Formation, Sedimentary rocks, Germansen Batholith, Iron carbonates, Quartz veins, Gold, Pyrite",11258.3,1.804,6240.742794,1.4169999999999998,7945.165843000001,1.202,9366.306156,http://aris.empr.gov.bc.ca/search.asp?mode=repsum&rep_no=35752
24477,35896,1.0,2015/10/1,GEOP:,13680,An Assessment Report on Geophysical Surveying,2016,2015.0,,2016-10-01,,2015/10/1,34,Holy Cross,093F15W:,093F076:,53,47,0,124,58,6,10,5961213,370315,53.783333,-124.968333,AU:AG:,,,PRG,3.0,OMIN:,Omineca,Omineca,"DUN,<br>SCORPIO,<br>VAN,<br>SLOW,<br>HOLY CROSS,<br>HALEN,<br>SLAYER,<br>SLED-HEAD E,<br>NO GQ MAN'S LAND,<br>STILL THE KING!",093F  029,,"DUN, SCORPIO, VAN, SLOW, HOLY CROSS, HALEN, SLAYER, SLED-HEAD E, NO GQ MAN'S LAND, STILL THE KING!",Geophysical,Geophysical,"17807, 19005, 19278, 19627, 24732, 25313, 26441, 26946, 30368, 31203, 35504, 35547","Greig, Charles J. (FMC #143767)","Greig, Charles J. (FMC #143767)","Walcott, Peter E.; Walcott, Alexander","Gold, Silver","Cretaceous, Holy Cross Pluton, Jurassic, Endako Batholith, Stag Lake Plutonic Suite, Quartz diorites, Quartz diorite stocks, Hazelton Group, Eocene, Nechacko Plateau Group, Andesitic volcanics, Bowser Lake Group, Coarse Clastic Sedimentary Rocks, Feldspar porphyries, Rhyolites, Felsic volcanics, Silicification, Quartz veins, Chalcedony, Pyrite, Chalcopyrite, Hematization",11490.0,1.837,6254.763201,1.443,7962.577963,1.224,9387.254901999999,http://aris.empr.gov.bc.ca/search.asp?mode=repsum&rep_no=35896
24489,35790,1.0,2015/8/28,GEOC:,15988,2015 Surface Exploration Assessment Report,2015,2015.0,,2016-08-28,,2015/8/28,21,Porphyry Creek,093M04E:,093M012:,55,7,40,127,36,9,9,6109902,589109,55.127778,-127.6025,AU:AG:CU:MO:WO:,45.0,,SMI,3.0,OMIN:,Omineca,Omineca,"SULTANA,<br>EAST SULTANA,<br>BRUNSWICK,<br>ARMAGOSA,<br>RIDGE,<br>CENTER WEST","093M  066, 093M  067, 093M  068, 093M  061, 093M  059, 093M  060, 093M  062, 093M  064, 093M  065",Silver Standard - Rocher Deboule Area,"SULTANA, EAST SULTANA, BRUNSWICK, ARMAGOSA, RIDGE, CENTER WEST",Geochemical,Geochemical,"00092, 01134, 02855, 04839, 06849, 08332, 09587, 12712, 13340, 14632, 16012, 16455, 29082, 29502, 30096, 30431, 31728, 32516, 32636","Johnson, Timothy; Warkentin, Doug (FMC 145582)","Johnson, Timothy; Warkentin, Doug (FMC 145582); Hardy, Samuel Anthony Kyler","Warkentin, Doug (FMC 145582)","Gold, Silver, Copper, Molybdenum/Molybdenite, Tungsten","Cretaceous, Kasalka Group, Andesitic volcanics, Skeena Group, Red Rose Formation, Coarse Clastic Sedimentary Rocks, Bulkley Plutonic Suite, Feldspar porphyries, Intrusive rocks, Granodiorites, Hornfels, Stocks, Stockworks, Molybdenite, Chalcopyrite, Pyrite",11366.41,1.804,6300.670732,1.4169999999999998,8021.460833,1.202,9456.24792,http://aris.empr.gov.bc.ca/search.asp?mode=repsum&rep_no=35790
24524,35997,1.0,2015/12/19,DRIL:GEOC:,11445,Diamond Drilling and Rock Geochemistry,2015,2015.0,,2016-12-19,,2015/12/19,24,HD Mineral,093L07E:,093L047:,54,26,49,126,39,51,9,6035763,651454,54.446943999999995,-126.66416699999999,ZN:CU:AG:AU:PB:MO:,43.0,,SMI,3.0,OMIN:,Omineca,Omineca,516488,093L  205,Babine Range,516488,"Drilling,<br>Geochemical","Drilling, Geochemical","09849, 14157, 18360, 18864, 18911, 23232, 25891, 26288, 26577, 26887, 27195, 27810, 28456, 29129, 29567, 30313, 31324, 31645, 33073, 33847, 34495","Merkley, Daniel M.; Merkley, William R.","Merkley, Daniel M.; Merkley, William R.","Moll, John Wesley (FMC# 118694); Merkley, Daniel M.","Zinc, Copper, Silver, Gold, Lead, Molybdenum/Molybdenite","Jurassic, Hazelton Group, Telkwa Formation, Calc-alkaline volcanics, Quartz Feldspar Porphyries, Andesites, Rhyolites, Basalts, Tuffs",11613.86,1.804,6437.838137,1.4169999999999998,8196.090332,1.202,9662.113145000001,http://aris.empr.gov.bc.ca/search.asp?mode=repsum&rep_no=35997
24574,35868,1.0,2015/10/13,GEOC:,10373,Geochemical Report,2016,2015.0,,2016-10-13,,2015/10/13,40,Cummins Creek,093E11E:,093E055:,53,33,0,127,3,6,9,5935222,629078,53.55,-127.051667,CU:AU:MO:ZN:PB:,,,SMI,3.0,OMIN:,Omineca,Omineca,"1031599,<br>1031601",093E  134,,"1031599, 1031601",Geochemical,Geochemical,"24387, 26060","Seel, Vernon","Seel, Vernon","Seel, Vernon","Copper, Gold, Molybdenum/Molybdenite, Zinc, Lead","Jurassic, Hazelton Group, Telkwa Formation, Calc-alkaline volcanics, Cretaceous, Bulkley Plutonic Suite, Diorite stocks, Diorites",12191.0,1.837,6636.363636,1.443,8448.371448,1.224,9959.96732,http://aris.empr.gov.bc.ca/search.asp?mode=repsum&rep_no=35868
24592,36192,1.0,2016/5/13,GEOC:,3094,2015 Soil Geochemistry Program,2016,2015.0,,2017-05-13,,2016/5/13,50,Apex,082E05W:,082E031:,49,21,35,119,54,39,11,5471521,288645,49.359722,-119.91083300000001,AU:,11.0,,KAM,3.0,OMIN:,Omineca,Omineca,"HMMM...,<br>APOA SELECTION PROCESS",,Hedley Camp,"HMMM..., APOA SELECTION PROCESS",Geochemical,Geochemical,"01044, 09473, 10926, 11954, 12583, 12783, 18204","Greig, Charles J. (FMC #143767)","Greig, Charles J. (FMC #143767)","Rowe, Jeffrey D.",Gold,"Jurassic, Okanagan Batholith, Granodiorites, Triassic, Independence Formation, Marine sedimentary and volcanic rocks, Apex Mountain Group, Apex Mountain Complex, Greenschists, Greenstones, Metamorphic rocks, Skarns, Pyrrhotite, Marbles, Cherts, Tuffs",12300.0,1.837,6695.69951,1.443,8523.908523999999,1.224,10049.01961,http://aris.empr.gov.bc.ca/search.asp?mode=repsum&rep_no=36192
24606,36181,1.0,2016/6/22,DRIL:GEOC:,16981,Assessment Report for the 2015 Drilling Report,2016,2015.0,,2017-06-22,,2016/6/22,16,China Knows,093L08W:,093L049:,54,26,53,126,24,1,9,6036486,668557,54.44805600000001,-126.400278,AG:AU:CU:ZN:PB:,43.0,,SMI,3.0,OMIN:,Omineca,Omineca,CHINA KNOWS,"093L  059, 093L  245, 093L  246, 093L  247, 093L  344",Babine Range,CHINA KNOWS,"Drilling,<br>Geochemical","Drilling, Geochemical","05288, 06427, 11504, 15408, 15489, 17154, 18519, 29986, 30292, 31181, 33185, 33427, 34833, 34919","Moll, John Wesley (FMC# 118694)","Moll, John Wesley (FMC# 118694)","Moll, John Wesley (FMC# 118694)","Silver, Gold, Copper, Zinc, Lead","Jurassic, Hazelton Group, Telkwa Formation, Calc-alkaline volcanics, Eocene, Endako Group, Buck Creek Formation, Basaltic volcanic rocks, Barite, Rhyolites, Dacites, Andesites, Chalcopyrite, Pyrite, Magnetite",12444.23,1.837,6774.213390999999,1.443,8623.860014,1.224,10166.85458,http://aris.empr.gov.bc.ca/search.asp?mode=repsum&rep_no=36181
24904,35723,1.0,2015/8/27,GEOL:PROS:GEOC:,11301,Assessment Report on the Teako Property,2015,2015.0,,2016-08-27,,2015/8/27,28,Teako,103P01W:,103P009:,55,2,29,128,20,6,9,6099599,542495,55.041389,-128.335,AU:AG:CU:,,,SMI,3.0,OMIN:,Omineca,Omineca,"1015035,<br>OWL","103P  033, 103P  032",,"1015035, OWL","Geological,<br>Prospecting,<br>Geochemical","Geological, Prospecting, Geochemical",34535,"Kemp, John","Kemp, John","Kemp, John","Gold, Silver, Copper","Cretaceous, Skeena Group, Kitsuns Creek Formation, Coarse Clastic Sedimentary Rocks, Jurassic-Cretaceous, Bowser Lake Group, Sedimentary rocks, Chalcopyrite, Intrusive plug, Galena, Pyrite, Pyrrhotite, Molybdenite, Arsenopyrite, Veins",14445.0,1.804,8007.206208,1.4169999999999998,10194.071979999999,1.202,12017.470879999999,http://aris.empr.gov.bc.ca/search.asp?mode=repsum&rep_no=35723
25164,36151,1.0,2016/4/26,GEOP:,17316,2015 Geophysical and Compilation Assessment Report,2016,2015.0,,2017-04-26,,2016/4/26,68,Kenny Creek,093K02W:,093K025:,55,0,0,125,0,6,10,6096624,371965,55.0,-125.001667,AU:AG:HG:,,,PRG,3.0,OMIN:,Omineca,Omineca,"532925,<br>532926,<br>842488,<br>607870,<br>518614","093N  046, 093N  047",,"532925, 532926, 842488, 607870, 518614",Geophysical,Geophysical,12294,"Mann, Vern Walter","Taschuck, Leo Frank (FMC 251086)","Middleton, Mike","Gold, Silver, Mercury","Permian-Jurassic, Permian-Jurassic, Cache Creek Complex, Cache Creek Complex, Sowchea Succession, Sowchea Succession, Mudstones, Mudstones, Siltstones, Siltstones, Shales, Shales, Fine Clastic Sedimentary Rocks, Fine Clastic Sedimentary Rocks, Placers, Placers, Placer gold",17316.4,1.837,9426.456179,1.443,12000.2772,1.224,14147.38562,http://aris.empr.gov.bc.ca/search.asp?mode=repsum&rep_no=36151
25285,35688,1.0,2015/8/28,GEOC:,24765,"Prospecting, Rock and Soil Sampling Exploration Report",2015,2015.0,,2016-08-28,,2015/8/28,66,Boer,093K05E:,093K022:,54,16,2,125,36,40,10,6016400,329960,54.267222,-125.61111100000001,AG:AU:MO:CU:,,,PRG,3.0,OMIN:,Omineca,Omineca,"BOER 4,<br>BOER 5,<br>BOER 10",093K  114,,"BOER 4, BOER 5, BOER 10",Geochemical,Geochemical,"33782, 34638, 35218","Carlson, Gerald G.; Chapman, John Arthur (FMC 104633)","Carlson, Gerald G.; Chapman, John Arthur (FMC 104633)","Carlson, Gerald G.","Silver, Gold, Molybdenum/Molybdenite, Copper","Jurassic, Cretaceous, Eocene-Oligocene, Endako Batholith, Endako Formation, Stag Lake Plutonic Suite, Kasalka Group, Nechacko Plateau Group, Granites, Alkali-feldspar granites, Andesitic volcanics, Molybdenite, Chalcopyrite",18337.16,1.804,10164.72284,1.4169999999999998,12940.83275,1.202,15255.54077,http://aris.empr.gov.bc.ca/search.asp?mode=repsum&rep_no=35688
25368,35819,1.0,2015/12/16,GEOL:GEOC:,19120,2015 Geological and Geochemical Assessment Report,2015,2015.0,,2016-12-16,,2015/12/16,52,Burbridge,093L10W:,093L077:,54,43,45,126,46,39,9,6066921,643114,54.729167000000004,-126.7775,CU:MO:AG:AU:,43.0,,SMI,3.0,OMIN:,Omineca,Omineca,"BURBRIDGE,<br>BURBRIDGE1,<br>BURBRIDGE2",093L  223,Babine Range,"BURBRIDGE, BURBRIDGE1, BURBRIDGE2","Geological,<br>Geochemical","Geological, Geochemical","06386, 05422, 21641, 24826, 21446, 24335, 31742, 35491","James, Rogers; Paul, Christopher Ryan (FMC 269478); Blady, Michael A. (FMC 278776)","James, Rogers; Paul, Christopher Ryan (FMC 269478); Blady, Michael A. (FMC 278776)","Paul, Christopher Ryan (FMC 269478)","Copper, Molybdenum/Molybdenite, Silver, Gold","Jurassic, Hazelton Group, Telkwa Formation, Calc-alkaline volcanics, Nilkitkwa Formation, Sedimentary rocks, Cretaceous, Bulkley Plutonic Suite, Diorites, Intrusive rocks, Porphyry, Porphyry copper-gold-molybdenum, Copper, Gold, Molybdenum, Silver",19146.48,1.804,10613.34812,1.4169999999999998,13511.983059999999,1.202,15928.85191,http://aris.empr.gov.bc.ca/search.asp?mode=repsum&rep_no=35819
25559,36251,1.0,2016/5/6,PROS:,13246,Technical Assessment Report,2016,2015.0,,2017-05-06,,2016/5/6,51,Swannell,094C11W:,094C053:,56,32,10,125,26,30,10,6268420,349851,56.536111,-125.441667,DS:,,,PRG,3.0,OMIN:,Omineca,Omineca,BACON1,,,BACON1,Prospecting,Prospecting,,"Deering, David R.","Deering, David R.","Deering, David R.",Dimension Stone,"Proterozoic-Paleozoic, Limestones, Marbles, Calcareous sedimentary rocks",21975.0,1.837,11962.43876,1.443,15228.690230000002,1.224,17953.43137,http://aris.empr.gov.bc.ca/search.asp?mode=repsum&rep_no=36251
25597,35743,1.0,2015/9/11,GEOL:PROS:GEOC:,21862,Prospecting and Geological Assessment Report,2015,2015.0,,2016-09-11,,2015/9/11,35,Swannell,094C11E:,094C065:,56,40,0,125,10,6,10,6282383,367115,56.666667000000004,-125.168333,ZN:PB:AG:,,,PRG,3.0,OMIN:,Omineca,Omineca,"SWAN,<br>SWANWARD,<br>1035363,<br>1035396","094C  003, 094C  005, 094C  182",,"SWAN, SWANWARD, 1035363, 1035396","Geological,<br>Prospecting,<br>Geochemical","Geological, Prospecting, Geochemical","00152, 00153, 00154, 01136, 01584, 13452, 14032, 26608, 26702, 26794, 27253, 28461",Spearhead Mining Corporation,"Cavey, Douglas","MacDonald, Francis","Zinc, Lead, Silver","Cambrian-Ordovician, Kechika Group, Proterozoic, Hadrynian, Ingenika Group, Mudstones, Siltstones, Shales, Limestones, Sphalerite, Galena, Pyrite, Espee Formation, Stelkuz Formation, Quartz-ankerite veins, Malachite, Covellite",22050.67,1.804,12223.20953,1.4169999999999998,15561.51729,1.202,18344.98336,http://aris.empr.gov.bc.ca/search.asp?mode=repsum&rep_no=35743
25635,35877,1.0,2015/10/22,GEOL:GEOC:,23229,Geological and Geochemical Report,2015,2015.0,,2016-10-22,,2015/10/22,71,Zymoetz,103H09W:,103H059:,53,31,10,128,19,27,9,5930269,544809,53.51944399999999,-128.324167,CU:AU:,,,SMI,3.0,OMIN:,Omineca,Omineca,"ZYMOETZ 1,<br>ZYMOETZ 2",103I  106,,"ZYMOETZ 1, ZYMOETZ 2","Geological,<br>Geochemical","Geological, Geochemical",,BC Copper NL,"MacDonald, KEN",,"Copper, Gold","Jurassic, Kleanza plutonic suite, Triassic-Jurassic, Telkwa Formation, Mississippian-Permian, Andesitic volcanics, Limestones, Skarns, Granodiorites, Diorites, Greenschist facies, Hazelton Group, Calc-alkaline volcanics, Bornite, Chalcopyrite, Galena, Tetrahedrite, Devonian, Stikine Assemblage",22600.04,1.804,12527.73836,1.4169999999999998,15949.21665,1.202,18802.02995,http://aris.empr.gov.bc.ca/search.asp?mode=repsum&rep_no=35877
25728,35695,1.0,2015/8/13,GEOL:GEOC:,30634,Geological and Geochemical Report,2015,2015.0,,2016-08-13,,2015/8/13,49,Hawk,094C04E:,094C002:,56,2,33,125,40,55,10,6214054,332940,56.0425,-125.681944,CU:AU:,,,PRG,3.0,OMIN:,Omineca,Omineca,"895709,<br>HAWK E,<br>895694","094C  138, 094C  139, 094C  140, 094C  171, 094C  177",,"895709, HAWK E, 895694","Geological,<br>Geochemical","Geological, Geochemical","24378, 31666, 32441, 33084","Durfeld, Rudolf M.","Durfeld, Rudolf M.","Durfeld, Rudolf M.","Copper, Gold","Cretaceous, Hogem Plutonic Suite, Granites, Alkali-feldspar granites, Quartz monzonites, Jurassic, Duckling Creek Syenite Complex, Quartz stockworks, Quartz veins, Pyrite, Chalcopyrite, Magnetite, Sphalerite, Galena",23780.62,1.804,13182.16186,1.4169999999999998,16782.37121,1.202,19784.20965,http://aris.empr.gov.bc.ca/search.asp?mode=repsum&rep_no=35695
26084,35776,1.0,2015/9/27,DRIL:GEOC:,43054,2015 Geochemical and Drilling Assessment Report,2015,2015.0,,2016-09-27,,2015/9/27,80,Hanson,093K03E:,093K025:,54,13,13,125,2,48,10,6009964,366560,54.220278,-125.046667,CU:MO:AU:,,,SMI,3.0,OMIN:,Omineca,Omineca,HAN1401,093K  081,,HAN1401,"Drilling,<br>Geochemical","Drilling, Geochemical","02931, 04703, 07190, 18398, 22499, 29154, 33278, 34087, 34832",Stone Ridge Exploration Corp.,"Carlson, Gerald G.; Chapman, John Arthur (FMC 104633)","Paul, Christopher Ryan (FMC 269478)","Copper, Molybdenum/Molybdenite, Gold","Jurassic, Jurassic, Endako Batholith, Endako Batholith, Francois Lake Suite, Francois Lake Suite, Glenannan subsuite, Glenannan subsuite, Glenannan phase, Glenannan phase, Granites, Granites, Granodiorites, Granodiorites, Triassic, Triassic, Diorites, Diorites, Cretaceous, Cretaceous, Kasalka Group, Kasalka Group, Andesitic volcanics, Andesitic volcanics, Quartz monzonites, Molybdenite, Bornite, Chalcopyrite, Float",30187.13,1.804,16733.44235,1.4169999999999998,21303.54975,1.202,25114.08486,http://aris.empr.gov.bc.ca/search.asp?mode=repsum&rep_no=35776
26089,35557,1.0,2015/9/11,GEOL:GEOC:,43172,Geological Mapping and Sampling on the Golden Girl Property,2015,2015.0,,2016-09-11,,2015/9/11,57,Golden Girl,093M12E:,093M063:,55,40,8,127,36,2,9,6170117,588022,55.668889,-127.60055600000001,MO:,,,SMI,3.0,OMIN:,Omineca,Omineca,"GOLDEN GIRL 1,<br>GOLDEN GIRL 2,<br>GOLDEN GIRL 3,<br>GOLDEN GIRL 4","093M  081, 093M  182",,"GOLDEN GIRL 1, GOLDEN GIRL 2, GOLDEN GIRL 3, GOLDEN GIRL 4","Geological,<br>Geochemical","Geological, Geochemical","17291, 29872",Cassiar East Yukon Expediting Ltd.,"Ostler, John (FMC # 120383)","Ostler, John (FMC # 120383)",Molybdenum/Molybdenite,"Jurassic-Cretaceous, Bowser Lake Group, Cretaceous, Bulkley Plutonic Suite, Argillites, Siltstones, Mudstones, Sandstones, Molybdenite, Pyrite, Polymetallic Veins, Galena, Sphalerite, Arsenopyrite, Tetrahedrite, Granodiorites, Stocks, Potassic alteration",30234.8,1.804,16759.86696,1.4169999999999998,21337.19125,1.202,25153.74376,http://aris.empr.gov.bc.ca/search.asp?mode=repsum&rep_no=35557
26418,35706,1.0,2015/7/19,PROS:PHYS:,37335,"Prospecting, Exploration/Development in support of exploration",2015,2015.0,,2016-07-19,,2015/7/19,15,Dig In,093N09W:,093N059:,55,32,56,124,15,18,10,6156601,420825,55.548889,-124.255,AU:,,,PRG,4.0,OMIN:,Omineca,Omineca,DIG IN,,,DIG IN,"Prospecting,<br>Physical","Prospecting, Physical",32656,"Forsman, Nils","Forsman, Nils","Forsman, Nils",Gold,"Proterozoic-Permian, Boulder Creek Group, Coarse Clastic Sedimentary Rocks, Triassic-Jurassic, Takla Group, Mudstones, Siltstones, Shales, Mississippian-Permian, Wolf Ridge Gabbro, Diorites, Placer",38245.0,1.804,21200.11086,1.4169999999999998,26990.11997,1.202,31817.80366,http://aris.empr.gov.bc.ca/search.asp?mode=repsum&rep_no=35706
26454,35491,1.0,2015/3/16,GEOC:GEOP:,39309,2015 Geochemical Assessment Report on the Burbridge Property,2015,2015.0,,2016-03-16,,2015/3/16,132,Burbridge,093L10W:,093L077:,54,43,45,126,46,45,9,6066917,643007,54.729167000000004,-126.77916699999999,CU:MO:AU:AG:,43.0,,SMI,3.0,OMIN:,Omineca,Omineca,"BURBRIDGE,<br>BURBRIDGE1,<br>BURBRIDGE2",093L  223,Babine Range,"BURBRIDGE, BURBRIDGE1, BURBRIDGE2","Geochemical,<br>Geophysical","Geochemical, Geophysical","31742, 21446, 21641","James, Rogers; Paul, Christopher Ryan (FMC 269478); Blady, Michael A. (FMC 278776)","James, Rogers; Paul, Christopher Ryan (FMC 269478); Blady, Michael A. (FMC 278776)","Paul, Christopher Ryan (FMC 269478)","Copper, Molybdenum/Molybdenite, Gold, Silver","Jurassic, Hazelton Group, Telkwa Formation, Calc-alkaline volcanics, Nilkitkwa Formation, Cretaceous, Bulkley Plutonic Suite, Diorites, Argillic alteration, Phyllic alteration, Pyrite, Magnetite, Chalcopyrite, Molybdenite",39378.05,1.804,21828.18736,1.4169999999999998,27789.73183,1.202,32760.44093,http://aris.empr.gov.bc.ca/search.asp?mode=repsum&rep_no=35491
26985,36280,1.0,2016/8/3,PHYS:,10944,"Prospecting, Exploration/Development in Support of Exploration",2016,2015.0,,2017-08-03,,2016/8/3,19,Kelly's Nugget,093J13W:,093J001:,55,0,0,124,0,6,10,6095250,435926,55.0,-124.001667,AU:,,,PRG,4.0,OMIN:,Omineca,Omineca,KELLY'S NUGGET,,,KELLY'S NUGGET,Physical,Physical,,"Forsman, Nils","Forsman, Nils","Forsman, Nils",Gold,"Cretaceous-Paleogene, Marine sedimentary and volcanic rocks, Placer, Placer gold, Placers",63365.5,1.837,34494.01198,1.443,43912.33541,1.224,51769.19935,http://aris.empr.gov.bc.ca/search.asp?mode=repsum&rep_no=36280
27070,35623,1.0,2015/6/29,GEOP:,67704,Airborne Magnetic and Radiometric Surveys and Geological Reconnaissance,2015,2015.0,,2016-06-29,,2015/6/29,153,Red Lion,094D09E:,094D060:,56,34,0,126,11,1,9,6272701,673046,56.566667,-126.18361100000001,CU:AU:AG:,,,PRG,3.0,OMIN:,Omineca,Omineca,"1024116,<br>1024118,<br>1024125,<br>1024127,<br>1024885,<br>1024886,<br>1032482,<br>1022491,<br>1035131","094D  135, 094D  165, 094D  167, 094D  179, 094D  168",,"1024116, 1024118, 1024125, 1024127, 1024885, 1024886, 1032482, 1022491, 1035131",Geophysical,Geophysical,"21781, 21782, 22585, 23543, 23842, 28439, 22019, 32364, 32618, 35336",Garibaldi Resources Corp.,"Greig, Charles J. (FMC #143767); Rowe, Jeffrey D.","Rowe, Jeffrey D.","Copper, Gold, Silver","Triassic, Cretaceous, Jurassic, Ultramafic rocks, Quartz diorites, Takla Group, Volcanic rocks, Andesites, Tuffs, Malachite, Chalcopyrite, Pyrite",67810.0,1.804,37588.6918,1.4169999999999998,47854.62244,1.202,56414.309479999996,http://aris.empr.gov.bc.ca/search.asp?mode=repsum&rep_no=35623
27179,35669,1.0,2015/11/29,GEOL:GEOC:,72632,2015 Geological and Geochemical Report,2015,2015.0,,2016-11-29,,2015/11/29,89,Hot Property,093M06E:,093M045:,55,24,0,127,3,6,9,6141032,623381,55.4,-127.051667,CU:MO:AU:AG:,45.0,,SMI,3.0,OMIN:,Omineca,Omineca,"COPPER#1,<br>COPPER BASIN,<br>COPPER BASIN2,<br>HOTTIE,<br>ICY,<br>SKINNY,<br>NAUGHTY,<br>HOT 2","093M  029, 093M  124, 093M  138, 093M  206",Silver Standard - Rocher Deboule Area,"COPPER#1, COPPER BASIN, COPPER BASIN2, HOTTIE, ICY, SKINNY, NAUGHTY, HOT 2","Geological,<br>Geochemical","Geological, Geochemical","03970, 04699, 05149, 08711, 29873, 30829, 32996, 35172",XANDER RESOURCES,"Ostler, John (FMC # 120383); Squinas, Bruce Mack","Lawrence, Joseph T.; Swanton, David","Copper, Molybdenum/Molybdenite, Gold, Silver","Jurassic, Bowser Lake Group, Ashman Formation, Mudstones, Siltstones, Shales, Fine Clastic Sedimentary Rocks, Jurassic-Cretaceous, Sedimentary rocks, Porphyry, Porphyry copper-molybdenum, Metasediments, Mount Thoen, Mount Thoen Batholith, Copper, Molybdenum, Digital data geochemistry, Digital data airborne geophysics, Digital data imagery, Digital data GIS",74950.14,1.804,41546.6408,1.4169999999999998,52893.535639999995,1.202,62354.52579,http://aris.empr.gov.bc.ca/search.asp?mode=repsum&rep_no=35669
27385,35680,1.0,2015/12/15,GEOC:,118250,Sampling on the Star Claims,2015,2015.0,,2016-12-15,,2015/12/15,81,Star,094C05E:,094C042:,56,28,59,125,40,6,10,6263035,335687,56.483056000000005,-125.668333,CU:PT:PD:,,,PRG,3.0,OMIN:,Omineca,Omineca,"Star 1,<br>Star 3,<br>Star 8,<br>Star 10,<br>Star 12","094C  162, 094C  163, 094C  165, 094C  164, 094C  166, 094C  167, 094C  168, 094C  169",,"Star 1, Star 3, Star 8, Star 10, Star 12",Geochemical,Geochemical,"15955, 16574, 16628, 24300, 25002, 25488, 25873, 26198, 26524, 26844, 27117, 27394, 27616, 28009, 28716, 29397, 31881, 34297, 35114","Mowat, Ursula G.","Mowat, Ursula G.","Mowat, Ursula G.","Copper, Platinum, Palladium","Jurassic, Permiability, Devonian-Permian, Polaris Ultramafic Complex, Ultramafic rocks, Pyroxenites, Dunites, Peridotites, Lay Range Assemblage, Volcaniclastic rocks, Mudstones, Siltstones, Shales, Chalcopyrite, Pyrrhotite, Covellite, Bornite",91166.31,1.804,50535.64856,1.4169999999999998,64337.55116,1.202,75845.51581,http://aris.empr.gov.bc.ca/search.asp?mode=repsum&rep_no=35680
27733,36234,1.0,2016/8/28,DRIL:GEOC:,132582,Report on Diamond Drilling,2016,2015.0,,2017-08-28,,2016/8/28,104,2 X Fred,093F16W:,093F088:,53,49,36,124,26,4,10,5965191,405586,53.82666700000001,-124.434444,AU:AG:,,,PRG,3.0,OMIN:,Omineca,Omineca,2 X FRED 03-11,093F  049,,2 X FRED 03-11,"Drilling,<br>Geochemical","Drilling, Geochemical","07145, 07147, 07198, 07199, 33436, 34967, 35291",Theia Resources,"LaVoie, D.","Kennedy, S.","Gold, Silver","Triassic-Jurassic, Brooks Diorite Complex, Diorites, Eocene, Nechacko Plateau Group, Endako Formation, Andesitic volcanics, Miocene, Chilcotin Group, Basaltic volcanics, Chalcedonic quartz, Clay alteration, Quartz vein stockworks",132670.68,1.837,72221.38269,1.443,91940.87318,1.224,108391.0784,http://aris.empr.gov.bc.ca/search.asp?mode=repsum&rep_no=36234
28872,35803,1.0,2015/10/6,GEOC:,2254,"Assessment Report on the Hedley, BC Tenures",2015,2015.0,,2016-10-06,,2015/10/6,19,Hedley,092H08E:,092H040:,49,21,3,120,4,44,10,5470562,712139,49.350833,-120.07888899999999,AU:AG:,11.0,,KAM,2.0,OSOY:,Osoyoos,Osoyoos,"KEYS,<br>RELIEF,<br>REWARD",,Hedley Camp,"KEYS, RELIEF, REWARD",Geochemical,Geochemical,"15714, 12203, 25222","Jensen, David Bjarne","Jensen, David Bjarne","Jensen, David Bjarne","Gold, Silver","Triassic, Nicola Group, Mudstones, Siltstones, Shales, Fine Clastic Sedimentary Rocks, Triassic-Jurassic, Granodiorites, Tailings, Hedley Intrusions",2254.0,1.804,1249.445676,1.4169999999999998,1590.6845449999998,1.202,1875.207987,http://aris.empr.gov.bc.ca/search.asp?mode=repsum&rep_no=35803
28915,35668,1.0,2015/10/20,GEOL:,3304,Geological Assessment Report,2015,2015.0,,2016-10-20,,2015/10/20,12,Ridge,082E04E:,082E023:,49,12,56,119,34,13,11,5454598,312825,49.215556,-119.570278,AU:SI:UR:,9.0,,KAM,3.0,OSOY:,Osoyoos,Osoyoos,"THE RIDGE MAIN,<br>FAIRVIEW-WL CLAIM",,Similkameen - Boundary Area,"THE RIDGE MAIN, FAIRVIEW-WL CLAIM",Geological,Geological,"06360, 06504, 06949, 07398, 09828, 13941, 12971","Brownstein, Bruce; Cameron, Diane","Brownstein, Bruce; Cameron, Diane","Sigurgeirson, Helgi","Gold, Silica, Uranium","Jurassic, Okanagan Batholith, Granodiorites, Intrusive rocks, Granites, Oliver Pluton",3166.89,1.804,1755.482262,1.4169999999999998,2234.9259,1.202,2634.68386,http://aris.empr.gov.bc.ca/search.asp?mode=repsum&rep_no=35668
