,rep_no,cnf_prd,aff_dt,gwrk_typs,claim_val,title,rep_yr,wrk_yr,conf_ldate,conf_adate,aff_ndate,aff_adate,page_ct,prpty_nm,nts_maps,bcgs_maps,lat83_deg,lat83_min,lat83_sec,lon83_deg,lon83_min,lon83_sec,zone83,north83,east83,lat83,long83,com_cds,camp_cd,geo_sum,reg_geo,info_cls,mdiv_cds,mdiv_nmx,mdiv_nms,claim_nmx,minf_nox,camp_nm,claim_nms,gwrk_nmx,gwrk_nms,rel_ars,oper_nms,own_nms,auth_nms,com_nms,kwl_nms,MERG_SPENT,DOLL_INX,doll_86,CPIdex1992,doll_92,CPIdex2002,doll_02,URL
23987,32186,1.0,2011/3/1,GEOC:,8051,Geochemical Survey Report on the Carlson Property,2011,2010.0,,2012-03-01,,2011/3/1,50,Carlson,103I09W:,103I079:,54,42,59,128,21,36,9,6063420,541228,54.716389,-128.36,MO:CU:AG:AU:,,,SMI,3.0,OMIN:,Omineca,Omineca,540060,103I  045,,540060,Geochemical,Geochemical,"27233, 27499, 27817, 28109, 30257","Bysouth, Garry D.; Kurz, Gary W.","Bysouth, Garry D.; Kurz, Gary W.","Bysouth, Garry D.","Molybdenum/Molybdenite, Copper, Silver, Gold","Jurassic-Cretaceous, Kitselas Volcanics, Hazelton Group, Rhyolites, Quartz diorites",8066.0,1.75,4609.142857,1.374,5870.451236999999,1.165,6923.60515,http://aris.empr.gov.bc.ca/search.asp?mode=repsum&rep_no=32186
23990,32069,1.0,2010/10/22,GEOC:,8014,Rock Geochemistry Program on the Bird Property,2011,2010.0,,2011-10-22,,2010/10/22,35,Bird,093F11E:,093F065:,53,37,14,125,8,54,10,5943451,357910,53.62055600000001,-125.14833300000001,AU:CU:,,,PRG,3.0,OMIN:,Omineca,Omineca,Bird 1-3,,,Bird 1-3,Geochemical,Geochemical,,Kootenay Gold Inc.,"Critchlow, Fred","Kennedy, Craig","Gold, Copper","Andesitic volcanics, Basaltic volcanics, Gabbros, Diorites, Carbonate alteration, Eocene-Oligocene, Nechacko Plateau Group",8082.0,1.75,4618.285714,1.374,5882.0960700000005,1.165,6937.339056,http://aris.empr.gov.bc.ca/search.asp?mode=repsum&rep_no=32069
24049,32400,1.0,2011/6/24,GEOL:GEOC:,8453,Geological and Geochemical Report on the Skip Property,2011,2010.0,,2012-06-24,,2011/6/24,66,Skip,093F15W:,093F096:,53,56,0,124,48,20,10,5977614,381464,53.933333,-124.80555600000001,MO:,,,PRG,3.0,OMIN:,Omineca,Omineca,574353,"093F  019, 093F  020",,574353,"Geological,<br>Geochemical","Geological, Geochemical","01002, 01107, 01108, 01216, 01689, 02455, 21587, 22061, 24789, 28350, 29601","Bysouth, Garry D.; Kurz, Gary W.","Bysouth, Garry D.; Kurz, Gary W.","Bysouth, Garry D.",Molybdenum/Molybdenite,"Jurassic, Cretaceous, Stag Lake Plutonic Suite, Kasalka Group, Quartz monzonites, Andesites, Molybdenite",8506.0,1.75,4860.571429,1.374,6190.684134,1.165,7301.2875540000005,http://aris.empr.gov.bc.ca/search.asp?mode=repsum&rep_no=32400
24058,32256,1.0,2011/2/21,PROS:,12205,Ches Property Evaluation Report,2011,2010.0,,2012-02-21,,2011/2/21,54,Ches,093F05E:,093F042:,53,24,46,125,42,37,10,5921612,319871,53.412778,-125.710278,,,,PRG,3.0,OMIN:,Omineca,Omineca,600320,"093F  017, 093F  035, 093F  002",,600320,Prospecting,Prospecting,"03173, 03777, 12291, 15129, 17679, 26354, 30575",Teck Resources Limited (FMC # 126548),"Keefe, Ralph R.","Galambos, Kenneth D.",,"Jurassic, Cretaceous, Naglico Formation, Andesites, Tuffs, Diorites, Agglomerates",8556.51,1.75,4889.434286,1.374,6227.445415,1.165,7344.643776999999,http://aris.empr.gov.bc.ca/search.asp?mode=repsum&rep_no=32256
24065,31683,1.0,2010/7/12,DRIL:GEOC:,11531,2010 Drilling Report on the China Knows 591617 Mineral Claims,2010,2010.0,,2011-07-12,,2010/7/12,17,China Knows,093L08W:,093L048:,54,26,59,126,27,24,9,6036538,664895,54.449721999999994,-126.456667,,,,SMI,3.0,OMIN:,Omineca,Omineca,591617,,,591617,"Drilling,<br>Geochemical","Drilling, Geochemical","04762, 05288, 06427, 08870, 11504, 15408, 15489, 17154, 18519, 29986, 30292, 31181","Moll, John Wesley (FMC# 118694)","Moll, John Wesley (FMC# 118694)","Moll, John Wesley (FMC# 118694)",,"Jurassic, Telkwa Formation, Andesites, Lapilli tuffs",8388.0,1.709,4908.133411,1.3419999999999999,6250.372578,1.138,7370.826011,http://aris.empr.gov.bc.ca/search.asp?mode=repsum&rep_no=31683
24088,32331,1.0,2011/4/14,GEOC:,8466,Rock Geochemistry Report on the Fox Property,2011,2010.0,,2012-04-14,,2011/4/14,31,Fox,093F14W:,093F093:,53,54,50,125,28,6,10,5976764,337883,53.913889000000005,-125.468333,AG:AU:,,,PRG,3.0,OMIN:,Omineca,Omineca,"750982,<br>751002",,,"750982, 751002",Geochemical,Geochemical,,Kootenay Gold Inc.,"Critchlow, Fred","Kennedy, Craig","Silver, Gold","Eocene-Oligocene, Ootsa Lake Formation, Rhyolites",8756.0,1.75,5003.428571,1.374,6372.634643,1.165,7515.879828,http://aris.empr.gov.bc.ca/search.asp?mode=repsum&rep_no=32331
24165,31570,1.0,2010/4/17,GEOP:GEOC:,9067,Geochemical and Geophysical Report on the Fort-Elden Cu-Ag-Au-Mo Project,2010,2010.0,,2011-04-17,,2010/4/17,62,Fort-Elden,093K12E:,093K063:,54,37,14,125,34,54,10,6055631,333318,54.62055600000001,-125.581667,CU:AG:AU:MO:,,,PRG,3.0,OMIN:,Omineca,Omineca,"Specularite,<br>Owl 1,<br>Recce 1,<br>Owl 3","093K  093, 093K  103",,"Specularite, Owl 1, Recce 1, Owl 3","Geophysical,<br>Geochemical","Geophysical, Geochemical","25760, 22610, 20377, 21640, 20590, 11520, 17294, 02319",Torch River Resources Ltd,"Kikauka, Andris (FMC # 114051)","Kikauka, Andris (FMC # 114051)","Copper, Silver, Gold, Molybdenum/Molybdenite","Permian, Permian, Asitka Group, Asitka Group, Triassic, Triassic, Takla Group, Takla Group, Sitlika Assemblage, Sitlika Assemblage, Mafic volcanics, Mafic volcanics, Eocene, Eocene, Oligocene, Oligocene, Endako Formation, Endako Formation, Granodiorites, Granodiorites, Jurassic, Jurassic, Topley Intrusions, Topley Intrusions, Diorites, Diorites, Butterfield Lake Intrusive Complex, Butterfield Lake Intrusive Complex, Ultramafic rocks, Ultramafic rocks, Gabbro, Volcanic rocks, Basalts, Chalcopyrite, Pyrite, Magnetite, Sphalerite, Galena, Greenschists, Felsic dykes, Taltapin Metamorphic Complex",8898.0,1.709,5206.55354,1.3419999999999999,6630.402385,1.138,7818.980668000001,http://aris.empr.gov.bc.ca/search.asp?mode=repsum&rep_no=31570
24172,31645,1.0,2010/6/9,DRIL:GEOC:,12116,Diamond Drilling Report on the HD Property,2010,2010.0,,2011-06-09,,2010/6/9,22,HD,093L07E:,093L047:,54,27,11,126,39,36,9,6036452,651702,54.453056000000004,-126.66,CU:ZN:PB:MO:AG:AU:,,,SMI,3.0,OMIN:,Omineca,Omineca,516488,"093L  203, 093L  204, 093L  205",,516488,"Drilling,<br>Geochemical","Drilling, Geochemical","09849, 14157, 18360, 18864, 18911, 23232, 25891, 26288, 26577, 26887, 27195, 27456, 27810, 28456, 29129, 29567, 30313, 31324","Moll, John Wesley (FMC# 118694); Merkley, Daniel M.; Merkley, Gloria","Moll, John Wesley (FMC# 118694); Merkley, Daniel M.; Merkley, Gloria","Merkley, Daniel M.; Kemp, Rick","Copper, Zinc, Lead, Molybdenum/Molybdenite, Silver, Gold","Jurassic, Telkwa Formation, Andesites, Tuffs, Sandstones",8961.0,1.709,5243.417203,1.3419999999999999,6677.347243,1.138,7874.3409489999995,http://aris.empr.gov.bc.ca/search.asp?mode=repsum&rep_no=31645
24295,31625,1.0,2010/4/26,GEOP:,7888,Airborne Geophysical Interpretation Report on the Max-K2 Property,2010,2010.0,,2011-04-26,,2010/4/26,51,Max-K2,093K16E:,093K100:,54,55,46,124,4,50,10,6087475,430759,54.929444,-124.080556,CU:AU:,,,PRG,3.0,OMIN:,Omineca,Omineca,"530480,<br>532537,<br>532538,<br>532540,<br>532541,<br>532542,<br>532543,<br>532635,<br>532638,<br>551895","093K  020, 093K  086",,"530480, 532537, 532538, 532540, 532541, 532542, 532543, 532635, 532638, 551895",Geophysical,Geophysical,"16379, 18020, 18988, 20530, 21736, 21873, 21949, 29353","Hewett, Anthony James","Hewett, Anthony James","Blann, David","Copper, Gold","Triassic, Takla Group, Inzana Lake Formation, Diorites, Calc-alkaline rocks, Argillites, Sandstones, Tuffs, Volcanic breccias, Interpretations",9500.0,1.709,5558.806318999999,1.3419999999999999,7078.986587,1.138,8347.97891,http://aris.empr.gov.bc.ca/search.asp?mode=repsum&rep_no=31625
24327,32180,1.0,2010/12/28,GEOC:,9886,Geochemical Report on the Porphyry Project,2011,2010.0,,2011-12-28,,2010/12/28,37,Porphyry,093F07E:,093F038:,53,20,58,124,31,19,10,5912224,398692,53.34944399999999,-124.52194399999999,,,,PRG,3.0,OMIN:,Omineca,Omineca,527382,093F  060,,527382,Geochemical,Geochemical,"08476, 09691, 10850, 14281, 25069, 30267, 30396",Omega Exploration Services Inc.,"McLeod, Jacqueline A.","McLeod, Jim",,"Jurassic, Hazelton Group, Hornfels, Conglomerates, Mudstones",9887.0,1.75,5649.714286,1.374,7195.778748000001,1.165,8486.695279000001,http://aris.empr.gov.bc.ca/search.asp?mode=repsum&rep_no=32180
24371,32410,1.0,2011/5/26,GEOL:GEOC:,13550,2010 Geological and Geochemical Report on the Jerry Boy Property,2011,2010.0,,2012-05-26,,2011/5/26,33,Jerry Boy,093F08W:,093F039:,53,19,14,124,17,13,10,5908703,414276,53.320556,-124.28694399999999,,,,PRG,3.0,OMIN:,Omineca,Omineca,"779802,<br>779822,<br>779862",,,"779802, 779822, 779862","Geological,<br>Geochemical","Geological, Geochemical",,"Awmack, Henry James","Awmack, Henry James","Jones, Murray",,"Eocene, Miocene, Ootsa Lake Formation, Cheslatta Lake Complex, Rhyolites, Dacites, Argillites, Tuffs",10217.15,1.75,5838.371429,1.374,7436.062591,1.165,8770.085837,http://aris.empr.gov.bc.ca/search.asp?mode=repsum&rep_no=32410
24456,32035,1.0,2010/8/30,GEOC:,7640,2010 Soil Geochemical Sampling Program on the Mo Java Property,2011,2010.0,,2011-08-30,,2010/8/30,57,Mo Java,093F07E:,093F047:,53,25,0,124,43,6,10,5919998,385800,53.416667000000004,-124.718333,MO:,,,PRG,3.0,OMIN:,Omineca,Omineca,591640,,,591640,Geochemical,Geochemical,28849,"Greig, Charles J. (FMC #143767)","Greig, Charles J. (FMC #143767)","Greig, Charles J. (FMC #143767)",Molybdenum/Molybdenite,"Jurassic, Bowser Lake Group, Ashman Formation, Conglomerates, Granodiorites",10782.5,1.75,6161.428571,1.374,7847.525473000001,1.165,9255.364807,http://aris.empr.gov.bc.ca/search.asp?mode=repsum&rep_no=32035
24641,32135,1.0,2011/2/3,GEOC:,11181,Technical and Prospecting Report on the Jay Property,2011,2010.0,,2012-02-03,,2011/2/3,44,Jay,093F07W:,093F046:,53,25,30,124,48,45,10,5921080,379566,53.425,-124.8125,,,,PRG,4.0,OMIN:,Omineca,Omineca,"777242,<br>695703,<br>749222,<br>749242,<br>749262,<br>777182,<br>777282,<br>777202,<br>777162",,,"777242, 695703, 749222, 749242, 749262, 777182, 777282, 777202, 777162",Geochemical,Geochemical,,"Saulnier, Paul","Saulnier, Paul","Saulnier, Paul",,"Jurassic, Eocene, Nechako Formation, Endako Formation, Andesites, Rhyolites",12137.56,1.75,6935.748570999999,1.374,8833.740902,1.165,10418.506440000001,http://aris.empr.gov.bc.ca/search.asp?mode=repsum&rep_no=32135
24888,31904,1.0,2010/12/23,GEOP:GEOC:,10269,Geochemical and Geophysical Report on the Fort-Elden Cu-Zn-Ag-Au-Mo Project,2011,2010.0,,2011-12-23,,2010/12/23,74,Fort-Elden,093K12E:,093K063:,54,37,14,125,34,54,10,6055631,333318,54.62055600000001,-125.581667,,,,SMI,3.0,OMIN:,Omineca,Omineca,"Specularite,<br>Specularite 2",093K  093,,"Specularite, Specularite 2","Geophysical,<br>Geochemical","Geophysical, Geochemical",31570,Torch River Resources Ltd,"Kikauka, Andris (FMC # 114051)","Kikauka, Andris (FMC # 114051)",,"Eocene, Triassic, Endako Formation, Takla Group, Butterfield Lake Intrusive Complex, Taltapin Metamorphic Complex, Andesites, Ultramafics, Amphibolites",13875.29,1.75,7928.737143,1.374,10098.46434,1.165,11910.12017,http://aris.empr.gov.bc.ca/search.asp?mode=repsum&rep_no=31904
24946,32038,1.0,2010/10/22,GEOC:,14218,Prospecting and Rock Geochemistry Report on the Laurie Property,2011,2010.0,,2011-10-22,,2010/10/22,37,Laurie,093F15W:,093F086:,53,52,9,124,51,11,10,5970557,378159,53.869167000000004,-124.85305600000001,,,,PRG,3.0,OMIN:,Omineca,Omineca,"638223,<br>712102,<br>712142,<br>751242,<br>751262",,,"638223, 712102, 712142, 751242, 751262",Geochemical,Geochemical,"06832, 07241, 07484, 07803, 07934, 08164, 11051",Kootenay Gold Inc.,"Critchlow, Fred","Kennedy, Craig",,"Jurassic, Cretaceous, Hazelton Group, Holy Cross Pluton, Kasalka Group, Andesites, Feldspar porphyry, Breccias, Pyrite",14413.3,1.75,8236.171429,1.374,10490.02911,1.165,12371.93133,http://aris.empr.gov.bc.ca/search.asp?mode=repsum&rep_no=32038
25224,32528,1.0,2011/4/30,GEOC:,16561,Report on the Quartzite Silica Occurrences on the Ptarmigan Property,2011,2010.0,,2012-04-30,,2011/4/30,26,Ptarmigan,093H10W:,093H066:,53,40,10,120,58,0,10,5948665,634329,53.66944399999999,-120.96666699999999,SI:,,,PRG,3.0,OMIN:,Omineca,Omineca,"PT1-2,<br>PT 1-2",,,"PT1-2, PT 1-2",Geochemical,Geochemical,,The Ptarmigan Group,"Braaten, Milton; Jeck, Brian C","Duncan, Mack S.",Silica,"Cambrian, Yanks Peak Formation, Quartzites",17099.37,1.75,9771.068571,1.374,12444.956329999999,1.165,14677.570819999999,http://aris.empr.gov.bc.ca/search.asp?mode=repsum&rep_no=32528
25227,32084,1.0,2010/9/8,GEOC:,16350,Rock Geochemistry and Prospecting on the Copley Property,2010,2010.0,,2011-09-08,,2010/9/8,27,Copley,093F15W:,093F076:,53,44,18,124,48,12,10,5955919,381058,53.738333,-124.80333300000001,AU:,,,PRG,3.0,OMIN:,Omineca,Omineca,"633003,<br>768402,<br>619103,<br>632984,<br>688291,<br>643704,<br>643745,<br>644403,<br>644443,<br>644563,<br>768382,<br>786262,<br>786282,<br>780702",,,"633003, 768402, 619103, 632984, 688291, 643704, 643745, 644403, 644443, 644563, 768382, 786262, 786282, 780702",Geochemical,Geochemical,"11850, 13944, 26896, 27265",Kootenay Gold Inc.,"Critchlow, Fred; Kennedy, Jonathan Sean","Kennedy, Jonathan Sean",Gold,"Ootsa Lake Group, Rhyolites, Chert pebble conglomerates, Jurassic, Hazelton Group, Epithermal gold, Eocene-Oligocene",16731.8,1.709,9790.403745,1.3419999999999999,12467.80924,1.138,14702.81195,http://aris.empr.gov.bc.ca/search.asp?mode=repsum&rep_no=32084
25323,31666,1.0,2010/6/16,GEOC:,12259,Technical Report on Hawk Property,2010,2010.0,,2011-06-16,,2010/6/16,48,Hawk,094C04E:,094C002:,56,2,33,125,40,55,10,6214054,332940,56.0425,-125.681944,,,,PRG,3.0,OMIN:,Omineca,Omineca,"728342,<br>728442,<br>728502,<br>728542","094C  138, 094C  139, 094C  140, 094C  063",,"728342, 728442, 728502, 728542",Geochemical,Geochemical,"21412, 21713, 22605, 24378, 27113","Durfeld, Rudolf M.","Durfeld, Rudolf M.","Durfeld, Rudolf M.",,"Jurassic, Hogem Batholith, Duckling Creek Syenite Complex, Syenites, Granodiorites, Alaskites, Compilation",17707.9,1.709,10361.55647,1.3419999999999999,13195.15648,1.138,15560.54482,http://aris.empr.gov.bc.ca/search.asp?mode=repsum&rep_no=31666
25380,31742,1.0,2010/3/16,GEOP:,19493,2010 Magnetic Survey on the Silver Streak Property,2010,2010.0,,2011-03-16,,2010/3/16,22,Silver Streak,093L07E:,093L077:,54,44,0,126,45,6,9,6067437,644762,54.733332999999995,-126.751667,AG:,,,SMI,3.0,OMIN:,Omineca,Omineca,"Westlake,<br>Carrier 1,<br>Hat,<br>Bug,<br>Tea,<br>Bird,<br>Zoo,<br>Silver Lode,<br>Silver Tip,<br>Southern Streak,<br>Silver Streak,<br>Start,<br>Sharp",093L  327,,"Westlake, Carrier 1, Hat, Bug, Tea, Bird, Zoo, Silver Lode, Silver Tip, Southern Streak, Silver Streak, Start, Sharp",Geophysical,Geophysical,30093,Cadillac Mining Corporation,"Audet, Andre J.; Westgarde, Ed & Edna; Westgarde, Gerald; Hofsink, Barry A.H.","Audet, Andre J.",Silver,"Jurassic-Cretaceous, Hazelton Group, Kasalka Group, Andesitic volcanics, Rhyolites, Cretaceous, Granodiorites, Quartz monzonites",18325.38,1.709,10722.86717,1.3419999999999999,13655.27571,1.138,16103.145869999998,http://aris.empr.gov.bc.ca/search.asp?mode=repsum&rep_no=31742
25502,32339,1.0,2011/1/18,GEOC:,25198,Soil and Rock Geochemical Survey on the Babine Project,2011,2010.0,,2012-01-18,,2011/1/18,48,Babine,093M01E:,093M010:,55,5,0,126,11,6,9,6107685,679673,55.083332999999996,-126.185,CU:MO:AU:ZN:,44.0,,SMI,3.0,OMIN:,Omineca,Omineca,"543110,<br>543112,<br>543116,<br>543119,<br>543115",093M  160,Babine Porphyry,"543110, 543112, 543116, 543119, 543115",Geochemical,Geochemical,"00976, 02524, 03261, 04249, 04250, 04426, 20415, 21106, 25401, 29629, 30720","Menard, Rolland J.","Menard, Rolland J.","Ledwon, Anastasia","Copper, Molybdenum/Molybdenite, Gold, Zinc","Jurassic-Cretaceous, Saddle Hill Formation, Newman Formation, Babine Plutonic Suite, Basalts, Diorites, Granodiorites, Argillites, Greywackes",20237.65,1.75,11564.37143,1.374,14729.00291,1.165,17371.37339,http://aris.empr.gov.bc.ca/search.asp?mode=repsum&rep_no=32339
25514,32086,1.0,2010/9/8,GEOC:,19640,Rock Geochemistry and Prospecting Report on the Copley Property,2010,2010.0,,2011-09-08,,2010/9/8,30,Copley,093F15E:,093F077:,53,45,32,124,44,16,10,5958097,385438,53.758889,-124.737778,AU:,,,PRG,3.0,OMIN:,Omineca,Omineca,"633003,<br>768402,<br>619103,<br>632984,<br>688291,<br>643704,<br>643745,<br>644403,<br>644443,<br>644563,<br>768382",,,"633003, 768402, 619103, 632984, 688291, 643704, 643745, 644403, 644443, 644563, 768382",Geochemical,Geochemical,"13944, 26896, 27265","Critchlow, Fred","Critchlow, Fred","Kennedy, Sean J. (FMC # 142365)",Gold,"Ootsa Lake Group, Rhyolites, Chert pebble conglomerates, Jurassic, Hazelton Group, Epithermal gold, Andesite tuffs, Lapilli tuff, Eocene-Oligocene, Endako Batholith, Francois Lake Intrusions",19848.1,1.709,11613.86776,1.3419999999999999,14789.94039,1.138,17441.21265,http://aris.empr.gov.bc.ca/search.asp?mode=repsum&rep_no=32086
25738,31892,1.0,2010/12/3,GEOC:,18798,Report on Soil Sampling Program,2010,2010.0,,2011-12-03,,2010/12/3,56,Besshi,094C05E:,094C042:,56,27,59,125,45,6,10,6261384,330482,56.466389,-125.751667,AU:AG:ZN:PB:CU:,,,PRG,3.0,OMIN:,Omineca,Omineca,506124,"094C  012, 094C  013, 094C  059, 094C  091",,506124,Geochemical,Geochemical,"22883, 09201, 11251, 12110, 17457, 22883, 23136, 26308, 06037","McMillan, Ronald H.","Keefe, Ralph R.; Halleran, Arthur Derry; McMillan, Ronald H.","Strickland, Derrick","Gold, Silver, Zinc, Lead, Copper","Triassic-Jurassic, Takla Group, Quesnel Terrane, Basaltic tuffs, Limestones, Siltstones, Greywackes, Quartz monzonite dykes, Volcanic flows, Mesothermal veins",22734.6,1.709,13302.86717,1.3419999999999999,16940.834580000002,1.138,19977.68014,http://aris.empr.gov.bc.ca/search.asp?mode=repsum&rep_no=31892
26048,31674,1.0,2010/6/30,GEOL:GEOC:,28450,2010 Geological and Geochemical Report on the Chuchi Property,2010,2010.0,,2011-06-30,,2010/6/30,38,Chuchi,093N02E:,093N018:,55,7,18,124,34,30,10,6109463,399559,55.121667,-124.575,,,,PRG,3.0,OMIN:,Omineca,Omineca,"Chuchi,<br>588279",,,"Chuchi, 588279","Geological,<br>Geochemical","Geological, Geochemical","07887, 19720, 20899, 21988, 24000, 24316, 30199, 30490",Equity Exploration Consultants Ltd.,"Awmack, Henry James; Jones, Murray","Jones, Murray",,"Triassic-Jurassic, Diorites, Gabbros, Monzonites, Tuffs, Greywackes, Hornfels, Witch Lake Formation, Hogem Plutonic Suite",27895.21,1.709,16322.53365,1.3419999999999999,20786.29657,1.138,24512.48682,http://aris.empr.gov.bc.ca/search.asp?mode=repsum&rep_no=31674
26179,31949,1.0,2010/10/23,DRIL:GEOL:GEOC:,24821,Diamond Drilling Report on the Evelyn Copper Property,2010,2010.0,,2011-10-23,,2010/10/23,54,Evelyn Copper,093L14W:,093L084:,54,53,23,127,17,40,9,6083857,609389,54.889722,-127.294444,CU:,42.0,,SMI,3.0,OMIN:,Omineca,Omineca,665643,,Telkwa Range,665643,"Drilling,<br>Geological,<br>Geochemical","Drilling, Geological, Geochemical",27947,"Fournier, Steven; Lychak, Wesley","Fournier, Steven; Lychak, Wesley","L'Orsa, Anthony T.",Copper,"Jurassic, Cretaceous, Telkwa Formation, Red Rose Formation, Trout Creek Formation, Basalts, Tuffs, Tectonic breccias, Native copper",30333.81,1.709,17749.449969999998,1.3419999999999999,22603.435169999997,1.138,26655.369069999997,http://aris.empr.gov.bc.ca/search.asp?mode=repsum&rep_no=31949
26349,31881,1.0,2010/10/8,GEOC:,44400,"Sampling on the HA, HB, Libra and Taurus Zones",2010,2010.0,,2011-10-08,,2010/10/8,65,Star,094C05E:,094C042:,56,28,59,125,40,6,10,6263035,335687,56.483056000000005,-125.668333,,,,PRG,3.0,OMIN:,Omineca,Omineca,Star 4-5,"094C  162, 094C  166, 094C  167, 094C  168",,Star 4-5,Geochemical,Geochemical,"15955, 16574, 16628, 24300, 25002, 25488, 25873, 26198, 26524, 26844, 27117, 27394, 27617, 28009, 28716","Mowat, Ursula G.","Mowat, Ursula G.","Mowat, Ursula G.",,"Jurassic, Permian, Polaris Ultramafic Complex, Lay Range Assemblage, Pyroxenites, Volcanics, Dunites",34373.01,1.709,20112.93739,1.3419999999999999,25613.271240000002,1.138,30204.75395,http://aris.empr.gov.bc.ca/search.asp?mode=repsum&rep_no=31881
26431,31939,1.0,2010/8/13,GEOP:,32192,Induced Polariztion Surveying on the Max-K2 Property,2010,2010.0,,2011-08-13,,2010/8/13,15,Max-K2,093K16E:,093K100:,54,56,52,124,3,37,10,6089495,432089,54.947778,-124.060278,,,,PRG,3.0,OMIN:,Omineca,Omineca,"532538,<br>532537,<br>532540",093K  086,,"532538, 532537, 532540",Geophysical,Geophysical,"16379, 18020, 18988, 20530, 21736, 21873, 21949, 29353, 31625","Hewett, Anthony James","Hewett, Anthony James","Walcott, Peter E.",,"Triassic-Jurassic, Takla Group, Diorites, Calc-alkaline volcanics",36650.0,1.709,21445.28964,1.3419999999999999,27309.9851,1.138,32205.6239,http://aris.empr.gov.bc.ca/search.asp?mode=repsum&rep_no=31939
26910,32441,1.0,2011/3/27,GEOL:GEOP:GEOC:,76232,Technical Report on the Hawk Property,2011,2010.0,,2012-03-27,,2011/3/27,61,Hawk,094C04E:,094C002:,56,2,19,125,39,53,10,6213580,333995,56.038610999999996,-125.664722,,,,PRG,3.0,OMIN:,Omineca,Omineca,"728382,<br>728402,<br>728502","094C  138, 094C  139, 094C  171",,"728382, 728402, 728502","Geological,<br>Geophysical,<br>Geochemical","Geological, Geophysical, Geochemical","24378, 31666","Durfeld, Rudolf M.","Durfeld, Rudolf M.","Durfeld, Rudolf M.",,"Jurassic, Hogem Batholith, Duckling Creek Syenite Complex, Syenites, Granodiorites, Alaskites",56536.6,1.75,32306.628569999997,1.374,41147.45269,1.165,48529.27039,http://aris.empr.gov.bc.ca/search.asp?mode=repsum&rep_no=32441
27083,31960,1.0,2010/10/19,GEOL:GEOC:,65404,2010 Geological Assessment Report for the Chuchi Property,2011,2010.0,,2011-10-19,,2010/10/19,116,Chuchi,093N07E:,093N028:,55,17,51,124,32,22,10,6128977,402258,55.2975,-124.53944399999999,,,,PRG,3.0,OMIN:,Omineca,Omineca,"670367,<br>670364,<br>670327,<br>670324,<br>670283,<br>598777,<br>597879,<br>597878,<br>597976",,,"670367, 670364, 670327, 670324, 670283, 598777, 597879, 597878, 597976","Geological,<br>Geochemical","Geological, Geochemical","19719, 20612, 22034","Lutynski, Piotr","Lutynski, Piotr","Ledwon, Anastasia; Beck, Richard",,"Triassic, Chuchi Lake Formation, Chuchi Lake Succession, Volcaniclastic rocks, Sedimentary rocks, Basalts",66501.39,1.75,38000.79429,1.374,48399.847160000005,1.165,57082.7382,http://aris.empr.gov.bc.ca/search.asp?mode=repsum&rep_no=31960
27096,32157,1.0,2010/12/4,GEOC:,33418,Technical Report on the Mount Milligan North Property,2011,2010.0,,2011-12-04,,2010/12/4,60,Mount Milligan North,093N08E:,093N030:,55,15,8,124,8,22,10,6123451,427571,55.252221999999996,-124.139444,,,,PRG,3.0,OMIN:,Omineca,Omineca,679503,,,679503,Geochemical,Geochemical,"20859, 28007","Shirvani, Farshad","Shirvani, Farshad","Ostensoe, Erik A.",,"Triassic, Witch Lake Formation, Volcaniclastics, Basaltic andesites",67122.0,1.75,38355.42857,1.374,48851.52838,1.165,57615.450639999995,http://aris.empr.gov.bc.ca/search.asp?mode=repsum&rep_no=32157
27301,32106,1.0,2010/12/11,GEOC:,81234,"Data Compilation, Geological and Prospecting on the Thane Creek Property",2011,2010.0,,2011-12-11,,2010/12/11,509,Thane Creek,094C04E:,094C012:,56,9,30,125,36,43,10,6226774,337787,56.158333,-125.611944,,,,PRG,3.0,OMIN:,Omineca,Omineca,"684230,<br>684243,<br>688843,<br>688863,<br>688883,<br>688926,<br>689845","094C  010, 094C  016, 094C  017, 094C  048, 094C  072",,"684230, 684243, 688843, 688863, 688883, 688926, 689845",Geochemical,Geochemical,"04599, 17743, 21425, 21426, 29112","Naas, Christopher O.","Naas, Christopher O.","Naas, Christopher O.",,"Jurassic, Hogem Batholith, Quartz monzonites, Calc-alkaline volcanics",81838.4,1.75,46764.8,1.374,59562.15429,1.165,70247.55365,http://aris.empr.gov.bc.ca/search.asp?mode=repsum&rep_no=32106
27508,32790,1.0,2011/8/7,GEOP:PHYS:,63165,Geophysical Report on the Max-K2 Property,2010,2010.0,,2012-08-07,,2011/8/7,73,MAX-K2,093K16E:,093K100:,54,56,0,124,2,6,10,6087863,433684,54.933333,-124.035,CU:AU:,,,PRG,3.0,OMIN:,Omineca,Omineca,"532537,<br>532538,<br>532540","093K  020, 093K  086",,"532537, 532538, 532540","Geophysical,<br>Physical","Geophysical, Physical","21873, 21736, 20530, 31939, 31625, 29353","Blann, David","Hewett, Anthony James","Walcott, Peter E.","Copper, Gold","Takla Group, Basalts, Basalts, Argillites, Hornfels, Calc-silicates, Pyrite, Chalcopyrite, Calc-alkaline volcanics, Calc-alkaline volcanics",97350.0,1.709,56963.13634,1.3419999999999999,72540.98361,1.138,85544.81547,http://aris.empr.gov.bc.ca/search.asp?mode=repsum&rep_no=32790
27770,32110,1.0,2010/12/22,GEOP:,134061,Geophysical Report on the East and West Blackwater Gold Claims,2011,2010.0,,2011-12-22,,2010/12/22,82,Blackwater Gold,093F02E:,093F027:,53,14,42,124,43,30,10,5900914,384896,53.245,-124.725,,,,PRG,3.0,OMIN:,Omineca,Omineca,"694243,<br>694245,<br>694263-265,<br>694203-210,<br>694283-296",,,"694243, 694245, 694263-265, 694203-210, 694283-296",Geophysical,Geophysical,31772,RJK Explorations Ltd.,"Strickland, Derrick","Strickland, Derrick",,"Jurassic, Tertiary-Eocene, Naglico Formation, Ootsa Lake Group, Argillites, Tuffs, Siltstones",134061.44,1.75,76606.53714,1.374,97570.18922999999,1.165,115074.1974,http://aris.empr.gov.bc.ca/search.asp?mode=repsum&rep_no=32110
