,rep_no,cnf_prd,aff_dt,gwrk_typs,claim_val,title,rep_yr,wrk_yr,conf_ldate,conf_adate,aff_ndate,aff_adate,page_ct,prpty_nm,nts_maps,bcgs_maps,lat83_deg,lat83_min,lat83_sec,lon83_deg,lon83_min,lon83_sec,zone83,north83,east83,lat83,long83,com_cds,camp_cd,geo_sum,reg_geo,info_cls,mdiv_cds,mdiv_nmx,mdiv_nms,claim_nmx,minf_nox,camp_nm,claim_nms,gwrk_nmx,gwrk_nms,rel_ars,oper_nms,own_nms,auth_nms,com_nms,kwl_nms,MERG_SPENT,DOLL_INX,doll_86,CPIdex1992,doll_92,CPIdex2002,doll_02,URL
21943,36899,1.0,2018/1/4,GEOL:,13973,Highland Valley Project Geology,2018,2017.0,,2019-01-04,,2018/1/4,36,Highland Valley,092I07W:,092I036:,50,19,28,120,51,43,10,5576901,652191,50.324444,-120.861944,CU:MO:,18.0,,KAM,3.0,NICO:,Nicola,Nicola,"1041003,<br>1049016,<br>1049020","092ISE063, 092ISE093",Highland Valley Camp,"1041003, 1049016, 1049020",Geological,Geological,"00451, 00737, 00749, 00764, 04043, 04056, 07494, 14978, 22839, 24884, 25286, 25561, 26657, 29223, 36189","Maddin, C. Hugh (FMC 116570)","Maddin, C. Hugh (FMC 116570)","Goldsmith, Locke B. (FMC #109865)","Copper, Molybdenum/Molybdenite","Triassic, Nicola Group, Andesitic volcanics, Guichon Creek Batholith, Highland Valley Phase, Quartz diorites, Granodiorites, Chataway granodiorite, Chalcopyrite, Bornite, Chalcocite, Quartz monzonites",9354.84,1.926,4857.133956000001,1.514,6178.890357,1.284,7285.700935,http://aris.empr.gov.bc.ca/search.asp?mode=repsum&rep_no=36899
21960,36992,1.0,2017/7/5,GEOL:,6083,Highland Valley East Project,2017,2017.0,,2018-07-05,,2017/7/5,29,Highland Valley East,092I07W:,092I036:,50,19,23,120,49,26,10,5576817,654900,50.323056,-120.823889,CU:AU:,18.0,,KAM,3.0,NICO:,Nicola,Nicola,1041028,,Highland Valley Camp,1041028,Geological,Geological,34867,"Maddin, C. Hugh (FMC 116570)","Maddin, C. Hugh (FMC 116570)","Goldsmith, Locke B. (FMC #109865)","Copper, Gold","Triassic-Jurassic, Guichon Creek Batholith, Highland Valley Phase, Granodiorites",9444.27,1.875,5036.944,1.474,6407.238806,1.25,7555.416,http://aris.empr.gov.bc.ca/search.asp?mode=repsum&rep_no=36992
22062,36583,1.0,2017/1/2,GEOL:,17980,Highland Valley Project Geology,2017,2017.0,,2018-01-02,,2017/1/2,31,Highland Valley,092I07W:,092I036:,50,19,37,120,51,27,10,5577175,652500,50.326944,-120.8575,CU:MO:,18.0,,KAM,3.0,NICO:,Nicola,Nicola,"1041000,<br>1041003,<br>1041007",092ISE093,Highland Valley Camp,"1041000, 1041003, 1041007",Geological,Geological,"00451, 00737, 00749, 00764, 04043, 04056, 07494, 22839, 24884, 25286, 34867, 36189","Maddin, C. Hugh (FMC 116570)","Maddin, C. Hugh (FMC 116570)","Goldsmith, Locke B. (FMC #109865)","Copper, Molybdenum/Molybdenite","Triassic, Nicola Group, Andesitic volcanics, Guichon Creek Batholith, Highland Valley Phase, Chataway phase, Chataway granodiorite, Granodiorites, Quartz diorites, Triassic-Jurassic",12590.19,1.875,6714.768,1.474,8541.51289,1.25,10072.152,http://aris.empr.gov.bc.ca/search.asp?mode=repsum&rep_no=36583
22716,37323,1.0,2017/12/12,GEOC:,45163,Soil Sample Survey (2017) Spius Mineral Property,2017,2017.0,,2018-12-12,,2017/12/12,113,SPIUS,092H14W:,092H094:,49,55,5,121,16,6,10,5530957,624311,49.918056,-121.26833300000001,CU:MO:AU:AG:,,,KAM,3.0,NICO:NWES:,"Nicola,<br>New Westminster","Nicola, New Westminster","SPIUS15C,<br>SPIUS15B,<br>SPIUS15A,<br>SPIUS15D,<br>SPIUS16A,<br>SPIUS16B",092HNW027,,"SPIUS15C, SPIUS15B, SPIUS15A, SPIUS15D, SPIUS16A, SPIUS16B",Geochemical,Geochemical,"03052, 05389, 06145, 33913, 36631","Bried, Patricia","Bried, Bruce E.; Chapman, John Arthur (FMC 104633); Carlson, Gerald G.; Paul, Christopher Ryan (FMC 269478); Blady, Michael A. (FMC 278776)","Bried, Bruce E.; Chapman, John Arthur (FMC 104633)","Copper, Molybdenum/Molybdenite, Gold, Silver","Permian-Jurassic, Diorites, Cretaceous, Granites, Alkali-feldspar granites, Jurassic, Tonalites, Mount Lytton Complex, Eagle Granodiorite, Gneisses, Quartz veins, Feldspar porphyries, Gossans",32106.79,1.875,17123.62133,1.474,21782.082769999997,1.25,25685.432,http://aris.empr.gov.bc.ca/search.asp?mode=repsum&rep_no=37323
22907,37236,1.0,2017/10/30,PROS:,1876,NorthLP Mineral Prospect - Prospecting Report 2017,2017,2017.0,,2018-10-30,,2017/10/30,14,NorthLP,093L10E:,093L057:,54,32,7,126,44,45,9,6045417,645845,54.535278000000005,-126.745833,CU:ZN:PB:AU:AG:MO:,43.0,,SMI,3.0,OMIN:,Omineca,Omineca,NORTHLP,,Babine Range,NORTHLP,Prospecting,Prospecting,13761,"Merkley, Shawn","Merkley, Shawn","Merkley, Shawn","Copper, Zinc, Lead, Gold, Silver, Molybdenum/Molybdenite","Jurassic, Hazelton Group, Telkwa Formation, Calc-alkaline volcanics, Bowser Lake Group, Ashman Formation, Mudstones, Siltstones, Shales, Limestones",1927.0,1.875,1027.733333,1.474,1307.3270009999999,1.25,1541.6,http://aris.empr.gov.bc.ca/search.asp?mode=repsum&rep_no=37236
23133,37524,1.0,2018/4/18,GEOP:,3755,Geophysical Report on the Skip Mineral Property,2018,2017.0,,2019-04-18,,2018/4/18,26,Skip #1,093F15W:,093F096:,53,56,0,124,49,6,10,5977636,380625,53.933333,-124.81833300000001,MO:,,,PRG,3.0,OMIN:,Omineca,Omineca,574353,"093F  019, 093F  020",,574353,Geophysical,Geophysical,"24798, 28350, 29601, 32400, 33026, 33221, 34350, 34956, 35361, 01108","Bysouth, Garry D.; Kurz, Gary W.","Bysouth, Garry D.; Kurz, Gary W.","Bysouth, Garry D.",Molybdenum/Molybdenite,"Jurassic, Endako Batholith, Stag Lake Plutonic Suite, Quartz diorites, Polymetallic Veins, Molybdenite, Chalcopyrite, Sphalerite, Galena, Francois Lake Suite, Quartz monzonites, Monzogranites",3760.0,1.926,1952.2326059999998,1.514,2483.48745,1.284,2928.34891,http://aris.empr.gov.bc.ca/search.asp?mode=repsum&rep_no=37524
23392,37440,1.0,2018/2/5,GEOC:,2675,ROG Claim Rock Geochemistry,2018,2017.0,,2019-02-05,,2018/2/5,38,ROG,093F15W:,093F076:,53,46,8,124,51,18,10,5959405,377740,53.768889,-124.855,AU:AG:,,,PRG,3.0,OMIN:,Omineca,Omineca,1049816,093F  084,,1049816,Geochemical,Geochemical,32691,"Prior, Glen","Prior, Glen","Prior, Glen","Gold, Silver","Jurassic, Jurassic, Hazelton Group, Hazelton Group, Naglico Formation, Naglico Formation, Volcanic rocks, Volcanic rocks, Rhyolites, Rhyolites, Rhyodacites, Rhyodacites, Clay alteration, Silicification",5061.83,1.926,2628.156802,1.514,3343.348745,1.284,3942.2352020000003,http://aris.empr.gov.bc.ca/search.asp?mode=repsum&rep_no=37440
23488,37722,1.0,2018/8/10,PHYS:GEOC:,7398,Geochemical Sampling Report Bear Hill Project,2018,2017.0,,2019-08-10,,2018/8/10,84,Bear Hill,093M08E:,093M040:,55,22,0,126,2,6,9,6139597,687903,55.36666700000001,-126.035,CU:AG:AU:,,,PRG,3.0,OMIN:,Omineca,Omineca,"1039647,<br>1045980,<br>1064216",093M  137,,"1039647, 1045980, 1064216","Physical,<br>Geochemical","Physical, Geochemical","09892, 10790, 10791, 32026, 34072, 36496","Galambos, Kenneth D.","Galambos, Kenneth D.","Galambos, Kenneth D.","Copper, Silver, Gold","Cretaceous, Skeena Group, Felsic volcanics, Volcanic rocks, Sedimentary rocks, Rhyolite, Sustut Group, Tango Creek Formation, Conglomerate, Coarse Clastic Sedimentary Rocks, Disseminated, Chalcopyrite, Bornite, Chalcocite",5786.0,1.926,3004.153686,1.514,3821.664465,1.284,4506.23053,http://aris.empr.gov.bc.ca/search.asp?mode=repsum&rep_no=37722
23563,36897,1.0,2017/12/29,GEOP:GEOC:,8857,Geochemical & Geophysical Report on Km 26 Claims,2018,2017.0,,2018-12-29,,2017/12/29,56,Km 26,093K15E:,093K087:,54,49,48,124,43,35,10,6077240,389105,54.83,-124.72638899999998,NI:CR:CO:AU:,,,PRG,3.0,OMIN:,Omineca,Omineca,"NIC,<br>KM 26,<br>KM 26 B",,,"NIC, KM 26, KM 26 B","Geophysical,<br>Geochemical","Geophysical, Geochemical",33325,"Kikauka, Andris (FMC # 114051)","Kikauka, Andris (FMC # 114051)","Kikauka, Andris (FMC # 114051)","Nickel, Chromium/Chromite, Cobalt, Gold","Triassic-Jurassic, Tezzeron Sequence, Argillites, Greywackes, Wackes, Conglomerate turbidites, Permian-Jurassic, Cache Creek Complex, Sowchea Succession, Mudstones, Siltstones, Shales, Copley Limestone, Limestones, Marbles, Calcareous sedimentary rocks, Pinchi Fault, Serpentinites",6271.2,1.926,3256.074766,1.514,4142.140026,1.284,4884.11215,http://aris.empr.gov.bc.ca/search.asp?mode=repsum&rep_no=36897
23619,37441,1.0,2018/2/5,GEOL:GEOC:,2674,Angle Claim Geology and Rock Geochemistry,2018,2017.0,,2019-02-05,,2018/2/5,37,Angle,093F15W:,093F077:,53,47,22,124,46,2,10,5961540,383590,53.789443999999996,-124.767222,AU:,,,PRG,3.0,OMIN:,Omineca,Omineca,1049819,093F  072,,1049819,"Geological,<br>Geochemical","Geological, Geochemical","30909, 37370, 33581","Prior, Glen","Prior, Glen","Prior, Glen",Gold,"Jurassic, Endako Batholith, Francois Lake Suite, Glenannan subsuite, Quartz monzonites, Monzogranitic intrusives, Chalcopyrite",6652.51,1.926,3454.0550359999997,1.514,4393.996037,1.284,5181.082555,http://aris.empr.gov.bc.ca/search.asp?mode=repsum&rep_no=37441
23651,37445,1.0,2018/2/6,GEOC:,6423,SOL Claim Rock Geochemistry,2018,2017.0,,2019-02-06,,2018/2/6,57,SOL,094D09W:,094D059:,56,31,43,126,15,8,9,6268300,669000,56.528611,-126.252222,AU:AG:,,,PRG,3.0,OMIN:,Omineca,Omineca,1049872,"094D  013, 094D  138, 094D  178",,1049872,Geochemical,Geochemical,"10809, 14105","Prior, Glen","Prior, Glen",,"Gold, Silver","Triassic, Takla Group, Volcanic rocks, Jurassic, Quartz diorites, Stocks, Quartz veins, Pyrite, Galena, Native gold",6878.59,1.926,3571.4382140000002,1.514,4543.322325,1.284,5357.157321,http://aris.empr.gov.bc.ca/search.asp?mode=repsum&rep_no=37445
23764,36721,1.0,2017/2/26,GEOP:,7320,Radioactivity Survey,2017,2017.0,,2018-02-26,,2017/2/26,44,Bisson,093O12W:,093O051:,55,32,56,123,58,18,10,6156303,438696,55.548889,-123.971667,RE:,,,PRG,3.0,OMIN:,Omineca,Omineca,1042379,093O  059,,1042379,Geophysical,Geophysical,"32770, 28877","Prior, Glen","Prior, Glen","Prior, Glen",Rhenium,"Cretaceous-Tertiary, Wolverine Range Plutonic Suite, Granodiorites, Gneisses, Pegmatites, Orthogneisses, Allanite",7370.28,1.875,3930.816,1.474,5000.189959,1.25,5896.224,http://aris.empr.gov.bc.ca/search.asp?mode=repsum&rep_no=36721
23776,36808,1.0,2017/11/27,GEOP:,7459,Geophysical Report,2017,2017.0,,2018-11-27,,2017/11/27,32,Carlson,103I09W:,103I079:,54,42,59,128,21,36,9,6063420,541228,54.716389,-128.36,MO:CU:AG:AU:,,,SMI,3.0,OMIN:,Omineca,Omineca,carlson,"103I  233, 103I  234, 103I  252, 103I  255",,carlson,Geophysical,Geophysical,"27233, 27499, 27817, 28109, 30257, 32186, 33429, 34602, 35252, 35951, 32967, 36389","Kurz, Gary W.","Bysouth, Garry D.; Kurz, Gary W.","Bysouth, Garry D.","Molybdenum/Molybdenite, Copper, Silver, Gold","Jurassic, Hazelton Group, Cretaceous-Paleogene, Quartz diorites, Kitselas Volcanics, Eocene, Carpenter Creek Putonic Suite, Granites, Granodiorites, Greenstones, Quartz carbonate veins, Quartz veins, Quartz-carbonate veins, Pyrite, Molybdenite, Chalcopyrite, Malachite, Magnetite",7463.0,1.875,3980.2666670000003,1.474,5063.093623,1.25,5970.4,http://aris.empr.gov.bc.ca/search.asp?mode=repsum&rep_no=36808
23800,37159,1.0,2017/10/1,GEOC:,3620,"2017 Geochemical Sampling, Prospecting and Hand Trenching Report on the Yellow Moose Property",2017,2017.0,,2018-10-01,,2017/10/1,26,Yellow Moose,093F05W:,093F041:,53,29,0,125,56,6,10,5930050,305263,53.483332999999995,-125.935,AU:AG:,,,PRG,3.0,OMIN:,Omineca,Omineca,"EM WEST,<br>1048568",093F  058,,"EM WEST, 1048568",Geochemical,Geochemical,"18191, 23099, 23387, 23748, 24265, 24766, 36657","Kreft, John Bernard (FMC #114661)","Kreft, John Bernard (FMC #114661)","Kreft, John Bernard (FMC #114661)","Gold, Silver","Eocene-Oligocene, Nechacko Plateau Group, Ootsa Lake Formation, Endako Group, Basaltic volcanics, Rhyolites, Tuffs, Clay alteration, Silicification, Arsenopyrite, Pyrite, Stibnite",7632.21,1.875,4070.512,1.474,5177.890095000001,1.25,6105.768,http://aris.empr.gov.bc.ca/search.asp?mode=repsum&rep_no=37159
23905,37656,1.0,2018/4/28,GEOP:,11557,An Assessment Report on a Heliborne Magnetic Survey,2018,2017.0,,2019-04-28,,2018/4/28,30,Stock,093L11W:,093L063:,54,41,40,127,27,24,9,6061884,599470,54.694444,-127.456667,CU:AG:AU:,42.0,,SMI,3.0,OMIN:,Omineca,Omineca,"1044008,<br>1044009,<br>1044010,<br>1047281","093L  085, 093L  084",Telkwa Range,"1044008, 1044009, 1044010, 1047281",Geophysical,Geophysical,"34037, 34841, 35111, 36947","Billingsley, Richard John","Billingsley, Richard John","Walcott, Peter E.; Walcott, Alexander","Copper, Silver, Gold","Jurassic, Hazelton Group, Eagle Peak Formation, Volcaniclastics, Telkwa Formation, Calc-alkaline volcanics, Cretaceous, Bulkley Plutonic Suite, Intrusive rocks, Volcanics, Copper, Gold, Silver, Chalcopyrite, Pyrite",8350.0,1.926,4335.410177000001,1.514,5515.191546,1.284,6503.115264999999,http://aris.empr.gov.bc.ca/search.asp?mode=repsum&rep_no=37656
24062,37634,1.0,2018/2/2,GEOP:,13413,An Assessment Report on a Heliborne Magnetic Survey,2018,2017.0,,2019-02-02,,2018/2/2,27,Serb,093L12W:,093L062:,54,38,49,127,45,34,9,6056212,580050,54.646944,-127.75944399999999,MO:CU:PB:ZN:,42.0,,SMI,3.0,OMIN:,Omineca,Omineca,"1050150,<br>1050151,<br>1053550,<br>1053551",093L  083,Telkwa Range,"1050150, 1050151, 1053550, 1053551",Geophysical,Geophysical,"05762, 31701, 32475","Billingsley, Richard John","Billingsley, Richard John","Walcott, Peter E.; Walcott, Alexander","Molybdenum/Molybdenite, Copper, Lead, Zinc","Jurassic, Hazelton Group, Telkwa Formation, Calc-alkaline volcanics, Nanika Plutonic Suite, Intrusive rocks, Molybdenum, Copper, Biotite, Granite, Stockwork",9455.0,1.926,4909.13811,1.514,6245.046235,1.284,7363.707165000001,http://aris.empr.gov.bc.ca/search.asp?mode=repsum&rep_no=37634
24078,37300,1.0,2017/11/28,GEOC:,9942,2017 Geochemical Sampling and Prospecting Report on the Uduk Epi Property,2017,2017.0,,2018-11-28,,2017/11/28,27,Uduk Epi,093E01E:,093E010:,53,36,0,126,0,6,9,5943199,698392,53.6,-126.001667,AU:AG:,,,SMI,3.0,OMIN:,Omineca,Omineca,"UDUK,<br>Uduk Perim South",093F  057,,"UDUK, Uduk Perim South",Geochemical,Geochemical,"14557, 35644","Kreft, John Bernard (FMC #114661)","Kreft, John Bernard (FMC #114661)","Kreft, John Bernard (FMC #114661)","Gold, Silver","Eocene, Ootsa Lake Group, Rhyolites, Silicification, Brecciation, Argillic alteration",9326.1,1.875,4973.92,1.474,6327.0691990000005,1.25,7460.88,http://aris.empr.gov.bc.ca/search.asp?mode=repsum&rep_no=37300
24134,37160,1.0,2017/10/1,GEOC:,11677,2017 Geochemical Sampling and Prospecting Report on the Wasi-Davies Property,2017,2017.0,,2018-10-01,,2017/10/1,33,Wasi-Davies,094C02W:,094C016:,56,8,0,124,54,6,10,6222548,381814,56.13333299999999,-124.90166699999999,ZN:PB:AG:,,,PRG,3.0,OMIN:,Omineca,Omineca,"1043222,<br>1043230,<br>1052771,<br>1052272","094C  031, 094C  032, 094C  033, 094C  129, 094C  161",,"1043222, 1043230, 1052771, 1052272",Geochemical,Geochemical,"01654, 05937, 06485, 08324, 23095","Kreft, John Bernard (FMC #114661)","Kreft, John Bernard (FMC #114661)","Kreft, John Bernard (FMC #114661); Kreft, Jarrett","Zinc, Lead, Silver","Ordovician-Devonian, Echo Lake Group, Dolomitic carbonate rocks, Cambrian-Ordovician, Razorback Group, Limestones, Slates, Siltstones, Argillites, Devonian, Otter Lakes Group, Marbles, Calcareous sedimentary rocks, Sphalerite, Galena, Pyrite, Chalcopyrite, Bornite, Devonian-Permian, Big Creek Group, Shales, Mudstones",9610.21,1.875,5125.445333,1.474,6519.816825,1.25,7688.168000000001,http://aris.empr.gov.bc.ca/search.asp?mode=repsum&rep_no=37160
24233,37156,1.0,2017/9/28,DRIL:GEOC:,9416,HD Mineral Prospect Diamond Drilling & Soil Geochemistry 2017,2017,2017.0,,2018-09-28,,2017/9/28,33,HD,093L07E:,093L047:,54,26,19,126,39,46,9,6034839,651575,54.438611,-126.662778,ZN:CU:PB:AU:AG:MO:,43.0,,SMI,3.0,OMIN:,Omineca,Omineca,516488,093L  205,Babine Range,516488,"Drilling,<br>Geochemical","Drilling, Geochemical","09849, 14157, 18360, 18864, 18911, 23232, 25891, 26288, 26577, 26887, 27195, 27810, 28456, 29129, 29567, 30313, 31324, 31645, 33073, 33847, 34495, 35997","Merkley, Daniel M.","Moll, John Wesley (FMC# 118694); Merkley, Daniel M.; Merkley, William R.","Merkley, Daniel M.","Zinc, Copper, Lead, Gold, Silver, Molybdenum/Molybdenite","Jurassic, Hazelton Group, Telkwa Formation, Calc-alkaline volcanics, Quartz Feldspar Porphyries, Andesites, Rhyolites, Basalts, Tuffs, Sphalerite, Chalcopyrite, Galena, Quartz carbonate veins",10130.0,1.875,5402.666667,1.474,6872.455902,1.25,8104.0,http://aris.empr.gov.bc.ca/search.asp?mode=repsum&rep_no=37156
24382,37126,1.0,2017/9/15,PROS:GEOC:,14007,2017 Prospecting Program on the Apex Property,2018,2017.0,,2018-09-15,,2017/9/15,69,Apex,082E05W:,082E031:,49,21,35,119,54,39,11,5471521,288645,49.359722,-119.91083300000001,AU:,11.0,,KAM,3.0,OMIN:,Omineca,Omineca,"HMMM...,<br>APOA SELECTION PROCESS,<br>MIDDLE MUDDLE,<br>BUNGLE IN THE FUMBLE,<br>AUSTRALIAN MC",,Hedley Camp,"HMMM..., APOA SELECTION PROCESS, MIDDLE MUDDLE, BUNGLE IN THE FUMBLE, AUSTRALIAN MC","Prospecting,<br>Geochemical","Prospecting, Geochemical","01044, 09473, 10926, 11954, 12583, 12783, 36192","Greig, Charles J. (FMC #143767)","Greig, Charles J. (FMC #143767)","Rowe, Jeffrey D.",Gold,"Triassic, Independence Formation, Marine sedimentary and volcanic rocks, Apex Mountain Group, Greenschists, Greenstones, Volcanics, Jurassic, Okanagan Batholith, Granodiorites, Permian-Triassic, Shoemaker Formation, Cherts, Siliceous argillites, Siliclastic rocks, Skarns, Pyrrhotite, Marbles, Tuffs, Apex Mountain Complex",11350.0,1.926,5893.042575,1.514,7496.6974900000005,1.284,8839.563863,http://aris.empr.gov.bc.ca/search.asp?mode=repsum&rep_no=37126
24567,37792,1.0,2018/8/31,GEOC:,24480,Geochemical Sampling Report,2018,2017.0,,2019-08-31,,2018/8/31,83,Morrison West Property,093M08W:,093M028:,55,15,13,126,26,7,9,6126012,663006,55.253611,-126.435278,CU:AU:MO:AG:,44.0,,SMI,3.0,OMIN:,Omineca,Omineca,1049185,,Babine Porphyry,1049185,Geochemical,Geochemical,"01070, 33770, 34344, 35544, 36500","Galambos, Kenneth D.","Galambos, Kenneth D.","Galambos, Kenneth D.","Copper, Gold, Molybdenum/Molybdenite, Silver","Jurassic, Hazelton Group, Smithers Formation, Marine sedimentary and volcanic rocks, Cretaceous, Skeena Group, Rocky Ridge Formation, Rhyolite, Felsic volcanics, Dome, Kitsuns Creek Formation, Sedimentary rocks, Potassic alteration, Argillic alteration, Pyrite, Chalcopyrite, Gold, Silver",12725.35,1.926,6607.139147999999,1.514,8405.11889,1.284,9910.708723,http://aris.empr.gov.bc.ca/search.asp?mode=repsum&rep_no=37792
24632,37152,1.0,2017/9/26,GEOP:,14271,An Assessment Report on Airborne Magnetic Surveying Buck Property,2018,2017.0,,2018-09-26,,2017/9/26,38,Buck,093L07E:,093L037:,54,18,16,126,37,4,9,6020000,655000,54.304444,-126.617778,AU:CU:,,,SMI,3.0,OMIN:,Omineca,Omineca,"1054639,<br>1054640,<br>1054641,<br>NEW BUCK 1,<br>NEW BUCK 2",093L  009,,"1054639, 1054640, 1054641, NEW BUCK 1, NEW BUCK 2",Geophysical,Geophysical,"06304, 06484, 06737, 06912, 10166, 11976, 13425, 14698, 18665, 18666, 19229, 19889, 27423, 27716, 33176, 36452, 36298, 36463, 36531, 36575","Billingsley, Richard John","Billingsley, Richard John","Walcott, Peter E.; Walcott, Alexander","Gold, Copper","Jurassic, Hazelton Group, Telkwa Formation, Calc-alkaline volcanics, Cretaceous, Kasalka Group, Andesitic volcanics, Skeena Group, Kitsuns Creek Formation, Coarse Clastic Sedimentary Rocks, Bulkley Plutonic Suite, Intrusive rocks, Eocene, Endako Group, Buck Creek Formation, Basaltic volcanic rocks, Breccia, Gold, Silver, Copper",13337.5,1.926,6924.974039,1.514,8809.445178,1.284,10387.46106,http://aris.empr.gov.bc.ca/search.asp?mode=repsum&rep_no=37152
24786,37388,1.0,2018/1/3,GEOC:,20323,Soil Geochemical Survey of the Babine Property,2018,2017.0,,2019-01-03,,2018/1/3,48,Babine,093M01E:,093M010:,55,5,0,126,11,6,9,6107685,679673,55.083332999999996,-126.185,CU:MO:AG:ZN:FE:AU:,44.0,,SMI,3.0,OMIN:,Omineca,Omineca,BABINE 5,"093M  003, 093M  160, 093M  198",Babine Porphyry,BABINE 5,Geochemical,Geochemical,"00976, 02524, 03261, 20415, 21106, 25401, 29629, 30720, 31469, 32339, 33139, 33643, 33939, 36690","Menard, Rolland J.","Menard, Rolland J.","Ledwon, Anastasia","Copper, Molybdenum/Molybdenite, Silver, Zinc, Iron, Gold","Jurassic, Hazelton Group, Smithers Formation, Marine sediments, Cretaceous, Skeena Group, Saddle Hill Formation, Cretaceous-Eocene, Diorites, Conglomerates, Volcanic rocks, Chalcopyrite, Bornite, Magnetite",14438.85,1.926,7496.806854,1.514,9536.889036,1.284,11245.21028,http://aris.empr.gov.bc.ca/search.asp?mode=repsum&rep_no=37388
24829,36575,1.0,2016/12/28,GEOL:GEOC:,18424,Geological and Geochemical Assessment Report,2017,2017.0,,2017-12-28,,2016/12/28,64,Buck,093L07E:,093L037:,54,18,20,126,38,25,9,6020087,653530,54.305556,-126.64027800000001,AU:AG:ZN:,,,SMI,3.0,OMIN:,Omineca,Omineca,"1045597,<br>1045609","093L  005, 093L  009",,"1045597, 1045609","Geological,<br>Geochemical","Geological, Geochemical","02367, 06304, 06484, 06737, 06912, 10166, 11976, 13425, 14698, 18665, 18666, 19229, 19879, 19883, 19889, 27423, 27716, 36298, 36452, 36463, 36531","Billingsley, Richard John","Billingsley, Richard John","Sookochoff, Laurence","Gold, Silver, Zinc","Jurassic, Hazelton Group, Cretaceous, Skeena Group, Kitsuns Creek Formation, Conglomerates, Telkwa Formation, Calc-alkaline volcanics, Kasalka Group, Andesitic volcanics, Bulkley Plutonic Suite, Buck Creek Formation, Basaltic volcanics",14409.09,1.875,7684.848000000001,1.474,9775.502035,1.25,11527.271999999999,http://aris.empr.gov.bc.ca/search.asp?mode=repsum&rep_no=36575
24842,36946,1.0,2017/5/29,GEOL:GEOC:,14502,2017 Technical Assessment Report on Geochemical and Biogeochemical Sampling for the Nak Property,2017,2017.0,,2018-05-29,,2017/5/29,49,Nak,093M08E:,093M029:,55,16,12,126,13,44,9,6128337,676048,55.27,-126.228889,AU:AG:CU:MO:PB:ZN:,44.0,,SMI,3.0,OMIN:,Omineca,Omineca,1044650,093M  010,Babine Porphyry,1044650,"Geological,<br>Geochemical","Geological, Geochemical","01198, 23358, 23848, 24273, 24928, 29855, 30986, 31285, 32356, 34934, 36172","Kreft, John Bernard (FMC #114661)","Kreft, John Bernard (FMC #114661)","Beck, Richard","Gold, Silver, Copper, Molybdenum/Molybdenite, Lead, Zinc","Jurassic, Bowser Lake Group, Trout Creek Formation, Conglomerates, Coarse Clastic Sedimentary Rocks, Hazelton Group, Telkwa Formation, Basaltic volcanic rocks, Eocene, Babine Plutonic Suite, Quartz diorites, Granodiorites, Cretaceous-Eocene, Diorites, Hornfels, Chalcopyrite, Pyrite, Bornite",14542.0,1.875,7755.733333,1.474,9865.671642,1.25,11633.6,http://aris.empr.gov.bc.ca/search.asp?mode=repsum&rep_no=36946
24874,37430,1.0,2018/2/14,DRIL:GEOC:,19985,Assessment Report for the 2017 Diamond Drilling Program for the China Knows Mineral Claims,2018,2017.0,,2019-02-14,,2018/2/14,20,China Knows,093L08W:,093L049:,54,26,53,126,24,0,9,6036487,668575,54.44805600000001,-126.4,CU:AU:AG:PB:ZN:,43.0,,SMI,3.0,OMIN:,Omineca,Omineca,CHINA KNOWS,"093L  059, 093L  245, 093L  246, 093L  247, 093L  344",Babine Range,CHINA KNOWS,"Drilling,<br>Geochemical","Drilling, Geochemical","05288, 06427, 11504, 15408, 15489, 17154, 18519, 29986, 30292, 31181, 33185, 33427, 34833, 34919, 36181","Moll, John Wesley (FMC# 118694)","Moll, John Wesley (FMC# 118694)","Moll, John Wesley (FMC# 118694)","Copper, Gold, Silver, Lead, Zinc","Jurassic, Hazelton Group, Telkwa Formation, Calc-alkaline volcanics, Eocene, Endako Group, Buck Creek Formation, Basaltic volcanic rocks, Goosly Lake Formation, Alkaline Volcanic Rocks, Quartz Feldspar Porphyries, Mafic tuffs, Lapilli tuffs",15182.0,1.926,7882.658359,1.514,10027.74108,1.284,11823.98754,http://aris.empr.gov.bc.ca/search.asp?mode=repsum&rep_no=37430
25510,37003,1.0,2017/7/16,GEOC:,30491,Geochemical Sampling Report Babs Property - 2017,2017,2017.0,,2018-07-16,,2017/7/16,110,Babs,093L16E:,093L090:,54,51,48,126,1,26,9,6083654,690997,54.863333,-126.02388899999998,CU:AU:MO:AG:,43.0,,SMI,3.0,OMIN:,Omineca,Omineca,"1053127,<br>1052251,<br>1052394,<br>1052786","093L  325, 093L  342",Babine Range,"1053127, 1052251, 1052394, 1052786",Geochemical,Geochemical,"01218, 22788, 23261, 23536, 23589, 24560, 33253, 33911","Galambos, Kenneth D.","Galambos, Kenneth D.","Galambos, Kenneth D.","Copper, Gold, Molybdenum/Molybdenite, Silver","Jurassic, Spike Peak Intrusive Suite, Quartz monzonites, Granodiorites, Rhyolites, Potassic alteration, Triassic-Jurassic",21772.0,1.875,11611.73333,1.474,14770.691990000001,1.25,17417.6,http://aris.empr.gov.bc.ca/search.asp?mode=repsum&rep_no=37003
25678,37145,1.0,2017/9/20,GEOC:,18833,Assessment Report on the Kilometer 26 Project,2017,2017.0,,2018-09-20,,2017/9/20,19,KM 26 (Fort St James Nickel),093K15E:,093K087:,54,51,16,124,44,41,10,6080000,388000,54.854443999999994,-124.744722,NI:AU:,,,PRG,3.0,OMIN:,Omineca,Omineca,"26 KM,<br>KM 26 (D),<br>649203,<br>MOE34567,<br>FORT ST JAMES NEW",093K  113,,"26 KM, KM 26 (D), 649203, MOE34567, FORT ST JAMES NEW",Geochemical,Geochemical,"32864, 36897, 33325, 31877, 31433, 12295, 14926",Fort St. James Nickel,Fort St. James Nickel,"Delong, R.C. (Cam)","Nickel, Gold","Permian-Jurassic, Cache Creek Complex, Sowchea Succession, Mudstones, Siltstones, Shales, Fine Clastic Sedimentary Rocks, Copley Limestone, Limestones, Marbles, Calcareous sedimentary rocks, Triassic-Jurassic, Tezzeron Sequence, Argillites, Wackes, Greywackes, Conglomerate turbidites, Triassic, Takla Group, Inzana Lake Formation, Sedimentary rocks, Jurassic, Endako Batholith, Stag Lake Plutonic Suite, Quartz diorites, Intrusive rocks, Gabbros, Pinchi Fault, Awaruite, Pentlandite",24055.0,1.875,12829.33333,1.474,16319.538669999998,1.25,19244.0,http://aris.empr.gov.bc.ca/search.asp?mode=repsum&rep_no=37145
