,rep_no,cnf_prd,aff_dt,gwrk_typs,claim_val,title,rep_yr,wrk_yr,conf_ldate,conf_adate,aff_ndate,aff_adate,page_ct,prpty_nm,nts_maps,bcgs_maps,lat83_deg,lat83_min,lat83_sec,lon83_deg,lon83_min,lon83_sec,zone83,north83,east83,lat83,long83,com_cds,camp_cd,geo_sum,reg_geo,info_cls,mdiv_cds,mdiv_nmx,mdiv_nms,claim_nmx,minf_nox,camp_nm,claim_nms,gwrk_nmx,gwrk_nms,rel_ars,oper_nms,own_nms,auth_nms,com_nms,kwl_nms,MERG_SPENT,DOLL_INX,doll_86,CPIdex1992,doll_92,CPIdex2002,doll_02,URL
208,25749,1.0,1998/11/9,GEOC:,2000,Geochemical Report on Scrutor Property,1998,1998.0,,1999-11-09,,1998/11/9,17,Scrutor,092L03E:,092L015,50,8,29,127,1,6,9,5556231,641598,50.141389000000004,-127.01833300000001,AU:AG:CU:,29.0,,VAN,3.0,ALBI:,Alberni,Alberni,Scrutor,092L  100,Zeballos - Kyuquot Area,Scrutor,Geochemical,Geochemical,"14618, 15562, 17134",Rex Ventures Ltd.,"Heyman, David A.","McCrossan, Ed","Gold, Silver, Copper","Jurassic, Bonanza Group, Andesitic tuffs, Siltstones, Shear zones, Pyrite",4120.0,1.4,2942.857143,1.1,3745.4545450000005,0.934,4411.134904,http://aris.empr.gov.bc.ca/search.asp?mode=repsum&rep_no=25749
1606,25725,1.0,1998/8/21,GEOL:GEOC:,22400,Geology and Hydrothermal Alteration Mineralogy of the Thorn Prospect,1998,1998.0,,1999-08-21,,1998/8/21,68,Thorn,104K10W:,104K057:,58,33,59,132,48,7,8,6493864,627853,58.566389,-132.801944,AU:CU:AG:,,,SMI,3.0,ATLN:,Atlin,Atlin,"Check-Mate,<br>Stuart 1-3","104K  018, 104K  031, 104K  116",,"Check-Mate, Stuart 1-3","Geological,<br>Geochemical","Geological, Geochemical","02512, 10243, 11923, 15897",Kohima Pacific Gold Corp.; Almaden Resources Corp.,"Aspinall, Nicholas Clive","Poliquin, J. Duane; Poliquin, Morgan","Gold, Copper, Silver","Triassic, Stuhini Group, Rhyolites, Porphyritic andesites, Quartz feldspar porphyry, Enargite, Pyrite, Brecciation",18648.27,1.4,13320.19286,1.1,16952.97273,0.934,19966.02784,http://aris.empr.gov.bc.ca/search.asp?mode=repsum&rep_no=25725
2462,25752,1.0,1998/9/8,PROS:,2400,"Geological, Geochemical Report on the Big Gulp 1 and 2 Property (Frank Creek Project)",1998,1998.0,,1999-09-08,,1998/9/8,14,Big Gulp,093A11W:,093A074:,52,43,47,121,23,25,10,5843420,608699,52.729721999999995,-121.39027800000001,AU:AG:CU:ZN:PB:,38.0,,PRG,4.0,CBOO:,Cariboo,Cariboo,Jess 1-3,,Cariboo - Barkerville Camp,Jess 1-3,Prospecting,Prospecting,,Barker Minerals Ltd.,"Doyle, Louis E.","Doyle, Louis E.","Gold, Silver, Copper, Zinc, Lead","Barkerville Terrane, Downey Succession, Metavolcanics",2452.75,1.4,1751.964286,1.1,2229.772727,0.934,2626.070664,http://aris.empr.gov.bc.ca/search.asp?mode=repsum&rep_no=25752
2555,25703,1.0,1998/10/27,GEOC:,4000,Assessment Report (Sampling a Paleoplacer Deposit) on the Hobson Property,1998,1998.0,,1999-10-27,,1998/10/27,13,Hobson,093A06W:,093A033,52,23,0,121,25,5,10,5804853,607668,52.383333,-121.418056,AU:,,,KAM,3.0,CBOO:,Cariboo,Cariboo,Hob 4,093A  042,,Hob 4,Geochemical,Geochemical,,J.D. Graham & Assoc. Ltd.,"Ashton, J.M.; Graham, John Donald","Graham, John Donald",Gold,"Tuffs, Tertiary, Gravels, Paleochannels",3082.0,1.4,2201.428571,1.1,2801.818182,0.934,3299.785867,http://aris.empr.gov.bc.ca/search.asp?mode=repsum&rep_no=25703
2837,25979,1.0,1999/5/13,GEOC:,3200,Geochemical Report on the Tuk Property,1999,1998.0,,2000-05-13,,1999/5/13,34,Tuk,093A02E:,093A007,52,0,25,120,37,1,10,5764492,663561,52.006944,-120.61694399999999,,36.0,,KAM,3.0,CBOO:,Cariboo,Cariboo,"Tuk 10-11,<br>Tuk 14",,Cariboo - Quesnel Belt,"Tuk 10-11, Tuk 14",Geochemical,Geochemical,,Mandalay Resources Corporation,"Jakubik, Juraj","Adamec, J. Duro",,"Porphyritic andesites, Argillites, Shales",5450.0,1.416,3848.870056,1.112,4901.079137,0.9440000000000001,5773.305085,http://aris.empr.gov.bc.ca/search.asp?mode=repsum&rep_no=25979
3009,25867,1.0,1998/11/27,GEOL:GEOC:,8400,Summary Report on the Redgold Porphyry Copper Gold Project,1999,1998.0,,1999-11-27,,1998/11/27,41,Redgold,093A06W:,093A043:,52,28,0,121,28,5,10,5814048,604069,52.466667,-121.468056,,36.0,,PRG,3.0,CBOO:,Cariboo,Cariboo,Shik 3-6,093A  058,Cariboo - Quesnel Belt,Shik 3-6,"Geological,<br>Geochemical","Geological, Geochemical","04557, 04601, 05540, 08260, 11297, 11623, 12584, 12694, 13355, 13804, 14009, 14870, 16093, 17645, 18837, 19803, 20930, 22104, 23771, 24630, 24865",Redgold Resources  Ltd.,"Morton, James W. (Bill) . (FMC# 118981); Durfeld, Rudolf M.","Morton, James W. (Bill) . (FMC# 118981); Durfeld, Rudolf M.",,"Triassic-Jurassic, Nicola Group, Shiko Stock, Basalts, Breccias, Conglomerates, Chalcopyrite, Pyrite, Bornite",6790.2,1.416,4795.338983,1.112,6106.294964,0.9440000000000001,7193.008475,http://aris.empr.gov.bc.ca/search.asp?mode=repsum&rep_no=25867
3647,25935,1.0,1999/6/6,PROS:,14800,Prospecting Report on the Ledge Property,1999,1998.0,,2000-06-06,,1999/6/6,30,Ledge,093A02E:,093A007,52,2,0,120,37,5,10,5767424,663389,52.033333,-120.61805600000001,,36.0,,KAM,3.0,CBOO:,Cariboo,Cariboo,Ledge 2-6,,Cariboo - Quesnel Belt,Ledge 2-6,Prospecting,Prospecting,,Mandalay Resources Corporation,"Ridley, David W. (FMC 122739)","Adamec, J. Duro",,"Triassic-Jurassic, Augite porphyry flows, Andesites, Argillites, Shales, Phyllites, Quartz diorites",14800.0,1.416,10451.9774,1.112,13309.35252,0.9440000000000001,15677.9661,http://aris.empr.gov.bc.ca/search.asp?mode=repsum&rep_no=25935
3890,25800,1.0,1998/10/19,GEOP:GEOL:PHYS:GEOC:,1200,Assessment Report on the Art Property,1998,1998.0,,1999-10-19,,1998/10/19,42,Art,093A02E:092P15E:,093A007,52,0,0,120,37,5,10,5763717,663510,52.0,-120.61805600000001,,,,KAM,3.0,CBOO:,Cariboo,Cariboo,Art 1-4,,,Art 1-4,"Geophysical,<br>Geological,<br>Physical,<br>Geochemical","Geophysical, Geological, Physical, Geochemical",,Mandalay Resources Corporation,"Ridley, David W. (FMC 122739)","Adamec, J. Duro",,"Permian, Amphibolites, Gabbros, Norites, Serpentinites, Andesites",20000.0,1.4,14285.71429,1.1,18181.818180000002,0.934,21413.27623,http://aris.empr.gov.bc.ca/search.asp?mode=repsum&rep_no=25800
4002,25888,1.0,1999/2/3,GEOC:,22400,Geochemical and Geological Report on the Dominion Creek Property,1999,1998.0,,2000-02-03,,1999/2/3,38,Dominion Creek,093H06E:093H07W:,093H044,53,27,0,121,16,17,10,5923722,614793,53.45,-121.27138899999999,AU:AG:PB:ZN:,,,PRG,3.0,CBOO:,Cariboo,Cariboo,"AK I - IV,<br>AK 7,<br>AK 9-14",093H  133,,"AK I - IV, AK 7, AK 9-14",Geochemical,Geochemical,"16549, 17599, 17612, 18035",Gold City Industries Ltd.,"Raven, Alan R.","Raven, Alan R.","Gold, Silver, Lead, Zinc","Isaac Formation, Cunningham Formation, Phyllites, Argillites",23235.13,1.416,16408.99011,1.112,20894.90108,0.9440000000000001,24613.48517,http://aris.empr.gov.bc.ca/search.asp?mode=repsum&rep_no=25888
4573,26019,1.0,1999/7/8,GEOL:PHYS:GEOP:GEOC:,4800,Geochemical and Geophysical Report on the Ledge Property,1999,1998.0,,2000-07-08,,1999/7/8,53,Ledge,093A02E:,093A008,52,0,39,120,35,5,10,5764997,665758,52.010833,-120.584722,AU:AG:ZN:PB:CU:,,,KAM,3.0,CBOO:,Cariboo,Cariboo,DL 1-8,093A  089,,DL 1-8,"Geological,<br>Physical,<br>Geophysical,<br>Geochemical","Geological, Physical, Geophysical, Geochemical","17646, 22460, 23201",Mandalay Resources Corporation,"Ridley, David W. (FMC 122739)","Christopher, Peter A.","Gold, Silver, Zinc, Lead, Copper","Triassic, Cariboo Group, Phyllites, Auriferous quartz veins",56042.78,1.416,39578.23446,1.112,50398.18345,0.9440000000000001,59367.351689999996,http://aris.empr.gov.bc.ca/search.asp?mode=repsum&rep_no=26019
5479,25650,1.0,1998/5/25,GEOL:,1800,Assessment Report on Cyan Claim,1998,1998.0,,1999-05-25,,1998/5/25,22,Cyan,092P14W:,092P094:,51,55,30,121,17,5,10,5754087,617947,51.925,-121.284722,CU:AU:,36.0,,KAM,3.0,CLIN:,Clinton,Clinton,Cyan,,Cariboo - Quesnel Belt,Cyan,Geological,Geological,23517,Norian Resources Corp.,"Blann, David","Blann, David","Copper, Gold","Triassic-Jurassic, Nicola Group, Monzonites, Breccias",4580.0,1.4,3271.428571,1.1,4163.636364,0.934,4903.640257,http://aris.empr.gov.bc.ca/search.asp?mode=repsum&rep_no=25650
5996,25844,1.0,1999/1/8,DRIL:GEOL:PHYS:GEOC:,25200,Assessment Report on the Red Property,1999,1998.0,,2000-01-08,,1999/1/8,34,Red,092P14W:,092P094,51,57,0,121,23,5,10,5756709,611010,51.95,-121.384722,CU:AU:AG:,36.0,,KAM,3.0,CLIN:,Clinton,Clinton,"Red 1-2,<br>Red 4",,Cariboo - Quesnel Belt,"Red 1-2, Red 4","Drilling,<br>Geological,<br>Physical,<br>Geochemical","Drilling, Geological, Physical, Geochemical","18589, 22203, 23310, 24391",Norian Resources Corp.,"Blann, David","Blann, David","Copper, Gold, Silver","Triassic-Jurassic, Nicola Group, Takomkane Batholith, Volcanic breccias, Volcanic conglomerates, Argillites, Siltstones, Native copper, Chalcocite",27992.0,1.416,19768.36158,1.112,25172.66187,0.9440000000000001,29652.54237,http://aris.empr.gov.bc.ca/search.asp?mode=repsum&rep_no=25844
6476,25639,1.0,1998/6/8,PROS:,800,Prospecting Report for the Blackfoot Claims,1998,1998.0,,1999-06-08,,1998/6/8,37,Blackfoot,082G14W:,082G094,49,58,24,115,17,4,11,5537076,623014,49.973333000000004,-115.284444,DI:,,,CRA,4.0,FORT:,Fort Steele,Fort Steele,Blackfoot 11-14,,,Blackfoot 11-14,Prospecting,Prospecting,,Nihilist Corporation,"Walker, Elizabeth","Walker, Richard T.",Diamond,"Silurian, Beaverfoot Formation, Ultramafics, Diatremes",842.0,1.4,601.4285714,1.1,765.4545455,0.934,901.4989293,http://aris.empr.gov.bc.ca/search.asp?mode=repsum&rep_no=25639
6493,25643,1.0,1998/7/13,GEOC:,1200,Fernie Phosphate Project 1998 Assessment Report on the Leslie Creek Claims,1998,1998.0,,1999-07-13,,1998/7/13,34,Leslie Creek,082G02E:,082G017,49,9,0,114,40,4,11,5446750,670065,49.15,-114.667778,PP:,,,CRA,3.0,FORT:,Fort Steele,Fort Steele,LC 1-12,082GSE063,,LC 1-12,Geochemical,Geochemical,"07617, 10135, 19938, 25076",Ecomineral Resources Ltd.,"Henneberry, R. Tim","Henneberry, R. Tim",Phosphate,"Permian-Jurassic, Ishbel Group, Fernie Group, Phosphates, Dolomites, Siltstones, Sandstones",1110.51,1.4,793.2214286000001,1.1,1009.554545,0.934,1188.982869,http://aris.empr.gov.bc.ca/search.asp?mode=repsum&rep_no=25643
6521,25642,1.0,1998/7/13,GEOC:,1500,Fernie Phosphate Project 1998 Assessment Report on the Cabin Creek Claims,1998,1998.0,,1999-07-13,,1998/7/13,34,Cabin Creek,082G02E:,082G017,49,7,0,114,41,4,11,5443007,668963,49.116667,-114.684444,PP:,,,CRA,3.0,FORT:,Fort Steele,Fort Steele,CC 1-15,082GSE055,,CC 1-15,Geochemical,Geochemical,"07617, 10135, 19938, 25080",Ecomineral Resources Ltd.,"Henneberry, R. Tim","Henneberry, R. Tim",Phosphate,"Permian-Jurassic, Ishbel Group, Spray River Group, Fernie Group, Dolomites, Siltstones, Sandstones, Phosphates",1530.75,1.4,1093.392857,1.1,1391.590909,0.934,1638.9186300000001,http://aris.empr.gov.bc.ca/search.asp?mode=repsum&rep_no=25642
6531,25644,1.0,1998/7/15,GEOC:,1200,Fernie Phosphate Project 1998 Assessment Report on the Barnes Lake Claims,1998,1998.0,,1999-07-15,,1998/7/15,34,Barnes Lake,082G07E:,082G047,49,27,0,114,42,4,11,5480023,666620,49.45,-114.70111100000001,PP:,,,CRA,3.0,FORT:,Fort Steele,Fort Steele,BL 1-12,082GSE051,,BL 1-12,Geochemical,Geochemical,"05556, 06365, 06859, 20872",Ecomineral Resources Ltd.,"Henneberry, R. Tim","Henneberry, R. Tim",Phosphate,"Permian-Jurassic, Fernie Group, Ishbel Group, Spray River Group, Dolomites, Phosphates, Siltstones",1647.35,1.4,1176.6785710000001,1.1,1497.590909,0.934,1763.75803,http://aris.empr.gov.bc.ca/search.asp?mode=repsum&rep_no=25644
6614,25657,1.0,1998/6/15,PROS:,2600,Prospecting Report on Mikala Property,1998,1998.0,,1999-06-15,,1998/6/15,39,Mikala,082F08W:,082F039,49,20,20,116,21,49,11,5465324,546230,49.338889,-116.363611,DI:,,,CRA,3.0,FORT:,Fort Steele,Fort Steele,"Shah 1-2,<br>Mikala 1",,,"Shah 1-2, Mikala 1",Prospecting,Prospecting,,Nihilist Corporation,"Walker, Elizabeth","Walker, Richard T.",Diamond,"Proterozoic, Aldridge Formation, Creston Formation, Moyie sills, Gabbros, Lamprophyres",2415.8,1.4,1725.5714289999999,1.1,2196.181818,0.934,2586.509636,http://aris.empr.gov.bc.ca/search.asp?mode=repsum&rep_no=25657
6633,25681,1.0,1998/6/24,PROS:,1200,Prospecting Report on Gregg Property,1998,1998.0,,1999-06-24,,1998/6/24,42,Gregg,082F08W:,082F031,49,20,30,117,50,4,11,5465773,439386,49.341667,-117.83444399999999,DI:,,,CRA,3.0,FORT:,Fort Steele,Fort Steele,Greg 1-6,,,Greg 1-6,Prospecting,Prospecting,,Nihilist Corporation,"Walker, Elizabeth","Walker, Richard T.",Diamond,"Eocene, Alkalic intrusives, Shonkinites",2677.0,1.4,1912.142857,1.1,2433.636364,0.934,2866.167024,http://aris.empr.gov.bc.ca/search.asp?mode=repsum&rep_no=25681
6730,26151,1.0,1999/10/26,GEOL:GEOC:,4000,Geological Report on the Elko Property,1999,1998.0,,2000-10-26,,1999/10/26,21,Elko,082G03E:082G06E:,082G025,49,15,25,115,6,4,11,5457755,638170,49.256944,-115.10111100000002,AU:CU:,,,CRA,3.0,FORT:,Fort Steele,Fort Steele,Elk 1-7,"082GSW010, 082GSW028",,Elk 1-7,"Geological,<br>Geochemical","Geological, Geochemical",,Morris Geological Co. Ltd.,"Morris, Robert J.","Morris, Robert J.","Gold, Copper","Helikian, Roosville Formation, Sericite",4016.95,1.416,2836.829096,1.112,3612.365108,0.9440000000000001,4255.243644,http://aris.empr.gov.bc.ca/search.asp?mode=repsum&rep_no=26151
7670,25871,1.0,1998/12/21,DRIL:,80000,Drilling Report on the Aspen 11 Claim,1999,1998.0,,1999-12-21,,1998/12/21,20,Aspen,082G11W:,082G053,49,31,47,115,26,43,11,5487500,612500,49.529722,-115.445278,FD:,1.0,,CRA,4.0,FORT:,Fort Steele,Fort Steele,Aspen 11,082GSW033,Purcell Belt (Sullivan),Aspen 11,Drilling,Drilling,"12997, 15653, 15858, 17401, 21155, 23602, 24595, 25191",Bul River Mineral Corporation Ltd.,"Stanfield, R.H. ESTATE OF","Master, Pilsum P.; de Souza, Phil D.",Feldspar,"Monzonites, Diorites, Quartzites, Argillic alteration",82216.36,1.416,58062.40113,1.112,73935.57553999999,0.9440000000000001,87093.60169,http://aris.empr.gov.bc.ca/search.asp?mode=repsum&rep_no=25871
8002,25719,1.0,1998/6/8,PROS:,800,Prospecting Report on the Steep Claims,1998,1998.0,,1999-06-08,,1998/6/8,37,Steep,082J03W:,082J014,50,9,0,115,22,4,11,5556584,616609,50.15,-115.367778,,,,CRA,4.0,GOLD:,Golden,Golden,Steep 1-4,,,Steep 1-4,Prospecting,Prospecting,,Nihilist Corporation,"Walker, Elizabeth","Walker, Richard T.",,"Diatremes, Ordovician",800.0,1.4,571.4285714,1.1,727.2727272999999,0.934,856.5310492999998,http://aris.empr.gov.bc.ca/search.asp?mode=repsum&rep_no=25719
8126,25658,1.0,1998/6/8,PROS:,6000,"Prospecting Report on Alpine, Anne, Bruce, C12, Sul Claims",1998,1998.0,,1999-06-08,,1998/6/8,50,Bruce-Sul,082K08W:,082K049,50,28,0,116,23,3,11,5590700,543706,50.466667,-116.38416699999999,DI:,,,CRA,4.0,GOLD:,Golden,Golden,"Alpine 1-8,<br>Anne 1-4,<br>Bruce,<br>C12,<br>Sul 1-6",,,"Alpine 1-8, Anne 1-4, Bruce, C12, Sul 1-6",Prospecting,Prospecting,,Nihilist Corporation,"Walker, Elizabeth","Walker, Richard T.",Diamond,"Paleozoic, Toby Formation, Mount Nelson Formation, Dolomites, Quartzites",4810.23,1.4,3435.878571,1.1,4372.936364,0.934,5150.139186,http://aris.empr.gov.bc.ca/search.asp?mode=repsum&rep_no=25658
8177,25550,1.0,1998/4/22,GEOC:,6500,Assessment Report for the Midfork Property,1998,1998.0,,1999-04-22,,1998/4/22,43,Midfork,082F16W:082K01W:,082K009,50,0,0,116,18,4,11,5538865,550087,50.0,-116.301111,PB:ZN:AG:,,,CRA,3.0,GOLD:,Golden,Golden,Midfork 1-10,,,Midfork 1-10,Geochemical,Geochemical,25025,Ascot Resources Ltd.,"Termuende, Tim J.","Termuende, Tim J.","Lead, Zinc, Silver","Helikian, Aldridge Formation, Tourmalinite, Quartzites",6550.63,1.4,4679.021429,1.1,5955.118182,0.934,7013.522484,http://aris.empr.gov.bc.ca/search.asp?mode=repsum&rep_no=25550
8570,25665,1.0,1998/6/8,PROS:,800,Prospecting Report on Kokin Claims,1998,1998.0,,1999-06-08,,1998/6/8,37,Kokin,082J03E:,082J024,50,13,0,115,14,4,11,5564213,625959,50.216667,-115.234444,DI:,,,CRA,4.0,GOLD:FORT:,"Golden,<br>Fort Steele","Golden, Fort Steele",Kokin 1-4,,,Kokin 1-4,Prospecting,Prospecting,,Nihilist Corporation,"Walker, Elizabeth","Walker, Richard T.",Diamond,"Diatremes, Ordovician",800.0,1.4,571.4285714,1.1,727.2727272999999,0.934,856.5310492999998,http://aris.empr.gov.bc.ca/search.asp?mode=repsum&rep_no=25665
8641,25788,1.0,1998/10/2,PROS:,900,Geological Report on the 97 Next Property,1998,1998.0,,1999-10-02,,1998/10/2,18,97 Next,082E03E:,8.20E+15,49,7,0,119,14,34,11,5442847,336347,49.116667,-119.242778,AU:AG:CU:,9.0,,CRA,3.0,GRWD:,Greenwood,Greenwood,97 Next,,Similkameen - Boundary Area,97 Next,Prospecting,Prospecting,,"Kure, W.; Big Blackfoot Resources","Kure, W.","Miller, Robert E.","Gold, Silver, Copper","Permian, Anarchist Group, Greenstones, Phyllites, Slates, Limestones, Diorites",1374.0,1.4,981.4285714,1.1,1249.090909,0.934,1471.092077,http://aris.empr.gov.bc.ca/search.asp?mode=repsum&rep_no=25788
8686,25632,1.0,1998/6/9,PROS:,2000,Geological Assessment Report on the Larry Property,1998,1998.0,,1999-06-09,,1998/6/9,28,Larry,082E08W:,8.20E+37,49,23,20,118,52,9,11,5472368,364356,49.388889,-118.86916699999999,AU:,,,CRA,4.0,GRWD:,Greenwood,Greenwood,Larry,,,Larry,Prospecting,Prospecting,"12323, 13883",Probe Resources Ltd.,"Sookochoff, Laurence","Sookochoff, Laurence",Gold,"Permian, Anarchist Group, Greenstones, Dacites",2000.0,1.4,1428.5714289999999,1.1,1818.181818,0.934,2141.327623,http://aris.empr.gov.bc.ca/search.asp?mode=repsum&rep_no=25632
8717,25789,1.0,1998/10/2,PHYS:GEOP:GEOC:,1800,Geological Report on the 97 Bev Property,1998,1998.0,,1999-10-02,,1998/10/2,24,97 Bev,082E03E:,8.20E+16,49,8,30,119,10,4,11,5445467,341899,49.141667,-119.167778,AU:AG:CU:,9.0,,CRA,3.0,GRWD:,Greenwood,Greenwood,97 Bev,,Similkameen - Boundary Area,97 Bev,"Physical,<br>Geophysical,<br>Geochemical","Physical, Geophysical, Geochemical",13768,"Kure, W.; Big Blackfoot Resources","Kure, W.","Miller, Robert E.","Gold, Silver, Copper","Permian, Anarchist Group, Greenstones, Phyllites, Slates, Limestones, Quartzites, Diorites",2325.0,1.4,1660.714286,1.1,2113.636364,0.934,2489.293362,http://aris.empr.gov.bc.ca/search.asp?mode=repsum&rep_no=25789
8750,25563,1.0,1998/6/9,PROS:,800,Geological Assessment Report on the Glover 13 Claim,1998,1998.0,,1999-06-09,,1998/6/9,21,Glover,082E01W:,8.20E+29,49,12,0,118,27,4,11,5450703,394289,49.2,-118.45111100000001,AU:,,,CRA,4.0,GRWD:,Greenwood,Greenwood,Glover 1,082ESE179,,Glover 1,Prospecting,Prospecting,"06130, 17375, 22349, 25125",Carnival Resources Ltd.,"Sookochoff, Laurence","Sookochoff, Laurence",Gold,"Triassic, Knob Hill Group, Andesites, Hornfels, Quartzites, Massive sulphides, Pyrite, Pyrrhotite",2625.15,1.4,1875.107143,1.1,2386.5,0.934,2810.653105,http://aris.empr.gov.bc.ca/search.asp?mode=repsum&rep_no=25563
8970,25479,1.0,1998/3/31,PHYS:GEOP:,6700,Assessment Report on Ground Magnetometer Survey on the Whales Property,1998,1998.0,,1999-03-31,,1998/3/31,27,Whales,082E02W:,8.20E+17,49,8,0,118,51,4,11,5443928,364970,49.133333,-118.85111100000002,AU:CU:,8.0,,CRA,3.0,GRWD:,Greenwood,Greenwood,97BK 3,,Greenwood Camp,97BK 3,"Physical,<br>Geophysical","Physical, Geophysical",,Phoenix Gold Resources Ltd.,"Carson, John W.; Anschetz, Kim; Brooks, Timothy","Caron, Linda J.","Gold, Copper","Permian, Knob Hill Group, Greenstones",5200.0,1.4,3714.285714,1.1,4727.2727270000005,0.934,5567.45182,http://aris.empr.gov.bc.ca/search.asp?mode=repsum&rep_no=25479
9120,25692,1.0,1998/10/7,GEOL:PHYS:GEOP:GEOC:,9400,"Geological, Geochemical and Geophysical Report on Pathfinder Property",1998,1998.0,,1999-10-07,,1998/10/7,62,Pathfinder,082E01W:,8.20E+29,49,12,0,118,25,4,11,5450657,396718,49.2,-118.417778,AU:AG:CU:PB:ZN:,,,CRA,3.0,GRWD:,Greenwood,Greenwood,Hornet 3-8,082ESE074,,Hornet 3-8,"Geological,<br>Physical,<br>Geophysical,<br>Geochemical","Geological, Physical, Geophysical, Geochemical","19979, 22772, 23882, 24894",Cassiar Gold Corporation,"Kemp, John","Gruenwald, Warner","Gold, Silver, Copper, Lead, Zinc","Paleozoic, Attwood Group, Knob Hill Group, Argillites, Greenstones",8127.2,1.4,5805.142857,1.1,7388.363636,0.934,8701.498929000001,http://aris.empr.gov.bc.ca/search.asp?mode=repsum&rep_no=25692
10480,25731,1.0,1998/9/29,GEOP:PHYS:GEOC:,4400,Geological and Geophysical Report on the M 1-8 and GA 1-18 Claims,1998,1998.0,,1999-09-29,,1998/9/29,39,Walloper,092I10E:,092I058,50,31,0,120,30,39,10,5599038,676462,50.516667,-120.510833,,15.0,,KAM,3.0,KAML:,Kamloops,Kamloops,"GA 5-8,<br>GA 11-12",,Greenstone Mountain - Meadow Creek Area,"GA 5-8, GA 11-12","Geophysical,<br>Physical,<br>Geochemical","Geophysical, Physical, Geochemical","25001, 21795",Walloper Gold Resources Corporation,"Crooker, Grant F.","Crooker, Grant F.",,"Jurassic, Nicola Group, Overburden, Glacial tills, Schists, Quartz veins, Carbonate veins, Diorites",3576.63,1.4,2554.735714,1.1,3251.4818179999997,0.934,3829.3683079999996,http://aris.empr.gov.bc.ca/search.asp?mode=repsum&rep_no=25731
11778,25566,1.0,1998/4/6,PROS:,11600,Assessment Report on the Irony Claim Group,1998,1998.0,,1999-04-06,,1998/4/6,57,Irony,082M15W:,082M076,51,46,0,118,54,4,11,5736797,368816,51.766667,-118.90111100000001,PB:ZN:AG:CU:,,,KAM,3.0,KAML:,Kamloops,Kamloops,"Irony 5-7,<br>Irony 11-22,<br>Irony 1-2",082M  084,,"Irony 5-7, Irony 11-22, Irony 1-2",Prospecting,Prospecting,,"Walker, Richard T.; Chapleau Resources Ltd.","Walker, Richard T.","Walker, Richard T.","Lead, Zinc, Silver, Copper","Proterozoic, Horsethief Creek Group, Shuswap Metamorphic Complex, Amphibolites, Schists, Gneisses, Marbles, Sphalerite, Pyrrhotite, Galena, Pyrite",14346.53,1.4,10247.521429999999,1.1,13042.3,0.934,15360.31049,http://aris.empr.gov.bc.ca/search.asp?mode=repsum&rep_no=25566
13045,25967,1.0,1999/4/6,DRIL:,15300,Drilling Report on the Wood Property,1999,1998.0,,2000-04-06,,1999/4/6,20,Wood,092I10E:092I09W:,092I068,50,37,0,120,32,35,10,5610079,673809,50.616667,-120.543056,CU:,15.0,,KAM,3.0,KAML:,Kamloops,Kamloops,"Camp 4,<br>Wood 5",092INE165,Greenstone Mountain - Meadow Creek Area,"Camp 4, Wood 5",Drilling,Drilling,"04017, 04055, 05961, 11550, 21608, 22404, 22630, 23420, 24017, 24317, 25615",Green Valley Mines Ltd.,"Boitard, Charles Roger","Reynolds, Paul",Copper,"Triassic, Nicola Group, Andesites, Chalcopyrite, Native copper",70991.0,1.416,50134.887010000006,1.112,63840.827339999996,0.9440000000000001,75202.33051,http://aris.empr.gov.bc.ca/search.asp?mode=repsum&rep_no=25967
13363,25478,1.0,1998/4/3,DRIL:GEOL:GEOC:PHYS:,72000,1998 Trenching and Diamond Drilling Report on the Millenium Property,1998,1998.0,,1999-04-03,,1998/4/3,203,Millenium,082L14E:,082L075:,50,47,0,119,3,4,11,5627737,355411,50.783333,-119.051111,PB:ZN:AG:,,,KAM,3.0,KAML:,Kamloops,Kamloops,Millenium 1-4,"082LNW021, 082LNW023, 082LNW024, 082LNW025",,Millenium 1-4,"Drilling,<br>Geological,<br>Geochemical,<br>Physical","Drilling, Geological, Geochemical, Physical","24550, 24909",APAC Minerals Inc.,"Awmack, Henry James","Jones, Murray I.","Lead, Zinc, Silver","Proterozoic, Eagle Bay Assemblage, Mount Ida Group, Quartzites, Schists, Pyrite, Pyrrhotite, Sphalerite, Galena",165467.15,1.4,118190.8214,1.1,150424.6818,0.934,177159.6895,http://aris.empr.gov.bc.ca/search.asp?mode=repsum&rep_no=25478
13911,25545,1.0,1998/3/12,PHYS:GEOP:,3900,Geophysical Report on the McDame Property,1998,1998.0,,1999-03-12,,1998/3/12,19,McDame,104P06W:,104P024,59,16,59,129,24,6,9,6571640,477113,59.28305600000001,-129.401667,PB:ZN:AG:,52.0,,SMI,3.0,LIAR:,Liard,Liard,TDG 1-6,104P  021,Cassiar Camp,TDG 1-6,"Physical,<br>Geophysical","Physical, Geophysical",7069,International KRL Resources Corp.,"Donaldson, Jim; Young, Tim; Millen, G.","Chow, Rita","Lead, Zinc, Silver","Mississippian, Atan Group, Kechika Group, Limestones, Dolomites",3280.0,1.4,2342.857143,1.1,2981.818182,0.934,3511.7773020000004,http://aris.empr.gov.bc.ca/search.asp?mode=repsum&rep_no=25545
16313,25813,1.0,1998/10/5,GEOL:PHYS:GEOC:,147600,"Geological, Geochemical and Trenching Report on the RDN Property",1999,1998.0,,1999-10-05,,1998/10/5,227,RDN,104B15E:104G02E:,104G007,56,59,59,130,39,7,9,6318568,399653,56.999722,-130.651944,AU:AG:PB:ZN:,,,SMI,2.0,LIAR:,Liard,Liard,"RDN 1-9,<br>RDN 13-18",104G  144,,"RDN 1-9, RDN 13-18","Geological,<br>Physical,<br>Geochemical","Geological, Physical, Geochemical","09041, 09692, 18411, 19646, 20667, 20769, 20916, 21366, 21529, 22003, 22238, 22607, 23734, 24057, 24719, 25336",Rimfire Minerals Corporation,"Awmack, Henry James; Debock, N.B.","Awmack, Henry James; Baknes, Mark","Gold, Silver, Lead, Zinc","Jurassic, Hazelton Group, Dacites, Trachytes, Pillow basalts, Argillites, Quartz veins, Pyrite, Chalcopyrite, Sphalerite, Tetrahedrite, Hematite, Specularite",183779.24,1.416,129787.5989,1.112,165269.1007,0.9440000000000001,194681.3983,http://aris.empr.gov.bc.ca/search.asp?mode=repsum&rep_no=25813
17137,25609,1.0,1998/6/25,GEOC:,4500,Prospecting and Geochemical Report on Goldmax 15 Property,1998,1998.0,,1999-06-25,,1998/6/25,40,Ample/Goldmax,092J09E:,092J070,50,40,40,122,4,23,10,5614403,565492,50.677778,-122.07305600000001,AU:,34.0,,KAM,3.0,LILL:,Lillooet,Lillooet,Goldmax 15,,Bridge River Camp,Goldmax 15,Geochemical,Geochemical,25597,Gold-Ore Resources Ltd.,"Javorsky, David; Polischuk, Gary","Pickett, J. Wayne",Gold,"Jurassic, Bridge River Complex, Greenstones, Basalts",6608.19,1.4,4720.135714,1.1,6007.445455,0.934,7075.149893000001,http://aris.empr.gov.bc.ca/search.asp?mode=repsum&rep_no=25609
17207,25597,1.0,1998/6/25,GEOL:GEOC:,6000,Geological and Geochemical Report on Ample/Goldmax Property,1998,1998.0,,1999-06-25,,1998/6/25,40,Ample/Goldmax,092I12W:,092I061,50,39,4,121,59,39,10,5611500,571100,50.651111,-121.99416699999999,AU:,34.0,,KAM,3.0,LILL:,Lillooet,Lillooet,Goldmax 16,092JNE069,Bridge River Camp,Goldmax 16,"Geological,<br>Geochemical","Geological, Geochemical","22154, 23274, 23945, 24360",Gold-Ore Resources Ltd.,"Javorsky, David; Polischuk, Gary","Pickett, J. Wayne",Gold,"Jurassic-Cretaceous, Jurassic-Cretaceous, Bridge River Complex, Jurassic-Cretaceous, Bridge River Complex, Mudstones, Bridge River Complex, Siltstones, Phyllitic argillites, Quartz veins, Pyrite, Pyrrhotite, Galena",8240.56,1.4,5886.114286,1.1,7491.418181999999,0.934,8822.869379,http://aris.empr.gov.bc.ca/search.asp?mode=repsum&rep_no=25597
