,rep_no,cnf_prd,aff_dt,gwrk_typs,claim_val,title,rep_yr,wrk_yr,conf_ldate,conf_adate,aff_ndate,aff_adate,page_ct,prpty_nm,nts_maps,bcgs_maps,lat83_deg,lat83_min,lat83_sec,lon83_deg,lon83_min,lon83_sec,zone83,north83,east83,lat83,long83,com_cds,camp_cd,geo_sum,reg_geo,info_cls,mdiv_cds,mdiv_nmx,mdiv_nms,claim_nmx,minf_nox,camp_nm,claim_nms,gwrk_nmx,gwrk_nms,rel_ars,oper_nms,own_nms,auth_nms,com_nms,kwl_nms,MERG_SPENT,DOLL_INX,doll_86,CPIdex1992,doll_92,CPIdex2002,doll_02,URL
13649,36001,1.0,2015/12/28,GEOL:PHYS:,25738,Geological Assessment Report Reconnaissance Geological Mapping,2016,2015.0,,2016-12-28,,2015/12/28,29,Dot-Apex,092I04E:,092I002:,50,3,39,121,38,27,10,5546279,597283,50.060833,-121.640833,AU:,,,KAM,3.0,KAML:NWES:,"Kamloops,<br>New Westminster","Kamloops, New Westminster","DRAGON,<br>839468,<br>APEX","092ISW055, 092ISW063, 092ISW064, 092ISW065, 092ISW079, 092ISW090",,"DRAGON, 839468, APEX","Geological,<br>Physical","Geological, Physical","04508, 04985, 05111, 08606, 10872, 11301, 13167, 13634, 16857, 21926, 22665, 25396, 25768, 25780, 26169, 26739, 26772, 27078, 27343, 28317, 30332, 30400, 30564, 31003, 31183, 31199, 31692, 31988, 32447, 33358, 33781, 33872, 34481, 35370","Cardinal, Daniel George (FMC#: 104232)","Cardinal, Daniel George (FMC#: 104232)","Cardinal, Daniel George (FMC#: 104232)",Gold,"Mississippian-Jurassic, Bridge River Complex, Marine sedimentary and volcanic rocks, Jurassic-Cretaceous, Mudstones, Siltstones, Shales, Serpentinite Ultramafic Rocks, Magnetite, Pentlandite, Heazlewoodite, Chromite, Arsenopyrite, Pyrrhotite, Pyrite, Galena, Greenschists, Phyllites",25785.0,1.837,14036.47251,1.443,17869.022869999997,1.224,21066.17647,http://aris.empr.gov.bc.ca/search.asp?mode=repsum&rep_no=36001
13947,36017,1.0,2015/12/31,GEOL:GEOP:,4186,"Magnetic Susceptibility, Landsat Enhanced Imagery and Lineament Interpretations",2016,2015.0,,2016-12-31,,2015/12/31,33,Park My Bills,094E13E:,094E073:,57,45,59,127,31,6,9,6403666,588146,57.766389000000004,-127.51833300000001,CU:AU:MO:,51.0,,SMI,3.0,LIAR:,Liard,Liard,"PARK MY BILLS,<br>BOWZER BILL,<br>MOUNTAIN MAGIC",094F  268,Toodoggone Camp,"PARK MY BILLS, BOWZER BILL, MOUNTAIN MAGIC","Geological,<br>Geophysical","Geological, Geophysical","09335, 10490, 11152, 13841, 25535, 35663","Greig, Charles J. (FMC #143767)","Greig, Charles J. (FMC #143767)","Rowe, Jeffrey D.; Walcott, Alexander","Copper, Gold, Molybdenum/Molybdenite","Jurassic, Granodiorites, Devonian-Permian, Asitka Group, Greenschists, Greenstones, Magnetite, Triassic, Stuhini Group, Skarns, Gossans, Linear analysis",4800.0,1.837,2612.9559059999997,1.443,3326.403326,1.224,3921.568627,http://aris.empr.gov.bc.ca/search.asp?mode=repsum&rep_no=36017
13996,35928,1.0,2015/11/19,GEOL:,3689,Assessment Report for OCS placer property,2016,2015.0,,2016-11-19,,2015/11/19,30,OCS Placer,104J16W:,104J088:,58,48,4,130,28,26,9,6518843,414838,58.801111,-130.47388899999999,AU:,,,SMI,3.0,LIAR:,Liard,Liard,1032333,,,1032333,Geological,Geological,,"Bond, Jeffrey David","Bond, Jeffrey David","Bond, Jeffrey David",Gold,"Cache Creek Complex, Cherts, Slates, Greywackes, Agglomerates, Mississippian-Triassic, Volcanic rocks, Permian, Placers, Placer gold, Kedahda Formation",5500.0,1.837,2994.0119760000002,1.443,3811.503812,1.224,4493.464052,http://aris.empr.gov.bc.ca/search.asp?mode=repsum&rep_no=35928
14350,35787,1.0,2015/8/20,PROS:PHYS:,7987,Prospecting Assessment Report on the Keays Property,2015,2015.0,,2016-08-20,,2015/8/20,23,Keays,094K11W:,094K053:,58,33,37,125,29,8,10,6493772,355406,58.560278000000004,-125.485556,CU:AG:,,,SMI,3.0,LIAR:,Liard,Liard,EAGLE 1,"094K  003, 094K  012",,EAGLE 1,"Prospecting,<br>Physical","Prospecting, Physical","24696, 25878, 26997, 31179","Bot, John","Bot, John","Warren, Chris I.","Copper, Silver","Proterozoic, Aida Formation, Mudstones, Fine Clastic Sedimentary Rocks, Muskwa Assemblage, Quartz carbonate veins, Chalcopyrite, Pyrite, Diabase dykes",9765.0,1.804,5412.971175,1.4169999999999998,6891.319689,1.202,8123.960067,http://aris.empr.gov.bc.ca/search.asp?mode=repsum&rep_no=35787
14571,35898,1.0,2015/10/31,GEOC:PHYS:,13102,2015 Geological and Prospecting Assessment Program,2016,2015.0,,2016-10-31,,2015/10/31,53,Jade Fever,104J16E:,104J080:,58,45,41,130,5,9,9,6513992,437187,58.761389,-130.085833,JD:,,,SMI,3.0,LIAR:,Liard,Liard,JADE FEVER 5,104J  066,,JADE FEVER 5,"Geochemical,<br>Physical","Geochemical, Physical","32861, 33513, 34509, 35170","Bunce, Donald (146351)","Bunce, Donald (146351); Bunce, Robin Neil","Hunt, Lesley C.; Bunce, Donald (146351)",Jade/Nephrite,"Mississippian-Triassic, Cache Creek Complex, Cherts, Siliceous argillites, Ultramafic rocks, Serpentinites, Nephrite, Jade, Kedahda Formation",13187.47,1.837,7178.807839,1.443,9138.925849,1.224,10774.0768,http://aris.empr.gov.bc.ca/search.asp?mode=repsum&rep_no=35898
15284,35708,1.0,2015/12/11,GEOL:GEOC:PHYS:,27911,"Report on Trenching, Geology and Surveying",2015,2015.0,,2016-12-11,,2015/12/11,43,Coral,094B03W:,094B014:,56,9,0,123,23,6,10,6222841,476082,56.15,-123.385,ZN:PB:AG:,,,PRG,3.0,LIAR:,Liard,Liard,CORAL,"094B  007, 094B  008, 094B  021",,CORAL,"Geological,<br>Geochemical,<br>Physical","Geological, Geochemical, Physical","04400, 05490, 05745, 06552, 13724, 15040, 16254, 23032, 25845, 35708","deGraaf, Kenneth","deGraaf, Kenneth","Harper, Gerald (Dr.); Manns, F.; deGraaf, Kenneth","Zinc, Lead, Silver","Devonian-Mississippian, Besa River Formation, Mudstones, Siltstones, Shales, Mississippian, Prophet Formation, Limestones, Marbles, Silurian-Devonian, Stone Formation, Dolomitic carbonate rocks, Silurian, Nonda Formation, Ordovician, Skoki Formation, Sphalerite, Galena, Dolostones, Breccias",32113.07,1.804,17801.03659,1.4169999999999998,22662.71701,1.202,26716.36439,http://aris.empr.gov.bc.ca/search.asp?mode=repsum&rep_no=35708
15326,35730,1.0,2015/6/6,GEOL:GEOC:PHYS:,32652,"Report on Prospecting, Geology and Trenching",2015,2015.0,,2016-06-06,,2015/6/6,65,Coral,094B03W:,094B003:,56,9,0,123,24,6,10,6222847,475046,56.15,-123.40166699999999,ZN:PB:AG:,,,PRG,3.0,LIAR:,Liard,Liard,"CORAL,<br>CORAL 2,<br>CORAL 5,<br>CORAL","094B  007, 094B  008, 094B  021",,"CORAL, CORAL 2, CORAL 5, CORAL","Geological,<br>Geochemical,<br>Physical","Geological, Geochemical, Physical","35708, 04400, 05490, 05745, 06552, 13724, 15040, 16254, 23032, 25845",Minfocus Exploration Corp.,"Harper, Gerald (Dr.); deGraaf, Kenneth","deGraaf, Kenneth","Zinc, Lead, Silver","Devonian-Mississippian, Besa River Formation, Mudstones, Siltstones, Shales, Mississippian, Prophet Formation, Limestones, Marbles, Silurian-Devonian, Stone Formation, Dolomitic carbonate rocks, Silurian, Nonda Formation, Ordovician, Skoki Formation, Sphalerite, Galena, Dolostones, Breccias",33916.22,1.804,18800.56541,1.4169999999999998,23935.22936,1.202,28216.48918,http://aris.empr.gov.bc.ca/search.asp?mode=repsum&rep_no=35730
15426,36074,1.0,2016/3/30,GEOL:GEOP:GEOC:,37703,Prospectivity Review and Exploration Plan,2016,2015.0,,2017-03-30,,2016/3/30,554,Silvertip,104O16W:,104O089:,59,50,1,130,15,14,9,6633546,429713,59.833611,-130.253889,AG:PB:ZN:AU:,,,PRG,3.0,LIAR:,Liard,Liard,"KW1,<br>RDC2,<br>RDC3,<br>STIB1,<br>BG,<br>AM,<br>STIB2,<br>SKIN1,<br>SKIN2,<br>RDC1,<br>PAL,<br>GAP,<br>KW2","104O  001, 104O  002, 104O  012, 104O  013, 104O  017, 104O  033, 104O  034, 104O  035, 104O  036, 104O  042, 104O  046, 104O  049",,"KW1, RDC2, RDC3, STIB1, BG, AM, STIB2, SKIN1, SKIN2, RDC1, PAL, GAP, KW2","Geological,<br>Geophysical,<br>Geochemical","Geological, Geophysical, Geochemical","00734, 03843, 03844, 04663, 05095, 06798, 07257, 07539, 08061, 08125, 11309, 12060, 12619, 13852, 13947, 14095, 14165, 14348, 14856, 15560, 16902","Stibbard, Jeff","Stibbard, Jeff","Cullen, Randal P.","Silver, Lead, Zinc, Gold","Cretaceous, Cassiar Batholith, Granites, Devonian-Mississippian, Earn Group, Ordovician-Silurian, Road River Group, Silurian-Devonian, McDame Group, Ramhorn Group, Mudstones, Siltstones, Limestones, Marbles, Kechika Group, Slates, Atan Group, Quartzites, Phyllites, Scheelite, Galena, Sphalerite, Powellite, Pyrargyrite, Molybdenite, Skarns, Quartz monzonites, Pyrite, Siderite",40178.37,1.837,21871.73108,1.443,27843.63825,1.224,32825.46569,http://aris.empr.gov.bc.ca/search.asp?mode=repsum&rep_no=36074
16253,36409,1.0,2016/6/8,GEOP:GEOC:,146730,"Report on Mobile Metal Ion, Induced Polarization and Ground Magnetometer Survey",2016,2015.0,,2017-06-08,,2016/6/8,378,Hot Bath,104I04E:,104I013:,58,10,3,129,33,39,9,6447496,467005,58.1675,-129.560833,CU:AU:,,,SMI,3.0,LIAR:,Liard,Liard,HOT BATH EXTENSION,104I  043,,HOT BATH EXTENSION,"Geophysical,<br>Geochemical","Geophysical, Geochemical","03963, 06323, 34288, 35456",DeCoors Mining Corp.,Brian Johnson,"Buckle, John","Copper, Gold","Jurassic, Three Sisters Plutonic Suite, Calc-alkaline rocks, Monzodiorites, Triassic, Quartz monzonites, Chalcopyrite, Molybdenite, Pyrite",191670.0,1.837,104338.5955,1.443,132827.4428,1.224,156593.1373,http://aris.empr.gov.bc.ca/search.asp?mode=repsum&rep_no=36409
16662,35779,1.0,2015/8/4,PHYS:DRIL:GEOC:,71228,Technical Report of Drilling,2016,2015.0,,2016-08-04,,2015/8/4,561,Hat,104J04E:,104J013:,58,11,59,131,35,7,9,6453860,348061,58.199721999999994,-131.58527800000002,AU:CU:,,,SMI,3.0,LIAR:,Liard,Liard,"507814,<br>515550",104J  021,,"507814, 515550","Physical,<br>Drilling,<br>Geochemical","Physical, Drilling, Geochemical","02554, 06835, 07482, 13939, 14802, 16311, 18158, 21615, 24388, 24935, 26737, 27932, 28537, 30372, 31178, 33038, 34654",DOUBLEVIEW CAPITAL CORP,"Lisle, Thomas E.","Ostensoe, Erik A.","Gold, Copper","Miocene-Pleistocene, Level Mountain Group, Alkaline Volcanic Rocks, Triassic, Stuhini Group, Marine sedimentary and volcanic rocks, Quartz diorites, Stocks, Andesites, Tuffs, Gossans, Pyrite, Chalcedony veins, Chalcopyrite, Galena, Sphalerite, Magnetite, Epidote",2196596.0,1.837,1195751.769,1.443,1522242.55,1.224,1794604.575,http://aris.empr.gov.bc.ca/search.asp?mode=repsum&rep_no=35779
16898,35506,1.0,2015/5/15,PROS:,1646,Prospecting Assessment Report,2015,2015.0,,2016-05-15,,2015/5/15,44,Birke,092J07E:,092J047:,50,28,36,122,42,22,10,5591672,520853,50.476667,-122.706111,AU:AG:,33.0,,NAN,3.0,LILL:,Lillooet,Lillooet,"LIZARD 1,<br>BIRKE WEST,<br>BIRKE NW",,Pemberton District,"LIZARD 1, BIRKE WEST, BIRKE NW",Prospecting,Prospecting,"10036, 17537, 21227, 30296, 33622, 34940","Shearer, Johan Tom FMC 124452","Shearer, Johan Tom FMC 124452","Shearer, Johan Tom FMC 124452","Gold, Silver","Jurassic, Jurassic, Ladner Group, Ladner Group, Mudstones, Mudstones, Siltstones, Siltstones, Shales, Shales, Fine Clastic Sedimentary Rocks, Fine Clastic Sedimentary Rocks, Quartz veins, Quartz veins, Gold, Gold, Pyrite, Pyrite, Chalcopyrite, Chalcopyrite, Triassic, Cadwallader Group, Metasediments, Metavolcanics",2576.0,1.804,1427.937916,1.4169999999999998,1817.9251940000001,1.202,2143.094842,http://aris.empr.gov.bc.ca/search.asp?mode=repsum&rep_no=35506
17053,35902,1.0,2016/1/2,GEOC:,7885,Assessment Report 2015 Geochemical Sampling and Prospecting Report,2016,2015.0,,2017-01-02,,2016/1/2,35,Bridge Epi,092J15E:,092J097:,50,55,0,122,42,5,10,5640600,520991,50.916667,-122.70138899999999,AU:AG:,34.0,,KAM,3.0,LILL:,Lillooet,Lillooet,1037319,092JNE155,Bridge River Camp,1037319,Geochemical,Geochemical,"18277, 19843","Kreft, John Bernard (FMC #114661)","Kreft, John Bernard (FMC #114661)","Kreft, John Bernard (FMC #114661)","Gold, Silver","Mississippian-Jurassic, Bridge River Complex, Marine sedimentary and volcanic rocks, Metamorphic rocks, Taylor Creek Group, Dash Creek Formation, Conglomerates, Coarse Clastic Sedimentary Rocks, Permian, Bralorne-East Liza Complex, Serpentinite Ultramafic Rocks, Pyrite, Stibnite, Arsenopyrite, Sphalerite, Galena",6332.47,1.837,3447.180185,1.443,4388.4060979999995,1.224,5173.586601,http://aris.empr.gov.bc.ca/search.asp?mode=repsum&rep_no=35902
17162,36305,1.0,2016/12/2,GEOC:,13195,2015 Geochemical Report on the Birken 8 Claim in the Pacific Ranges of the Coast Mountains,2016,2015.0,,2017-12-02,,2016/12/2,54,Birken,092J07E:092J10E:,092J048:,50,29,59,122,35,19,10,5594275,529176,50.499722,-122.58861100000001,CU:CO:ZN:AU:PL:PA:,33.0,,NAN,3.0,LILL:,Lillooet,Lillooet,Birken 8,,Pemberton District,Birken 8,Geochemical,Geochemical,"33543, 33637, 34834, 35021, 35816, 36173",Ken MacKenzie,Ken MacKenzie,Ken MacKenzie,"Copper, Cobalt, Zinc, Gold, Pyrophyllite, Peat","Cretaceous, Quartz diorites, Jurassic, Ladner Group, Cayoosh Assemblage, Mudstones, Siltstones, Shales, Malachite, Pyrite, Chalcopyrite, Mississippian-Jurassic, Bridge River Complex, Marine sedimentary and volcanic rocks, Permian, Chism Creek Schist, Serpentinites, Ultramafic rocks",9395.47,1.837,5114.572673,1.443,6511.067221,1.224,7676.037581999999,http://aris.empr.gov.bc.ca/search.asp?mode=repsum&rep_no=36305
17283,35804,1.0,2015/10/6,DRIL:,18062,Geological Report (Core Logging),2015,2015.0,,2016-10-06,,2015/10/6,52,Roderick,092O01E:,092O019:,51,7,29,122,13,50,10,5663976,553846,51.124722,-122.230556,AU:,35.0,,KAM,3.0,LILL:,Lillooet,Lillooet,"1032146,<br>1032149,<br>1032281","092O  054, 092O  055",Taseko - Blackdome Area,"1032146, 1032149, 1032281",Drilling,Drilling,"16303, 17336, 18352, 28032","Durfeld, Rudolf M.","Stewart, John Melvin (Mel)","Durfeld, Rudolf M.",Gold,"Cretaceous, Jackass Mountain Group, Sandstones, Siltstones, Argillites, Cretaceous-Paleogene, Felsic intrusions, Stocks, Quartz porphyries, Granodiorites, Clay alteration, Quartz veins, Stibnite, Pyrite, Arsenopyrite, Gold, Chalcedonic quartz",14000.0,1.804,7760.532151,1.4169999999999998,9880.028229000001,1.202,11647.254579999999,http://aris.empr.gov.bc.ca/search.asp?mode=repsum&rep_no=35804
17468,35816,1.0,2015/12/3,GEOC:,46941,2014 Geochemical Report on the Birken 1-11 claims,2016,2015.0,,2016-12-03,,2015/12/3,97,Birken,092J10E:,092J057:,50,30,13,122,36,33,10,5594700,527716,50.503611,-122.609167,CU:ZN:AU:PT:PD:,34.0,,KAM,3.0,LILL:,Lillooet,Lillooet,"BIRKEN 2,<br>BIRKEN 3,<br>BIRKEN 4,<br>BIRKEN 5,<br>BIRKEN 6,<br>BIRKEN 7,<br>BIRKEN 8,<br>BIRKEN 9,<br>BIRKEN 10,<br>BIRKEN 11",,Bridge River Camp,"BIRKEN 2, BIRKEN 3, BIRKEN 4, BIRKEN 5, BIRKEN 6, BIRKEN 7, BIRKEN 8, BIRKEN 9, BIRKEN 10, BIRKEN 11",Geochemical,Geochemical,"33543, 33637, 33818, 34834, 35021, 35303","MacKenzie, Kenneth (FMC # 116450)","MacKenzie, Kenneth (FMC # 116450)","MacKenzie, Kenneth (FMC # 116450)","Copper, Zinc, Gold, Platinum, Palladium","Cretaceous, Quartz diorites, Jurassic, Ladner Group, Cayoosh Assemblage, Mudstones, Siltstones, Shales, Malachite, Pyrite, Chalcopyrite, Mississippian-Jurassic, Bridge River Complex, Marine sedimentary and volcanic rocks, Permian, Chism Creek Schist, Serpentinite Ultramafic Rocks",34421.08,1.837,18737.65923,1.443,23853.832290000002,1.224,28121.797389999996,http://aris.empr.gov.bc.ca/search.asp?mode=repsum&rep_no=35816
17505,35629,1.0,2015/7/8,PROS:GEOC:,40597,Assessment Work Report 2014-2015a - Sky Pilot Gold,2015,2015.0,,2016-07-08,,2015/7/8,50,Sky Pilot Gold,092G11E:,092G007:,49,39,8,123,1,5,10,5499965,498697,49.652221999999995,-123.018056,AU:CU:ZN:AG:,21.0,,NAN,3.0,LILL:,Lillooet,Lillooet,"SKY,<br>KOKO,<br>COLLEEN,<br>SKY PILOT,<br>WHISTLER",,Britannia Area,"SKY, KOKO, COLLEEN, SKY PILOT, WHISTLER","Prospecting,<br>Geochemical","Prospecting, Geochemical","00626, 02373, 07021, 07026, 07047, 07671, 09437, 10293, 10724, 11642, 16494, 33118, 34210, 34899",Murray Halliday,Murray Halliday,Murray Halliday,"Gold, Copper, Zinc, Silver","Jurassic, Cretaceous, Gambier Group, Marine sediments, Quartz diorites, Granodiorites",40139.96,1.804,22250.53215,1.4169999999999998,28327.42414,1.202,33394.30948,http://aris.empr.gov.bc.ca/search.asp?mode=repsum&rep_no=35629
17517,36226,1.0,2016/7/6,PROS:GEOC:,43911,Assessment Work Report 2015 - 2016,2016,2015.0,,2017-07-06,,2016/7/6,58,Sky Pilot Gold,092G11E:,092G065:,49,39,8,123,1,5,10,5499965,498697,49.652221999999995,-123.018056,CU:ZN:AU:AG:,21.0,,KAM,3.0,LILL:,Lillooet,Lillooet,"SKY,<br>COLLEEN,<br>SKY PILOT,<br>WHISTLER",092GNW042,Britannia Area,"SKY, COLLEEN, SKY PILOT, WHISTLER","Prospecting,<br>Geochemical","Prospecting, Geochemical","00626, 02373, 07021, 07026, 07047, 07671, 09437, 10293, 10724, 11642, 16494, 33118, 34210, 34899, 35629","Halliday, Murray (FMC 142681)","Halliday, Murray (FMC 142681)","Halliday, Murray (FMC 142681)","Copper, Zinc, Gold, Silver","Jurassic, Cretaceous, Coast Plutonic Complex, Gambier Group, Granodiorites, Quartz diorites, Marine sedimentary and volcanic rocks, Chalcopyrite, Pyrite, Sphalerite, Galena",44066.62,1.837,23988.36146,1.443,30538.1982,1.224,36002.14052,http://aris.empr.gov.bc.ca/search.asp?mode=repsum&rep_no=36226
17614,35709,1.0,2015/7/21,GEOL:GEOC:,98065,Assessment Report on the Popa Bear Property,2015,2015.0,,2016-07-21,,2015/7/21,79,Popa Bear,092J09W:,092J059:,50,30,59,122,23,14,10,5596227,543444,50.516389000000004,-122.387222,AU:CU:PB:ZN:,34.0,,KAM,3.0,LILL:,Lillooet,Lillooet,PAPA BEAR,,Bridge River Camp,PAPA BEAR,"Geological,<br>Geochemical","Geological, Geochemical","33819, 34749","Rogers, Don","Rogers, Don","Raffle, Kristopher J.","Gold, Copper, Lead, Zinc","Mississippian-Jurassic, Bridge River Complex, Ultramafic rocks, Marine sedimentary and volcanic rocks, Jurassic-Cretaceous, Cayoosh Assemblage, Cretaceous-Paleogene, Granodiorites",82075.12,1.804,45496.18625,1.4169999999999998,57921.750179999995,1.202,68282.12977999999,http://aris.empr.gov.bc.ca/search.asp?mode=repsum&rep_no=35709
17706,36237,1.0,2016/4/30,GEOP:GEOL:PHYS:,269736,Technical Assessment Report,2016,2015.0,,2017-04-30,,2016/4/30,164,Bridge River & Shulaps,092J16W:,092J089:,50,49,0,122,16,5,10,5629693,551562,50.816666999999995,-122.268056,JD:,34.0,,KAM,3.0,LILL:,Lillooet,Lillooet,"BIRK,<br>1024678","092JNE087, 092JNE063, 092JNE039, 092JNE099, 092JNE173, 092JNE111",Bridge River Camp,"BIRK, 1024678","Geophysical,<br>Geological,<br>Physical","Geophysical, Geological, Physical","11758, 13182, 14895, 15948, 16202, 19041, 19260, 20499, 22211, 22601, 22656, 22858, 23103, 23175, 23581, 24282, 27641, 29125, 32966, 34905, 35052, 35320","Deering, David R.","Deering, David R.","Deering, David R.",Jade/Nephrite,"Mississippian-Jurassic, Bridge River Complex, Marine sedimentary and volcanic rocks, Greenschists, Greenstones, Eocene, Granodiorites, Nephrite, Jade, Shulaps Ultramafic Complex, Serpentinites, Ultramafic rocks",269736.25,1.837,146835.1932,1.443,186927.4082,1.224,220372.7533,http://aris.empr.gov.bc.ca/search.asp?mode=repsum&rep_no=36237
17847,35598,1.0,2015/8/4,PROS:GEOC:,2253,Prospecting and Geological Report,2015,2015.0,,2016-08-04,,2015/8/4,21,Cedarhill,092F13E:,092F083:,49,52,59,125,31,1,10,5528666,319191,49.883055999999996,-125.516944,AG:CU:PB:ZN:,,,NAN,3.0,NIMO:,Nanaimo,Nanaimo,CEDAR HILL,092F  194,,CEDAR HILL,"Prospecting,<br>Geochemical","Prospecting, Geochemical",12637,"Gal, Leonard","Gal, Leonard","Gal, Leonard","Silver, Copper, Lead, Zinc","Jurassic, Island Plutonic Suite, Granodiorites, Intrusive rocks, Quinsam intrusions",2262.71,1.804,1254.2738359999998,1.4169999999999998,1596.831334,1.202,1882.454243,http://aris.empr.gov.bc.ca/search.asp?mode=repsum&rep_no=35598
18047,35202,1.0,2014/10/13,GEOC:,4503,Geochemical and Prospecting Technical Assessment Report on the Mt. Washington Property,2015,2015.0,,2015-10-13,,2014/10/13,42,Mt. Washington,092F14W:,092F074:,49,45,55,125,19,31,10,5515128,332552,49.765278,-125.325278,AU:,27.0,,NAN,3.0,NIMO:,Nanaimo,Nanaimo,"L-A,<br>1026806,<br>1026809,<br>1027586,<br>DOMINEER 2,<br>DOMINEER 1 - TUNNEL","092F  116, 092F  117, 092F  641",Mt. Washington Area,"L-A, 1026806, 1026809, 1027586, DOMINEER 2, DOMINEER 1 - TUNNEL",Geochemical,Geochemical,"11996, 15395, 15825, 30010, 17123, 12605","Wallach, David Arnold","Zamida, David Anthony","Zamida, David Anthony; Wallach, David Arnold",Gold,"Eocene-Oligocene, Mount Washington Plutonic Suite, Quartz diorites, Cretaceous, Nanaimo Group, Sedimentary rocks, Triassic, Vancouver Group, Karmutsen Formation, Basaltic volcanics, Bornite, Covellite, Realgar, Orpiment, Pyrrhotite, Arsenopyrite, Molybdenite, Sphalerite, Galena, Chalcopyrite, Stockworks, Quartz-sulphide veins",5307.39,1.804,2942.012195,1.4169999999999998,3745.5116439999997,1.202,4415.4658899999995,http://aris.empr.gov.bc.ca/search.asp?mode=repsum&rep_no=35202
18070,35814,1.0,2015/11/22,GEOL:GEOP:GEOC:,8014,"Geological, Geochemical and Geophysical Report",2015,2015.0,,2016-11-22,,2015/11/22,51,Beaver Cove - Black Marble,092L10W:,092L056:,50,30,59,126,53,38,9,5598166,649310,50.516389000000004,-126.89388899999999,MB:BS:DS:,30.0,,NAN,3.0,NIMO:,Nanaimo,Nanaimo,BLACK MARBLE,092L  279,Nimpkish Area,BLACK MARBLE,"Geological,<br>Geophysical,<br>Geochemical","Geological, Geophysical, Geochemical","23070, 23616, 26783, 31800, 33646, 08285, 15230",Fundamental Resources Corporation,"Pfaffenberger, William Elmer","Kikauka, Andris (FMC # 114051)","Marble, Building Stone, Dimension Stone","Triassic, Vancouver Group, Karmutsen Formation, Basaltic volcanic rocks, Parson Bay Formation, Limestones, Slates, Siltstones, Argillites, Quatsino Formation, Marbles, Calcareous sedimentary rocks, Marble, Graphitic, Graphitic marbles, Building stone, Dimension stone",5660.95,1.804,3137.998891,1.4169999999999998,3995.0247,1.202,4709.608985,http://aris.empr.gov.bc.ca/search.asp?mode=repsum&rep_no=35814
18148,36011,1.0,2015/12/30,GEOP:,3367,Assessment Report Differential Interferomatic Satellite Synthetic Aperture Radar Change and Texture Detection,2016,2015.0,,2016-12-30,,2015/12/30,56,Bountiful Property,092F07E:,092F037:,49,22,7,124,43,15,10,5469850,375074,49.368611,-124.72083300000001,ZN:,,,NAN,3.0,NIMO:,Nanaimo,Nanaimo,"MZ2,<br>MZ5","092F  089, 092F  171",,"MZ2, MZ5",Geophysical,Geophysical,"13105, 14415, 30044, 32894, 33757","McLelland, David","McLelland, David","McLelland, David",Zinc,"Triassic, Vancouver Group, Karmutsen Formation, Permian, Buttle Lake Group, Skarns, Limestones, Massive sulphides, Sphalerite",7040.0,1.837,3832.335329,1.443,4878.724879,1.224,5751.633987,http://aris.empr.gov.bc.ca/search.asp?mode=repsum&rep_no=36011
18198,36053,1.0,2016/1/14,GEOL:GEOC:,5773,Assessment Report on the Geochemical and Geological Survey,2016,2015.0,,2017-01-14,,2016/1/14,38,Orp #1,102I09E:,102I070:,50,38,59,128,5,13,9,5611257,564550,50.649722,-128.086944,AU:,,,NAN,3.0,NIMO:,Nanaimo,Nanaimo,ORP 1,102I  012,,ORP 1,"Geological,<br>Geochemical","Geological, Geochemical",32396,"Bilquist, Ronald John (102389)","Bilquist, Ronald John (102389)","Bilquist, Ronald John (102389)",Gold,"Triassic, Vancouver Group, Quatsino Formation, Limestones, Parson Bay Formation, Porphyry dykes, Marbles, Calcareous rocks, Orpiment, Realgar, Cinnabar, Skarns, Arsenopyrite, Pyrite",7908.9,1.837,4305.334785,1.443,5480.873181,1.224,6461.519608,http://aris.empr.gov.bc.ca/search.asp?mode=repsum&rep_no=36053
18278,35732,1.0,2015/10/17,GEOC:,11846,Geochemical Assessement Report,2015,2015.0,,2016-10-17,,2015/10/17,65,Port Alice Dolomite,092L06W:,092L043:,50,26,47,127,30,5,9,5589337,606401,50.446389,-127.50138899999999,DO:,,,NAN,3.0,NIMO:,Nanaimo,Nanaimo,"504307,<br>JEUNE LANDING WEST","092L  151, 092L  461",,"504307, JEUNE LANDING WEST",Geochemical,Geochemical,"27800, 31943, 33944, 34533","Shearer, Johan Tom FMC 124452","Shearer, Johan Tom FMC 124452","Shearer, Johan Tom FMC 124452",Dolomite,"Triassic, Vancouver Group, Quatsino Formation, Limestones, Marbles, Calcareous sedimentary rocks, Dolomites",9910.0,1.804,5493.348115,1.4169999999999998,6993.648553,1.202,8244.592346,http://aris.empr.gov.bc.ca/search.asp?mode=repsum&rep_no=35732
19168,35822,1.0,2015/11/14,PROS:PHYS:,898,Prospecting Report on the Sadsak Claim,2016,2015.0,,2016-11-14,,2015/11/14,14,Sadsak,082F03E:,082F024:082F014:,49,11,45,117,21,21,11,5449287,474076,49.195833,-117.355833,AU:,3.0,,CRA,3.0,NELS:,Nelson,Nelson,SADSAK,"082FSW267, 082FSW402, 082FSW405",Salmo - Sheep Creek Area,SADSAK,"Prospecting,<br>Physical","Prospecting, Physical","20208, 32900, 34004",Tom Kennedy,Tom Kennedy,Tom Kennedy,Gold,"Jurassic, Granites, Alkali-feldspar granites, Rossland Group, Elise Formation, Basaltic volcanic rocks, Quartz veins, Pyrite, Galena, Nelson Batholith, Sphalerite, Arsenopyrite, Polymetallic Veins, Quartz stockworks",900.0,1.837,489.9292324,1.443,623.7006237,1.224,735.2941176,http://aris.empr.gov.bc.ca/search.asp?mode=repsum&rep_no=35822
19211,35660,1.0,2015/10/18,GEOC:,2101,Bonanza Dump Rock Study,2015,2015.0,,2016-10-18,,2015/10/18,24,Silver King,082F06W:,082F044:,49,25,18,117,18,8,11,5474376,478082,49.421667,-117.302222,AG:CU:PB:ZN:,4.0,,CRA,3.0,NELS:,Nelson,Nelson,SK Bonanza,"082FSW173, 082FSW175, 082FSW176",Ymir - Nelson Area,SK Bonanza,Geochemical,Geochemical,"04701, 12611, 21277, 22276, 22394, 22662, 23078, 23250, 26356, 32818, 35220, 35608","Graham, John Donald","Graham, John Donald","Graham, John Donald","Silver, Copper, Lead, Zinc","Jurassic, Elise Formation, Mafic volcanics, Tuffs, Volcaniclastic rocks, Quartz-chalcedony veins, Pyrite, Chalcopyrite, Galena, Sphalerite, Tetrahedrite, Bornite, Rossland Group, Basaltic volcanics",1730.62,1.804,959.3237251,1.4169999999999998,1221.326747,1.202,1439.783694,http://aris.empr.gov.bc.ca/search.asp?mode=repsum&rep_no=35660
19238,36134,1.0,2016/2/23,PROS:,2097,Prospecting Report,2016,2015.0,,2017-02-23,,2016/2/23,10,Thea,082F08E:,082F030:,49,15,45,116,10,15,11,5456968,560328,49.2625,-116.170833,AU:,1.0,,CRA,3.0,NELS:,Nelson,Nelson,THEA,082FSE147,Purcell Belt (Sullivan),THEA,Prospecting,Prospecting,"27465, 36099","Kennedy, Thomas Peter James (FMC134308)","Kennedy, Thomas Peter James (FMC134308)","Kennedy, Sean J. (FMC # 142365)",Gold,"Proterozoic, Purcell Supergroup, Aldridge Formation, Quartzites, Argillites, Moyie sills, Gabbro sills, Galena, Goethite, Greywackes, Wackes, Conglomerate turbidites",2100.0,1.837,1143.168209,1.443,1455.301455,1.224,1715.686275,http://aris.empr.gov.bc.ca/search.asp?mode=repsum&rep_no=36134
