,rep_no,cnf_prd,aff_dt,gwrk_typs,claim_val,title,rep_yr,wrk_yr,conf_ldate,conf_adate,aff_ndate,aff_adate,page_ct,prpty_nm,nts_maps,bcgs_maps,lat83_deg,lat83_min,lat83_sec,lon83_deg,lon83_min,lon83_sec,zone83,north83,east83,lat83,long83,com_cds,camp_cd,geo_sum,reg_geo,info_cls,mdiv_cds,mdiv_nmx,mdiv_nms,claim_nmx,minf_nox,camp_nm,claim_nms,gwrk_nmx,gwrk_nms,rel_ars,oper_nms,own_nms,auth_nms,com_nms,kwl_nms,MERG_SPENT,DOLL_INX,doll_86,CPIdex1992,doll_92,CPIdex2002,doll_02,URL
19434,32219,1.0,2011/2/1,GEOL:GEOC:,4351,Prospecting and Rock Geochemistry Report on the Big Smoke Property,2011,2010.0,,2012-02-01,,2011/2/1,25,Big Smoke,082F09W:,082F069:,49,38,10,116,15,25,11,5498438,553653,49.636111,-116.25694399999999,,1.0,,CRA,3.0,NELS:,Nelson,Nelson,"705432,<br>705436,<br>705438",,Purcell Belt (Sullivan),"705432, 705436, 705438","Geological,<br>Geochemical","Geological, Geochemical","07676, 07681, 07902, 10311, 10389, 10394, 11209, 11686, 22695, 24877, 25194, 25326, 26118, 26361",Kootenay Gold Inc.,"Kennedy, Robert Duncan Craig","Kennedy, Sean J. (FMC # 142365)",,"Helikian, Aldridge Formation, Wackes, Siltstones, Fragmentals",5095.0,1.75,2911.428571,1.374,3708.151383,1.165,4373.390558,http://aris.empr.gov.bc.ca/search.asp?mode=repsum&rep_no=32219
19462,32263,1.0,2011/2/28,GEOC:,5303,Rock Geochemistry Report on the South Slocanny Granny Property,2011,2010.0,,2012-02-28,,2011/2/28,38,South Slocanny Granny,082F09W:,082F058:,49,31,8,116,27,40,11,5485287,538995,49.518889,-116.46111100000002,,1.0,,CRA,3.0,NELS:,Nelson,Nelson,"709602,<br>709642",082FNE065,Purcell Belt (Sullivan),"709602, 709642",Geochemical,Geochemical,"09105, 29140, 32262",Kootenay Gold Inc.,"Kennedy, Jonathan Sean","Kennedy, Jonathan Sean",,"Proterozoic, Dutch Creek Formation, Mount Skelly Pluton, Granodiorites, Quartzites, Dolomites",5524.0,1.75,3156.571429,1.374,4020.3784570000003,1.165,4741.6309009999995,http://aris.empr.gov.bc.ca/search.asp?mode=repsum&rep_no=32263
19467,31606,1.0,2010/4/14,GEOC:,5307,Rock Geochemistry,2009,2010.0,,2011-04-14,,2010/4/14,23,Sadarsa,082F05E:,082F032:,49,12,46,117,22,4,11,5451175,473215,49.212778,-117.367778,AU:AG:,3.0,,CRA,3.0,NELS:,Nelson,Nelson,"Sadarsa 2,3,4,5","082FSW267, 082FSW266",Salmo - Sheep Creek Area,"Sadarsa 2,3,4,5",Geochemical,Geochemical,"08986, 11542, 12436, 12438, 14890, 18830, 20160, 20208, 20235, 21357, 21685, 22425, 24774, 26050, 30175",Kootenay Gold Inc.,"Lavoie, Darlene (132094)","Kennedy, Tom","Gold, Silver","Jurassic, Rossland Group, Volcanic sediments, Granodiorites, Quartz feldspar porphyry, Felsic dykes, Lamprophyre dykes, Quartz veins",5388.0,1.6869999999999998,3193.83521,1.324,4069.4864049999996,1.123,4797.862867,http://aris.empr.gov.bc.ca/search.asp?mode=repsum&rep_no=31606
19512,31724,1.0,2010/7/14,GEOC:,5953,Technical Report on the Pend Oreille Claim Group,2010,2010.0,,2011-07-14,,2010/7/14,29,Pend Oreille,082F03W:,082F004:,49,0,6,117,19,44,11,5427693,475945,49.001667,-117.32888899999999,PB:ZN:AU:,3.0,,CRA,3.0,NELS:,Nelson,Nelson,Pend Orelle 3,082FSW018,Salmo - Sheep Creek Area,Pend Orelle 3,Geochemical,Geochemical,"06416, 06880, 11447, 12927, 19817","Wallach, David Arnold","Wallach, David Arnold","Ledwon, Anastasia","Lead, Zinc, Gold","Cambrian, Nelway Formation, Active Formation, Limestones, Mudstones, Siltstones, Slates",6204.98,1.709,3630.76653,1.3419999999999999,4623.681073,1.138,5452.530756,http://aris.empr.gov.bc.ca/search.asp?mode=repsum&rep_no=31724
19518,31934,1.0,2010/9/17,GEOC:,6164,Clubine Nevada Project Geochemical Sampling,2010,2010.0,,2011-09-17,,2010/9/17,29,Clubine-Nevada,082F03W:,082F024:,49,14,7,117,15,57,11,5453645,480648,49.235278,-117.265833,AU:,4.0,,CRA,3.0,NELS:,Nelson,Nelson,"597523,<br>600777",082FSW200,Ymir - Nelson Area,"597523, 600777",Geochemical,Geochemical,"10884, 17510, 22137, 22965, 24789, 31473",Crucible Resources Ltd.,"Warkentin, Doug (FMC 145582)","Warkentin, Doug (FMC 145582)",Gold,"Jurassic, Elise Formation, Hall Formation, Argillites, Tuffs",6231.52,1.709,3646.2960799999996,1.3419999999999999,4643.457526,1.138,5475.852373,http://aris.empr.gov.bc.ca/search.asp?mode=repsum&rep_no=31934
19554,31659,1.0,2010/6/22,GEOC:,5892,Rock Geochemistry Report,2010,2010.0,,2011-06-22,,2010/6/22,23,Big Kahuna and Sta,082F08W:,082F029:,49,15,39,116,19,28,11,5456672,549153,49.260833,-116.324444,AU:,,,CRA,3.0,NELS:,Nelson,Nelson,"603141,<br>603142,<br>603246,<br>603247,<br>605579,<br>605580,<br>606471","082FSE006, 082FSE069, 082FSE089",,"603141, 603142, 603246, 603247, 605579, 605580, 606471",Geochemical,Geochemical,"23538, 24950, 25457, 31586",Kootenay Gold Inc.,"Kennedy, Robert Duncan Craig; Kennedy, Jonathan Sean","Kennedy, Jonathan Sean",Gold,"Old Baldy Fault, Aldridge Formation, Vein systems, Proterozoic, Purcell Supergroup, Creston Formation, Gabbro dykes, Lamprophyre dykes, Cretaceous, Bayonne Batholith, Goethite",6756.66,1.709,3953.57519,1.3419999999999999,5034.769001,1.138,5937.3110719999995,http://aris.empr.gov.bc.ca/search.asp?mode=repsum&rep_no=31659
19584,31810,1.0,2010/8/31,PROS:,5485,Geophysical and Geological Report on the Bear Creek Rare Earth Property,2010,2010.0,,2011-08-31,,2010/8/31,28,Bear Creek,082F04E:,082F012:,49,8,7,117,37,20,11,5442681,454613,49.135278,-117.622222,,,,CRA,3.0,NELS:,Nelson,Nelson,"634483,<br>738062",,,"634483, 738062",Prospecting,Prospecting,"17330, 18872","Wallach, David Arnold","Wallach, David Arnold","Wallach, David Arnold",,"Jurassic, Elise Formation, Granodiorites, Basalts, Rare earths",7338.37,1.709,4293.955529999999,1.3419999999999999,5468.233979,1.138,6448.479789,http://aris.empr.gov.bc.ca/search.asp?mode=repsum&rep_no=31810
19627,32399,1.0,2011/8/24,GEOC:,11449,Soil Geochemistry and Geology on the Kootenay Belle Mine,2011,2010.0,,2012-08-24,,2011/8/24,28,Kootenay Belle,082F03E:,082F015:,49,8,49,117,7,20,11,5443798,491087,49.146944,-117.122222,,3.0,,CRA,3.0,NELS:,Nelson,Nelson,"232822,<br>232823","082FSW044, 082FSW049",Salmo - Sheep Creek Area,"232822, 232823",Geochemical,Geochemical,"11066, 11589, 16861, 31224","Goldsmith, Locke B. (FMC #109865)","Goldsmith, Locke B. (FMC #109865)","Goldsmith, Locke B. (FMC #109865)",,"Proterozoic-Cambrian, Hamill Group, Laib Formation, Quartzites, Quartz arenites",8807.48,1.75,5032.845714,1.374,6410.101892000001,1.165,7560.068670000001,http://aris.empr.gov.bc.ca/search.asp?mode=repsum&rep_no=32399
19658,32254,1.0,2011/3/1,GEOC:,13866,Report on Reconnaissance Soil Geochemistry on the Rely Property,2011,2010.0,,2012-03-01,,2011/3/1,36,Rely,082F03W:,082F023:,49,12,21,117,28,0,11,5450440,466000,49.205833,-117.46666699999999,AU:CU:PB:ZN:AG:,4.0,,CRA,3.0,NELS:,Nelson,Nelson,"619663,<br>687047,<br>687087",082FSW266,Ymir - Nelson Area,"619663, 687047, 687087",Geochemical,Geochemical,"08469, 09157, 12762, 14043, 18938","Bourdon, R.J.","Bourdon, R.J.","Bourdon, R.J.","Gold, Copper, Lead, Zinc, Silver","Jurassic, Elise Formation, Archibald Formation, Bonnington Pluton, Granodiorites, Basalts, Mudstones, Siltstones",9731.37,1.75,5560.782857,1.374,7082.5109170000005,1.165,8353.107296,http://aris.empr.gov.bc.ca/search.asp?mode=repsum&rep_no=32254
19739,31779,1.0,2010/8/5,GEOL:,11183,Geology of the Purple Chubbs Property,2010,2010.0,,2011-08-05,,2010/8/5,35,Purple Chubbs,082F04E:,082F013:,49,11,18,117,34,6,11,5448548,458588,49.188333,-117.56833300000001,AU:CU:,,,CRA,3.0,NELS:,Nelson,Nelson,Purple Chubbs 1-2,,,Purple Chubbs 1-2,Geological,Geological,,Kootenay Gold Inc.,"Kennedy, Thomas Peter James (FMC134308)","Hoy, Trygve","Gold, Copper","Jurassic, Elise Formation, Conglomerates, Andesitic tuffs, Tuffs, Breccias, Quartz monzonites",12117.0,1.709,7090.111176,1.3419999999999999,9029.061103,1.138,10647.62742,http://aris.empr.gov.bc.ca/search.asp?mode=repsum&rep_no=31779
19806,31928,1.0,2010/12/13,PROS:,15763,Assessment Report for the Lost Mine Property,2010,2010.0,,2011-12-13,,2010/12/13,88,Lost Mine,082F02W:,082F016:,49,11,42,116,50,14,11,5449146,511859,49.195,-116.837222,CU:AG:AU:,,,CRA,4.0,NELS:,Nelson,Nelson,"501469,<br>501561,<br>501599,<br>501319,<br>526680,<br>524219",082FSE048,,"501469, 501561, 501599, 501319, 526680, 524219",Prospecting,Prospecting,"11028, 28122, 28687, 29546, 30466, 31272","Oppelt, Harold (#143039)","Oppelt, Harold (#143039)","Oppelt, Harold (#143039)","Copper, Silver, Gold","Jurassic-Cretaceous, Granodiorites, Granites",15800.0,1.709,9245.172616,1.3419999999999999,11773.47243,1.138,13884.00703,http://aris.empr.gov.bc.ca/search.asp?mode=repsum&rep_no=31928
19936,31978,1.0,2010/10/4,PHYS:GEOC:,22373,Line Cutting and Geochemical Soil Sampling Technical Report,2011,2010.0,,2011-10-04,,2010/10/4,75,Mammoth,082F11W:,082F053:,49,31,12,117,27,16,11,5485364,467108,49.52,-117.454444,AU:MO:CU:ZN:,,,CRA,3.0,NELS:,Nelson,Nelson,"543797,<br>546706,<br>546714",,,"543797, 546706, 546714","Physical,<br>Geochemical","Physical, Geochemical","00457, 20586, 23194, 27912","Carter, Ruth","Walker, Albert; Carter, Ruth","Buss. L. P.Geo., P.Geol","Gold, Molybdenum/Molybdenite, Copper, Zinc","Nelson Batholith, Granites, Granodiorites, Tuffaceous sediments, Pyroxenites, Jurassic, Triassic-Jurassic, Ymir Group, Rossland Group",27236.99,1.75,15563.99429,1.374,19823.13683,1.165,23379.39056,http://aris.empr.gov.bc.ca/search.asp?mode=repsum&rep_no=31978
19966,32218,1.0,2011/2/24,GEOL:GEOC:,32782,Geology and Geochemical Report on the Ruby Steele Property,2011,2010.0,,2012-02-24,,2011/2/24,128,Ruby Steele,082F14W:,082F073:,49,47,49,117,25,51,11,5516143,468994,49.796944,-117.430833,,7.0,,CRA,3.0,NELS:,Nelson,Nelson,"607060,<br>705871,<br>737822,<br>773162,<br>773182,<br>774202,<br>774262,<br>774362,<br>774406,<br>774442,<br>774462","082FNW167, 082FNW173, 082FNW216",Tillicum Mountain Area,"607060, 705871, 737822, 773162, 773182, 774202, 774262, 774362, 774406, 774442, 774462","Geological,<br>Geochemical","Geological, Geochemical","09732, 11126, 11809, 11836, 13552, 14803, 15204, 16249, 32244",Kootenay Gold Inc.,"Kennedy, Thomas Peter James (FMC134308)","Kennedy, Thomas Peter James (FMC134308); Hoy, Trygve",,"Jurassic, Paleocene-Eocene, Carboniferous-Permian, Nelson Batholith, Sheppard Intrusions, Granodiorites, Granites, Ultramafics",32877.0,1.75,18786.85714,1.374,23927.9476,1.165,28220.600860000002,http://aris.empr.gov.bc.ca/search.asp?mode=repsum&rep_no=32218
20008,32785,1.0,2011/7/23,GEOP:PHYS:GEOC:,32535,Geochemical and Geophysical Report on the Klovance Property,2011,2010.0,,2012-07-23,,2011/7/23,115,Klovance,082F03W:,082F023:,49,14,41,117,24,18,11,5454740,470523,49.244721999999996,-117.405,AG:PB:ZN:CU:,,,CRA,3.0,NELS:,Nelson,Nelson,"646645,<br>830970,<br>830971,<br>646663",082FSW381,,"646645, 830970, 830971, 646663","Geophysical,<br>Physical,<br>Geochemical","Geophysical, Physical, Geochemical",31931,Swift Resources Inc.,"Cherry, Tom; Doyle, Bruce A.","Caron, Linda J.","Silver, Lead, Zinc, Copper","Rossland Group, Jurassic, Bonnington Pluton, Basaltic volcanics, Granodiorites, Granodiorites, Quartz diorites, Quartz diorites, Hornfels, Skarns",45501.77,1.75,26001.011430000002,1.374,33116.28093,1.165,39057.3133,http://aris.empr.gov.bc.ca/search.asp?mode=repsum&rep_no=32785
20046,31929,1.0,2010/11/17,GEOL:PHYS:GEOC:,58271,"2010 Work Program, Soil and Rock Geochemistry on the Amazing Grace Property",2010,2010.0,,2011-11-17,,2010/11/17,179,Amazing Grace,082F05E:,082F023:,49,17,2,117,32,47,11,5459159,460263,49.283889,-117.54638899999999,AU:AG:,,,CRA,3.0,NELS:,Nelson,Nelson,"501113,<br>553134,<br>550797,<br>545599,<br>501117,<br>505016,<br>505249","082FSW325, 082FSW375",,"501113, 553134, 550797, 545599, 501117, 505016, 505249","Geological,<br>Physical,<br>Geochemical","Geological, Physical, Geochemical","30359, 29881, 29530, 29263, 27969, 27834, 26427, 26153, 25219, 24119",Swift Resources Inc.,"Denny, Jack; Doyle, Bruce A.","Caron, Linda J.","Gold, Silver","Bonnington Pluton, Volcanics, Sediments, Quartz veins, Sericite alteration, Eocene, Faults, Rossland Group, Hornfels, Granodiorites, Quartz diorites, Aplite dykes, Feldspar porphyry, Elise Formation, Scheelite, Molybdenite, Gold",59179.82,1.709,34628.33236,1.3419999999999999,44098.22653,1.138,52003.35677,http://aris.empr.gov.bc.ca/search.asp?mode=repsum&rep_no=31929
20341,32409,1.0,2010/12/22,PROS:,86,2010 Prospecting Report on the Old Settle Frac Property,2010,2010.0,,2011-12-22,,2010/12/22,0,Old Setter Frac,092H06W:,092H043:,49,29,8,121,28,27,10,5482554,610512,49.485556,-121.474167,,20.0,,NAN,4.0,NWES:,New Westminster,New Westminster,Old Settler Frac,,Lillooet River - Harrison Lake Belt,Old Settler Frac,Prospecting,Prospecting,,"D'Aoust, Robert A.","D'Aoust, Robert A.","D'Aoust, Robert A.",,"Cretaceous-Tertiary, Amphibolites",100.0,1.709,58.51375073,1.3419999999999999,74.51564829,1.138,87.87346221,http://aris.empr.gov.bc.ca/search.asp?mode=repsum&rep_no=32409
20345,32140,1.0,2011/3/13,PROS:,105,2010 - 2011 Prospecting Report on the Crossing Property,2011,2010.0,,2012-03-13,,2011/3/13,7,Crossing,092H06W:,092H044:,49,26,37,121,16,45,10,5478195,624742,49.443611,-121.27916699999999,,19.0,,KAM,4.0,NWES:,New Westminster,New Westminster,600989,,Coquihalla Gold Belt,600989,Prospecting,Prospecting,,"Chamberlain, David Reginald","Chamberlain, David Reginald","Amey, William Larry",,"Permian-Jurassic, Hozameen Complex, Sedimentary rocks",156.8,1.75,89.6,1.374,114.1193595,1.165,134.5922747,http://aris.empr.gov.bc.ca/search.asp?mode=repsum&rep_no=32140
20360,31785,1.0,2010/9/28,PROS:,252,2009 - 2010 Prospecting Report on the Cross Rock Property,2010,2010.0,,2011-09-28,,2010/9/28,7,Cross Rock,092H06W:,092H044:,49,26,26,121,16,52,10,5477852,624608,49.440556,-121.28111100000001,,19.0,,KAM,4.0,NWES:,New Westminster,New Westminster,650683,,Coquihalla Gold Belt,650683,Prospecting,Prospecting,,"Chamberlain, David Reginald","Chamberlain, David Reginald","Amey, William Larry",,"Permian-Jurassic, Hozameen Complex, Sedimentary rocks",281.6,1.709,164.7747221,1.3419999999999999,209.83606559999998,1.138,247.4516696,http://aris.empr.gov.bc.ca/search.asp?mode=repsum&rep_no=31785
20381,31603,1.0,2010/7/13,PROS:,516,Prospecting Report on the Andy One Property,2010,2010.0,,2011-07-13,,2010/7/13,7,Andy One,092H11W:,092H064:,49,40,5,121,18,43,10,5503093,621806,49.668056,-121.311944,AU:AG:,19.0,,NAN,3.0,NWES:,New Westminster,New Westminster,538210,092HSW107,Coquihalla Gold Belt,538210,Prospecting,Prospecting,"04930, 05053, 05440, 05870, 06236, 09035, 09035, 10515, 29370, 30227, 31060","Amey, William Larry","Amey, William Larry","Amey, William Larry","Gold, Silver","Jurassic, Ladner Group, Argillites, Slates, Siltstones, Pyrite, Pyrrhotite",504.8,1.709,295.37741370000003,1.3419999999999999,376.1549925,1.138,443.58523729999996,http://aris.empr.gov.bc.ca/search.asp?mode=repsum&rep_no=31603
20382,31604,1.0,2010/7/13,PROS:,503,2009 - 2010 Prospecting Report on the Silver Salam Property,2010,2010.0,,2011-07-13,,2010/7/13,7,Silver Salam,092H06E:,092H044:,49,29,57,121,14,47,10,5484426,626974,49.499167,-121.246389,,19.0,,NAN,4.0,NWES:,New Westminster,New Westminster,537127,092HSW107,Coquihalla Gold Belt,537127,Prospecting,Prospecting,"05053, 30227, 31060","Amey, William Larry","Amey, William Larry","Amey, William Larry",,"Jurassic, Ladner Group, Argillites, Mudstones",504.8,1.709,295.37741370000003,1.3419999999999999,376.1549925,1.138,443.58523729999996,http://aris.empr.gov.bc.ca/search.asp?mode=repsum&rep_no=31604
20393,31862,1.0,2010/11/29,PROS:,602,2009 - 2010 Prospecting Report on the Serpentine Junction Property,2010,2010.0,,2011-11-29,,2010/11/29,8,Serpentine Junction,092H06E:,092H035:,49,21,43,121,11,20,10,5469270,631503,49.361944,-121.18888899999999,,19.0,,KAM,4.0,NWES:,New Westminster,New Westminster,677143,,Coquihalla Gold Belt,677143,Prospecting,Prospecting,,"Amey, William Larry","Amey, William Larry","Amey, William Larry",,"Permian-Jurassic, Hozameen Complex, Ladner Group, Mudstones, Siltstones",607.94,1.709,355.7284962,1.3419999999999999,453.01043219999997,1.138,534.2179262,http://aris.empr.gov.bc.ca/search.asp?mode=repsum&rep_no=31862
20401,32445,1.0,2011/7/12,PROS:,710,2010 - 2011 Prospecting Report on the Silver Salam,2011,2010.0,,2012-07-12,,2011/7/12,7,Silver Salam,092H06E:,092H044:,49,29,57,121,14,47,10,5484426,626974,49.499167,-121.246389,,19.0,,NAN,4.0,NWES:,New Westminster,New Westminster,537127,092HSW107,Coquihalla Gold Belt,537127,Prospecting,Prospecting,"05053, 30227, 31060, 31604","Amey, William Larry","Amey, William Larry","Amey, William Larry",,"Jurassic, Ladner Group, Argillites, Mudstones",719.2,1.75,410.9714286,1.374,523.4352256,1.165,617.3390558,http://aris.empr.gov.bc.ca/search.asp?mode=repsum&rep_no=32445
20418,32139,1.0,2011/3/16,PROS:,839,2010 - 2011 Prospecting Report Nine Mile,2011,2010.0,,2012-03-16,,2011/3/16,7,Nine Mile,092H06W:,092H044:,49,25,20,121,18,43,10,5475764,622419,49.422222,-121.311944,,19.0,,KAM,4.0,NWES:,New Westminster,New Westminster,578614,,Coquihalla Gold Belt,578614,Prospecting,Prospecting,,"Chamberlain, David Reginald","Chamberlain, David Reginald","Amey, William Larry",,"Permian-Jurassic, Hozameen Complex, Basalts",854.8,1.75,488.45714289999995,1.374,622.125182,1.165,733.7339056,http://aris.empr.gov.bc.ca/search.asp?mode=repsum&rep_no=32139
20420,32141,1.0,2011/3/16,PROS:,819,2010 - 2011 Prospecting Report on the Deneau Creek Property,2011,2010.0,,2012-03-16,,2011/3/16,8,Deneau Creek,092H06W:,092H044:,49,26,12,121,18,9,10,5477385,623068,49.436667,-121.3025,,19.0,,KAM,4.0,NWES:,New Westminster,New Westminster,578616,,Coquihalla Gold Belt,578616,Prospecting,Prospecting,30857,"Chamberlain, David Reginald","Chamberlain, David Reginald","Amey, William Larry",,"Permian-Jurassic, Hozameen Complex, Sedimentary rocks",875.2,1.75,500.1142857,1.374,636.9723435,1.165,751.2446352000001,http://aris.empr.gov.bc.ca/search.asp?mode=repsum&rep_no=32141
20424,32260,1.0,2011/5/17,PROS:,868,Prospecting Report on the Ghost Valley Property,2011,2010.0,,2012-05-17,,2011/5/17,8,Ghost Valley,092H06E:,092H025:,49,17,32,121,6,20,10,5461668,637748,49.292221999999995,-121.105556,,19.0,,KAM,4.0,NWES:,New Westminster,New Westminster,777442,,Coquihalla Gold Belt,777442,Prospecting,Prospecting,"29463, 30908","Chamberlain, David Reginald","Chamberlain, David Reginald","Amey, William Larry",,"Permian-Jurassic, Hozameen Complex, Ultramafics, Mudstones",945.28,1.75,540.16,1.374,687.9767102999999,1.165,811.3991416,http://aris.empr.gov.bc.ca/search.asp?mode=repsum&rep_no=32260
20427,32142,1.0,2011/3/16,PROS:,839,2010 - 2011 Prospecting Report on the Ten Mile Property,2011,2010.0,,2012-03-16,,2011/3/16,8,Ten Mile,092H06W:,092H044:,49,25,48,121,18,29,10,5476635,622682,49.43,-121.30805600000001,,19.0,,KAM,4.0,NWES:,New Westminster,New Westminster,578615,,Coquihalla Gold Belt,578615,Prospecting,Prospecting,30849,"Chamberlain, David Reginald","Chamberlain, David Reginald","Amey, William Larry",,"Permian-Jurassic, Hozameen Complex, Basalts, Sedimentary rocks",980.8,1.75,560.4571429,1.374,713.8282387,1.165,841.8884119999999,http://aris.empr.gov.bc.ca/search.asp?mode=repsum&rep_no=32142
20435,32143,1.0,2011/3/16,PROS:,904,2010 - 2011 Prospecting Report on the Karen Creek Property,2011,2010.0,,2012-03-16,,2011/3/16,7,Karen Creek,092H06W:,092H044:,49,26,20,121,17,35,10,5477647,623747,49.438889,-121.293056,,19.0,,KAM,4.0,NWES:,New Westminster,New Westminster,578618,,Coquihalla Gold Belt,578618,Prospecting,Prospecting,30858,"Chamberlain, David Reginald","Chamberlain, David Reginald","Amey, William Larry",,"Permian-Jurassic, Hozameen Complex, Sedimentary rocks",1032.4,1.75,589.9428571000001,1.374,751.3828239000001,1.165,886.1802574999999,http://aris.empr.gov.bc.ca/search.asp?mode=repsum&rep_no=32143
20461,32132,1.0,2011/3/13,PROS:,1374,2010 - 2011 Prospecting Report,2011,2010.0,,2012-03-13,,2011/3/13,11,Broken Hill,092H06W:,092H044:,49,24,30,121,18,53,10,5474215,622252,49.408333,-121.314722,,19.0,,KAM,4.0,NWES:,New Westminster,New Westminster,600988,,Coquihalla Gold Belt,600988,Prospecting,Prospecting,31517,"Amey, William Larry","Amey, Sarah Della Lila","Amey, William Larry",,"Permian-Jurassic, Hozameen Complex, Basalts, Gravels",1380.4,1.75,788.8,1.374,1004.657933,1.165,1184.8927039999999,http://aris.empr.gov.bc.ca/search.asp?mode=repsum&rep_no=32132
20473,32408,1.0,2010/12/22,PROS:,1271,2010 Prospecting Report on the Old Settler Property,2010,2010.0,,2011-12-22,,2010/12/22,8,Old Settler,092H06W:,092H043:,49,28,38,121,26,58,10,5481664,612322,49.477222,-121.449444,,20.0,,NAN,4.0,NWES:,New Westminster,New Westminster,"688183,<br>691903",,Lillooet River - Harrison Lake Belt,"688183, 691903",Prospecting,Prospecting,,"D'Aoust, Robert A.","D'Aoust, Robert A.","D'Aoust, Robert A.",,"Cretaceous-Tertiary, Amphibolites, Custer-Skagit gneiss, Orthogneisses",1500.0,1.709,877.7062609999999,1.3419999999999999,1117.734724,1.138,1318.101933,http://aris.empr.gov.bc.ca/search.asp?mode=repsum&rep_no=32408
20506,31765,1.0,2010/5/20,PROS:,1887,Emory Placer Claim,2010,2010.0,,2011-05-20,,2010/5/20,14,Emory,092H11W:,092H053:,49,30,43,121,25,17,10,5485566,614273,49.511944,-121.42138899999999,AU:,,,NAN,3.0,NWES:,New Westminster,New Westminster,Emory,,,Emory,Prospecting,Prospecting,"26571, 26538","Goldsmith, Elmar L.","Goldsmith, Elmar L.","Goldsmith, Elmar L.",Gold,"Placer, Gravels",1930.0,1.709,1129.315389,1.3419999999999999,1438.152012,1.138,1695.9578210000002,http://aris.empr.gov.bc.ca/search.asp?mode=repsum&rep_no=31765
20560,32222,1.0,2011/2/9,GEOC:,2492,Geochemical Sampling Report on the Coquihalla Gold Belt Project,2011,2010.0,,2012-02-09,,2011/2/9,28,Karen Creek,092H06E:,092H044:,49,27,21,121,14,18,10,5479622,627670,49.455833,-121.23833300000001,,19.0,,KAM,3.0,NWES:,New Westminster,New Westminster,CGB-N,,Coquihalla Gold Belt,CGB-N,Geochemical,Geochemical,"02999, 03000, 03620, 13046, 26533",Crucible Resources Ltd.,"Warkentin, Doug (FMC 145582)","Warkentin, Doug (FMC 145582)",,"Triassic, Spider Peak Formation, Ladner Group, Basalts, Argillites, Siltstones",2883.07,1.75,1647.468571,1.374,2098.304221,1.165,2474.7381969999997,http://aris.empr.gov.bc.ca/search.asp?mode=repsum&rep_no=32222
20561,32288,1.0,2011/5/9,GEOC:,351,Coquihalla Gold Belt Project,2011,2010.0,,2012-05-09,,2011/5/9,28,Karen Creek,092H06E:,092H044:,49,27,28,121,14,0,10,5479847,628027,49.457778000000005,-121.233333,,19.0,,NAN,3.0,NWES:,New Westminster,New Westminster,705889,,Coquihalla Gold Belt,705889,Geochemical,Geochemical,"08533, 09506, 09766, 12340, 26533, 31555",Crucible Resources Ltd.,"Warkentin, Doug (FMC 145582)","Warkentin, Doug (FMC 145582)",,"Triassic, Spider Peak Formation, Ladner Group, Basalts, Argillites, Siltstones, Ultramafics",2883.07,1.75,1647.468571,1.374,2098.304221,1.165,2474.7381969999997,http://aris.empr.gov.bc.ca/search.asp?mode=repsum&rep_no=32288
20640,32251,1.0,2011/2/25,GEOL:,3814,Geological Report on the Master Ace Property,2011,2010.0,,2012-02-25,,2011/2/25,22,Master Ace,092H06E:,092H035:,49,19,40,121,7,1,10,5465600,636822,49.327778,-121.11694399999999,,19.0,,KAM,3.0,NWES:,New Westminster,New Westminster,721982,092HSW145,Coquihalla Gold Belt,721982,Geological,Geological,"14527, 14570, 14751, 15323, 29965, 30808","Cardinal, Daniel G.","Cardinal, Daniel G.; Olynyk, Ronald","Cardinal, Daniel G.",,"Cretaceous, Jackass Mountain Group, Ladner Group, Quartz monzonites, Greywackes, Shales, Siltstones",3900.0,1.75,2228.571429,1.374,2838.427948,1.165,3347.639485,http://aris.empr.gov.bc.ca/search.asp?mode=repsum&rep_no=32251
20661,31731,1.0,2010/10/4,GEOL:GEOC:,4025,Asbestos Mineral Check of Rocks at Vedder Mountain Quarry,2010,2010.0,,2011-10-04,,2010/10/4,28,Vedder Mountain,092G01E:,092G010:,49,5,3,122,0,13,10,5437300,572750,49.084167,-122.003611,AB:,,,NAN,3.0,NWES:,New Westminster,New Westminster,512638,,,512638,"Geological,<br>Geochemical","Geological, Geochemical","11133, 21044, 27573, 29191, 31366","Kirkness, Bryan","Kirkness, Bryan","Randall, A. W",Asbestos,"Permian, Jurassic, Vedder metamorphic complex, Kent Formation, Amphibolites, Conglomerates",4026.7,1.709,2356.173201,1.3419999999999999,3000.5216100000002,1.138,3538.4007030000002,http://aris.empr.gov.bc.ca/search.asp?mode=repsum&rep_no=31731
20737,31595,1.0,2010/5/19,PROS:GEOC:,1339,2009 Prospecting Report,2010,2010.0,,2011-05-19,,2010/5/19,34,Mamquam 5,092G10W:,092G066:,49,37,53,122,55,30,10,5497651,505416,49.631389,-122.925,,21.0,,NAN,3.0,NWES:,New Westminster,New Westminster,Mamquam 5,,Britannia Area,Mamquam 5,"Prospecting,<br>Geochemical","Prospecting, Geochemical","29120, 29233, 29949, 30074, 30303, 30738, 30950, 31177","MacKenzie, Kenneth (FMC # 116450)","MacKenzie, Kenneth (FMC # 116450)","MacKenzie, Kenneth (FMC # 116450)",,"Gambier Group, Rhyolites, Andesites, Tuffs, Cherts, Volcaniclastics, Granodiorites, Quartz diorites, Jurassic, Cretaceous",5089.62,1.709,2978.1275600000004,1.3419999999999999,3792.5633380000004,1.138,4472.425308,http://aris.empr.gov.bc.ca/search.asp?mode=repsum&rep_no=31595
20740,31887,1.0,2010/11/4,GEOC:,7344,Geochemical Report on the Serp Property,2010,2010.0,,2011-11-04,,2010/11/4,37,Serp,092H06E:,092H044:,49,24,59,121,13,5,10,5475272,629243,49.416389,-121.218056,NI:CO:MG:AU:,19.0,,NAN,3.0,NWES:,New Westminster,New Westminster,"Serp 1-4,<br>Serp 8",092HSW136,Coquihalla Gold Belt,"Serp 1-4, Serp 8",Geochemical,Geochemical,"26066, 26322, 09766, 08533, 12340, 22521, 13046",Almo Capital Corp.,"Vallabh, Ram","Vallabh, Ram","Nickel, Cobalt, Magnesium, Gold","Hozameen Group, Cherts, Cherty argillites, Serpentine, Greenstones, Spider Peak Formation, Siltstones, Argillites, Slates, Ladner Group, Jurassic-Cretaceous, Permian-Jurassic, Hozameen Fault",5165.0,1.709,3022.235225,1.3419999999999999,3848.7332340000003,1.138,4538.664323,http://aris.empr.gov.bc.ca/search.asp?mode=repsum&rep_no=31887
