,rep_no,cnf_prd,aff_dt,gwrk_typs,claim_val,title,rep_yr,wrk_yr,conf_ldate,conf_adate,aff_ndate,aff_adate,page_ct,prpty_nm,nts_maps,bcgs_maps,lat83_deg,lat83_min,lat83_sec,lon83_deg,lon83_min,lon83_sec,zone83,north83,east83,lat83,long83,com_cds,camp_cd,geo_sum,reg_geo,info_cls,mdiv_cds,mdiv_nmx,mdiv_nms,claim_nmx,minf_nox,camp_nm,claim_nms,gwrk_nmx,gwrk_nms,rel_ars,oper_nms,own_nms,auth_nms,com_nms,kwl_nms,MERG_SPENT,DOLL_INX,doll_86,CPIdex1992,doll_92,CPIdex2002,doll_02,URL
25226,25722,1.0,1998/8/20,GEOL:PHYS:GEOC:,16600,Exploration Program on the Atty Property,1998,1998.0,,1999-08-20,,1998/8/20,66,Atty,094E02E:,9.40E+08,57,4,52,126,44,3,9,6328695,637330,57.081111,-126.734167,CU:AU:AG:,51.0,,SMI,3.0,OMIN:,Omineca,Omineca,Atty 3-4,094E  022,Toodoggone Camp,Atty 3-4,"Geological,<br>Physical,<br>Geochemical","Geological, Physical, Geochemical","06650, 08013, 09038, 10113, 10742, 21059",Electrum Resource Corp. (FMC 107591),Electrum Resource Corp. (FMC 107591),"Ronning, Peter A.","Copper, Gold, Silver","Triassic, Takla Group, Basalts, Andesites, Lapilli tuffs",13721.54,1.4,9801.1,1.1,12474.12727,0.934,14691.156319999998,http://aris.empr.gov.bc.ca/search.asp?mode=repsum&rep_no=25722
25298,25786,1.0,1999/1/5,GEOC:,12800,Geochemical Report on the Mat Property,1998,1998.0,,2000-01-05,,1999/1/5,27,Mat,094C04E:,092K023,50,13,59,125,34,5,10,5567699,316857,50.233056,-125.568056,AG:,,,PRG,3.0,OMIN:,Omineca,Omineca,Rolly,094C  099,,Rolly,Geochemical,Geochemical,"14192, 21865",Canasil Resources Inc.,Canasil Resources Inc.,"Weishaupt, Paul J.",Silver,"Jurassic, Takla Group, Fragmentals, Andesites, Quartz veins, Argentite",14343.0,1.4,10245.0,1.1,13039.090909999999,0.934,15356.53105,http://aris.empr.gov.bc.ca/search.asp?mode=repsum&rep_no=25786
25970,25628,1.0,1998/6/4,GEOP:PHYS:,21600,Line Cutting and Geophysical Report on the Len 3-5 Claims,1998,1998.0,,1999-06-04,,1998/6/4,20,Len,093L09W:093L16W:,093L079:,54,44,0,126,19,6,9,6068418,672657,54.733332999999995,-126.31833300000001,CU:ZN:,43.0,,SMI,3.0,OMIN:,Omineca,Omineca,Len 3-5,"093L  190, 093L  191",Babine Range,Len 3-5,"Geophysical,<br>Physical","Geophysical, Physical",23048,Hudson Bay Exploration & Development Co.,Hudson Bay Exploration & Development Co.,"Bidwell, Gerald Eugene","Copper, Zinc","Overburden, Jurassic, Hazelton Group",21722.9,1.4,15516.35714,1.1,19748.09091,0.934,23257.92291,http://aris.empr.gov.bc.ca/search.asp?mode=repsum&rep_no=25628
26295,25926,1.0,1999/1/4,GEOL:GEOC:,32000,Geological and Geochemical Report on the Kit Property,1999,1998.0,,2000-01-04,,1999/1/4,26,Kit,093L13W:,093L091,54,53,59,127,53,6,9,6084202,571501,54.899722,-127.885,AU:AG:CU:,42.0,,SMI,3.0,OMIN:,Omineca,Omineca,Kit 1-2,093L  076,Telkwa Range,Kit 1-2,"Geological,<br>Geochemical","Geological, Geochemical","00698, 18058, 19799, 25732",Teck Exploration Ltd.,Teck Corporation,"Smith, Scott William","Gold, Silver, Copper","Jurassic, Hazelton Group, Bulkley Intrusions, Granodiorites, Feldspar porphyry, Pyrite, Pyrrhotite, Chalcopyrite, Arsenopyrite",27211.86,1.416,19217.41525,1.112,24471.09712,0.9440000000000001,28826.122880000003,http://aris.empr.gov.bc.ca/search.asp?mode=repsum&rep_no=25926
26480,25811,1.0,1999/1/21,GEOL:PHYS:GEOP:GEOC:,39200,"Geological, Geochemical and Geophysical Report on the Pil Property",1998,1998.0,,2000-01-21,,1999/1/21,123,Pil,094E07W:,9.40E+37,57,18,59,126,57,6,9,6354462,623363,57.316389,-126.95166699999999,CU:AU:PB:ZN:AG:,51.0,,PRG,3.0,OMIN:,Omineca,Omineca,Pil 6-21,"094E  083, 094E  029, 094E  216, 094E  201, 094E  202, 094E  213, 094E  215",Toodoggone Camp,Pil 6-21,"Geological,<br>Physical,<br>Geophysical,<br>Geochemical","Geological, Physical, Geophysical, Geochemical","01825, 01861, 01888, 01906, 04971, 17451, 22750, 23313, 24356, 25054, 25282",Electrum Resource Corp. (FMC 107591),Electrum Resource Corp. (FMC 107591),"Ronning, Peter A.","Copper, Gold, Lead, Zinc, Silver","Jurassic, Toodoggone Formation, Dacites, Crystal tuffs, Granodiorites, Stereonet diagrams, Rose diagrams",31344.64,1.4,22389.02857,1.1,28495.127269999997,0.934,33559.57173,http://aris.empr.gov.bc.ca/search.asp?mode=repsum&rep_no=25811
26682,25850,1.0,1998/11/15,GEOP:PHYS:,33800,A Geophysical Report on an Induced Polarization Survey on the Whiting Creek Property,1999,1998.0,,1999-11-15,,1998/11/15,30,Whiting Creek,093E11E:,9.30E+76,53,44,16,127,11,56,9,5955853,618797,53.737778000000006,-127.198889,CU:MO:,,,PRG,3.0,OMIN:,Omineca,Omineca,"Whit 3-4,<br>Whit 19","093E  112, 093E  050, 093E  087",,"Whit 3-4, Whit 19","Geophysical,<br>Physical","Geophysical, Physical","03691, 08757, 09119, 09831, 09897, 22109, 23289",Huckleberry Mines Ltd.,Huckleberry Mines Ltd.,"Blower, Steven J.","Copper, Molybdenum/Molybdenite","Jurassic, Hazelton Group, Andesites, Bulkley Intrusions, Hornblende-biotite granodiorites, Chalcopyrite, Molybdenite",36909.95,1.416,26066.348869999998,1.112,33192.40108,0.9440000000000001,39099.523310000004,http://aris.empr.gov.bc.ca/search.asp?mode=repsum&rep_no=25850
26732,25810,1.0,1999/1/20,GEOL:GEOP:GEOC:PHYS:,8000,"Geological, Geochemical and Geophysical Report on the Taken Property",1998,1998.0,,2000-01-20,,1999/1/20,33,Taken,093F02W:093F03E:,093F005,53,2,0,125,0,6,10,5877852,365778,53.033333,-125.001667,AU:,,,PRG,3.0,OMIN:,Omineca,Omineca,Taken 1,,,Taken 1,"Geological,<br>Geophysical,<br>Geochemical,<br>Physical","Geological, Geophysical, Geochemical, Physical","23758, 24203",Paramount Ventures & Finance Inc.,Paramount Ventures & Finance Inc.,"Fox, Peter E.",Gold,"Jurassic, Hazelton Group, Naglico Formation, Lapilli tuffs, Andesites, Basalts, Quartz-carbonate veins, Bornite, Galena",38230.0,1.4,27307.142860000004,1.1,34754.54545,0.934,40931.47752,http://aris.empr.gov.bc.ca/search.asp?mode=repsum&rep_no=25810
26794,25812,1.0,1998/12/14,GEOL:PHYS:GEOC:,36400,Geological and Geochemical Report on the Kemess Property,1999,1998.0,,1999-12-14,,1998/12/14,87,Kemess,094E02W:,9.40E+07,57,3,59,126,50,6,9,6326858,631272,57.066389,-126.835,AU:AG:CU:PB:ZN:,51.0,,PRG,3.0,OMIN:,Omineca,Omineca,"Lake 1-2,<br>Ridge 1,<br>Atty 3-6",094E  108,Toodoggone Camp,"Lake 1-2, Ridge 1, Atty 3-6","Geological,<br>Physical,<br>Geochemical","Geological, Physical, Geochemical","12401, 13022, 16882, 18241",Royal Oak Mines Inc.,Royal Oak Mines Inc.,"Houle, Jacques (FMC 137830)","Gold, Silver, Copper, Lead, Zinc","Permian-Jurassic, Asitka Group, Limestones, Monzonites, Skarns, Porphyry",40798.02,1.416,28812.16102,1.112,36688.866910000004,0.9440000000000001,43218.24153,http://aris.empr.gov.bc.ca/search.asp?mode=repsum&rep_no=25812
26808,25922,1.0,1999/6/11,DRIL:GEOC:,27000,Chisholm Lake Project Drilling Project,1999,1998.0,,2000-06-11,,1999/6/11,78,Chisholm Lake,093L03W:,093L024,54,14,0,127,16,6,9,6010867,612869,54.233332999999995,-127.26833300000001,CU:MO:,,,PRG,3.0,OMIN:,Omineca,Omineca,"CL 4,<br>Star 2,<br>Star 5,<br>Star 16",,,"CL 4, Star 2, Star 5, Star 16","Drilling,<br>Geochemical","Drilling, Geochemical",,Imperial Metals Corp.,Imperial Metals Corp.,"Robertson, Stephen B.","Copper, Molybdenum/Molybdenite","Jurassic, Telkwa Formation, Monzonites, Chalcopyrite, Molybdenite",41250.0,1.416,29131.35593,1.112,37095.32374,0.9440000000000001,43697.0339,http://aris.empr.gov.bc.ca/search.asp?mode=repsum&rep_no=25922
27429,25931,1.0,1999/1/4,GEOL:GEOC:,37800,Geological Report on the Jake Property,1999,1998.0,,2000-01-04,,1999/1/4,87,Jake,094D03W:,094D024,56,15,0,127,20,7,9,6235151,603148,56.25,-127.335278,AU:AG:CU:,,,SMI,3.0,OMIN:,Omineca,Omineca,Jake 1-5,094D  061,,Jake 1-5,"Geological,<br>Geochemical","Geological, Geochemical","01874, 03868, 04563, 05947, 06492, 16838, 20607, 25530",Teck Exploration Ltd.,Teck Corporation,"Smith, Scott William","Gold, Silver, Copper","Jurassic, Bowser Lake Group, Breccias, Monzonites, Diorites, Feldspar porphyry",74661.94,1.416,52727.35876,1.112,67142.03237,0.9440000000000001,79091.03814,http://aris.empr.gov.bc.ca/search.asp?mode=repsum&rep_no=25931
27535,25739,1.0,1998/8/25,DRIL:GEOC:,30000,Diamond Drilling Report on the 1998 Exploration of the Lustdust Property,1998,1998.0,,1999-08-25,,1998/8/25,77,Lustdust,093N11W:,093N053:,55,34,0,125,25,6,10,6160507,347507,55.566667,-125.418333,,,,PRG,3.0,OMIN:,Omineca,Omineca,"Wow 1,<br>MV 1-2",093N  009,,"Wow 1, MV 1-2","Drilling,<br>Geochemical","Drilling, Geochemical","07059, 07509, 07759, 08669, 09937, 21965, 22309, 22726, 24735",Alpha Gold Corp.,Alpha Gold Corp.,"Evans, Graeme",,"Permian, Cache Creek Complex, Limestones, Marbles, Phyllites, Argillites, Sphalerite, Pyrite, Arsenopyrite, Stibnite",82007.53,1.4,58576.80714,1.1,74552.3,0.934,87802.49465,http://aris.empr.gov.bc.ca/search.asp?mode=repsum&rep_no=25739
27781,25802,1.0,1999/1/20,GEOL:GEOC:,8200,Geological Report on the Carruthers Pass Property,1998,1998.0,,2000-01-20,,1999/1/20,61,Carruthers Pass,094D08W:,094D039,56,23,0,126,18,7,9,6252012,666579,56.38333299999999,-126.30194399999999,CU:ZN:,,,PRG,3.0,OMIN:,Omineca,Omineca,"Car 1-3,<br>Rut 1-2",,,"Car 1-3, Rut 1-2","Geological,<br>Geochemical","Geological, Geochemical","25444, 25445",Paramount Ventures & Finance Inc.,Phelps Dodge Corporation of Canada Ltd.,"Fox, Peter E.","Copper, Zinc","Triassic, Dewar Formation, Savage Mountain Formation, Shales, Siltstones, Cherts, Andesitic tuffs, Stuhini Group",109600.0,1.4,78285.71429,1.1,99636.36364,0.934,117344.7537,http://aris.empr.gov.bc.ca/search.asp?mode=repsum&rep_no=25802
27844,25930,1.0,1999/6/11,GEOL:GEOC:PHYS:,92000,Exploration of the Del Santo Property,1999,1998.0,,2000-06-11,,1999/6/11,103,Del Santo,093L10W:,093L067,54,39,0,126,40,6,9,6058342,650435,54.65,-126.668333,CU:AG:,,,SMI,3.0,OMIN:,Omineca,Omineca,"Del,<br>Santo,<br>Grouse No.1",093L  025,,"Del, Santo, Grouse No.1","Geological,<br>Geochemical,<br>Physical","Geological, Geochemical, Physical","01665, 02238, 02543, 07286, 17255, 17478, 17874, 23023, 25206, 25779",Telkwa Gold Corporation,Telkwa Gold Corporation,"Tompson, Willard D.","Copper, Silver","Jurassic, Nilkitkwa Formation, Dacitic tuffs, Felsic tuffs, Limestones, VMS",118864.65,1.416,83943.96186,1.112,106892.6709,0.9440000000000001,125915.9428,http://aris.empr.gov.bc.ca/search.asp?mode=repsum&rep_no=25930
28026,25620,1.0,1998/8/26,DRIL:GEOL:GEOC:,44700,Diamond Drill Report on Thor-Marmot Claims,1998,1998.0,,1999-08-26,,1998/8/26,114,Thor-Marmot,094D15E:,094D087,56,49,29,126,38,37,9,6300351,643802,56.824721999999994,-126.643611,CU:AU:,,,PRG,3.0,OMIN:,Omineca,Omineca,"Thor 2-3,<br>Marmot 2",094D  005,,"Thor 2-3, Marmot 2","Drilling,<br>Geological,<br>Geochemical","Drilling, Geological, Geochemical","17925, 18370, 20222",San Telmo Resources Ltd,Electrum Resource Corp. (FMC 107591); San Telmo Resources Ltd,"Allen, Gordon J.","Copper, Gold","Triassic, Takla Group, Basalts, Granodiorites, Quartz veins, Shear zones",157179.0,1.4,112270.7143,1.1,142890.0,0.934,168285.8672,http://aris.empr.gov.bc.ca/search.asp?mode=repsum&rep_no=25620
28030,25774,1.0,1998/12/18,DRIL:GEOC:,0,Drilling Report on the Buck Property,1998,1998.0,,1999-12-18,,1998/12/18,103,Buck,093F03E:,093F025:,53,12,0,125,4,6,10,5896516,361844,53.2,-125.06833300000001,AU:AG:ZN:CU:PB:,,,PRG,3.0,OMIN:,Omineca,Omineca,Buck 1-4,,,Buck 1-4,"Drilling,<br>Geochemical","Drilling, Geochemical","10787, 10899, 22569, 23513, 24549",Pacific Star Resources Inc.,"Awmack, Henry James; Baker, Darcy E. L.; Western Keltic Mines Inc.","Lehtinen, Jim J","Gold, Silver, Zinc, Copper, Lead","Jurassic, Hazelton Group, Andesites, Felsic volcanics, Quartz-calcite veins",158397.17,1.4,113140.8357,1.1,143997.4273,0.934,169590.1178,http://aris.empr.gov.bc.ca/search.asp?mode=repsum&rep_no=25774
28087,25508,1.0,1998/4/3,DRIL:GEOC:,15600,"Assessment Report, Diamond Drilling on the Indata Property",1998,1998.0,,1999-04-03,,1998/4/3,40,Indata,093N06W:,093N034,55,23,0,125,19,6,10,6139896,353131,55.38333299999999,-125.31833300000001,,,,PRG,3.0,OMIN:,Omineca,Omineca,Schnapps 3-4,093N  192,,Schnapps 3-4,"Drilling,<br>Geochemical","Drilling, Geochemical",21397,Eastfield Resources Ltd. (FMC #107399),Eastfield Resources Ltd. (FMC #107399),"Yorston, Robert",,"Triassic-Jurassic, Cache Creek Group, Takla Group, Andesites, Pillow breccias, Crystal tuffs, Serpentinites",176335.68,1.4,125954.0571,1.1,160305.1636,0.934,188796.2313,http://aris.empr.gov.bc.ca/search.asp?mode=repsum&rep_no=25508
28173,25574,1.0,1998/6/3,DRIL:PHYS:GEOC:,11800,Diamond Drilling and Geochemistry Report on the Morrison Property,1998,1998.0,,1999-06-03,,1998/6/3,134,Morrison,093M01W:,093M019,55,11,0,126,18,6,9,6118515,671798,55.183333,-126.301667,CU:AU:,44.0,,SMI,3.0,OMIN:,Omineca,Omineca,"Alva 1-2,<br>Dyke 1-7,<br>Elen 1-16,<br>Frances 25-27,<br>Patch,<br>She 13-14",093M  007,Babine Porphyry,"Alva 1-2, Dyke 1-7, Elen 1-16, Frances 25-27, Patch, She 13-14","Drilling,<br>Physical,<br>Geochemical","Drilling, Physical, Geochemical","01102, 01611, 09298, 20919",Booker Gold Explorations Ltd.,Booker Gold Explorations Ltd.,"O'Brien, Erin Kathleen; Weary, Gordon F","Copper, Gold","Jurassic, Ashman Formation, Babine Intrusions, Biotite feldspar porphyry, Porphyry copper",207418.85,1.4,148156.3214,1.1,188562.5909,0.934,222075.8565,http://aris.empr.gov.bc.ca/search.asp?mode=repsum&rep_no=25574
28185,25760,1.0,1998/10/16,GEOL:GEOP:PHYS:GEOC:,58800,Geological Report on Fort Property,1998,1998.0,,1999-10-16,,1998/10/16,147,Fort,093K12E:,093K063,54,38,30,125,35,10,10,6058000,333118,54.641667000000005,-125.58611100000002,CU:MO:AG:,,,PRG,3.0,OMIN:,Omineca,Omineca,"Elden 1-13,<br>But 4","093K  053, 093K  054, 093K  093, 093K  103",,"Elden 1-13, But 4","Geological,<br>Geophysical,<br>Physical,<br>Geochemical","Geological, Geophysical, Physical, Geochemical","02319, 02917, 11520, 17294, 20377, 21640, 22610",Ascot Resources Ltd.,Eastfield Resources Ltd. (FMC #107399),"Garratt, Glen L.; Tregaskis, S.W.; Page, J.","Copper, Molybdenum/Molybdenite, Silver","Tertiary, Asitka Group, Takla Group, Metasediments, Latites, Monzonites, Hydrothermal breccias, Chalcopyrite, Permian-Triassic",209801.0,1.4,149857.8571,1.1,190728.1818,0.934,224626.3383,http://aris.empr.gov.bc.ca/search.asp?mode=repsum&rep_no=25760
28215,25856,1.0,1999/2/8,GEOL:GEOP:PHYS:GEOC:,56000,"Geological, Geochemical and Geophysical Report on the Abe Property",1999,1998.0,,2000-02-08,,1999/2/8,91,Abe,094C05E:094C05W:,094C031,56,21,0,125,48,6,10,6248559,326875,56.35,-125.801667,CU:AU:MO:AG:,,,PRG,3.0,OMIN:,Omineca,Omineca,"Abe 1-8,<br>Norm 1-4","094C  149, 094C  148, 094C  064, 094C  078, 094C  053",,"Abe 1-8, Norm 1-4","Geological,<br>Geophysical,<br>Physical,<br>Geochemical","Geological, Geophysical, Physical, Geochemical","03267, 10436, 14809, 22121, 22860, 23284, 23780",Starfield Resources Inc.,Major General Resources Ltd,"Sivertz, G.W.","Copper, Gold, Molybdenum/Molybdenite, Silver","Triassic, Takla Group, Andesites, Tuffs, Pyroxenites, Monzonites, Pyrite, Malachite, Chalcopyrite",225000.0,1.416,158898.3051,1.112,202338.1295,0.9440000000000001,238347.4576,http://aris.empr.gov.bc.ca/search.asp?mode=repsum&rep_no=25856
28273,26004,1.0,1999/4/30,DRIL:GEOC:PHYS:,24800,Assessment Report on the Chappelle / Shasta Property,1999,1998.0,,2000-04-30,,1999/4/30,154,Chappelle/Shasta,094E06E:,094E025:,57,16,59,127,6,6,9,6350490,614434,57.28305600000001,-127.10166699999999,AU:AG:CU:,51.0,,SMI,3.0,OMIN:,Omineca,Omineca,"Mineral Lease 13,<br>Mineral Lease 49,<br>Chappelle 1-10",094E  026,Toodoggone Camp,"Mineral Lease 13, Mineral Lease 49, Chappelle 1-10","Drilling,<br>Geochemical,<br>Physical","Drilling, Geochemical, Physical","01959, 02582, 02819, 03171, 03198, 03343, 03367, 03417, 03418, 03419, 04065, 04066, 05268, 05667, 06096, 07533, 09889, 10662, 11516, 11598, 15321, 15701, 16499, 16741, 18083, 20880, 23922",Sable Resources Ltd.,Multinational Resources Inc.; Sable Resources Ltd.,"Craft, Edward W.","Gold, Silver, Copper","Permian, Takla Group, Hazelton Group, Toodoggone Formation, Limestones, Andesites",252389.32,1.416,178241.0452,1.112,226968.8129,0.9440000000000001,267361.5678,http://aris.empr.gov.bc.ca/search.asp?mode=repsum&rep_no=26004
28305,25908,1.0,1999/5/25,DRIL:GEOL:GEOC:,119000,Geological and Diamond Drilling Report on the Pine Property,1999,1998.0,,2000-05-25,,1999/5/25,123,Pine,094E02E:094E07E:,094E027:,57,12,59,126,42,6,9,6343815,638792,57.216389,-126.70166699999999,,51.0,,SMI,3.0,OMIN:,Omineca,Omineca,FIN 14,"094E  016, 094E  045",Toodoggone Camp,FIN 14,"Drilling,<br>Geological,<br>Geochemical","Drilling, Geological, Geochemical","01846, 01886, 01983, 02035, 02326, 02380, 03031, 03119, 03120, 03266, 04396, 07750, 08331, 08686, 11032, 16502, 17595, 20300, 21139, 22240, 22324, 22873, 23364, 24461, 25268, 25517",Stealth Mining Corporation,Electrum Resource Corp. (FMC 107591); Stealth Mining Corporation,"Blann, David",,"Jurassic, Toodoggone Formation, Quartz latites, Granodiorites, Monzonites, Quartz eye porphyry, Pyrite, Chalcopyrite, Sphalerite",275600.0,1.416,194632.7684,1.112,247841.7266,0.9440000000000001,291949.1525,http://aris.empr.gov.bc.ca/search.asp?mode=repsum&rep_no=25908
28579,25757,1.0,1998/10/28,DRIL:PHYS:GEOP:GEOC:,142800,Assessment Report on MH Property,1998,1998.0,,1999-10-28,,1998/10/28,200,MH,094E06E:,9.40E+46,57,26,39,127,11,22,9,6368278,608666,57.44416700000001,-127.189444,AU:,51.0,,PRG,4.0,OMIN:,Omineca,Omineca,MH 3,,Toodoggone Camp,MH 3,"Drilling,<br>Physical,<br>Geophysical,<br>Geochemical","Drilling, Physical, Geophysical, Geochemical","15185, 16551",AGC Americas Gold Corp.,AGC Americas Gold Corp.,"Davis, J.W.; Jamieson, Micheal D.",Gold,"Jurassic, Toodoggone Formation, Andesites, Lithic tuffs, Potassic alteration",706552.0,1.4,504680.0,1.1,642320.0,0.934,756479.6574,http://aris.empr.gov.bc.ca/search.asp?mode=repsum&rep_no=25757
28914,25841,1.0,1998/11/9,GEOP:,2400,Geophysical Report on the Fort Knox Property,1999,1998.0,,1999-11-09,,1998/11/9,42,Fort Knox,082E06W:,8.20E+25,49,17,0,119,21,4,11,5461613,329018,49.283333,-119.35111100000002,AU:AG:,,,KAM,3.0,OSOY:,Osoyoos,Osoyoos,Lucky Star 3-14,,,Lucky Star 3-14,Geophysical,Geophysical,"22134, 23266, 23807, 24290, 24580, 24897, 25394",Doublestar Resources Limited,"Morrison, Murray Scott","Morrison, Murray Scott","Gold, Silver","Eocene, Marama Formation, Tuffaceous rocks, Conglomerates",2473.0,1.416,1746.468927,1.112,2223.920863,0.9440000000000001,2619.7033899999997,http://aris.empr.gov.bc.ca/search.asp?mode=repsum&rep_no=25841
28942,25721,1.0,1998/6/26,PHYS:GEOC:,2800,Assessment Report on Mak Sikker Property,1998,1998.0,,1999-06-26,,1998/6/26,18,Mak Sikker,082E04E:,8.20E+13,49,6,0,119,40,4,11,5442000,305273,49.1,-119.667778,AG:AU:CU:,9.0,,KAM,3.0,OSOY:,Osoyoos,Osoyoos,"Mak 1-10,<br>Mopar",082ESW004,Similkameen - Boundary Area,"Mak 1-10, Mopar","Physical,<br>Geochemical","Physical, Geochemical","15920, 20115, 20638",Crosscreek Mining Corp.,Crosscreek Mining Corp.,"Gal, Leonard","Silver, Gold, Copper","Carboniferous-Permian, Shear zones, Stockwork, Kobau Group, Greenstones, Quartzites, Tuffs",3145.89,1.4,2247.064286,1.1,2859.9,0.934,3368.190578,http://aris.empr.gov.bc.ca/search.asp?mode=repsum&rep_no=25721
30028,25772,1.0,1998/12/15,GEOC:,30400,Geochemical Report on McCulloch/French Project,1998,1998.0,,1999-12-15,,1998/12/15,95,McCulloch/French,082M09W:,082M068:,51,40,0,118,25,4,11,5724917,401950,51.666667,-118.417778,CU:PB:ZN:,40.0,,KAM,3.0,REVL:,Revelstoke,Revelstoke,"Oui 1-3,<br>Hilroy,<br>Lex 1-4,<br>Montreal,<br>Quebec,<br>Marlene,<br>DeRome,<br>Laval,<br>Frone,<br>Fr. Two",,Goldstream Area,"Oui 1-3, Hilroy, Lex 1-4, Montreal, Quebec, Marlene, DeRome, Laval, Frone, Fr. Two",Geochemical,Geochemical,"24741, 25154","Goodwill, Clifford",Court Bailiffs of Okanagan,"Henneberry, R. Tim","Copper, Lead, Zinc","Cambrian-Devonian, Index Formation, Quartzites, Marbles, Greenstones",30974.0,1.4,22124.28571,1.1,28158.181819999998,0.934,33162.7409,http://aris.empr.gov.bc.ca/search.asp?mode=repsum&rep_no=25772
30646,26042,1.0,1999/6/21,GEOC:,8400,Geochemical Report on the Travis Property,1999,1998.0,,2000-06-21,,1999/6/21,101,Travis,092H16E:,092H080,49,47,0,120,4,4,10,5518667,711071,49.783333,-120.067778,AU:CU:MO:,,,KAM,3.0,SIMK:,Similkameen,Similkameen,Travis 1-2,092HNE051,,Travis 1-2,Geochemical,Geochemical,"16750, 16977, 24231, 25646",Ragnar U. Bruaset & Associates Ltd.,Ragnar U. Bruaset & Associates Ltd.,"Bruaset, Ragnar","Gold, Copper, Molybdenum/Molybdenite","Triassic-Jurassic, Pennask Batholith, Granodiorites",8201.65,1.416,5792.125706,1.112,7375.584531999999,0.9440000000000001,8688.188559,http://aris.empr.gov.bc.ca/search.asp?mode=repsum&rep_no=26042
30783,25646,1.0,1998/6/22,GEOC:,15000,Biogeochemical and Enzyme Leach Surveys of the Travis Claims,1998,1998.0,,1999-06-22,,1998/6/22,43,Travis,092H16E:,092H080,49,47,0,120,4,4,10,5518667,711071,49.783333,-120.067778,AU:CU:MO:,,,KAM,3.0,SIMK:,Similkameen,Similkameen,Travis 1,092HNE051,,Travis 1,Geochemical,Geochemical,"00986, 01180, 09123, 10109, 16977",Ragnar U. Bruaset & Associates Ltd.,Ragnar U. Bruaset & Associates Ltd.,"Bruaset, Ragnar","Gold, Copper, Molybdenum/Molybdenite","Tertiary, Pennask Batholith, Granites, Stocks, Molybdenite, Chalcopyrite, Sphalerite, Galena, Phyllic alteration",11787.32,1.4,8419.514286,1.1,10715.74545,0.934,12620.256959999999,http://aris.empr.gov.bc.ca/search.asp?mode=repsum&rep_no=25646
31151,26002,1.0,1999/8/31,GEOC:PHYS:,5300,Exploratory Soil and Rock Sampling on the BJP Property,1999,1998.0,,2000-08-31,,1999/8/31,49,BJP,092H07W:092H10W:,092H046,49,28,59,120,50,4,10,5483411,656851,49.483056,-120.83444399999999,PT:PD:AU:CU:NI:,12.0,,KAM,4.0,SIMK:,Similkameen,Similkameen,BJP 1-2,092HSE141,Nicola Belt,BJP 1-2,"Geochemical,<br>Physical","Geochemical, Physical","01566, 02526, 11888, 12506, 16661, 17819, 18675",Aboriginal Investments Inc.,Aboriginal Investments Inc.,"Perry, Bruce J.","Platinum, Palladium, Gold, Copper, Nickel","Tulameen Ultramafic Complex, Ultramafics",44943.85,1.416,31740.007060000004,1.112,40417.13129,0.9440000000000001,47610.01059,http://aris.empr.gov.bc.ca/search.asp?mode=repsum&rep_no=26002
31234,25761,1.0,1998/12/10,GEOP:PHYS:GEOC:,43000,Assessment Report on the Summers Creek Project,1998,1998.0,,1999-12-10,,1998/12/10,70,Summers Creek,092H10E:,092H068,49,39,0,120,32,4,10,5502636,677970,49.65,-120.534444,,12.0,,KAM,3.0,SIMK:,Similkameen,Similkameen,"Axe 100-1400,<br>Axe 3000-6000,<br>Adam 5","092HNE040, 092HNE050, 092HNE114, 092HNE142, 092HNE143",Nicola Belt,"Axe 100-1400, Axe 3000-6000, Adam 5","Geophysical,<br>Physical,<br>Geochemical","Geophysical, Physical, Geochemical","04166, 10593, 21630, 22302, 24412",Causeway Mining Corp.,"Daughtry, Kenneth L.; Causeway Mining Corp.","Kerr, John R.",,"Triassic, Nicola Group, Breccias, Tuffs, Lahars, Siltstones, Pyrite, Chalcopyrite, Malachite",72350.14,1.4,51678.67143,1.1,65772.85455,0.934,77462.67666,http://aris.empr.gov.bc.ca/search.asp?mode=repsum&rep_no=25761
31505,25838,1.0,1998/9/18,GEOL:,1200,Geochemical Report on the Alice Property,1999,1998.0,,1999-09-18,,1998/9/18,27,Alice,103P05E:,103P042,55,25,29,129,41,6,9,6142269,456646,55.424721999999996,-129.685,,49.0,,SMI,4.0,SKEE:,Skeena,Skeena,Alice 1-4,103P  110,Alice Arm - Anyox Area,Alice 1-4,Geological,Geological,"08377, 13059, 25344",Angel Jade Mines Ltd.,Angel Jade Mines Ltd.,"Carter, Nick C.",,"Triassic, Coast Plutonic Complex, Kunga Formation, Gabbros, Argillites, Siltstones, Pyrrhotite, Chalcopyrite, Pentlandite",1860.0,1.416,1313.559322,1.112,1672.661871,0.9440000000000001,1970.3389829999999,http://aris.empr.gov.bc.ca/search.asp?mode=repsum&rep_no=25838
31628,26111,1.0,1999/9/17,GEOL:GEOC:PHYS:,1800,Geochemical Report on the Four J's,1999,1998.0,,2000-09-17,,1999/9/17,24,Four J's,104B08E:,104B040,56,18,28,130,7,33,9,6240905,430345,56.307778000000006,-130.125833,PB:ZN:AG:SB:,50.0,,SMI,4.0,SKEE:,Skeena,Skeena,4J 1-4,104B  128,Stewart Camp,4J 1-4,"Geological,<br>Geochemical,<br>Physical","Geological, Geochemical, Physical","12387, 14386",Teuton Resources Corp.,Teuton Resources Corp.,"Cremonese, Dino M.","Lead, Zinc, Silver, Antimony","Jurassic, Unuk River Formation, Argillites, Galena, Sphalerite, Bournontite",3398.0,1.416,2399.717514,1.112,3055.755396,0.9440000000000001,3599.576271,http://aris.empr.gov.bc.ca/search.asp?mode=repsum&rep_no=26111
32149,25785,1.0,1998/10/2,GEOC:PHYS:,5000,Trenching and Sampling Report on the Clone Property,1998,1998.0,,1999-10-02,,1998/10/2,34,Clone,103P13W:,103P082,55,47,59,129,47,6,9,6184068,450789,55.799721999999996,-129.785,AU:CO:CU:,50.0,,SMI,3.0,SKEE:,Skeena,Skeena,"Clone 1,<br>Auco 1",103P  251,Stewart Camp,"Clone 1, Auco 1","Geochemical,<br>Physical","Geochemical, Physical","24376, 24699, 24720, 24938, 25335",Teuton Resources Corp.,Teuton Resources Corp.,"Kruchkowski, Edward R.","Gold, Cobalt, Copper","Jurassic, Hazelton Group, Volcanic breccias, Pillow lavas, Pillow breccias, Andesites, Hematite, Specularite, Malachite, Bornite",9010.35,1.4,6435.964286,1.1,8191.227273,0.934,9647.055675,http://aris.empr.gov.bc.ca/search.asp?mode=repsum&rep_no=25785
32152,25868,1.0,1998/11/13,PROS:,7500,1998 Prospecting Report on the Coulter Property,1998,1998.0,,1999-11-13,,1998/11/13,26,Coulter,104B09W:,104B058,56,34,59,130,30,7,9,6271985,407746,56.583056000000006,-130.50194399999998,AU:AG:PB:CU:ZN:,51.0,,SMI,3.0,SKEE:,Skeena,Skeena,Coulter 1,,Toodoggone Camp,Coulter 1,Prospecting,Prospecting,23226,Homestake Canada Inc.,Homestake Canada Inc.,"Javorsky, David","Gold, Silver, Lead, Copper, Zinc","Jurassic, Hazelton Group, Mudstones, Rhyolites, Dacites",9016.5,1.4,6440.357143,1.1,8196.818181999999,0.934,9653.640257,http://aris.empr.gov.bc.ca/search.asp?mode=repsum&rep_no=25868
