,rep_no,cnf_prd,aff_dt,gwrk_typs,claim_val,title,rep_yr,wrk_yr,conf_ldate,conf_adate,aff_ndate,aff_adate,page_ct,prpty_nm,nts_maps,bcgs_maps,lat83_deg,lat83_min,lat83_sec,lon83_deg,lon83_min,lon83_sec,zone83,north83,east83,lat83,long83,com_cds,camp_cd,geo_sum,reg_geo,info_cls,mdiv_cds,mdiv_nmx,mdiv_nms,claim_nmx,minf_nox,camp_nm,claim_nms,gwrk_nmx,gwrk_nms,rel_ars,oper_nms,own_nms,auth_nms,com_nms,kwl_nms,MERG_SPENT,DOLL_INX,doll_86,CPIdex1992,doll_92,CPIdex2002,doll_02,URL
9730,25895,1.0,1999/2/18,GEOL:PHYS:GEOC:,41800,Geological and Trenching Report on the Golden Crown Property,1999,1998.0,,2000-02-18,,1999/2/18,79,Golden Crown,082E02E:,8.20E+09,49,4,30,118,34,34,11,5436990,384894,49.075,-118.57611100000001,AU:CU:,8.0,,CRA,3.0,GRWD:,Greenwood,Greenwood,"Golden Crown  (L. 599),<br>Winnipeg (L. 600),<br>Calumet (RCG L. 1314),<br>Hard Cash (RCG L. 1062)","082ESE032, 082ESE033",Greenwood Camp,"Golden Crown  (L. 599), Winnipeg (L. 600), Calumet (RCG L. 1314), Hard Cash (RCG L. 1062)","Geological,<br>Physical,<br>Geochemical","Geological, Physical, Geochemical","08482, 08851, 12131, 12373, 14641, 15435, 16090, 20431",Century Gold Corp.,Century Gold Corp.,"Caron, Linda J.","Gold, Copper","Jurassic, Rossland Group, Diorites, Amphibolites, Greenstones, Pyrite, Pyrrhotite",71601.0,1.416,50565.67797,1.112,64389.38849,0.9440000000000001,75848.51695,http://aris.empr.gov.bc.ca/search.asp?mode=repsum&rep_no=25895
10092,25602,1.0,1998/5/8,GEOC:,1400,Biogeochemical Survey on L Property,1998,1998.0,,1999-05-08,,1998/5/8,36,L,092I14W:,092I093,50,59,0,121,29,5,10,5649064,606362,50.983333,-121.48472199999999,AU:,,,KAM,3.0,KAML:,Kamloops,Kamloops,L 1-4,,,L 1-4,Geochemical,Geochemical,"13772, 14207, 24004, 24675, 25097","Morrison, Murray Scott","Morrison, Murray Scott","Morrison, Murray Scott",Gold,"Permian, Permian, Cache Creek Group, Permian, Argillites, Cache Creek Group, Cherty argillites, Permian, Argillites, Limestones, Andesitic tuffs, Cache Creek Group, Ankerite, Cache Creek Group, Cherty argillites, Mariposite, Argillites, Argillites, Cherty argillites, Cherty argillites",1593.0,1.4,1137.857143,1.1,1448.181818,0.934,1705.567452,http://aris.empr.gov.bc.ca/search.asp?mode=repsum&rep_no=25602
10133,25601,1.0,1998/5/8,GEOC:,1800,Biogeochemical Report on Copper Keg Property,1998,1998.0,,1999-05-08,,1998/5/8,39,Copper Keg,092I11E:092I14E:,092I075,50,45,0,121,10,5,10,5623625,629232,50.75,-121.168056,AU:PB:CU:,,,KAM,3.0,KAML:,Kamloops,Kamloops,Copper Keg 5-11,092INW031,,Copper Keg 5-11,Geochemical,Geochemical,,"Morrison, Murray Scott","Morrison, Murray Scott","Morrison, Murray Scott","Gold, Lead, Copper","Jurassic, Guichon Creek Batholith, Nicola Group, Andesites, Quartz diorites, Gossans, Limonite",1812.0,1.4,1294.285714,1.1,1647.272727,0.934,1940.042827,http://aris.empr.gov.bc.ca/search.asp?mode=repsum&rep_no=25601
10246,25539,1.0,1998/3/31,GEOC:,2400,Geological and Geochemical Report on the Oona Property,1998,1998.0,,1999-03-31,,1998/3/31,17,Oona,092I15E:,092I078,50,45,0,120,30,4,10,5625002,676276,50.75,-120.50111100000001,CU:AU:AG:,16.0,,KAM,3.0,KAML:,Kamloops,Kamloops,Oona,,Iron Mask Area,Oona,Geochemical,Geochemical,,Eureka Resources Inc.,Eureka Resources Inc.,"Kerr, John R.","Copper, Gold, Silver","Iron Mask Batholith, Syenites, Triassic-Tertiary, Nicola Group, Kamloops Group, Andesite tuffs",2283.8,1.4,1631.285714,1.1,2076.181818,0.934,2445.182013,http://aris.empr.gov.bc.ca/search.asp?mode=repsum&rep_no=25539
10305,25538,1.0,1998/3/12,GEOP:,2500,Geophysical Assessment Report on the Gold Key Property,1998,1998.0,,1999-03-12,,1998/3/12,31,Gold Key,092I10E:,092I077:,50,43,0,120,41,5,10,5620875,663441,50.716667,-120.684722,AU:AG:,16.0,,KAM,3.0,KAML:,Kamloops,Kamloops,"Gold Key 3-4,<br>Gold Key 13-14",,Iron Mask Area,"Gold Key 3-4, Gold Key 13-14",Geophysical,Geophysical,"24010, 24470, 25040","Morrison, Murray Scott","Morrison, Murray Scott","Morrison, Murray Scott","Gold, Silver","Triassic, Nicola Group, Basalts, Andesites, Quartz veins, Carbonate veins",2580.0,1.4,1842.857143,1.1,2345.454545,0.934,2762.312634,http://aris.empr.gov.bc.ca/search.asp?mode=repsum&rep_no=25538
10935,25633,1.0,1998/6/19,GEOL:GEOC:,7000,Assessment Report on Ladybug Property,1998,1998.0,,1999-06-19,,1998/6/19,50,Ladybug,082M03E:,082M005,51,5,0,119,6,4,11,5661192,352837,51.083333,-119.10111100000002,ZN:PB:AG:CU:MN:,,,KAM,3.0,KAML:,Kamloops,Kamloops,"Ladybug 1-4,<br>LB 1-5,<br>Eye 1-2,<br>Russ 1-4,<br>Lady 1-4",082M  265,,"Ladybug 1-4, LB 1-5, Eye 1-2, Russ 1-4, Lady 1-4","Geological,<br>Geochemical","Geological, Geochemical",,"Lindinger, Leopold Joseph (Leo) (FMC 115","Lindinger, Leopold Joseph (Leo) (FMC 115; Pipe, David","Lindinger, Leopold Joseph (Leo) (FMC 115","Zinc, Lead, Silver, Copper, Manganese","Devonian, Eagle Bay Formation, Cherts, Quartzites, Granodiorites, Orthogneisses, Skarns, Galena, Sphalerite",6285.0,1.4,4489.285714,1.1,5713.636364,0.934,6729.122056,http://aris.empr.gov.bc.ca/search.asp?mode=repsum&rep_no=25633
10995,26036,1.0,1999/7/27,GEOL:GEOC:,4400,Geological Report on the Barbecue Property,1999,1998.0,,2000-07-27,,1999/7/27,32,Barbecue,092I04W:,092I094,50,59,0,121,20,5,10,5649291,616890,50.983333,-121.334722,PU:,,,KAM,3.0,KAML:,Kamloops,Kamloops,Barbecue,,,Barbecue,"Geological,<br>Geochemical","Geological, Geochemical",,"Yacoub, Fayz F.","Yacoub, Fayz F.","Yacoub, Fayz F.",Pumice,"Cache Creek Complex, Basalts, Pumice, Volcanic ash",6756.51,1.416,4771.54661,1.112,6075.998200999999,0.9440000000000001,7157.319915000001,http://aris.empr.gov.bc.ca/search.asp?mode=repsum&rep_no=26036
11084,25790,1.0,1998/9/24,GEOC:,8000,Biogeochemical Report on the Rabbit Property,1998,1998.0,,1999-09-24,,1998/9/24,58,Rabbit,092I10E:,092I067:,50,36,0,120,42,5,10,5607867,662667,50.6,-120.70138899999999,CU:AU:,15.0,,KAM,3.0,KAML:,Kamloops,Kamloops,Rabbit 38,"092INE114, 092INE147",Greenstone Mountain - Meadow Creek Area,Rabbit 38,Geochemical,Geochemical,"01099, 02102, 02511, 03458, 03713, 04008, 05673, 07337, 08238, 20649, 21125, 22055, 23721, 24785, 25124",Ragnar U. Bruaset & Associates Ltd.,Ragnar U. Bruaset & Associates Ltd.,"Bruaset, Ragnar","Copper, Gold","Triassic, Nicola Group, Basalts, Durand Lake Stock, Roper Lake Stock, Monzonites, Diorites, Biogeochemistry",7397.7,1.4,5284.071429,1.1,6725.181818000001,0.934,7920.449679,http://aris.empr.gov.bc.ca/search.asp?mode=repsum&rep_no=25790
11187,25803,1.0,1998/10/16,GEOL:PHYS:GEOC:,4000,Geological Report on the Armour Property,1998,1998.0,,1999-10-16,,1998/10/16,40,Armour,092P01E:,092P020,51,10,0,120,6,4,10,5672354,702666,51.166667,-120.10111100000002,CU:PB:ZN:AG:AU:,,,KAM,3.0,KAML:,Kamloops,Kamloops,Armour,092P  051,,Armour,"Geological,<br>Physical,<br>Geochemical","Geological, Physical, Geochemical","07855, 15248, 16322",Rimfire Minerals Corporation,Rimfire Minerals Corporation,"Caulfield, David A.","Copper, Lead, Zinc, Silver, Gold","Devonian-Mississippian, Eagle Bay Assemblage, Mafic volcanics, Cherts, Argillites, Wackes, Pyrite",8312.49,1.4,5937.492857,1.1,7556.809091,0.934,8899.882227,http://aris.empr.gov.bc.ca/search.asp?mode=repsum&rep_no=25803
11366,25939,1.0,1999/3/23,GEOL:,11200,Geological Report on the Lem Property,1999,1998.0,,2000-03-23,,1999/3/23,23,Lem,092P09W:,092P069,51,37,0,120,18,16,10,5721846,686612,51.616667,-120.30444399999999,CU:PB:ZN:AG:,,,KAM,3.0,KAML:,Kamloops,Kamloops,Lem 2,092P  018,,Lem 2,Geological,Geological,"08492, 08649, 09810, 10748, 12076, 18219, 24417, 25582",Canadian Zeolite Ltd.,"Paquette, L.R.; Canadian Mining Company Ltd.","Jenks, John D.","Copper, Lead, Zinc, Silver","Triassic, Argillites, Latite tuffs, Flysch, Tills, Pyrite, Pyrrhotite, Arsenopyrite",9885.68,1.416,6981.412429000001,1.112,8890.0,0.9440000000000001,10472.11864,http://aris.empr.gov.bc.ca/search.asp?mode=repsum&rep_no=25939
12050,25589,1.0,1998/6/17,GEOP:PHYS:,22800,DaVinci Property Induced Polarization Survey,1998,1998.0,,1999-06-17,,1998/6/17,28,DaVinci,092I13E:,092I082:,50,49,0,121,37,5,10,5630348,597350,50.816666999999995,-121.61805600000001,CU:PB:ZN:AU:,,,KAM,3.0,KAML:,Kamloops,Kamloops,DaVinci 1-2,,,DaVinci 1-2,"Geophysical,<br>Physical","Geophysical, Physical","23461, 24170, 24763","Grexton, Lynn","Grexton, Lynn","Grexton, Lynn","Copper, Lead, Zinc, Gold","Pennsylvanian-Triassic, Cache Creek Group, Cherts, Greenstones",18400.29,1.4,13143.06429,1.1,16727.53636,0.934,19700.52463,http://aris.empr.gov.bc.ca/search.asp?mode=repsum&rep_no=25589
12505,25941,1.0,1999/6/18,GEOL:GEOC:PHYS:,36700,Geological and Geochemical Report on Rabbit 38 Claim,1999,1998.0,,2000-06-18,,1999/6/18,32,Rabbit,092I10E:,092I067,50,36,0,120,42,5,10,5607867,662667,50.6,-120.70138899999999,AU:CU:,15.0,,KAM,3.0,KAML:,Kamloops,Kamloops,Rabbit 38,"092INE045, 092INE071, 092INE114, 092INE130, 092INE147",Greenstone Mountain - Meadow Creek Area,Rabbit 38,"Geological,<br>Geochemical,<br>Physical","Geological, Geochemical, Physical","00325, 01009, 01099, 02102, 02511, 03458, 03713, 04008, 04110, 05673, 06149, 06440, 06579, 07052, 07155, 07337, 07436, 07764, 08238, 08580, 08780, 09319, 12698, 17669, 20320, 20648, 20649, 20793, 21125, 22055, 22531, 23721, 24785, 25124, 25790",ProAm Explorations Corporation,"Ragnar U. Bruaset & Associates Ltd.; Cooke, David Lawrence (FMC# 105390)","Bruaset, Ragnar","Gold, Copper","Triassic, Nicola Group, Basalts, Andesites, Diorites, Roper Lake Stock",30767.31,1.416,21728.326269999998,1.112,27668.444239999997,0.9440000000000001,32592.489410000002,http://aris.empr.gov.bc.ca/search.asp?mode=repsum&rep_no=25941
12661,25502,1.0,1998/4/22,DRIL:GEOC:,46600,Diamond Drilling Report for the Brassie Creek Property,1998,1998.0,,1999-04-22,,1998/4/22,54,Brassie Creek,092I11E:,092I075,50,44,0,121,2,5,10,5622013,638686,50.733333,-121.034722,CU:,18.0,,KAM,3.0,KAML:,Kamloops,Kamloops,Brassie 101,"092INW018, 092INW055",Highland Valley Camp,Brassie 101,"Drilling,<br>Geochemical","Drilling, Geochemical","24809, 25285",Christopher James Gold Corp.,Christopher James Gold Corp.,"Wells, Ronald C.",Copper,"Nicola Group, Lapilli tuffs, Crystal tuffs, Triassic-Jurassic",37715.53,1.4,26939.664289999997,1.1,34286.84545,0.934,40380.6531,http://aris.empr.gov.bc.ca/search.asp?mode=repsum&rep_no=25502
12973,26079,1.0,1999/11/17,GEOP:PHYS:,38500,Geophysical Report on the McDougal Creek Property,1999,1998.0,,2000-11-17,,1999/11/17,27,McDougal Creek,082M12W:092P09E:,082M031,51,33,0,120,0,4,10,5715253,707912,51.55,-120.00111100000001,ZN:CU:PB:AG:,39.0,,KAM,3.0,KAML:,Kamloops,Kamloops,Doug 1-2,,Adams Plateau - Clearwater Area,Doug 1-2,"Geophysical,<br>Physical","Geophysical, Physical","17782, 18814, 20209",Spokane Resources Limited,Spokane Resources Limited,"Hancock, Kirk Douglas","Zinc, Copper, Lead, Silver","Devonian-Permian, Fennell Formation, Pillow basalts, Tuffs",61856.07,1.416,43683.66525,1.112,55625.96223,0.9440000000000001,65525.497879999995,http://aris.empr.gov.bc.ca/search.asp?mode=repsum&rep_no=26079
13035,25918,1.0,1999/3/5,DRIL:GEOL:GEOC:,65200,Geological Report on the Redhill Property,1999,1998.0,,2000-03-05,,1999/3/5,71,Redhill,092I11W:,092I064,50,40,0,121,21,5,10,5614055,616506,50.666667,-121.35138899999998,,,,KAM,3.0,KAML:,Kamloops,Kamloops,RH 4-7,092INW042,,RH 4-7,"Drilling,<br>Geological,<br>Geochemical","Drilling, Geological, Geochemical","05308, 07907, 08892, 09415, 10459, 10513, 11067, 12100, 13826, 15132, 17263, 23423, 25537",Teck Corporation,Teck Corporation,"Evans, Graeme",,"Triassic-Jurassic, Nicola Group, Rhyolites, Dacites, Massive sulphides",69698.45,1.416,49222.06921,1.112,62678.46223,0.9440000000000001,73833.10381,http://aris.empr.gov.bc.ca/search.asp?mode=repsum&rep_no=25918
13356,25740,1.0,1999/3/24,DRIL:GEOC:,36000,Summary of Past Exploration and Details of 1998 Diamond Drilling on the Bonaparte Gold Property,1998,1998.0,,2000-03-24,,1999/3/24,151,Bonaparte Gold,092P01W:092I16W:,092P008,51,0,37,120,26,55,10,5654066,678978,51.010278,-120.44861100000001,AU:,,,KAM,3.0,KAML:,Kamloops,Kamloops,"Nabob 1,<br>Rebob 2",092P  050,,"Nabob 1, Rebob 2","Drilling,<br>Geochemical","Drilling, Geochemical","04665, 08500, 13908, 15166, 15651, 15757, 16045, 16137, 17206, 17762, 18682, 23722",Orko Gold Corp.,Orko Gold Corp.,"Livgard, Egil",Gold,"Triassic, Nicola Group, Harper Ranch Group, Quartz diorites, Shales, Argillites, Metavolcanics, Phyllites, Auriferous quartz veins",161719.0,1.4,115513.5714,1.1,147017.2727,0.934,173146.6809,http://aris.empr.gov.bc.ca/search.asp?mode=repsum&rep_no=25740
13645,25768,1.0,1998/10/20,GEOL:,7200,Geological Report on Talc Ridge Group,1998,1998.0,,1999-10-20,,1998/10/20,17,Talc Ridge,092I04E:,092I002,50,4,0,121,38,5,10,5546936,597708,50.066666999999995,-121.634722,MT:TC:,,,VAN,3.0,KAML:NWES:,"Kamloops,<br>New Westminster","Kamloops, New Westminster",Talc Ridge 1,"092ISW063, 092ISW064, 092ISW065",,Talc Ridge 1,Geological,Geological,"22665, 22688, 23691, 25396","Cardinal, Daniel G.",Highland Talc Minerals,"Cardinal, Daniel G.","Magnesite, Talc","Serpentinites, Phyllites, Chlorite schists, Lenses",9550.0,1.4,6821.4285709999995,1.1,8681.818181999999,0.934,10224.8394,http://aris.empr.gov.bc.ca/search.asp?mode=repsum&rep_no=25768
14529,25573,1.0,1998/4/2,GEOL:,12000,Interpretation of Regional Airborne and Remote Sensing Studies on the Arc Property,1998,1998.0,,1999-04-02,,1998/4/2,17,Arc,094E13W:,094E082:,57,48,42,127,46,10,9,6408407,573116,57.81166700000001,-127.769444,CU:AU:AG:,51.0,,SMI,3.0,LIAR:,Liard,Liard,ARC 1-4,,Toodoggone Camp,ARC 1-4,Geological,Geological,24366,Antares Mining and Exploration (BC),AGC Americas Gold Corp.,"Hawkins, Paul A.","Copper, Gold, Silver","Asitka Group, Quartz monzonites, Granodiorites, Gossans, Remote sensing",9500.0,1.4,6785.714286,1.1,8636.363636,0.934,10171.306209999999,http://aris.empr.gov.bc.ca/search.asp?mode=repsum&rep_no=25573
15195,25986,1.0,1999/7/16,GEOL:GEOC:,18800,Geological Mapping Report on the Keystone Property,1999,1998.0,,2000-07-16,,1999/7/16,42,Keystone,104J16E:,104J090,58,48,59,130,11,6,9,6520213,431559,58.816389,-130.185,AU:,,,SMI,3.0,LIAR:,Liard,Liard,"THI 11-30,<br>E.A. 1-18,<br>Rusty 1-10,<br>Bert 1-24","104J  038, 104J  012, 104J  054, 104J  055",,"THI 11-30, E.A. 1-18, Rusty 1-10, Bert 1-24","Geological,<br>Geochemical","Geological, Geochemical","13309, 24902, 25606",Global Tree Technologies,Nu-Lite Industries Ltd.,"Ostler, John (FMC # 120383)",Gold,"Mississippian, Kedahada Formation, Diorites, Andesites, Greywackes",22310.94,1.416,15756.313559999999,1.112,20063.79496,0.9440000000000001,23634.47034,http://aris.empr.gov.bc.ca/search.asp?mode=repsum&rep_no=25986
15396,25679,1.0,1998/6/8,GEOC:,17400,Geochemical Report on the Yehiniko Property,1998,1998.0,,1999-06-08,,1998/6/8,36,Yehiniko,104G11W:,104G081,57,48,59,131,54,7,9,6411964,327623,57.816389,-131.901944,CU:AU:AG:PB:ZN:,,,SMI,3.0,LIAR:,Liard,Liard,"Aris 1-9,<br>Yeti 4","104G  129, 104G  134, 104G  135, 104G  136",,"Aris 1-9, Yeti 4",Geochemical,Geochemical,"22773, 24659, 21168",Gold Win Ventures Inc.,Gold Win Ventures Inc.,"Chow, Rita","Copper, Gold, Silver, Lead, Zinc","Triassic, Stuhini Group, Volcanic breccias, Andesites, Basalts, Shear zones, Pyrite, Chalcopyrite, Bornite, Tetrahedrite, Galena, Sphalerite",29015.0,1.4,20725.0,1.1,26377.27273,0.934,31065.310489999996,http://aris.empr.gov.bc.ca/search.asp?mode=repsum&rep_no=25679
15663,25845,1.0,1998/11/12,PHYS:GEOC:,6000,Geological and Geochemical Report on the Mount Burden Property,1999,1998.0,,1999-11-12,,1998/11/12,82,Mount Burden,094B03W:,094B014,56,9,30,123,23,36,10,6223772,475569,56.158333,-123.39333300000001,ZN:PB:,,,PRG,3.0,LIAR:,Liard,Liard,Burden,"094B  008, 094B  021",,Burden,"Physical,<br>Geochemical","Physical, Geochemical","13742, 15040, 16254",Boliden Westmin (Canada)  Ltd.,Boliden Westmin (Canada)  Ltd.,"Turner, Andrew","Zinc, Lead","Silurian-Devonian, Stone Formation, Dolostones, Sphalerite, Galena",45949.49,1.416,32450.2048,1.112,41321.483810000005,0.9440000000000001,48675.3072,http://aris.empr.gov.bc.ca/search.asp?mode=repsum&rep_no=25845
15869,25656,1.0,1998/9/11,GEOL:GEOC:PHYS:,46800,Trenching Report on the Sun Claims - Bear Vein of the Table Mountain Gold Property,1998,1998.0,,1999-09-11,,1998/9/11,31,Table Mountain Gold,104P04E:,104P022,59,13,18,129,39,6,9,6564917,462802,59.221667000000004,-129.651667,AU:AG:,52.0,,SMI,3.0,LIAR:,Liard,Liard,Sun,104P  029,Cassiar Camp,Sun,"Geological,<br>Geochemical,<br>Physical","Geological, Geochemical, Physical","05628, 05887, 06125, 06641, 07501, 07601, 07816, 09116, 11074, 14491, 21548, 21549, 21550",Cusac Gold Mines Ltd.,Cusac Gold Mines Ltd.,"Glover, Michael J.","Gold, Silver","Paleozoic, Sylvester Allochthon, Quartz veins, Auriferous quartz veins, Gold",63335.0,1.4,45239.285710000004,1.1,57577.27273,0.934,67810.49251,http://aris.empr.gov.bc.ca/search.asp?mode=repsum&rep_no=25656
16067,25777,1.0,1998/12/22,GEOL:PHYS:GEOC:,88000,Geological and Geochemical Report on the PBR Property,1998,1998.0,,1999-12-22,,1998/12/22,133,PBR,104B15E:,104B087,56,49,59,130,36,7,9,6299947,402255,56.833056000000006,-130.601944,AU:,50.0,,SMI,3.0,LIAR:,Liard,Liard,PBR 1-16,,Stewart Camp,PBR 1-16,"Geological,<br>Physical,<br>Geochemical","Geological, Physical, Geochemical","19636, 19637, 20684, 20573, 20738, 21999",Homestake Canada Inc.,Homestake Canada Inc.; Prime Resources Group Inc.,"Huggins, Christopher; Vaskovic, Marcela",Gold,"Jurassic, Hazelton Group, Salmon River Formation, Pillow basalts, Mudstones, Siltstones, Tuffs, Pyrite, Quartz carbonate veins",90198.62,1.4,64427.58571,1.1,81998.74545,0.934,96572.39829,http://aris.empr.gov.bc.ca/search.asp?mode=repsum&rep_no=25777
16085,25767,1.0,1998/10/2,GEOL:PHYS:GEOC:,18000,Geochemical Report on Gin Property,1998,1998.0,,1999-10-02,,1998/10/2,170,Gin,104H12W:104G09E:,104H061,57,38,59,129,59,7,9,6390141,441195,57.649722,-129.985278,AU:,,,SMI,3.0,LIAR:,Liard,Liard,Gin 5-14,,,Gin 5-14,"Geological,<br>Physical,<br>Geochemical","Geological, Physical, Geochemical","21204, 21957",Homestake Canada Inc.,Homestake Canada Inc.,"Huggins, Christopher; Vaskovic, Marcela",Gold,"Jurassic, Hazelton Group, Bowser Lake Group, Chert pebble conglomerates, Siltstones, Rhyolites, Rhyolite breccias, Mudstones",93844.47,1.4,67031.76428999999,1.1,85313.15455,0.934,100475.8779,http://aris.empr.gov.bc.ca/search.asp?mode=repsum&rep_no=25767
16111,25932,1.0,1999/6/23,GEOL:GEOC:,8000,Geological and Geochemical Report on the Sail Property,1999,1998.0,,2000-06-23,,1999/6/23,146,Sail,104I15W:,104I077,58,46,59,128,45,6,9,6515922,514357,58.78305600000001,-128.751667,CU:PB:ZN:AU:AG:,,,SMI,2.0,LIAR:,Liard,Liard,Sail 1-8,,,Sail 1-8,"Geological,<br>Geochemical","Geological, Geochemical","25045, 25461",Boliden Westmin (Canada)  Ltd.,Boliden Westmin (Canada)  Ltd.,"Pawliuk, David J.; Terry, David A.","Copper, Lead, Zinc, Gold, Silver","Devonian-Mississippian, Sylvester Allochthon, Chlorite gneisses, Quartz-biotite gneisses, Argillites, Dacites, Serpentinites, Pyrite, Pyrrhotite, Chalcopyrite, Malachite, Sphalerite, Arsenopyrite, Galena",99423.0,1.416,70213.98305,1.112,89409.17266,0.9440000000000001,105320.9746,http://aris.empr.gov.bc.ca/search.asp?mode=repsum&rep_no=25932
16133,25606,1.0,1998/5/8,DRIL:GEOC:,15400,Diamond Drilling Report on Keystone Property,1998,1998.0,,1999-05-08,,1998/5/8,88,Keystone,104J16E:,104J089:,58,49,7,130,13,46,9,6520506,428997,58.818611,-130.229444,AU:,,,SMI,3.0,LIAR:,Liard,Liard,Auey 71,104J  012,,Auey 71,"Drilling,<br>Geochemical","Drilling, Geochemical","17706, 24902",Nu-Lite Industries Ltd.,Nu-Lite Industries Ltd.,"Kowalchuk, J.M.",Gold,"Mississippian-Permian, Cache Creek Group, Kedahada Formation, Serpentinites, Listwanites, Shales, Argillites, Ultramafics",106000.0,1.4,75714.28571,1.1,96363.63636,0.934,113490.364,http://aris.empr.gov.bc.ca/search.asp?mode=repsum&rep_no=25606
16442,25889,1.0,1999/4/23,DRIL:GEOL:GEOC:PHYS:,11600,Exploration Report on the Cassiar Project,1999,1998.0,,2000-04-23,,1999/4/23,355,Magno,104P05W:,104P021,59,16,59,129,50,6,9,6571869,452422,59.28305600000001,-129.835,PB:ZN:AG:,52.0,,SMI,3.0,LIAR:,Liard,Liard,"Crown Point,<br>Chiera,<br>Zone 1-4,<br>Pit 1-2,<br>Alta 1,<br>Bev 1-20","104P  006, 104P  044, 104P  080, 104P  081, 104P  082",Cassiar Camp,"Crown Point, Chiera, Zone 1-4, Pit 1-2, Alta 1, Bev 1-20","Drilling,<br>Geological,<br>Geochemical,<br>Physical","Drilling, Geological, Geochemical, Physical","01962, 05578, 05713, 06084, 07912, 07978, 09215, 09262, 09548",Eveready Resources Corporation,Eveready Resources Corporation,"Hoffman, Georgia; Nikols, Dennis","Lead, Zinc, Silver","Cambrian, Rosella Formation, Dolomites, Marbles, Limestones, Rhodochrosite, Galena, Sphalerite",320193.32,1.416,226125.22600000002,1.112,287943.6331,0.9440000000000001,339187.839,http://aris.empr.gov.bc.ca/search.asp?mode=repsum&rep_no=25889
16494,25791,1.0,1998/10/13,GEOL:GEOC:PHYS:DRIL:GEOP:,540400,"Geology, Geochemistry, Geophysics and Drilling Report on the Silvertip Property",1998,1998.0,,1999-10-13,,1998/10/13,673,Silvertip,104O16W:,104O099,59,54,59,130,20,6,9,6642852,425352,59.916389,-130.335,,,,SMI,3.0,LIAR:,Liard,Liard,"Renee 1,<br>Way 8-12,<br>Climax 1-15fr,<br>Bull 1-11,<br>Bull 16-28,<br>Toots 4,<br>Star 2 fr,<br>Beth 1",104O  038,,"Renee 1, Way 8-12, Climax 1-15fr, Bull 1-11, Bull 16-28, Toots 4, Star 2 fr, Beth 1","Geological,<br>Geochemical,<br>Physical,<br>Drilling,<br>Geophysical","Geological, Geochemical, Physical, Drilling, Geophysical","09912, 11020, 11799, 13259, 14104, 15560, 16899, 20735, 25495",Silvertip Mining Corporation,Silvertip Mining Corporation,"Rees, Christopher John",,"Feasibility studies, Devonian, McDame Group, Limestones, Carbonate alteration, Mantos, Massive sulphides, Replacement, Environmental baseline studies, Environmental impact studies, Environmental studies",415771.0,1.4,296979.2857,1.1,377973.6364,0.934,445150.9636,http://aris.empr.gov.bc.ca/search.asp?mode=repsum&rep_no=25791
16808,25587,1.0,1998/4/20,GEOP:,148400,Airborne Geophysical Survey on the Toodoggone Joint Venture,1998,1998.0,,1999-04-20,,1998/4/20,135,JD,094E06W:094E06E:094E11W:,9.40E+45,57,24,59,127,15,6,9,6365088,605012,57.416389,-127.251667,AU:AG:,51.0,,SMI,3.0,LIAR:OMIN:,"Liard,<br>Omineca","Liard, Omineca","Al 1-8,<br>New 1-2,<br>Hyuk 1-3 Fr.,<br>Mill,<br>Spur,<br>McClair 1,<br>Ordon 1-6,<br>Was 1-2,<br>TH 5,<br>Horn 2 Fr.,<br>Mouse 1,-3,<br>Kadah 1-2,<br>MC 1-2,<br>Attorney 2,<br>Lawyer's 1-9,<br>Breeze,<br>GTW 2-3,<br>Mets 5,<br>Wankle,<br>Surprise,<br>Gerome,<br>Winkle,<br>Chute,<br>J.O. Fr,<br>R.J. Fr.,<br>New Moose 2A-D,<br>MH 1-6,<br>Scree 1-3,<br>Moose 1-3,<br>Bull Moose,<br>New Moose 1C-L,<br>Law 1-3,<br>Mining Lease 33-34,<br>Mining Lease 473,<br>Road I-III,<br>Gas 1,<br>JD","094E  026, 094E  065, 094E  066, 094E  080, 094E  093, 094E  091, 094E  099, 094E  079, 094E  163, 094E  168, 094E  169, 094E  170, 094E  171, 094E  236",Toodoggone Camp,"Al 1-8, New 1-2, Hyuk 1-3 Fr., Mill, Spur, McClair 1, Ordon 1-6, Was 1-2, TH 5, Horn 2 Fr., Mouse 1,-3, Kadah 1-2, MC 1-2, Attorney 2, Lawyer's 1-9, Breeze, GTW 2-3, Mets 5, Wankle, Surprise, Gerome, Winkle, Chute, J.O. Fr, R.J. Fr., New Moose 2A-D, MH 1-6, Scree 1-3, Moose 1-3, Bull Moose, New Moose 1C-L, Law 1-3, Mining Lease 33-34, Mining Lease 473, Road I-III, Gas 1, JD",Geophysical,Geophysical,,AGC Americas Gold Corp.; Antares Mining and Exploration (BC),Cheni Gold Mines Inc.; AGC Americas Gold Corp.; Cheni Resources Inc.,"Hawkins, Paul A.","Gold, Silver","Jurassic, Toodoggone Formation, Crystal tuffs, Trachyandesites, Andesites, Tuffs, Epithermal gold, Porphyry mineralization, Gold",202346.38,1.4,144533.1286,1.1,183951.2545,0.934,216644.9465,http://aris.empr.gov.bc.ca/search.asp?mode=repsum&rep_no=25587
16976,25981,1.0,1999/8/12,GEOP:,4000,Geophysical Report on the Veegee Group,1999,1998.0,,2000-08-12,,1999/8/12,23,Veegee,092J10E:,092J068,50,38,0,122,31,5,10,5609162,534084,50.633333,-122.518056,,34.0,,KAM,3.0,LILL:,Lillooet,Lillooet,Mac 1-2,092JNE080,Bridge River Camp,Mac 1-2,Geophysical,Geophysical,"00263, 00264, 10494, 11749, 11876, 13522, 14382, 15341, 15871, 16725, 19276, 22281, 22951","McConechy, Bill","McConechy, Bill","McConechy, Bill",,"Bralorne Intrusions, Hurley Formation, Diorites, Argillites, Phyllites",3600.0,1.416,2542.372881,1.112,3237.4100719999997,0.9440000000000001,3813.559322,http://aris.empr.gov.bc.ca/search.asp?mode=repsum&rep_no=25981
18020,25764,1.0,1998/12/9,PROS:,4900,Assessment Report on the 2Star Claim Group,1998,1998.0,,1999-12-09,,1998/12/9,40,2Star,092L07W:,092L036,50,19,31,126,50,18,9,5577032,653866,50.325278000000004,-126.838333,CU:AG:AU:ZN:,30.0,,VAN,3.0,NIMO:,Nanaimo,Nanaimo,2Star 1-7,"092L  118, 092L  206, 092L  207",Nimpkish Area,2Star 1-7,Prospecting,Prospecting,832,Doublestar Resources Limited,Doublestar Resources Limited,"Gray, Paul D.","Copper, Silver, Gold, Zinc","Triassic, Bonanza Group, Quatsino Formation, Limestones, Granodiorites, Malachite, Magnetite, Nimkish Batholith",3725.5,1.4,2661.071429,1.1,3386.818182,0.934,3988.7580299999995,http://aris.empr.gov.bc.ca/search.asp?mode=repsum&rep_no=25764
18132,25903,1.0,1999/5/11,GEOC:,5600,Sampling Report on the Ranch Property,1999,1998.0,,2000-05-11,,1999/5/11,22,Ranch,092L07W:,092L037,50,19,59,126,46,5,9,5578044,658842,50.333056,-126.768056,LS:,30.0,,VAN,3.0,NIMO:,Nanaimo,Nanaimo,"Ranch,<br>Hop Sing",092L  134,Nimpkish Area,"Ranch, Hop Sing",Geochemical,Geochemical,"22354, 23489",Omya St. Armand Ltd.,Omya St. Armand Ltd.,"Brown, Howard J.",Limestone,"Triassic, Karmutsen Formation, Quatsino Formation, Limestones, Andesites, Basalts, Parson Bay Formation",5247.0,1.416,3705.508475,1.112,4718.52518,0.9440000000000001,5558.262712,http://aris.empr.gov.bc.ca/search.asp?mode=repsum&rep_no=25903
