,rep_no,cnf_prd,aff_dt,gwrk_typs,claim_val,title,rep_yr,wrk_yr,conf_ldate,conf_adate,aff_ndate,aff_adate,page_ct,prpty_nm,nts_maps,bcgs_maps,lat83_deg,lat83_min,lat83_sec,lon83_deg,lon83_min,lon83_sec,zone83,north83,east83,lat83,long83,com_cds,camp_cd,geo_sum,reg_geo,info_cls,mdiv_cds,mdiv_nmx,mdiv_nms,claim_nmx,minf_nox,camp_nm,claim_nms,gwrk_nmx,gwrk_nms,rel_ars,oper_nms,own_nms,auth_nms,com_nms,kwl_nms,MERG_SPENT,DOLL_INX,doll_86,CPIdex1992,doll_92,CPIdex2002,doll_02,URL
100,33232,1.0,2011/12/13,PROS:,3046,Prospecting Survey Report Hook Bay Cu Property,2012,2011.0,,2012-12-13,,2011/12/13,25,Hook Bay,092F02W:,092F006:,49,4,49,124,52,36,10,5438074,362950,49.080278,-124.876667,CU:AG:AU:,,,NAN,3.0,ALBI:,Alberni,Alberni,840842,092F  195,,840842,Prospecting,Prospecting,12044,"Ferguson, Delbert W.","Ferguson, Delbert W.","Ferguson, Delbert W.","Copper, Silver, Gold","Triassic, Vancouver Group, Karmutsen Formation, Basaltic volcanics, Jurassic, Island Plutonic Suite, Granodiorites",3100.0,1.7690000000000001,1752.402487,1.389,2231.821454,1.178,2631.578947,http://aris.empr.gov.bc.ca/search.asp?mode=repsum&rep_no=33232
176,32090,1.0,2011/2/3,PROS:,3708,"Geochemical, Prospecting Report on the Bitterroot Property",2011,2011.0,,2012-02-03,,2011/2/3,36,Bitterroot,092F07E:,092F027:,49,16,33,124,42,19,10,5459519,375965,49.275833,-124.705278,,24.0,,NAN,3.0,ALBI:,Alberni,Alberni,"700664,<br>700827,<br>701146,<br>705562,<br>705563,<br>705712,<br>700683","092F  246, 092F  451, 092F  452",Sicker Belt,"700664, 700827, 701146, 705562, 705563, 705712, 700683",Prospecting,Prospecting,30529,"Saulnier, Paul","Saulnier, Paul","Saulnier, Paul",,"Devonian-Permian, Nitinat Formation, McLaughlin Ridge Formation, Mount Mark Formation, Karmutsen Formation, Limestones, Basalts",4386.09,1.75,2506.337143,1.374,3192.20524,1.165,3764.88412,http://aris.empr.gov.bc.ca/search.asp?mode=repsum&rep_no=32090
225,32897,1.0,2010/11/28,GEOC:,6487,Geological and Rock Geochemistry at the DAAS Bornite Vein Deposit,2012,2011.0,,2011-11-28,,2010/11/28,18,DASS,092F13E:,092F092:,49,56,47,125,41,50,10,5536158,306495,49.946389,-125.697222,CU:,,,NAN,3.0,ALBI:,Alberni,Alberni,571072,,,571072,Geochemical,Geochemical,30383,"Crombie, Walter","Crombie, Walter","Wasteneys, Hardolph",Copper,"Triassic, Karmutsen Formation, Basalts, Bornite",5578.23,1.7690000000000001,3153.3239120000003,1.389,4016.0043200000005,1.178,4735.339559,http://aris.empr.gov.bc.ca/search.asp?mode=repsum&rep_no=32897
336,32556,1.0,2011/9/12,GEOP:,6102,Assessment Report Spectral Data Fusion and Spectral Analyses on the WWW Property,2011,2011.0,,2012-09-12,,2011/9/12,24,WWW,092F02E:,092F007:,49,0,41,124,43,1,10,5430142,374450,49.011389,-124.716944,,,,NAN,3.0,ALBI:,Alberni,Alberni,516512,,,516512,Geophysical,Geophysical,"30045, 30948, 31357, 31821","McLelland, Julie","McLelland, Julie","McLelland, David",,"Jurassic, Karmutsen Formation, Island Plutonic Suite, Granodiorites, Diorites, Basalts",8216.66,1.75,4695.234286,1.374,5980.101892000001,1.165,7052.927039,http://aris.empr.gov.bc.ca/search.asp?mode=repsum&rep_no=32556
358,33624,1.0,2012/5/10,PROS:,7914,Prospecting Report on the Wiskey Jack Property,2012,2011.0,,2013-05-10,,2012/5/10,31,Wiskey Jack,092F03W:,092F014:,49,6,59,125,18,5,10,5442945,332070,49.116389,-125.30138899999999,,25.0,,NAN,4.0,ALBI:,Alberni,Alberni,"Wiskey Jack,<br>Sherelle,<br>Danny Boy",,Tofino - Kennedy River Area,"Wiskey Jack, Sherelle, Danny Boy",Prospecting,Prospecting,,"Herriott, Douglas; Brouwer, Douglas A.","Herriott, Douglas; Brouwer, Douglas A.","Herriott, Douglas; Brouwer, Douglas A.",,"Jurassic, Triassic, Island Plutonic Suite, Karmutsen Formation, Basalts, Granodiorites",8930.88,1.7690000000000001,5048.547202000001,1.389,6429.719222,1.178,7581.3921900000005,http://aris.empr.gov.bc.ca/search.asp?mode=repsum&rep_no=33624
546,32557,1.0,2011/7/25,GEOP:,17290,Spectral Data Fusion and Spectral Analyses on the WWW Property,2011,2011.0,,2012-07-25,,2011/7/25,27,WWW,092F02E:,092F007:,49,0,17,124,40,47,10,5429340,377150,49.004721999999994,-124.679722,,,,NAN,3.0,ALBI:,Alberni,Alberni,"516513,<br>516514",,,"516513, 516514",Geophysical,Geophysical,"30045, 30948, 31816, 32342","McLelland, Julie","McLelland, Julie","McLelland, David",,"Jurassic, Island Plutonic Suite, Karmutsen Formation, Basalts, Granodiorites",16433.34,1.75,9390.48,1.374,11960.218340000001,1.165,14105.87124,http://aris.empr.gov.bc.ca/search.asp?mode=repsum&rep_no=32557
636,33041,1.0,2011/9/25,GEOC:,25250,Geological and Geochemical Report on the Scrutor Gold Property,2011,2011.0,,2012-09-25,,2011/9/25,96,Scrutor Gold,092L03E:,092L015:,50,8,10,127,1,30,9,5555632,641138,50.136111,-127.025,AU:AG:CU:,29.0,,NAN,3.0,ALBI:,Alberni,Alberni,"Tahsish One,<br>Artlish Two,<br>Scrutor North",092L  100,Zeballos - Kyuquot Area,"Tahsish One, Artlish Two, Scrutor North",Geochemical,Geochemical,"14608, 15562, 17134, 19820, 25749, 29591, 30218, 31961","Shearer, Johan Tom FMC 124452","Shearer, Johan Tom FMC 124452","Shearer, Johan Tom FMC 124452","Gold, Silver, Copper","Jurassic, Bonanza Group, Island Plutonic Suite, Granodiorites, Andesites, Crystal tuffs, Rhyolites, Argillites",27258.5,1.75,15576.28571,1.374,19838.79185,1.165,23397.85408,http://aris.empr.gov.bc.ca/search.asp?mode=repsum&rep_no=33041
711,33577,1.0,2012/11/13,PROS:GEOC:,42243,Technical Assessment Report for a Prospecting and Geochemistry Program on the Old Joe Property,2012,2011.0,,2013-11-13,,2012/11/13,36,Old Joe,092F06E:,092F035:,49,20,48,125,1,56,10,5467981,352397,49.346667,-125.03222199999999,CU:AG:AU:,,,NAN,3.0,ALBI:,Alberni,Alberni,"POONTANG2,<br>JOHNNY BOY1,<br>OLD JOE,<br>BOOTS ON THE GROUND,<br>ASH 276,<br>940215,<br>MUD LAKE,<br>POONTANG3,<br>MUD LAKE PIT EXTENSION,<br>ASH 276,<br>941482,<br>964869,<br>964889,<br>964909,<br>964929,<br>975698,<br>975707,<br>977092","092F  293, 092F  340, 092F  415, 092F  430",,"POONTANG2, JOHNNY BOY1, OLD JOE, BOOTS ON THE GROUND, ASH 276, 940215, MUD LAKE, POONTANG3, MUD LAKE PIT EXTENSION, ASH 276, 941482, 964869, 964889, 964909, 964929, 975698, 975707, 977092","Prospecting,<br>Geochemical","Prospecting, Geochemical","16101, 16239, 19943, 21401","Bruner, Danny","Bruner, Danny","Houle, Jacques (FMC 137830)","Copper, Silver, Gold","Jurassic, Island Plutonic Suite, Granodiorites, Triassic, Vancouver Group, Karmutsen Formation, Mafic volcanics, Chalcopyrite, Pyrite, Bornite, Chlorite alteration, Porphyries",42294.74,1.7690000000000001,23908.84115,1.389,30449.77682,1.178,35903.853989999996,http://aris.empr.gov.bc.ca/search.asp?mode=repsum&rep_no=33577
842,32690,1.0,2012/1/31,GEOP:GEOC:,36380,"Geological, Geochemical and Geophysical Report on the Conuma Property",2012,2011.0,,2013-01-31,,2012/1/31,98,Conuma,092E16W:,092E088:,49,52,59,126,25,5,9,5528825,685478,49.883055999999996,-126.418056,,,,NAN,3.0,ALBI:,Alberni,Alberni,Con 1-11,,,Con 1-11,"Geophysical,<br>Geochemical","Geophysical, Geochemical",26394,Red Hut Metals Inc.,"Eadie, Robert","Malahoff, Brian Thomson",,"Triassic-Jurassic, Karmutsen Formation, Island Plutonic Suite, Basalts, Granodiorites, Digital data airborne geophysics",108729.84,1.7690000000000001,61464.01357,1.389,78279.22246,1.178,92300.37351,http://aris.empr.gov.bc.ca/search.asp?mode=repsum&rep_no=32690
856,32983,1.0,2011/8/30,GEOP:,110777,Airborne Geophysical Survey on the Tib Property,2011,2011.0,,2012-08-30,,2011/8/30,140,Tib,092E16E:,092E100:,49,54,5,126,0,15,9,5531971,715125,49.901389,-126.004167,CU:AU:AG:,,,NAN,3.0,ALBI:,Alberni,Alberni,"Bit 1-3,<br>Tibor 1-2,<br>North Tib,<br>west Tib 1-2,<br>Southwest Tib,<br>New Tib 1-5,<br>732542,<br>732562","092E  050, 092F  401",,"Bit 1-3, Tibor 1-2, North Tib, west Tib 1-2, Southwest Tib, New Tib 1-5, 732542, 732562",Geophysical,Geophysical,"02436, 03953, 08065, 09151, 14551, 23547, 23654, 24090, 24178, 25248",Universal Ventures Inc.,"Price, Barry J.","Price, Barry J.","Copper, Gold, Silver","Triassic, Karmutsen Formation, Island Plutonic Suite, Basalts, Granodiorites",130200.0,1.75,74400.0,1.374,94759.82532999999,1.165,111759.6567,http://aris.empr.gov.bc.ca/search.asp?mode=repsum&rep_no=32983
984,33388,1.0,2012/8/9,GEOL:,1693,Petrology of One Rock Sample Number 8R299851 Collected from Tunjony Lake Island,2012,2011.0,,2013-08-09,,2012/8/9,31,Tunjony,104K07E:,104K047:,58,27,0,132,42,46,8,6481083,633480,58.45,-132.71277800000001,,,,SMI,3.0,ATLN:,Atlin,Atlin,TUNJONY 1,,,TUNJONY 1,Geological,Geological,,"Aspinall, Nicholas Clive","Aspinall, Nicholas Clive","Aspinall, Nicholas Clive",,"Triassic, Stuhini Group, Andesite flows, Basalt flows, Volcanic breccias",1740.0,1.7690000000000001,983.6065573999999,1.389,1252.699784,1.178,1477.079796,http://aris.empr.gov.bc.ca/search.asp?mode=repsum&rep_no=33388
990,32677,1.0,2011/10/5,PROS:,483,Prospecting Report on the Husselbee Property,2011,2011.0,,2012-10-05,,2011/10/5,39,Husselbee,104N12W:,104N071:,59,42,26,133,51,24,8,6619360,564333,59.707221999999994,-133.856667,RS:,,,SMI,3.0,ATLN:,Atlin,Atlin,672503,104N  001,,672503,Prospecting,Prospecting,"02786, 28771","Aspinall, Nicholas Clive","Aspinall, Nicholas Clive","Aspinall, Nicholas Clive",Rare Earths,"Permian-Jurassic, Cache Creek Complex, Nakina Formation, Three Sisters Plutonic Suite, Tonalites, Basalts",2020.0,1.75,1154.285714,1.374,1470.160116,1.165,1733.905579,http://aris.empr.gov.bc.ca/search.asp?mode=repsum&rep_no=32677
1027,33228,1.0,2011/11/12,GEOL:,2991,Petrology Study on the Imperial Property,2011,2011.0,,2012-11-12,,2011/11/12,36,Imperial,104N12E:,104N062:,59,36,37,133,36,13,8,6608838,578798,59.610278,-133.603611,AU:AG:,53.0,,SMI,3.0,ATLN:,Atlin,Atlin,Imperial,,Atlin Camp,Imperial,Geological,Geological,"17495, 26602, 27504, 28620, 29481, 30462, 31403","Aspinall, Nicholas Clive","Aspinall, Nicholas Clive","Aspinall, Nicholas Clive","Gold, Silver","Mississippian-Permian, Cache Creek Complex, Nakina Formation, Basaltic volcanics, Ultramafic rocks, Gabbros",3183.0,1.75,1818.857143,1.374,2316.593886,1.165,2732.188841,http://aris.empr.gov.bc.ca/search.asp?mode=repsum&rep_no=33228
1104,33623,1.0,2012/5/9,PROS:,5126,Assessment Report describing Prospecting on the Silt Claims,2012,2011.0,,2013-05-09,,2012/5/9,20,Silt,104M13E:,104M093:,59,54,22,135,32,17,8,6641077,469904,59.906110999999996,-135.538056,,,,SMI,3.0,ATLN:,Atlin,Atlin,Silt,,,Silt,Prospecting,Prospecting,,"Wilson, Bradley S.","Wilson, Bradley S.","Wilson, Bradley S.",,"Paleogene, Granites, Biotite granites",5127.7,1.7690000000000001,2898.643301,1.389,3691.648668,1.178,4352.886248,http://aris.empr.gov.bc.ca/search.asp?mode=repsum&rep_no=33623
1262,32511,1.0,2011/8/15,GEOC:,11726,Geochemistry Reconnaissance on West Boundaries Metla Property,2011,2011.0,,2012-08-15,,2011/8/15,55,Metla,104K07E:,104K037:,58,23,26,132,40,10,8,6474553,636237,58.390556000000004,-132.669444,,,,SMI,3.0,ATLN:,Atlin,Atlin,"Metla 1,<br>Metla West 1-5",104K  161,,"Metla 1, Metla West 1-5",Geochemical,Geochemical,"21757, 27145, 27771, 29058, 30661, 32184","Aspinall, Nicholas Clive; Dawson, James Martin","Aspinall, Nicholas Clive; Dawson, James Martin","Aspinall, Nicholas Clive",,"Triassic, Stuhini Group, Andesites, Breccias, Agglomerates, Phyllites",9122.6,1.75,5212.914286,1.374,6639.446870000001,1.165,7830.557940000001,http://aris.empr.gov.bc.ca/search.asp?mode=repsum&rep_no=32511
1314,33184,1.0,2011/11/1,PROS:,5737,VLF-EM Prospecting Report on the Pine Creek Placer Claims,2011,2011.0,,2012-11-01,,2011/11/1,30,Pine Creek,104N12E:,104N053:,59,35,1,133,34,6,8,6605912,580852,59.583611,-133.568333,AU:,,,SMI,4.0,ATLN:,Atlin,Atlin,746362,,,746362,Prospecting,Prospecting,,"Javorsky, David","Javorsky, David","Javorsky, David",Gold,"Mississippian-Permian, Cache Creek Complex, Ultramafics, Basalts",11116.45,1.75,6352.257143,1.374,8090.574964,1.165,9542.017167,http://aris.empr.gov.bc.ca/search.asp?mode=repsum&rep_no=33184
1396,32791,1.0,2012/2/6,PROS:,9114,2011 Exploration and Fieldwork on the Volcanic Creek Property,2011,2011.0,,2013-02-06,,2012/2/6,32,Volcanic Creek,104N14W:,104N083:,59,49,3,133,26,16,8,6632119,587611,59.8175,-133.437778,AU:,53.0,,SMI,3.0,ATLN:,Atlin,Atlin,"845653,<br>845660",,Atlin Camp,"845653, 845660",Prospecting,Prospecting,"31369, 13307",877384 Alberta Ltd.,"Dahrouge, Jody","Krysa, Stephanie",Gold,"Tertiary, Quaternary, Placers, Placer gold, Stikine Terrane, Three Sisters Plutonic Suite",13676.54,1.75,7815.165714,1.374,9953.813683,1.165,11739.51931,http://aris.empr.gov.bc.ca/search.asp?mode=repsum&rep_no=32791
1779,33489,1.0,2012/2/20,GEOC:,34792,Geochemical and Geological Assessment Report on the Metla Property,2012,2011.0,,2013-02-20,,2012/2/20,51,Metla,104K07E:,104K037:,58,23,10,132,36,40,8,6474178,639664,58.386111,-132.61111100000002,AU:AG:CU:MO:PB:ZN:,,,SMI,3.0,ATLN:,Atlin,Atlin,"510305,<br>510282,<br>409034,<br>393212,<br>408834,<br>832466,<br>840658,<br>840661,<br>852267,<br>852266",104K  161,,"510305, 510282, 409034, 393212, 408834, 832466, 840658, 840661, 852267, 852266",Geochemical,Geochemical,"19226, 21757, 21812, 22127, 22128, 22209, 22210, 27145, 27771, 29058, 30661, 32184, 32511",Ocean Park Ventures Corp.,"Aspinall, Nicholas Clive; Dawson, James Martin","CLIFT, BRADY","Gold, Silver, Copper, Molybdenum/Molybdenite, Lead, Zinc","Triassic, Quartz diorites, Paleocene-Eocene, Sloko-Hyder Plutonic Suite, Granites, Stuhini Group, Volcanics",39323.82,1.7690000000000001,22229.40644,1.389,28310.88553,1.178,33381.850589999995,http://aris.empr.gov.bc.ca/search.asp?mode=repsum&rep_no=33489
1894,32637,1.0,2011/10/12,GEOP:GEOC:,49451,Technical Assessment Report on the Northern Treasure Property,2012,2011.0,,2012-10-12,,2011/10/12,65,Northern Treasure,104K11E:,104K065:,58,41,41,133,4,0,8,6507675,612046,58.694722,-133.066667,AU:,,,SMI,3.0,ATLN:,Atlin,Atlin,Northern Treasure 1-7,104K  144,,Northern Treasure 1-7,"Geophysical,<br>Geochemical","Geophysical, Geochemical",21435,Gulfside Minerals Ltd.,"Javorsky, David","Burton, Alex D.K.",Gold,"Jurassic, Laberge Group, Cretaceous-Tertiary, Sloko Group, Takwahoni Formation, Conglomerates, Greywackes, Sandstones, Volcanics, Volcanic flows",67181.56,1.7690000000000001,37977.13963,1.389,48366.85385,1.178,57030.186760000004,http://aris.empr.gov.bc.ca/search.asp?mode=repsum&rep_no=32637
1999,33568,1.0,2012/1/5,PHYS:GEOC:,112957,Exploration Report on an MMI Soil Sampling Survey over the Bee Lake Grid,2012,2011.0,,2013-01-05,,2012/1/5,132,Llewellyn,104M09E:,104M059:,59,32,2,134,13,45,8,6599756,543598,59.533889,-134.229167,,,,SMI,3.0,ATLN:,Atlin,Atlin,"676423,<br>549628,<br>549629,<br>552496,<br>552498,<br>555072,<br>568679,<br>568680,<br>570299,<br>676424,<br>676425,<br>843637",,,"676423, 549628, 549629, 552496, 552498, 555072, 568679, 568680, 570299, 676424, 676425, 843637","Physical,<br>Geochemical","Physical, Geochemical","19630, 21011",MOMENTUM MINERALS INC.,"Meghji, Nash","Mark, David G.",,"Jurassic, Inklin Formation, Argillites, Greywackes, Conglomerates",118730.0,1.7690000000000001,67117.01526,1.389,85478.7617,1.178,100789.4737,http://aris.empr.gov.bc.ca/search.asp?mode=repsum&rep_no=33568
2004,33038,1.0,2011/8/14,GEOC:,56546,Geochemical Report on the Hat Property,2012,2011.0,,2012-08-14,,2011/8/14,62,Hat,104J04E:,104J012:,58,11,38,131,37,3,9,6453284,346143,58.193889,-131.6175,,,,SMI,3.0,ATLN:,Atlin,Atlin,"Hat,<br>Hat 3-4,<br>Top Hat,<br>Bob 1-2","104J  021, 104J  015",,"Hat, Hat 3-4, Top Hat, Bob 1-2",Geochemical,Geochemical,"02554, 06835, 07482, 13939, 14802, 16311, 18158, 21615, 24388, 24935, 26737, 27932, 28537, 30372, 31178",Doubleview Capital Corp.,"Ostensoe, Erik A.","Ostensoe, Erik A.",,"Triassic, Stuhini Group, Andesites, Tuffs, Granodiorites",121134.0,1.7690000000000001,68475.97512999999,1.389,87209.50323999999,1.178,102830.2207,http://aris.empr.gov.bc.ca/search.asp?mode=repsum&rep_no=33038
2387,32662,1.0,2011/12/16,GEOC:,3275,Rock Geochemistry Report on the Hottie Property,2012,2011.0,,2012-12-16,,2011/12/16,20,Hottie,093B13W:,093B091:,52,57,1,123,53,59,10,5867118,439551,52.950278000000004,-123.899722,AU:,,,PRG,3.0,CBOO:,Cariboo,Cariboo,Hottie 1-4,,,Hottie 1-4,Geochemical,Geochemical,"20022, 20874, 23195, 23695, 24177",Kootenay Gold Inc.,"Kennedy, Thomas Peter James (FMC134308)","Kennedy, Thomas Peter James (FMC134308)",Gold,"Jurassic, Hazelton Group, Tuffs, Chert pebble conglomerates",2446.0,1.7690000000000001,1382.702092,1.389,1760.979122,1.178,2076.400679,http://aris.empr.gov.bc.ca/search.asp?mode=repsum&rep_no=32662
2495,32887,1.0,2011/11/4,GEOC:,4191,Assessment report Rock Geochemical Sampling on the FIT Property,2012,2011.0,,2012-11-04,,2011/11/4,14,FIT 21,093C01E:,093C019:,52,11,0,124,14,5,10,5782148,415584,52.183333000000005,-124.23472199999999,CU:AG:,,,KAM,3.0,CBOO:,Cariboo,Cariboo,865014,,,865014,Geochemical,Geochemical,"31519, 31696, 32123",Serengeti Resources Inc. (146739),"Bowen, Brian K. (Barney)","Bowen, Brian K. (Barney)","Copper, Silver","Cretaceous-Eocene, Conglomerates, Jurassic, Chilanko Igneous Complex, Tonalites, Diorites, Granodiorites",3400.0,1.7690000000000001,1921.989825,1.389,2447.804176,1.178,2886.247878,http://aris.empr.gov.bc.ca/search.asp?mode=repsum&rep_no=32887
2564,32621,1.0,2011/12/9,PROS:,2632,2011 Geological Mapping on the Murray Property,2011,2011.0,,2012-12-09,,2011/12/9,24,Murray,093G03W:,093G023:,53,14,0,123,25,18,10,5898310,471855,53.233332999999995,-123.421667,,,,PRG,3.0,CBOO:,Cariboo,Cariboo,M 1-4,,,M 1-4,Prospecting,Prospecting,"25504, 25911","Poole, William E.","Poole, William E.","Poole, William E.",,"Carboniferous-Triassic, Cache Creek Complex, Trembleur Intrusives, Granodiorites, Greenstones, Argillites, Andesites, Ultramafics",3900.0,1.75,2228.571429,1.374,2838.427948,1.165,3347.639485,http://aris.empr.gov.bc.ca/search.asp?mode=repsum&rep_no=32621
2600,32683,1.0,2011/10/13,GEOP:,1362,Geophysical Technical Report on the Fontaine Property,2012,2011.0,,2012-10-13,,2011/10/13,31,Fontaine,093A13E:,093A092:,52,58,40,121,44,0,10,5870549,585048,52.977778,-121.733333,AU:,,,PRG,3.0,CBOO:,Cariboo,Cariboo,Fontaincreek,,,Fontaincreek,Geophysical,Geophysical,,"Walter, Jason Douglas","Walter, Jason Douglas","Garrow, Terry D.",Gold,"Proterozoic, Snowshoe Group, Phyllites, Quartzites, Argillites",4265.0,1.7690000000000001,2410.966648,1.389,3070.5543559999996,1.178,3620.5432939999996,http://aris.empr.gov.bc.ca/search.asp?mode=repsum&rep_no=32683
2626,32858,1.0,2011/7/22,PHYS:,4720,Archaelogical Impact Assessment Interim Report on the Fraser Sed Property,2011,2011.0,,2012-07-22,,2011/7/22,17,Fraser Sed,093B01W:,093B029:,52,14,7,122,16,16,10,5787457,549776,52.235278,-122.271111,,,,PRG,4.0,CBOO:,Cariboo,Cariboo,"625383,<br>625403,<br>643383",,,"625383, 625403, 643383",Physical,Physical,,"MARUNIAK, DONALD","MARUNIAK, DONALD",TY HEFFNER,,"Permian-Triassic, Cache Creek Complex, Marine sediments",4382.5,1.75,2504.285714,1.374,3189.592431,1.165,3761.802575,http://aris.empr.gov.bc.ca/search.asp?mode=repsum&rep_no=32858
2631,32395,1.0,2011/6/1,GEOC:,6049,Geochemical Report on the MH Property,2011,2011.0,,2012-06-01,,2011/6/1,27,MH,093A05E:,093A042:,52,26,53,121,38,3,10,5811751,592824,52.44805600000001,-121.63416699999999,,36.0,,PRG,4.0,CBOO:,Cariboo,Cariboo,"665425,<br>665423,<br>665424",,Cariboo - Quesnel Belt,"665425, 665423, 665424",Geochemical,Geochemical,"14420, 22853, 23941, 28882, 30423","Livgard, Egil","Livgard, Egil; MacPherson, Frances Jean","Livgard, Egil",,"Triassic, Nicola Group, Basalts, Sedimentary rocks",4421.44,1.75,2526.537143,1.374,3217.933042,1.165,3795.227468,http://aris.empr.gov.bc.ca/search.asp?mode=repsum&rep_no=32395
2942,32385,1.0,2011/5/21,GEOP:PHYS:,10449,Geophysical Survey for Placer Prospecting at Mary Creek,2011,2011.0,,2012-05-21,,2011/5/21,43,Mary Creek,093G01E:,093G010:,53,3,47,122,5,0,10,5879678,561427,53.063056,-122.08333300000001,AU:,38.0,,PRG,3.0,CBOO:,Cariboo,Cariboo,"Lee 3,<br>Mary Gold 2,<br>Mary Gold 1,<br>643263,<br>839298",093G  026,Cariboo - Barkerville Camp,"Lee 3, Mary Gold 2, Mary Gold 1, 643263, 839298","Geophysical,<br>Physical","Geophysical, Physical","12474, 16365","Zeiler, Melvin Lee","Zeiler, Melvin Lee","Moll, Philipp",Gold,"Surficial geology, Placer, Tertiary, Glaciofluvial deposits, Gravels, Sediments, Triassic, Sandstone",7712.44,1.75,4407.108571,1.374,5613.129549,1.165,6620.120172,http://aris.empr.gov.bc.ca/search.asp?mode=repsum&rep_no=32385
3131,32766,1.0,2012/2/8,GEOC:,12776,Geochemical Report on the Marg Property,2012,2011.0,,2013-02-08,,2012/2/8,43,Marg,093B09W:,093B018:,52,30,0,122,24,5,10,5816820,540635,52.5,-122.401389,CU:AU:MO:,37.0,,PRG,3.0,CBOO:,Cariboo,Cariboo,"705764,<br>706170","093B  007, 093B  006, 093B  011, 093B  012",Gibraltar Area,"705764, 706170",Geochemical,Geochemical,"02225, 03483, 04243, 02253, 32382",Delore Management Ltd.,"Boitard, Charles Roger","Mark, David G.","Copper, Gold, Molybdenum/Molybdenite","Miocene-Pliocene, Chilcotin Group, Basaltic volcanics, Permian-Triassic, Cache Creek Complex, Sedimentary rocks",9774.0,1.7690000000000001,5525.155455,1.389,7036.717062999999,1.178,8297.113752,http://aris.empr.gov.bc.ca/search.asp?mode=repsum&rep_no=32766
3171,33238,1.0,2011/12/21,PROS:,7190,Prospecting Report on the Tubby Property,2012,2011.0,,2012-12-21,,2011/12/21,45,Tubby,093B10E:,093B077:,52,43,48,122,39,0,10,5842293,523635,52.73,-122.65,AU:,,,PRG,3.0,CBOO:,Cariboo,Cariboo,"Tubby 1-5,<br>Tubby 8-9",093B  065,,"Tubby 1-5, Tubby 8-9",Prospecting,Prospecting,,"Shearer, Johan Tom FMC 124452","Shearer, Johan Tom FMC 124452","Shearer, Johan Tom FMC 124452",Gold,"Ootsa Lake Group, Triassic, Takla Group, Limestones, Volcanics",10289.5,1.7690000000000001,5816.563029999999,1.389,7407.847372,1.178,8734.719864,http://aris.empr.gov.bc.ca/search.asp?mode=repsum&rep_no=33238
3175,33449,1.0,2012/1/13,GEOC:,10513,Geological and Geochemical and Prospecting Report on the Blackwater Property,2012,2011.0,,2013-01-13,,2012/1/13,34,Blackwater,093G07W:,093G026:,53,17,49,122,57,29,10,5905305,502796,53.296943999999996,-122.958056,AU:AG:CU:PB:ZN:,,,PRG,3.0,CBOO:,Cariboo,Cariboo,845472,"093G  062, 093G  010",,845472,Geochemical,Geochemical,"31538, 20506, 16073, 30932","Raven, Alan R.","Raven, Alan R.","Raven, Alan R.","Gold, Silver, Copper, Lead, Zinc","Permian-Triassic, Cache Creek Complex, Cherts, Siliciclastics, Oligocene-Pliocene, Conglomerates, Coarse Clastic Sedimentary Rocks",10323.73,1.7690000000000001,5835.912945,1.389,7432.491001,1.178,8763.777589,http://aris.empr.gov.bc.ca/search.asp?mode=repsum&rep_no=33449
3227,32659,1.0,2011/11/21,PHYS:GEOC:,15105,Report of 2011 Geochemical Survey on the Keno Property,2011,2011.0,,2012-11-21,,2011/11/21,33,Keno,093A06E:,093A035:,52,18,30,121,2,35,10,5797136,633414,52.308333000000005,-121.043056,MO:CU:AU:,36.0,,PRG,3.0,CBOO:,Cariboo,Cariboo,522517,093A  079,Cariboo - Quesnel Belt,522517,"Physical,<br>Geochemical","Physical, Geochemical","12363, 20040, 30356, 26317, 28677","Wahl, Herbert Joseph (FMC# 128059); Brown - John, Jack","Wahl, Herbert Joseph (FMC# 128059); Brown - John, Jack","Wahl, Herbert Joseph (FMC# 128059)","Molybdenum/Molybdenite, Copper, Gold","Quesnel Trough, Triassic, Nicola Group, Argillites, Quartz monzonites, Granodiorites, Rhyolite dykes",10974.66,1.75,6271.234286,1.374,7987.379913,1.165,9420.309013,http://aris.empr.gov.bc.ca/search.asp?mode=repsum&rep_no=32659
3257,32752,1.0,2011/12/30,GEOC:PROS:,10959,Report on 2011 Geochemical and Prospecting Programs,2012,2011.0,,2012-12-30,,2011/12/30,26,Star,093B12E:,093B063:,52,39,2,123,30,33,10,5833521,465555,52.65055600000001,-123.50916699999999,AU:,,,PRG,3.0,CBOO:,Cariboo,Cariboo,"854085,<br>854087,<br>854088,<br>854090",,,"854085, 854087, 854088, 854090","Geochemical,<br>Prospecting","Geochemical, Prospecting",,"Dunn, David St. Clair","Dunn, David St. Clair","Dunn, David St. Clair",Gold,"Eocene-Oligocene, Endako Group, Basalts",11468.13,1.7690000000000001,6482.832109,1.389,8256.393089,1.178,9735.254669,http://aris.empr.gov.bc.ca/search.asp?mode=repsum&rep_no=32752
3350,32660,1.0,2011/11/23,PHYS:GEOC:,18137,Geochemical Report on the Horsefly Motherlode Gold Project,2011,2011.0,,2012-11-23,,2011/11/23,29,Motherlode,093A06W:,093A023:,52,17,30,121,26,35,10,5794621,606186,52.291667,-121.443056,CU:PB:ZN:AG:AU:,36.0,,PRG,3.0,CBOO:,Cariboo,Cariboo,"521461,<br>521538","093A  064, 093A  075",Cariboo - Quesnel Belt,"521461, 521538","Physical,<br>Geochemical","Physical, Geochemical","13490, 30448, 31568, 06965, 27258","Wahl, Herbert Joseph (FMC# 128059); Brown - John, Jack","Wahl, Herbert Joseph (FMC# 128059); Brown - John, Jack","Wahl, Herbert Joseph (FMC# 128059)","Copper, Lead, Zinc, Silver, Gold","Triassic, Quesnel Trough, Mafic volcanics, Syenites",12712.05,1.75,7264.028570999999,1.374,9251.855895,1.165,10911.6309,http://aris.empr.gov.bc.ca/search.asp?mode=repsum&rep_no=32660
3613,33096,1.0,2012/3/8,GEOC:,15142,Summary Report on the D.D. Platinum Palladium Base and Precious Metal Property,2012,2011.0,,2013-03-08,,2012/3/8,84,D.D.,093J14E:,093J095:,54,56,56,123,14,42,10,6089121,484300,54.948889,-123.245,CU:NI:CO:VA:PD:PT:,,,PRG,4.0,CBOO:,Cariboo,Cariboo,"Chain 2,<br>Snow 1-4,<br>Calf 1,<br>Moose 2,<br>Moose 4,<br>D.D. 1-2,<br>DD1",093J  031,,"Chain 2, Snow 1-4, Calf 1, Moose 2, Moose 4, D.D. 1-2, DD1",Geochemical,Geochemical,"04999, 09297, 13215, 16269, 26461, 27501, 28319, 29357",Almo Capital Corp.,"Vallabh, Ram","Vallabh, Ram","Copper, Nickel, Cobalt, Vanadium, Palladium, Platinum","Argillites, Marbles, Volcanics, Pyroxenites, Ultramafics, Felsic intrusions, Feldspar porphyry dykes, Triassic, Jurassic",17821.31,1.7690000000000001,10074.22838,1.389,12830.31677,1.178,15128.44652,http://aris.empr.gov.bc.ca/search.asp?mode=repsum&rep_no=33096
